[I 2025-07-28 23:33:02,517] Trial 27 finished with value: 4.747531179276429e-06 and parameters: {'n_estimators': 128, 'max_depth': 3}. Best is trial 21 with value: 4.7445459491352896e-06.
[I 2025-07-28 23:33:39,196] Trial 28 finished with value: 4.8603571951154175e-06 and parameters: {'n_estimators': 169, 'max_depth': 5}. Best is trial 21 with value: 4.7445459491352896e-06.
[I 2025-07-28 23:34:13,755] Trial 29 finished with value: 4.967825747122453e-06 and parameters: {'n_estimators': 104, 'max_depth': 8}. Best is trial 21 with value: 4.7445459491352896e-06.
[I 2025-07-28 23:34:47,930] Trial 30 finished with value: 4.838354156649195e-06 and parameters: {'n_estimators': 133, 'max_depth': 6}. Best is trial 21 with value: 4.7445459491352896e-06.
[I 2025-07-28 23:35:04,563] Trial 31 finished with value: 4.750261667483692e-06 and parameters: {'n_estimators': 124, 'max_depth': 3}. Best is trial 21 with value: 4.7445459491352896e-06.
[I 2025-07-28 23:35:22,176] Trial 32 finished with value: 4.814576416346677e-06 and parameters: {'n_estimators': 101, 'max_depth': 4}. Best is trial 21 with value: 4.7445459491352896e-06.
[I 2025-07-28 23:35:45,197] Trial 33 finished with value: 4.779362404445238e-06 and parameters: {'n_estimators': 172, 'max_depth': 3}. Best is trial 21 with value: 4.7445459491352896e-06.
[I 2025-07-28 23:36:23,085] Trial 34 finished with value: 4.820914638456994e-06 and parameters: {'n_estimators': 215, 'max_depth': 4}. Best is trial 21 with value: 4.7445459491352896e-06.
[I 2025-07-28 23:37:10,412] Trial 35 finished with value: 4.985587061208166e-06 and parameters: {'n_estimators': 129, 'max_depth': 9}. Best is trial 21 with value: 4.7445459491352896e-06.
[I 2025-07-28 23:37:43,814] Trial 36 finished with value: 4.782043298686472e-06 and parameters: {'n_estimators': 249, 'max_depth': 3}. Best is trial 21 with value: 4.7445459491352896e-06.
[I 2025-07-28 23:38:11,673] Trial 37 finished with value: 4.8127568491587284e-06 and parameters: {'n_estimators': 158, 'max_depth': 4}. Best is trial 21 with value: 4.7445459491352896e-06.
[I 2025-07-28 23:38:29,479] Trial 38 finished with value: 4.7447574159606235e-06 and parameters: {'n_estimators': 133, 'max_depth': 3}. Best is trial 21 with value: 4.7445459491352896e-06.
[I 2025-07-28 23:39:28,711] Trial 39 finished with value: 4.979276207259348e-06 and parameters: {'n_estimators': 200, 'max_depth': 7}. Best is trial 21 with value: 4.7445459491352896e-06.
[I 2025-07-28 23:39:50,771] Trial 40 finished with value: 4.7907397451729135e-06 and parameters: {'n_estimators': 125, 'max_depth': 4}. Best is trial 21 with value: 4.7445459491352896e-06.
[I 2025-07-28 23:40:09,557] Trial 41 finished with value: 4.750082718070047e-06 and parameters: {'n_estimators': 140, 'max_depth': 3}. Best is trial 21 with value: 4.7445459491352896e-06.
[I 2025-07-28 23:40:32,072] Trial 42 finished with value: 4.772742470566525e-06 and parameters: {'n_estimators': 168, 'max_depth': 3}. Best is trial 21 with value: 4.7445459491352896e-06.
[I 2025-07-28 23:40:49,888] Trial 43 finished with value: 4.7447574159606235e-06 and parameters: {'n_estimators': 133, 'max_depth': 3}. Best is trial 21 with value: 4.7445459491352896e-06.
[I 2025-07-28 23:41:08,753] Trial 44 finished with value: 4.749643883207215e-06 and parameters: {'n_estimators': 141, 'max_depth': 3}. Best is trial 21 with value: 4.7445459491352896e-06.
[I 2025-07-28 23:41:40,451] Trial 45 finished with value: 4.787201222438064e-06 and parameters: {'n_estimators': 237, 'max_depth': 3}. Best is trial 21 with value: 4.7445459491352896e-06.
[I 2025-07-28 23:43:06,932] Trial 46 finished with value: 4.831668921889631e-06 and parameters: {'n_estimators': 493, 'max_depth': 4}. Best is trial 21 with value: 4.7445459491352896e-06.
[I 2025-07-28 23:43:24,505] Trial 47 finished with value: 4.818139765643552e-06 and parameters: {'n_estimators': 100, 'max_depth': 4}. Best is trial 21 with value: 4.7445459491352896e-06.
[I 2025-07-28 23:43:48,602] Trial 48 finished with value: 4.782454611991935e-06 and parameters: {'n_estimators': 180, 'max_depth': 3}. Best is trial 21 with value: 4.7445459491352896e-06.
[I 2025-07-28 23:45:23,926] Trial 49 finished with value: 4.87914886959394e-06 and parameters: {'n_estimators': 440, 'max_depth': 5}. Best is trial 21 with value: 4.7445459491352896e-06.
[I 2025-07-28 23:45:23,927] A new study created in memory with name: no-name-6bed4532-44d3-4b46-89f7-30983ec3e652
[I 2025-07-28 23:45:24,632] Trial 0 finished with value: 4.856360703623916e-06 and parameters: {'n_estimators': 856, 'learning_rate': 0.18667602987273216, 'max_depth': 8, 'num_leaves': 74, 'reg_alpha': 0.08624183104187355, 'reg_lambda': 0.4303456403328322}. Best is trial 0 with value: 4.856360703623916e-06.
[I 2025-07-28 23:45:25,166] Trial 1 finished with value: 5.019251650211013e-06 and parameters: {'n_estimators': 673, 'learning_rate': 0.21847710795303696, 'max_depth': 10, 'num_leaves': 78, 'reg_alpha': 0.6666337125940911, 'reg_lambda': 0.16439181525474478}. Best is trial 0 with value: 4.856360703623916e-06.
[I 2025-07-28 23:45:25,478] Trial 2 finished with value: 5.019251650211013e-06 and parameters: {'n_estimators': 257, 'learning_rate': 0.27213384753869546, 'max_depth': 5, 'num_leaves': 48, 'reg_alpha': 0.32739263783922756, 'reg_lambda': 0.47378095765000117}. Best is trial 0 with value: 4.856360703623916e-06.
[I 2025-07-28 23:45:26,163] Trial 3 finished with value: 5.019251650211013e-06 and parameters: {'n_estimators': 938, 'learning_rate': 0.14057063288876398, 'max_depth': 7, 'num_leaves': 39, 'reg_alpha': 0.8434374503137974, 'reg_lambda': 0.7847529467960963}. Best is trial 0 with value: 4.856360703623916e-06.
[I 2025-07-28 23:45:26,570] Trial 4 finished with value: 5.019251650211013e-06 and parameters: {'n_estimators': 387, 'learning_rate': 0.17453813563682016, 'max_depth': 10, 'num_leaves': 95, 'reg_alpha': 0.8109287765566661, 'reg_lambda': 0.6821487786796224}. Best is trial 0 with value: 4.856360703623916e-06.
[I 2025-07-28 23:45:27,258] Trial 5 finished with value: 5.019251650211013e-06 and parameters: {'n_estimators': 843, 'learning_rate': 0.2526884361716688, 'max_depth': 6, 'num_leaves': 73, 'reg_alpha': 0.5597808753608713, 'reg_lambda': 0.9730734628914947}. Best is trial 0 with value: 4.856360703623916e-06.
[I 2025-07-28 23:45:27,663] Trial 6 finished with value: 5.019251650211013e-06 and parameters: {'n_estimators': 485, 'learning_rate': 0.22110168538485614, 'max_depth': 4, 'num_leaves': 15, 'reg_alpha': 0.9960106671225027, 'reg_lambda': 0.246231248912271}. Best is trial 0 with value: 4.856360703623916e-06.
[I 2025-07-28 23:45:27,988] Trial 7 finished with value: 5.019251650211013e-06 and parameters: {'n_estimators': 308, 'learning_rate': 0.2010292371298805, 'max_depth': 9, 'num_leaves': 44, 'reg_alpha': 0.9320924080690111, 'reg_lambda': 0.4371111902372228}. Best is trial 0 with value: 4.856360703623916e-06.
[I 2025-07-28 23:45:28,364] Trial 8 finished with value: 5.019251650211013e-06 and parameters: {'n_estimators': 366, 'learning_rate': 0.20171876757884072, 'max_depth': 9, 'num_leaves': 61, 'reg_alpha': 0.5646326512316111, 'reg_lambda': 0.8776937559650343}. Best is trial 0 with value: 4.856360703623916e-06.
[I 2025-07-28 23:45:28,992] Trial 9 finished with value: 5.003733334833304e-06 and parameters: {'n_estimators': 783, 'learning_rate': 0.07732065791762581, 'max_depth': 10, 'num_leaves': 49, 'reg_alpha': 0.16528971838293716, 'reg_lambda': 0.3915096495889264}. Best is trial 0 with value: 4.856360703623916e-06.
[I 2025-07-28 23:45:30,223] Trial 10 finished with value: 4.773866334190295e-06 and parameters: {'n_estimators': 123, 'learning_rate': 0.016924117414128526, 'max_depth': 7, 'num_leaves': 95, 'reg_alpha': 0.0001628228939758447, 'reg_lambda': 0.009592802903476472}. Best is trial 10 with value: 4.773866334190295e-06.
[I 2025-07-28 23:45:31,411] Trial 11 finished with value: 4.95902603522684e-06 and parameters: {'n_estimators': 104, 'learning_rate': 0.0419962569554905, 'max_depth': 7, 'num_leaves': 98, 'reg_alpha': 0.00427270947849237, 'reg_lambda': 0.052707878323162816}. Best is trial 10 with value: 4.773866334190295e-06.
[I 2025-07-28 23:45:32,093] Trial 12 finished with value: 4.905935349308693e-06 and parameters: {'n_estimators': 614, 'learning_rate': 0.11198527729384167, 'max_depth': 8, 'num_leaves': 84, 'reg_alpha': 0.03927767828456652, 'reg_lambda': 0.6488207905981063}. Best is trial 10 with value: 4.773866334190295e-06.
[I 2025-07-28 23:45:32,837] Trial 13 finished with value: 5.019251650211013e-06 and parameters: {'n_estimators': 991, 'learning_rate': 0.02848569407276333, 'max_depth': 3, 'num_leaves': 65, 'reg_alpha': 0.28647516557460584, 'reg_lambda': 0.026101876696755455}. Best is trial 10 with value: 4.773866334190295e-06.
[I 2025-07-28 23:45:33,110] Trial 14 finished with value: 5.0145130736872075e-06 and parameters: {'n_estimators': 126, 'learning_rate': 0.09833543103376677, 'max_depth': 6, 'num_leaves': 83, 'reg_alpha': 0.18400334924183392, 'reg_lambda': 0.28315375779970964}. Best is trial 10 with value: 4.773866334190295e-06.
[I 2025-07-28 23:45:33,635] Trial 15 finished with value: 5.019251650211013e-06 and parameters: {'n_estimators': 523, 'learning_rate': 0.15359757754659714, 'max_depth': 8, 'num_leaves': 100, 'reg_alpha': 0.3909146830691108, 'reg_lambda': 0.571242622669328}. Best is trial 10 with value: 4.773866334190295e-06.
[I 2025-07-28 23:45:34,270] Trial 16 finished with value: 4.977059177417676e-06 and parameters: {'n_estimators': 713, 'learning_rate': 0.06119433416265033, 'max_depth': 8, 'num_leaves': 87, 'reg_alpha': 0.1398735506170221, 'reg_lambda': 0.15962081359337485}. Best is trial 10 with value: 4.773866334190295e-06.
[I 2025-07-28 23:45:35,023] Trial 17 finished with value: 4.835493612616657e-06 and parameters: {'n_estimators': 888, 'learning_rate': 0.1273021155937853, 'max_depth': 6, 'num_leaves': 68, 'reg_alpha': 0.07906472140980145, 'reg_lambda': 0.33967708825107434}. Best is trial 10 with value: 4.773866334190295e-06.
[I 2025-07-28 23:45:35,305] Trial 18 finished with value: 5.019251650211013e-06 and parameters: {'n_estimators': 202, 'learning_rate': 0.012940060743028087, 'max_depth': 5, 'num_leaves': 19, 'reg_alpha': 0.25169229019055006, 'reg_lambda': 0.3002627588173567}. Best is trial 10 with value: 4.773866334190295e-06.
[I 2025-07-28 23:45:35,789] Trial 19 finished with value: 5.019251650211013e-06 and parameters: {'n_estimators': 456, 'learning_rate': 0.11389461938993264, 'max_depth': 5, 'num_leaves': 65, 'reg_alpha': 0.4125051100561411, 'reg_lambda': 0.1259062469570284}. Best is trial 10 with value: 4.773866334190295e-06.
[I 2025-07-28 23:45:36,388] Trial 20 finished with value: 4.879115015263172e-06 and parameters: {'n_estimators': 585, 'learning_rate': 0.06873062348372239, 'max_depth': 6, 'num_leaves': 29, 'reg_alpha': 0.09520324490454682, 'reg_lambda': 0.3283551250616196}. Best is trial 10 with value: 4.773866334190295e-06.
[I 2025-07-28 23:45:37,529] Trial 21 finished with value: 5.3109303824610465e-06 and parameters: {'n_estimators': 871, 'learning_rate': 0.1788532474950515, 'max_depth': 7, 'num_leaves': 72, 'reg_alpha': 0.012614045312744238, 'reg_lambda': 0.5397366326765154}. Best is trial 10 with value: 4.773866334190295e-06.
[I 2025-07-28 23:45:38,178] Trial 22 finished with value: 5.019251650211013e-06 and parameters: {'n_estimators': 752, 'learning_rate': 0.1348014008635551, 'max_depth': 8, 'num_leaves': 91, 'reg_alpha': 0.21159968106830315, 'reg_lambda': 0.36679606970735146}. Best is trial 10 with value: 4.773866334190295e-06.
[I 2025-07-28 23:45:38,890] Trial 23 finished with value: 4.878370380465109e-06 and parameters: {'n_estimators': 871, 'learning_rate': 0.28897806275656623, 'max_depth': 7, 'num_leaves': 57, 'reg_alpha': 0.09098610240101122, 'reg_lambda': 0.6180482728235163}. Best is trial 10 with value: 4.773866334190295e-06.
[I 2025-07-28 23:45:39,676] Trial 24 finished with value: 4.880794084302273e-06 and parameters: {'n_estimators': 937, 'learning_rate': 0.23625801060673066, 'max_depth': 9, 'num_leaves': 74, 'reg_alpha': 0.09583119873159994, 'reg_lambda': 0.21088247859456005}. Best is trial 10 with value: 4.773866334190295e-06.
[I 2025-07-28 23:45:40,254] Trial 25 finished with value: 5.019251650211013e-06 and parameters: {'n_estimators': 646, 'learning_rate': 0.17581008714254376, 'max_depth': 6, 'num_leaves': 68, 'reg_alpha': 0.36027027838600867, 'reg_lambda': 0.08459227116085542}. Best is trial 10 with value: 4.773866334190295e-06.
[I 2025-07-28 23:45:40,973] Trial 26 finished with value: 5.019251650211013e-06 and parameters: {'n_estimators': 817, 'learning_rate': 0.08479769078409916, 'max_depth': 7, 'num_leaves': 81, 'reg_alpha': 0.24457089409977592, 'reg_lambda': 0.7261507497880326}. Best is trial 10 with value: 4.773866334190295e-06.
[I 2025-07-28 23:45:41,720] Trial 27 finished with value: 5.019251650211013e-06 and parameters: {'n_estimators': 946, 'learning_rate': 0.04709333101976461, 'max_depth': 4, 'num_leaves': 52, 'reg_alpha': 0.46589189646096274, 'reg_lambda': 0.0014842869061414514}. Best is trial 10 with value: 4.773866334190295e-06.
[I 2025-07-28 23:45:42,395] Trial 28 finished with value: 4.855318893772238e-06 and parameters: {'n_estimators': 738, 'learning_rate': 0.11938888553223852, 'max_depth': 8, 'num_leaves': 90, 'reg_alpha': 0.08496267929324038, 'reg_lambda': 0.44861882563471334}. Best is trial 10 with value: 4.773866334190295e-06.
[I 2025-07-28 23:45:43,101] Trial 29 finished with value: 4.826682236279433e-06 and parameters: {'n_estimators': 724, 'learning_rate': 0.12237284936861013, 'max_depth': 9, 'num_leaves': 88, 'reg_alpha': 0.057717294533865406, 'reg_lambda': 0.49484059981251743}. Best is trial 10 with value: 4.773866334190295e-06.
[I 2025-07-28 23:45:43,768] Trial 30 finished with value: 4.983976180491115e-06 and parameters: {'n_estimators': 689, 'learning_rate': 0.1589916505259809, 'max_depth': 9, 'num_leaves': 92, 'reg_alpha': 0.14927388963014562, 'reg_lambda': 0.5207596682930606}. Best is trial 10 with value: 4.773866334190295e-06.
[I 2025-07-28 23:45:44,474] Trial 31 finished with value: 4.855354052317778e-06 and parameters: {'n_estimators': 738, 'learning_rate': 0.12800003029387516, 'max_depth': 9, 'num_leaves': 85, 'reg_alpha': 0.08744664135417723, 'reg_lambda': 0.445417421824022}. Best is trial 10 with value: 4.773866334190295e-06.
[I 2025-07-28 23:45:47,974] Trial 32 finished with value: 5.458798082805812e-06 and parameters: {'n_estimators': 786, 'learning_rate': 0.09949669104001882, 'max_depth': 8, 'num_leaves': 89, 'reg_alpha': 0.0014455111783219668, 'reg_lambda': 0.36550662198769257}. Best is trial 10 with value: 4.773866334190295e-06.
[I 2025-07-28 23:45:48,675] Trial 33 finished with value: 4.828171082133489e-06 and parameters: {'n_estimators': 646, 'learning_rate': 0.12188656197853714, 'max_depth': 7, 'num_leaves': 78, 'reg_alpha': 0.07108010050955811, 'reg_lambda': 0.4945494721298299}. Best is trial 10 with value: 4.773866334190295e-06.
[I 2025-07-28 23:45:49,251] Trial 34 finished with value: 5.019251650211013e-06 and parameters: {'n_estimators': 554, 'learning_rate': 0.14895238912887576, 'max_depth': 5, 'num_leaves': 78, 'reg_alpha': 0.3126260528322808, 'reg_lambda': 0.5565498094726392}. Best is trial 10 with value: 4.773866334190295e-06.
[I 2025-07-28 23:45:49,880] Trial 35 finished with value: 5.019251650211013e-06 and parameters: {'n_estimators': 673, 'learning_rate': 0.08850273547362078, 'max_depth': 6, 'num_leaves': 78, 'reg_alpha': 0.6824211821754768, 'reg_lambda': 0.5025399227239695}. Best is trial 10 with value: 4.773866334190295e-06.
[I 2025-07-28 23:45:50,766] Trial 36 finished with value: 4.843113702130761e-06 and parameters: {'n_estimators': 622, 'learning_rate': 0.0531917924878426, 'max_depth': 7, 'num_leaves': 95, 'reg_alpha': 0.04404551648566513, 'reg_lambda': 0.7588992708216695}. Best is trial 10 with value: 4.773866334190295e-06.
[I 2025-07-28 23:45:51,255] Trial 37 finished with value: 5.019251650211013e-06 and parameters: {'n_estimators': 455, 'learning_rate': 0.16399027179285708, 'max_depth': 10, 'num_leaves': 71, 'reg_alpha': 0.2030434958125198, 'reg_lambda': 0.2091168558653362}. Best is trial 10 with value: 4.773866334190295e-06.
[I 2025-07-28 23:45:52,080] Trial 38 finished with value: 4.9811812920727866e-06 and parameters: {'n_estimators': 900, 'learning_rate': 0.13663428140622155, 'max_depth': 7, 'num_leaves': 78, 'reg_alpha': 0.1454905441296254, 'reg_lambda': 0.6024980063614956}. Best is trial 10 with value: 4.773866334190295e-06.
[I 2025-07-28 23:45:52,626] Trial 39 finished with value: 4.84812848975639e-06 and parameters: {'n_estimators': 365, 'learning_rate': 0.19525012444648487, 'max_depth': 6, 'num_leaves': 96, 'reg_alpha': 0.051229471142121855, 'reg_lambda': 0.4847275145288955}. Best is trial 10 with value: 4.773866334190295e-06.
[I 2025-07-28 23:45:52,949] Trial 40 finished with value: 5.019251650211013e-06 and parameters: {'n_estimators': 196, 'learning_rate': 0.030622164418363063, 'max_depth': 4, 'num_leaves': 60, 'reg_alpha': 0.7322792687340915, 'reg_lambda': 0.8486291298828829}. Best is trial 10 with value: 4.773866334190295e-06.
[I 2025-07-28 23:45:53,736] Trial 41 finished with value: 4.8191494832138565e-06 and parameters: {'n_estimators': 630, 'learning_rate': 0.057595264551239124, 'max_depth': 7, 'num_leaves': 97, 'reg_alpha': 0.053286720017836235, 'reg_lambda': 0.7154766153363895}. Best is trial 10 with value: 4.773866334190295e-06.
[I 2025-07-28 23:45:54,379] Trial 42 finished with value: 4.959751463717938e-06 and parameters: {'n_estimators': 521, 'learning_rate': 0.010833734663699064, 'max_depth': 7, 'num_leaves': 94, 'reg_alpha': 0.12584522214686333, 'reg_lambda': 0.6969392986298474}. Best is trial 10 with value: 4.773866334190295e-06.
[I 2025-07-28 23:45:55,250] Trial 43 finished with value: 4.839030249978899e-06 and parameters: {'n_estimators': 814, 'learning_rate': 0.104150224615781, 'max_depth': 6, 'num_leaves': 80, 'reg_alpha': 0.04968373034093941, 'reg_lambda': 0.99632231017112}. Best is trial 10 with value: 4.773866334190295e-06.
[I 2025-07-28 23:45:55,925] Trial 44 finished with value: 5.019251650211013e-06 and parameters: {'n_estimators': 674, 'learning_rate': 0.033501689855441816, 'max_depth': 5, 'num_leaves': 87, 'reg_alpha': 0.2409816479093724, 'reg_lambda': 0.8510582632645385}. Best is trial 10 with value: 4.773866334190295e-06.
[I 2025-07-28 23:45:59,737] Trial 45 finished with value: 5.380902993211131e-06 and parameters: {'n_estimators': 584, 'learning_rate': 0.07323580818984737, 'max_depth': 7, 'num_leaves': 100, 'reg_alpha': 0.0019244529378405206, 'reg_lambda': 0.9169781704702568}. Best is trial 10 with value: 4.773866334190295e-06.
[I 2025-07-28 23:46:00,355] Trial 46 finished with value: 5.019251650211013e-06 and parameters: {'n_estimators': 639, 'learning_rate': 0.12572896172240944, 'max_depth': 8, 'num_leaves': 68, 'reg_alpha': 0.5639194361317281, 'reg_lambda': 0.41825029324836904}. Best is trial 10 with value: 4.773866334190295e-06.
[I 2025-07-28 23:46:00,775] Trial 47 finished with value: 5.01453310107324e-06 and parameters: {'n_estimators': 298, 'learning_rate': 0.08545550233729945, 'max_depth': 6, 'num_leaves': 84, 'reg_alpha': 0.1840343144379763, 'reg_lambda': 0.6475108618084779}. Best is trial 10 with value: 4.773866334190295e-06.
[I 2025-07-28 23:46:01,452] Trial 48 finished with value: 4.8158675523675885e-06 and parameters: {'n_estimators': 487, 'learning_rate': 0.05686580917161879, 'max_depth': 9, 'num_leaves': 97, 'reg_alpha': 0.056883659495641906, 'reg_lambda': 0.7984984059950051}. Best is trial 10 with value: 4.773866334190295e-06.
[I 2025-07-28 23:46:01,965] Trial 49 finished with value: 4.958572676222479e-06 and parameters: {'n_estimators': 383, 'learning_rate': 0.059058319532799906, 'max_depth': 10, 'num_leaves': 97, 'reg_alpha': 0.125310523214792, 'reg_lambda': 0.7977276335888643}. Best is trial 10 with value: 4.773866334190295e-06.
[I 2025-07-28 23:46:01,967] A new study created in memory with name: no-name-9ae4b224-0fb2-422b-b898-6bccf5b864d7
[I 2025-07-28 23:46:05,939] Trial 0 finished with value: 5.019251649998546e-06 and parameters: {'n_estimators': 527, 'learning_rate': 0.20779335499396195, 'max_depth': 3, 'reg_alpha': 0.20562597979819908, 'reg_lambda': 0.9253131347644179}. Best is trial 0 with value: 5.019251649998546e-06.
[I 2025-07-28 23:46:12,897] Trial 1 finished with value: 5.019251649998546e-06 and parameters: {'n_estimators': 947, 'learning_rate': 0.13675329965279034, 'max_depth': 4, 'reg_alpha': 0.6472534240769029, 'reg_lambda': 0.5512422963622352}. Best is trial 0 with value: 5.019251649998546e-06.
[I 2025-07-28 23:46:18,835] Trial 2 finished with value: 5.019251649998546e-06 and parameters: {'n_estimators': 800, 'learning_rate': 0.06098787228195918, 'max_depth': 7, 'reg_alpha': 0.3068962875366742, 'reg_lambda': 0.39476582200405264}. Best is trial 0 with value: 5.019251649998546e-06.
[I 2025-07-28 23:46:25,366] Trial 3 finished with value: 5.019251649998546e-06 and parameters: {'n_estimators': 882, 'learning_rate': 0.2639912995627215, 'max_depth': 5, 'reg_alpha': 0.4643393313035056, 'reg_lambda': 0.9955723244352579}. Best is trial 0 with value: 5.019251649998546e-06.
[I 2025-07-28 23:46:29,211] Trial 4 finished with value: 5.019251649998546e-06 and parameters: {'n_estimators': 501, 'learning_rate': 0.1941813805472633, 'max_depth': 7, 'reg_alpha': 0.7558847662720506, 'reg_lambda': 0.6197607605921719}. Best is trial 0 with value: 5.019251649998546e-06.
[I 2025-07-28 23:46:35,129] Trial 5 finished with value: 5.019251649998546e-06 and parameters: {'n_estimators': 801, 'learning_rate': 0.1278787981711377, 'max_depth': 9, 'reg_alpha': 0.7964698764318756, 'reg_lambda': 0.5575311686511808}. Best is trial 0 with value: 5.019251649998546e-06.
