[I 2025-07-29 07:00:14,187] Trial 0 finished with value: 5.019251649998546e-06 and parameters: {'n_estimators': 264, 'learning_rate': 0.13620166262416983, 'max_depth': 3, 'reg_alpha': 0.9226637285483835, 'reg_lambda': 0.354383091334852}. Best is trial 0 with value: 5.019251649998546e-06.
[I 2025-07-29 07:00:16,629] Trial 1 finished with value: 5.019251649998546e-06 and parameters: {'n_estimators': 275, 'learning_rate': 0.15704818655801664, 'max_depth': 3, 'reg_alpha': 0.30301172692443556, 'reg_lambda': 0.05310770553645272}. Best is trial 0 with value: 5.019251649998546e-06.
[I 2025-07-29 07:00:23,217] Trial 2 finished with value: 5.019251649998546e-06 and parameters: {'n_estimators': 831, 'learning_rate': 0.05564458527254176, 'max_depth': 3, 'reg_alpha': 0.19311444140057465, 'reg_lambda': 0.8247354206072844}. Best is trial 0 with value: 5.019251649998546e-06.
[I 2025-07-29 07:00:29,876] Trial 3 finished with value: 5.013316967504396e-06 and parameters: {'n_estimators': 840, 'learning_rate': 0.14726501448725396, 'max_depth': 6, 'reg_alpha': 0.17500125754464513, 'reg_lambda': 0.15914653166060788}. Best is trial 3 with value: 5.013316967504396e-06.
[I 2025-07-29 07:00:36,487] Trial 4 finished with value: 5.019251649998546e-06 and parameters: {'n_estimators': 794, 'learning_rate': 0.17591080924784938, 'max_depth': 8, 'reg_alpha': 0.702322343959798, 'reg_lambda': 0.8604948840357854}. Best is trial 3 with value: 5.013316967504396e-06.
[I 2025-07-29 07:00:41,568] Trial 5 finished with value: 4.898052058068571e-06 and parameters: {'n_estimators': 566, 'learning_rate': 0.07894954459813766, 'max_depth': 5, 'reg_alpha': 0.08228890896753138, 'reg_lambda': 0.2533349205207259}. Best is trial 5 with value: 4.898052058068571e-06.
[I 2025-07-29 07:00:45,798] Trial 6 finished with value: 5.019251649998546e-06 and parameters: {'n_estimators': 510, 'learning_rate': 0.08356382670050706, 'max_depth': 3, 'reg_alpha': 0.22128404764298615, 'reg_lambda': 0.18676876464194248}. Best is trial 5 with value: 4.898052058068571e-06.
[I 2025-07-29 07:00:52,629] Trial 7 finished with value: 5.301210885702413e-06 and parameters: {'n_estimators': 112, 'learning_rate': 0.06267823374710443, 'max_depth': 7, 'reg_alpha': 0.00042709695575604556, 'reg_lambda': 0.33036434912269486}. Best is trial 5 with value: 4.898052058068571e-06.
[I 2025-07-29 07:00:57,861] Trial 8 finished with value: 5.019251649998546e-06 and parameters: {'n_estimators': 638, 'learning_rate': 0.01650232717527971, 'max_depth': 3, 'reg_alpha': 0.4679606939502252, 'reg_lambda': 0.037183390600629584}. Best is trial 5 with value: 4.898052058068571e-06.
[I 2025-07-29 07:01:02,672] Trial 9 finished with value: 5.019251649998546e-06 and parameters: {'n_estimators': 588, 'learning_rate': 0.16382170969311188, 'max_depth': 6, 'reg_alpha': 0.6120298921604912, 'reg_lambda': 0.20405609679468506}. Best is trial 5 with value: 4.898052058068571e-06.
[I 2025-07-29 07:01:10,364] Trial 10 finished with value: 5.019251649998546e-06 and parameters: {'n_estimators': 975, 'learning_rate': 0.2905711168634386, 'max_depth': 10, 'reg_alpha': 0.44620075478524374, 'reg_lambda': 0.5942789577385811}. Best is trial 5 with value: 4.898052058068571e-06.
[I 2025-07-29 07:01:14,596] Trial 11 finished with value: 4.840589618008401e-06 and parameters: {'n_estimators': 471, 'learning_rate': 0.21367219917605923, 'max_depth': 5, 'reg_alpha': 0.06280329570711103, 'reg_lambda': 0.5448182873051274}. Best is trial 11 with value: 4.840589618008401e-06.
[I 2025-07-29 07:01:18,668] Trial 12 finished with value: 4.872504520506569e-06 and parameters: {'n_estimators': 438, 'learning_rate': 0.23935405320076475, 'max_depth': 5, 'reg_alpha': 0.04624668430091783, 'reg_lambda': 0.5878875204174976}. Best is trial 11 with value: 4.840589618008401e-06.
[I 2025-07-29 07:01:23,116] Trial 13 finished with value: 5.287683060378922e-06 and parameters: {'n_estimators': 397, 'learning_rate': 0.24902221318728285, 'max_depth': 5, 'reg_alpha': 0.008690856602260086, 'reg_lambda': 0.6037755288402669}. Best is trial 11 with value: 4.840589618008401e-06.
[I 2025-07-29 07:01:26,596] Trial 14 finished with value: 5.019251649998546e-06 and parameters: {'n_estimators': 413, 'learning_rate': 0.2216691338889384, 'max_depth': 5, 'reg_alpha': 0.3993554348475307, 'reg_lambda': 0.5024201485305461}. Best is trial 11 with value: 4.840589618008401e-06.
[I 2025-07-29 07:01:30,315] Trial 15 finished with value: 5.019251649998546e-06 and parameters: {'n_estimators': 407, 'learning_rate': 0.21857050409362472, 'max_depth': 8, 'reg_alpha': 0.323906563487403, 'reg_lambda': 0.732453980078141}. Best is trial 11 with value: 4.840589618008401e-06.
[I 2025-07-29 07:01:32,705] Trial 16 finished with value: 4.984521001728592e-06 and parameters: {'n_estimators': 255, 'learning_rate': 0.2894356756668224, 'max_depth': 4, 'reg_alpha': 0.13150180865461322, 'reg_lambda': 0.9965074482322042}. Best is trial 11 with value: 4.840589618008401e-06.
[I 2025-07-29 07:01:38,081] Trial 17 finished with value: 5.019251649998546e-06 and parameters: {'n_estimators': 672, 'learning_rate': 0.2483875173933452, 'max_depth': 7, 'reg_alpha': 0.6540732724274559, 'reg_lambda': 0.4704860033500838}. Best is trial 11 with value: 4.840589618008401e-06.
[I 2025-07-29 07:01:42,018] Trial 18 finished with value: 5.019251649998546e-06 and parameters: {'n_estimators': 469, 'learning_rate': 0.19604189905890787, 'max_depth': 4, 'reg_alpha': 0.8672406082051498, 'reg_lambda': 0.5879341948209382}. Best is trial 11 with value: 4.840589618008401e-06.
[I 2025-07-29 07:01:43,266] Trial 19 finished with value: 5.019251649998546e-06 and parameters: {'n_estimators': 115, 'learning_rate': 0.26260793756024114, 'max_depth': 10, 'reg_alpha': 0.31566146338568907, 'reg_lambda': 0.7043177524495932}. Best is trial 11 with value: 4.840589618008401e-06.
[I 2025-07-29 07:01:49,133] Trial 20 finished with value: 4.8760339283035646e-06 and parameters: {'n_estimators': 705, 'learning_rate': 0.21275301279115075, 'max_depth': 4, 'reg_alpha': 0.08037116360495226, 'reg_lambda': 0.48197488658496734}. Best is trial 11 with value: 4.840589618008401e-06.
[I 2025-07-29 07:01:55,170] Trial 21 finished with value: 4.858208224323734e-06 and parameters: {'n_estimators': 731, 'learning_rate': 0.2097809363819907, 'max_depth': 4, 'reg_alpha': 0.07310074122993769, 'reg_lambda': 0.4774369825467534}. Best is trial 11 with value: 4.840589618008401e-06.
[I 2025-07-29 07:02:01,437] Trial 22 finished with value: 4.870143615424769e-06 and parameters: {'n_estimators': 739, 'learning_rate': 0.1907697991632352, 'max_depth': 5, 'reg_alpha': 0.07497669807664942, 'reg_lambda': 0.40595823005492726}. Best is trial 11 with value: 4.840589618008401e-06.
[I 2025-07-29 07:02:07,626] Trial 23 finished with value: 5.019251649998546e-06 and parameters: {'n_estimators': 739, 'learning_rate': 0.12459979716947797, 'max_depth': 6, 'reg_alpha': 0.24392713010209544, 'reg_lambda': 0.38429871447392694}. Best is trial 11 with value: 4.840589618008401e-06.
[I 2025-07-29 07:02:14,500] Trial 24 finished with value: 4.98080880523895e-06 and parameters: {'n_estimators': 867, 'learning_rate': 0.18657276803731476, 'max_depth': 4, 'reg_alpha': 0.13362974715358533, 'reg_lambda': 0.4261661814142493}. Best is trial 11 with value: 4.840589618008401e-06.
[I 2025-07-29 07:02:22,191] Trial 25 finished with value: 4.966406046728026e-06 and parameters: {'n_estimators': 948, 'learning_rate': 0.20209197999510276, 'max_depth': 5, 'reg_alpha': 0.10266768016163196, 'reg_lambda': 0.6783810653116751}. Best is trial 11 with value: 4.840589618008401e-06.
[I 2025-07-29 07:02:28,363] Trial 26 finished with value: 5.019251649998546e-06 and parameters: {'n_estimators': 769, 'learning_rate': 0.10449959725552466, 'max_depth': 4, 'reg_alpha': 0.25444650608915315, 'reg_lambda': 0.2772484290477367}. Best is trial 11 with value: 4.840589618008401e-06.
[I 2025-07-29 07:02:33,572] Trial 27 finished with value: 5.019251649998546e-06 and parameters: {'n_estimators': 640, 'learning_rate': 0.17572377831979644, 'max_depth': 6, 'reg_alpha': 0.38269501365193165, 'reg_lambda': 0.4942187212553118}. Best is trial 11 with value: 4.840589618008401e-06.
[I 2025-07-29 07:02:40,614] Trial 28 finished with value: 5.00548199437328e-06 and parameters: {'n_estimators': 883, 'learning_rate': 0.26840882628604523, 'max_depth': 5, 'reg_alpha': 0.16008838578739565, 'reg_lambda': 0.40000296322308404}. Best is trial 11 with value: 4.840589618008401e-06.
[I 2025-07-29 07:02:43,422] Trial 29 finished with value: 5.019251649998546e-06 and parameters: {'n_estimators': 322, 'learning_rate': 0.13348830479670853, 'max_depth': 7, 'reg_alpha': 0.5659486693555135, 'reg_lambda': 0.5419666612979364}. Best is trial 11 with value: 4.840589618008401e-06.
[I 2025-07-29 07:02:47,688] Trial 30 finished with value: 5.019251649998546e-06 and parameters: {'n_estimators': 515, 'learning_rate': 0.22884292831686542, 'max_depth': 4, 'reg_alpha': 0.7298713768551488, 'reg_lambda': 0.34977986721414855}. Best is trial 11 with value: 4.840589618008401e-06.
[I 2025-07-29 07:02:53,219] Trial 31 finished with value: 4.866789291850619e-06 and parameters: {'n_estimators': 597, 'learning_rate': 0.231416569544456, 'max_depth': 5, 'reg_alpha': 0.043691302707818444, 'reg_lambda': 0.6556597790658542}. Best is trial 11 with value: 4.840589618008401e-06.
[I 2025-07-29 07:02:58,520] Trial 32 finished with value: 4.853994797290036e-06 and parameters: {'n_estimators': 590, 'learning_rate': 0.20082968677544494, 'max_depth': 5, 'reg_alpha': 0.038734270342111854, 'reg_lambda': 0.7604197943026646}. Best is trial 11 with value: 4.840589618008401e-06.
[I 2025-07-29 07:03:03,506] Trial 33 finished with value: 5.019251649998546e-06 and parameters: {'n_estimators': 610, 'learning_rate': 0.26581111074336994, 'max_depth': 6, 'reg_alpha': 0.9981917673291286, 'reg_lambda': 0.7883361949845902}. Best is trial 11 with value: 4.840589618008401e-06.
[I 2025-07-29 07:03:08,174] Trial 34 finished with value: 4.828740319250513e-06 and parameters: {'n_estimators': 536, 'learning_rate': 0.23832558211127897, 'max_depth': 3, 'reg_alpha': 0.04401736447402045, 'reg_lambda': 0.9191701762827962}. Best is trial 34 with value: 4.828740319250513e-06.
[I 2025-07-29 07:03:12,414] Trial 35 finished with value: 5.019251649998546e-06 and parameters: {'n_estimators': 509, 'learning_rate': 0.2082730248851809, 'max_depth': 3, 'reg_alpha': 0.19614589974371172, 'reg_lambda': 0.9250677353171176}. Best is trial 34 with value: 4.828740319250513e-06.
[I 2025-07-29 07:03:15,540] Trial 36 finished with value: 4.9929773874036185e-06 and parameters: {'n_estimators': 355, 'learning_rate': 0.1547498151080511, 'max_depth': 3, 'reg_alpha': 0.1461187902005205, 'reg_lambda': 0.8743823397873955}. Best is trial 34 with value: 4.828740319250513e-06.
[I 2025-07-29 07:03:21,468] Trial 37 finished with value: 5.5122542332567594e-06 and parameters: {'n_estimators': 549, 'learning_rate': 0.16871600337447887, 'max_depth': 3, 'reg_alpha': 0.004046710788722686, 'reg_lambda': 0.7597114637375448}. Best is trial 34 with value: 4.828740319250513e-06.
[I 2025-07-29 07:03:23,579] Trial 38 finished with value: 5.019251649998546e-06 and parameters: {'n_estimators': 225, 'learning_rate': 0.18409851786745257, 'max_depth': 4, 'reg_alpha': 0.26919871995955813, 'reg_lambda': 0.9237278848273273}. Best is trial 34 with value: 4.828740319250513e-06.
[I 2025-07-29 07:03:29,094] Trial 39 finished with value: 5.019251649998546e-06 and parameters: {'n_estimators': 683, 'learning_rate': 0.2506020718464836, 'max_depth': 3, 'reg_alpha': 0.20026556604614043, 'reg_lambda': 0.8467158568269544}. Best is trial 34 with value: 4.828740319250513e-06.
[I 2025-07-29 07:03:33,922] Trial 40 finished with value: 4.9096004837696935e-06 and parameters: {'n_estimators': 543, 'learning_rate': 0.27463159918615776, 'max_depth': 4, 'reg_alpha': 0.09264659861216158, 'reg_lambda': 0.9918764250998869}. Best is trial 34 with value: 4.828740319250513e-06.
[I 2025-07-29 07:03:39,437] Trial 41 finished with value: 4.92916423608635e-06 and parameters: {'n_estimators': 607, 'learning_rate': 0.23082574665019226, 'max_depth': 5, 'reg_alpha': 0.030282491636096524, 'reg_lambda': 0.6721921248265245}. Best is trial 34 with value: 4.828740319250513e-06.
[I 2025-07-29 07:03:43,692] Trial 42 finished with value: 4.894016148409182e-06 and parameters: {'n_estimators': 474, 'learning_rate': 0.2317812653772062, 'max_depth': 6, 'reg_alpha': 0.0723723854390147, 'reg_lambda': 0.6512622958584209}. Best is trial 34 with value: 4.828740319250513e-06.
[I 2025-07-29 07:03:48,629] Trial 43 finished with value: 4.806490123840627e-06 and parameters: {'n_estimators': 573, 'learning_rate': 0.20540521650773613, 'max_depth': 3, 'reg_alpha': 0.046682211821986466, 'reg_lambda': 0.768877570517783}. Best is trial 43 with value: 4.806490123840627e-06.
[I 2025-07-29 07:03:55,139] Trial 44 finished with value: 4.972493086950821e-06 and parameters: {'n_estimators': 808, 'learning_rate': 0.20609730237914586, 'max_depth': 3, 'reg_alpha': 0.12368119466808282, 'reg_lambda': 0.10280772884991968}. Best is trial 43 with value: 4.806490123840627e-06.
[I 2025-07-29 07:03:58,982] Trial 45 finished with value: 5.019251649998546e-06 and parameters: {'n_estimators': 462, 'learning_rate': 0.15507002251887345, 'max_depth': 3, 'reg_alpha': 0.18851588421928778, 'reg_lambda': 0.8034171779446837}. Best is trial 43 with value: 4.806490123840627e-06.
[I 2025-07-29 07:04:05,789] Trial 46 finished with value: 5.903595990775583e-06 and parameters: {'n_estimators': 643, 'learning_rate': 0.19766712105856174, 'max_depth': 4, 'reg_alpha': 0.0003958246387707545, 'reg_lambda': 0.907868828536698}. Best is trial 43 with value: 4.806490123840627e-06.
[I 2025-07-29 07:04:17,233] Trial 47 finished with value: 4.866750048161329e-06 and parameters: {'n_estimators': 568, 'learning_rate': 0.01703194547825307, 'max_depth': 9, 'reg_alpha': 0.048737761596684, 'reg_lambda': 0.7508797540092451}. Best is trial 43 with value: 4.806490123840627e-06.
[I 2025-07-29 07:04:21,452] Trial 48 finished with value: 5.002287535692259e-06 and parameters: {'n_estimators': 508, 'learning_rate': 0.2436821608505452, 'max_depth': 3, 'reg_alpha': 0.15821743724833787, 'reg_lambda': 0.5353139742854124}. Best is trial 43 with value: 4.806490123840627e-06.
[I 2025-07-29 07:04:24,998] Trial 49 finished with value: 4.948242721083576e-06 and parameters: {'n_estimators': 367, 'learning_rate': 0.22176278249481687, 'max_depth': 4, 'reg_alpha': 0.10790540931428694, 'reg_lambda': 0.816638525669143}. Best is trial 43 with value: 4.806490123840627e-06.
[I 2025-07-29 07:04:24,998] A new study created in memory with name: no-name-4552e12a-fe68-4da9-858c-772c259870d0
[I 2025-07-29 07:04:28,888] Trial 0 finished with value: 5.111573834423984e-06 and parameters: {'n_estimators': 353, 'max_depth': 16, 'min_samples_split': 17, 'min_samples_leaf': 6, 'max_features': 'log2'}. Best is trial 0 with value: 5.111573834423984e-06.
[I 2025-07-29 07:04:35,358] Trial 1 finished with value: 5.180701653158861e-06 and parameters: {'n_estimators': 497, 'max_depth': 20, 'min_samples_split': 8, 'min_samples_leaf': 3, 'max_features': 'log2'}. Best is trial 0 with value: 5.111573834423984e-06.
[I 2025-07-29 07:04:42,442] Trial 2 finished with value: 5.0647910047841104e-06 and parameters: {'n_estimators': 302, 'max_depth': 20, 'min_samples_split': 18, 'min_samples_leaf': 6, 'max_features': 'sqrt'}. Best is trial 2 with value: 5.0647910047841104e-06.
[I 2025-07-29 07:04:45,374] Trial 3 finished with value: 5.193527285247558e-06 and parameters: {'n_estimators': 212, 'max_depth': 18, 'min_samples_split': 7, 'min_samples_leaf': 2, 'max_features': 'log2'}. Best is trial 2 with value: 5.0647910047841104e-06.
[I 2025-07-29 07:07:04,652] Trial 4 finished with value: 5.097157990589395e-06 and parameters: {'n_estimators': 269, 'max_depth': 19, 'min_samples_split': 14, 'min_samples_leaf': 1, 'max_features': None}. Best is trial 2 with value: 5.0647910047841104e-06.
[I 2025-07-29 07:07:06,504] Trial 5 finished with value: 5.127652328413303e-06 and parameters: {'n_estimators': 160, 'max_depth': 16, 'min_samples_split': 20, 'min_samples_leaf': 4, 'max_features': 'log2'}. Best is trial 2 with value: 5.0647910047841104e-06.
[I 2025-07-29 07:07:11,024] Trial 6 finished with value: 5.106187232484968e-06 and parameters: {'n_estimators': 179, 'max_depth': 15, 'min_samples_split': 13, 'min_samples_leaf': 4, 'max_features': 'sqrt'}. Best is trial 2 with value: 5.0647910047841104e-06.
[I 2025-07-29 07:09:15,830] Trial 7 finished with value: 4.85387778942898e-06 and parameters: {'n_estimators': 346, 'max_depth': 17, 'min_samples_split': 6, 'min_samples_leaf': 10, 'max_features': None}. Best is trial 7 with value: 4.85387778942898e-06.
[I 2025-07-29 07:09:18,126] Trial 8 finished with value: 5.191648638324912e-06 and parameters: {'n_estimators': 220, 'max_depth': 9, 'min_samples_split': 7, 'min_samples_leaf': 1, 'max_features': 'log2'}. Best is trial 7 with value: 4.85387778942898e-06.
[I 2025-07-29 07:09:20,253] Trial 9 finished with value: 5.11496380719079e-06 and parameters: {'n_estimators': 154, 'max_depth': 5, 'min_samples_split': 9, 'min_samples_leaf': 1, 'max_features': 'sqrt'}. Best is trial 7 with value: 4.85387778942898e-06.
[I 2025-07-29 07:11:35,673] Trial 10 finished with value: 4.8510830630879806e-06 and parameters: {'n_estimators': 408, 'max_depth': 11, 'min_samples_split': 2, 'min_samples_leaf': 10, 'max_features': None}. Best is trial 10 with value: 4.8510830630879806e-06.
[I 2025-07-29 07:13:52,149] Trial 11 finished with value: 4.852306737640369e-06 and parameters: {'n_estimators': 412, 'max_depth': 11, 'min_samples_split': 2, 'min_samples_leaf': 10, 'max_features': None}. Best is trial 10 with value: 4.8510830630879806e-06.
[I 2025-07-29 07:16:22,619] Trial 12 finished with value: 4.83751160760601e-06 and parameters: {'n_estimators': 455, 'max_depth': 11, 'min_samples_split': 2, 'min_samples_leaf': 10, 'max_features': None}. Best is trial 12 with value: 4.83751160760601e-06.
[I 2025-07-29 07:18:28,468] Trial 13 finished with value: 4.823243174301967e-06 and parameters: {'n_estimators': 476, 'max_depth': 7, 'min_samples_split': 2, 'min_samples_leaf': 8, 'max_features': None}. Best is trial 13 with value: 4.823243174301967e-06.
[I 2025-07-29 07:20:15,767] Trial 14 finished with value: 4.808579854932725e-06 and parameters: {'n_estimators': 455, 'max_depth': 6, 'min_samples_split': 4, 'min_samples_leaf': 8, 'max_features': None}. Best is trial 14 with value: 4.808579854932725e-06.
[I 2025-07-29 07:21:20,519] Trial 15 finished with value: 4.7398470837357656e-06 and parameters: {'n_estimators': 497, 'max_depth': 3, 'min_samples_split': 5, 'min_samples_leaf': 8, 'max_features': None}. Best is trial 15 with value: 4.7398470837357656e-06.
[I 2025-07-29 07:22:15,875] Trial 16 finished with value: 4.742582379873134e-06 and parameters: {'n_estimators': 422, 'max_depth': 3, 'min_samples_split': 5, 'min_samples_leaf': 8, 'max_features': None}. Best is trial 15 with value: 4.7398470837357656e-06.
[I 2025-07-29 07:23:08,997] Trial 17 finished with value: 4.745515367065442e-06 and parameters: {'n_estimators': 406, 'max_depth': 3, 'min_samples_split': 10, 'min_samples_leaf': 8, 'max_features': None}. Best is trial 15 with value: 4.7398470837357656e-06.
[I 2025-07-29 07:23:58,338] Trial 18 finished with value: 4.760118650969459e-06 and parameters: {'n_estimators': 375, 'max_depth': 3, 'min_samples_split': 5, 'min_samples_leaf': 7, 'max_features': None}. Best is trial 15 with value: 4.7398470837357656e-06.
[I 2025-07-29 07:25:28,393] Trial 19 finished with value: 4.825621067596444e-06 and parameters: {'n_estimators': 437, 'max_depth': 5, 'min_samples_split': 11, 'min_samples_leaf': 7, 'max_features': None}. Best is trial 15 with value: 4.7398470837357656e-06.
[I 2025-07-29 07:25:37,410] Trial 20 finished with value: 5.013482058689525e-06 and parameters: {'n_estimators': 491, 'max_depth': 9, 'min_samples_split': 4, 'min_samples_leaf': 9, 'max_features': 'sqrt'}. Best is trial 15 with value: 4.7398470837357656e-06.
[I 2025-07-29 07:25:51,183] Trial 21 finished with value: 4.6929509371622144e-06 and parameters: {'n_estimators': 105, 'max_depth': 3, 'min_samples_split': 11, 'min_samples_leaf': 8, 'max_features': None}. Best is trial 21 with value: 4.6929509371622144e-06.
[I 2025-07-29 07:26:05,108] Trial 22 finished with value: 4.695718296302872e-06 and parameters: {'n_estimators': 106, 'max_depth': 3, 'min_samples_split': 13, 'min_samples_leaf': 7, 'max_features': None}. Best is trial 21 with value: 4.6929509371622144e-06.
[I 2025-07-29 07:26:29,218] Trial 23 finished with value: 4.7710362985796e-06 and parameters: {'n_estimators': 117, 'max_depth': 5, 'min_samples_split': 13, 'min_samples_leaf': 7, 'max_features': None}. Best is trial 21 with value: 4.6929509371622144e-06.
[I 2025-07-29 07:26:59,561] Trial 24 finished with value: 4.858156206302897e-06 and parameters: {'n_estimators': 101, 'max_depth': 8, 'min_samples_split': 15, 'min_samples_leaf': 5, 'max_features': None}. Best is trial 21 with value: 4.6929509371622144e-06.
[I 2025-07-29 07:27:21,953] Trial 25 finished with value: 4.693778856458157e-06 and parameters: {'n_estimators': 133, 'max_depth': 4, 'min_samples_split': 12, 'min_samples_leaf': 9, 'max_features': None}. Best is trial 21 with value: 4.6929509371622144e-06.
[I 2025-07-29 07:27:48,987] Trial 26 finished with value: 4.733641771141859e-06 and parameters: {'n_estimators': 133, 'max_depth': 5, 'min_samples_split': 11, 'min_samples_leaf': 9, 'max_features': None}. Best is trial 21 with value: 4.6929509371622144e-06.
[I 2025-07-29 07:28:59,840] Trial 27 finished with value: 4.844096367725583e-06 and parameters: {'n_estimators': 197, 'max_depth': 13, 'min_samples_split': 12, 'min_samples_leaf': 9, 'max_features': None}. Best is trial 21 with value: 4.6929509371622144e-06.
