[I 2025-07-28 22:11:40,895] Trial 15 finished with value: 5.019251650211013e-06 and parameters: {'n_estimators': 422, 'learning_rate': 0.07613337138321723, 'max_depth': 9, 'num_leaves': 39, 'reg_alpha': 0.5962851979877836, 'reg_lambda': 0.5447495496713415}. Best is trial 2 with value: 4.922998423839225e-06.
[I 2025-07-28 22:11:41,177] Trial 16 finished with value: 5.019251650211013e-06 and parameters: {'n_estimators': 127, 'learning_rate': 0.18704390049811603, 'max_depth': 8, 'num_leaves': 83, 'reg_alpha': 0.3595290463960249, 'reg_lambda': 0.893159076406485}. Best is trial 2 with value: 4.922998423839225e-06.
[I 2025-07-28 22:11:42,031] Trial 17 finished with value: 4.944971368404755e-06 and parameters: {'n_estimators': 979, 'learning_rate': 0.1367134291785552, 'max_depth': 9, 'num_leaves': 48, 'reg_alpha': 0.113405818079287, 'reg_lambda': 0.3256605048244472}. Best is trial 2 with value: 4.922998423839225e-06.
[I 2025-07-28 22:11:42,905] Trial 18 finished with value: 5.019251650211013e-06 and parameters: {'n_estimators': 973, 'learning_rate': 0.06990790291597611, 'max_depth': 10, 'num_leaves': 49, 'reg_alpha': 0.5836847677548822, 'reg_lambda': 0.06398803675160858}. Best is trial 2 with value: 4.922998423839225e-06.
[I 2025-07-28 22:11:43,672] Trial 19 finished with value: 5.019251650211013e-06 and parameters: {'n_estimators': 857, 'learning_rate': 0.146565197802567, 'max_depth': 9, 'num_leaves': 26, 'reg_alpha': 0.7520323053370552, 'reg_lambda': 0.2830301587046206}. Best is trial 2 with value: 4.922998423839225e-06.
[I 2025-07-28 22:11:45,221] Trial 20 finished with value: 5.453352231145391e-06 and parameters: {'n_estimators': 1000, 'learning_rate': 0.18541352090716026, 'max_depth': 9, 'num_leaves': 58, 'reg_alpha': 0.0067683082928850224, 'reg_lambda': 0.4247658936911481}. Best is trial 2 with value: 4.922998423839225e-06.
[I 2025-07-28 22:11:45,880] Trial 21 finished with value: 5.003336452598987e-06 and parameters: {'n_estimators': 653, 'learning_rate': 0.12749488691538508, 'max_depth': 10, 'num_leaves': 42, 'reg_alpha': 0.16449932246701612, 'reg_lambda': 0.3322728144374304}. Best is trial 2 with value: 4.922998423839225e-06.
[I 2025-07-28 22:11:46,329] Trial 22 finished with value: 4.923191512703056e-06 and parameters: {'n_estimators': 310, 'learning_rate': 0.12997212573981767, 'max_depth': 8, 'num_leaves': 99, 'reg_alpha': 0.10481627142955217, 'reg_lambda': 0.5873211700276977}. Best is trial 2 with value: 4.922998423839225e-06.
[I 2025-07-28 22:11:46,886] Trial 23 finished with value: 4.918035993922146e-06 and parameters: {'n_estimators': 447, 'learning_rate': 0.1538077168727363, 'max_depth': 8, 'num_leaves': 68, 'reg_alpha': 0.10347593491485545, 'reg_lambda': 0.5814667313404629}. Best is trial 23 with value: 4.918035993922146e-06.
[I 2025-07-28 22:11:47,433] Trial 24 finished with value: 5.019251650211013e-06 and parameters: {'n_estimators': 496, 'learning_rate': 0.06595305788016359, 'max_depth': 8, 'num_leaves': 75, 'reg_alpha': 0.2454071029835228, 'reg_lambda': 0.6403229214997728}. Best is trial 23 with value: 4.918035993922146e-06.
[I 2025-07-28 22:11:47,864] Trial 25 finished with value: 4.838839478183849e-06 and parameters: {'n_estimators': 308, 'learning_rate': 0.16086162938599965, 'max_depth': 8, 'num_leaves': 99, 'reg_alpha': 0.08063885205835425, 'reg_lambda': 0.6078726587116993}. Best is trial 25 with value: 4.838839478183849e-06.
[I 2025-07-28 22:11:48,380] Trial 26 finished with value: 5.019251650211013e-06 and parameters: {'n_estimators': 451, 'learning_rate': 0.1625856376544088, 'max_depth': 7, 'num_leaves': 86, 'reg_alpha': 0.31180859171092856, 'reg_lambda': 0.49350143666572377}. Best is trial 25 with value: 4.838839478183849e-06.
[I 2025-07-28 22:11:48,765] Trial 27 finished with value: 5.019251650211013e-06 and parameters: {'n_estimators': 261, 'learning_rate': 0.20251702923166423, 'max_depth': 5, 'num_leaves': 65, 'reg_alpha': 0.20288950854939145, 'reg_lambda': 0.1610013523387296}. Best is trial 25 with value: 4.838839478183849e-06.
[I 2025-07-28 22:11:49,395] Trial 28 finished with value: 4.857355951552841e-06 and parameters: {'n_estimators': 610, 'learning_rate': 0.22574390386253762, 'max_depth': 9, 'num_leaves': 67, 'reg_alpha': 0.08360848514382646, 'reg_lambda': 0.468380100581523}. Best is trial 25 with value: 4.838839478183849e-06.
[I 2025-07-28 22:11:49,911] Trial 29 finished with value: 4.92482056778742e-06 and parameters: {'n_estimators': 374, 'learning_rate': 0.24101268160999068, 'max_depth': 8, 'num_leaves': 65, 'reg_alpha': 0.04575833088839367, 'reg_lambda': 0.6731742262151403}. Best is trial 25 with value: 4.838839478183849e-06.
[I 2025-07-28 22:11:50,437] Trial 30 finished with value: 5.019251650211013e-06 and parameters: {'n_estimators': 501, 'learning_rate': 0.28206343330313427, 'max_depth': 9, 'num_leaves': 88, 'reg_alpha': 0.35404848915283316, 'reg_lambda': 0.5926019840748751}. Best is trial 25 with value: 4.838839478183849e-06.
[I 2025-07-28 22:11:51,081] Trial 31 finished with value: 4.855205119008922e-06 and parameters: {'n_estimators': 617, 'learning_rate': 0.20952723524101685, 'max_depth': 10, 'num_leaves': 55, 'reg_alpha': 0.08719876265361828, 'reg_lambda': 0.4705430376673104}. Best is trial 25 with value: 4.838839478183849e-06.
[I 2025-07-28 22:11:51,729] Trial 32 finished with value: 4.8357418906587225e-06 and parameters: {'n_estimators': 638, 'learning_rate': 0.20800817114830183, 'max_depth': 10, 'num_leaves': 57, 'reg_alpha': 0.07769818008129326, 'reg_lambda': 0.5957058818414892}. Best is trial 32 with value: 4.8357418906587225e-06.
[I 2025-07-28 22:11:52,336] Trial 33 finished with value: 5.019251650211013e-06 and parameters: {'n_estimators': 636, 'learning_rate': 0.21693689194616833, 'max_depth': 10, 'num_leaves': 55, 'reg_alpha': 0.19741894973194368, 'reg_lambda': 0.47551223490720607}. Best is trial 32 with value: 4.8357418906587225e-06.
[I 2025-07-28 22:11:53,069] Trial 34 finished with value: 4.847913622392865e-06 and parameters: {'n_estimators': 774, 'learning_rate': 0.24232014355503767, 'max_depth': 10, 'num_leaves': 60, 'reg_alpha': 0.06958985619442497, 'reg_lambda': 0.3811099127379417}. Best is trial 32 with value: 4.8357418906587225e-06.
[I 2025-07-28 22:11:53,799] Trial 35 finished with value: 4.836627043273638e-06 and parameters: {'n_estimators': 785, 'learning_rate': 0.2567293716417201, 'max_depth': 10, 'num_leaves': 57, 'reg_alpha': 0.06987712792992228, 'reg_lambda': 0.3822582639224817}. Best is trial 32 with value: 4.8357418906587225e-06.
[I 2025-07-28 22:11:54,570] Trial 36 finished with value: 5.018712144913194e-06 and parameters: {'n_estimators': 785, 'learning_rate': 0.25332812963091583, 'max_depth': 10, 'num_leaves': 60, 'reg_alpha': 0.19026433710878676, 'reg_lambda': 0.35538896741502773}. Best is trial 32 with value: 4.8357418906587225e-06.
[I 2025-07-28 22:11:55,862] Trial 37 finished with value: 5.336492557801899e-06 and parameters: {'n_estimators': 789, 'learning_rate': 0.26056518698893244, 'max_depth': 10, 'num_leaves': 74, 'reg_alpha': 0.006721006857681788, 'reg_lambda': 0.3796329084099826}. Best is trial 32 with value: 4.8357418906587225e-06.
[I 2025-07-28 22:11:56,537] Trial 38 finished with value: 5.019251650211013e-06 and parameters: {'n_estimators': 698, 'learning_rate': 0.27712094224010586, 'max_depth': 9, 'num_leaves': 51, 'reg_alpha': 0.8295731407751203, 'reg_lambda': 0.23351964848396767}. Best is trial 32 with value: 4.8357418906587225e-06.
[I 2025-07-28 22:11:57,374] Trial 39 finished with value: 5.019251650211013e-06 and parameters: {'n_estimators': 903, 'learning_rate': 0.24287314397292697, 'max_depth': 10, 'num_leaves': 60, 'reg_alpha': 0.5135386228429145, 'reg_lambda': 0.7503017566281428}. Best is trial 32 with value: 4.8357418906587225e-06.
[I 2025-07-28 22:11:58,157] Trial 40 finished with value: 4.87463364096719e-06 and parameters: {'n_estimators': 787, 'learning_rate': 0.18969621822209587, 'max_depth': 7, 'num_leaves': 42, 'reg_alpha': 0.05569016033787155, 'reg_lambda': 0.41535389509294357}. Best is trial 32 with value: 4.8357418906587225e-06.
[I 2025-07-28 22:11:58,861] Trial 41 finished with value: 4.839673711453839e-06 and parameters: {'n_estimators': 743, 'learning_rate': 0.2019181776648385, 'max_depth': 10, 'num_leaves': 54, 'reg_alpha': 0.07570432883757931, 'reg_lambda': 0.6345351376945729}. Best is trial 32 with value: 4.8357418906587225e-06.
[I 2025-07-28 22:11:59,564] Trial 42 finished with value: 5.006203482248924e-06 and parameters: {'n_estimators': 740, 'learning_rate': 0.16908895621423525, 'max_depth': 10, 'num_leaves': 61, 'reg_alpha': 0.17001256755011246, 'reg_lambda': 0.6322926733040473}. Best is trial 32 with value: 4.8357418906587225e-06.
[I 2025-07-28 22:12:00,411] Trial 43 finished with value: 4.856118873925625e-06 and parameters: {'n_estimators': 845, 'learning_rate': 0.2282563828563697, 'max_depth': 10, 'num_leaves': 37, 'reg_alpha': 0.060434676063576664, 'reg_lambda': 0.6991211064730801}. Best is trial 32 with value: 4.8357418906587225e-06.
[I 2025-07-28 22:12:01,086] Trial 44 finished with value: 5.019251650211013e-06 and parameters: {'n_estimators': 679, 'learning_rate': 0.27319489591372964, 'max_depth': 9, 'num_leaves': 53, 'reg_alpha': 0.2302190728533254, 'reg_lambda': 0.8077587372798944}. Best is trial 32 with value: 4.8357418906587225e-06.
[I 2025-07-28 22:12:01,721] Trial 45 finished with value: 4.9713534131062584e-06 and parameters: {'n_estimators': 559, 'learning_rate': 0.19925675978469962, 'max_depth': 10, 'num_leaves': 71, 'reg_alpha': 0.13373845270565593, 'reg_lambda': 0.5451965617921188}. Best is trial 32 with value: 4.8357418906587225e-06.
[I 2025-07-28 22:12:02,583] Trial 46 finished with value: 4.857601452050014e-06 and parameters: {'n_estimators': 897, 'learning_rate': 0.24196934520083385, 'max_depth': 9, 'num_leaves': 44, 'reg_alpha': 0.051108007905094205, 'reg_lambda': 0.6745293043368081}. Best is trial 32 with value: 4.8357418906587225e-06.
[I 2025-07-28 22:12:04,112] Trial 47 finished with value: 5.695627530099705e-06 and parameters: {'n_estimators': 805, 'learning_rate': 0.2184894728902159, 'max_depth': 10, 'num_leaves': 26, 'reg_alpha': 0.0050032047981971445, 'reg_lambda': 0.7969540177839756}. Best is trial 32 with value: 4.8357418906587225e-06.
[I 2025-07-28 22:12:04,768] Trial 48 finished with value: 5.019251650211013e-06 and parameters: {'n_estimators': 723, 'learning_rate': 0.26157457564261427, 'max_depth': 6, 'num_leaves': 45, 'reg_alpha': 0.2923492010656817, 'reg_lambda': 0.5369474887092491}. Best is trial 32 with value: 4.8357418906587225e-06.
[I 2025-07-28 22:12:05,498] Trial 49 finished with value: 4.981823014397642e-06 and parameters: {'n_estimators': 766, 'learning_rate': 0.2966399734976965, 'max_depth': 3, 'num_leaves': 78, 'reg_alpha': 0.14558735921575316, 'reg_lambda': 0.8872557501823652}. Best is trial 32 with value: 4.8357418906587225e-06.
[I 2025-07-28 22:12:05,499] A new study created in memory with name: no-name-b43c0614-8f13-403a-94bd-ad61d1947f6b
[I 2025-07-28 22:12:12,491] Trial 0 finished with value: 5.019251649998546e-06 and parameters: {'n_estimators': 893, 'learning_rate': 0.08993234662746663, 'max_depth': 5, 'reg_alpha': 0.27893469005877014, 'reg_lambda': 0.5185275257565738}. Best is trial 0 with value: 5.019251649998546e-06.
[I 2025-07-28 22:12:16,286] Trial 1 finished with value: 5.019251649998546e-06 and parameters: {'n_estimators': 459, 'learning_rate': 0.25632566505794635, 'max_depth': 7, 'reg_alpha': 0.37073919110828646, 'reg_lambda': 0.5682314184956031}. Best is trial 0 with value: 5.019251649998546e-06.
[I 2025-07-28 22:12:18,363] Trial 2 finished with value: 5.019251649998546e-06 and parameters: {'n_estimators': 232, 'learning_rate': 0.1025592493792032, 'max_depth': 8, 'reg_alpha': 0.2810462902691999, 'reg_lambda': 0.27231530899011136}. Best is trial 0 with value: 5.019251649998546e-06.
[I 2025-07-28 22:12:23,763] Trial 3 finished with value: 5.019251649998546e-06 and parameters: {'n_estimators': 685, 'learning_rate': 0.29994217010681723, 'max_depth': 3, 'reg_alpha': 0.7371971835133412, 'reg_lambda': 0.6839865339953224}. Best is trial 0 with value: 5.019251649998546e-06.
[I 2025-07-28 22:12:25,803] Trial 4 finished with value: 5.019251649998546e-06 and parameters: {'n_estimators': 223, 'learning_rate': 0.19224547933968286, 'max_depth': 4, 'reg_alpha': 0.5436093279009833, 'reg_lambda': 0.03909356169191325}. Best is trial 0 with value: 5.019251649998546e-06.
[I 2025-07-28 22:12:30,615] Trial 5 finished with value: 5.019251649998546e-06 and parameters: {'n_estimators': 595, 'learning_rate': 0.272102796276067, 'max_depth': 5, 'reg_alpha': 0.31826789812734413, 'reg_lambda': 0.6704538118347436}. Best is trial 0 with value: 5.019251649998546e-06.
[I 2025-07-28 22:12:34,706] Trial 6 finished with value: 4.903639021039551e-06 and parameters: {'n_estimators': 314, 'learning_rate': 0.10023498103461051, 'max_depth': 10, 'reg_alpha': 0.05711679855573548, 'reg_lambda': 0.8304469145458535}. Best is trial 6 with value: 4.903639021039551e-06.
[I 2025-07-28 22:12:41,038] Trial 7 finished with value: 4.993965194169683e-06 and parameters: {'n_estimators': 762, 'learning_rate': 0.08582042064816871, 'max_depth': 10, 'reg_alpha': 0.1296465834276802, 'reg_lambda': 0.41511068630399717}. Best is trial 6 with value: 4.903639021039551e-06.
[I 2025-07-28 22:12:44,536] Trial 8 finished with value: 5.019251649998546e-06 and parameters: {'n_estimators': 410, 'learning_rate': 0.27718887293748756, 'max_depth': 7, 'reg_alpha': 0.6005278137329146, 'reg_lambda': 0.5315628752608426}. Best is trial 6 with value: 4.903639021039551e-06.
[I 2025-07-28 22:12:50,003] Trial 9 finished with value: 5.019251649998546e-06 and parameters: {'n_estimators': 646, 'learning_rate': 0.22714157192419665, 'max_depth': 3, 'reg_alpha': 0.9346956606442562, 'reg_lambda': 0.8320506441736814}. Best is trial 6 with value: 4.903639021039551e-06.
[I 2025-07-28 22:12:56,046] Trial 10 finished with value: 4.898601694528766e-06 and parameters: {'n_estimators': 340, 'learning_rate': 0.030278329947269117, 'max_depth': 10, 'reg_alpha': 0.06530624533125018, 'reg_lambda': 0.9173236781089837}. Best is trial 10 with value: 4.898601694528766e-06.
[I 2025-07-28 22:13:09,587] Trial 11 finished with value: 5.057984146760845e-06 and parameters: {'n_estimators': 100, 'learning_rate': 0.027985461222977154, 'max_depth': 10, 'reg_alpha': 0.0057557716009885435, 'reg_lambda': 0.9827303160172248}. Best is trial 10 with value: 4.898601694528766e-06.
[I 2025-07-28 22:13:49,506] Trial 12 finished with value: 5.181240864548294e-06 and parameters: {'n_estimators': 415, 'learning_rate': 0.01041766902229408, 'max_depth': 9, 'reg_alpha': 0.003913295686821611, 'reg_lambda': 0.9836770645791687}. Best is trial 10 with value: 4.898601694528766e-06.
[I 2025-07-28 22:13:51,818] Trial 13 finished with value: 4.996210469597771e-06 and parameters: {'n_estimators': 239, 'learning_rate': 0.138920436780456, 'max_depth': 9, 'reg_alpha': 0.1374172116032213, 'reg_lambda': 0.8442717830967741}. Best is trial 10 with value: 4.898601694528766e-06.
[I 2025-07-28 22:13:54,979] Trial 14 finished with value: 5.004262743517604e-06 and parameters: {'n_estimators': 347, 'learning_rate': 0.053984188925515986, 'max_depth': 9, 'reg_alpha': 0.14954714272948932, 'reg_lambda': 0.8224315715643369}. Best is trial 10 with value: 4.898601694528766e-06.
[I 2025-07-28 22:13:59,101] Trial 15 finished with value: 5.019251649998546e-06 and parameters: {'n_estimators': 506, 'learning_rate': 0.14176214952537497, 'max_depth': 10, 'reg_alpha': 0.42672929092205014, 'reg_lambda': 0.7324878781626379}. Best is trial 10 with value: 4.898601694528766e-06.
[I 2025-07-28 22:14:01,873] Trial 16 finished with value: 5.019402975561564e-06 and parameters: {'n_estimators': 318, 'learning_rate': 0.05826243746248482, 'max_depth': 8, 'reg_alpha': 0.18119577983501892, 'reg_lambda': 0.9927889018985888}. Best is trial 10 with value: 4.898601694528766e-06.
[I 2025-07-28 22:14:03,003] Trial 17 finished with value: 5.019251649998546e-06 and parameters: {'n_estimators': 100, 'learning_rate': 0.1764056491467101, 'max_depth': 8, 'reg_alpha': 0.6924314196260766, 'reg_lambda': 0.28992587224478034}. Best is trial 10 with value: 4.898601694528766e-06.
[I 2025-07-28 22:14:08,685] Trial 18 finished with value: 5.3109018228038464e-06 and parameters: {'n_estimators': 296, 'learning_rate': 0.11340402228045085, 'max_depth': 6, 'reg_alpha': 0.002133592378402105, 'reg_lambda': 0.884853101590815}. Best is trial 10 with value: 4.898601694528766e-06.
[I 2025-07-28 22:14:16,443] Trial 19 finished with value: 5.019251649998546e-06 and parameters: {'n_estimators': 1000, 'learning_rate': 0.05196413668880275, 'max_depth': 10, 'reg_alpha': 0.45254435945335036, 'reg_lambda': 0.7358933314842486}. Best is trial 10 with value: 4.898601694528766e-06.
[I 2025-07-28 22:14:20,812] Trial 20 finished with value: 5.019251649998546e-06 and parameters: {'n_estimators': 542, 'learning_rate': 0.07024539358937615, 'max_depth': 9, 'reg_alpha': 0.9778615654942845, 'reg_lambda': 0.615648608913765}. Best is trial 10 with value: 4.898601694528766e-06.
[I 2025-07-28 22:14:27,102] Trial 21 finished with value: 4.995843377024333e-06 and parameters: {'n_estimators': 753, 'learning_rate': 0.11488395834164135, 'max_depth': 10, 'reg_alpha': 0.12376128361353715, 'reg_lambda': 0.3750563998245355}. Best is trial 10 with value: 4.898601694528766e-06.
[I 2025-07-28 22:14:33,526] Trial 22 finished with value: 5.019251649998546e-06 and parameters: {'n_estimators': 820, 'learning_rate': 0.08110992617193649, 'max_depth': 10, 'reg_alpha': 0.2240008895479299, 'reg_lambda': 0.3705551506667295}. Best is trial 10 with value: 4.898601694528766e-06.
[I 2025-07-28 22:14:41,179] Trial 23 finished with value: 4.972608570977205e-06 and parameters: {'n_estimators': 719, 'learning_rate': 0.025441825534378237, 'max_depth': 9, 'reg_alpha': 0.09476956828984405, 'reg_lambda': 0.12384209124324774}. Best is trial 10 with value: 4.898601694528766e-06.
[I 2025-07-28 22:14:45,511] Trial 24 finished with value: 4.893646192760918e-06 and parameters: {'n_estimators': 185, 'learning_rate': 0.030172411998627868, 'max_depth': 9, 'reg_alpha': 0.06917952298225927, 'reg_lambda': 0.013457222412281353}. Best is trial 24 with value: 4.893646192760918e-06.
[I 2025-07-28 22:14:49,239] Trial 25 finished with value: 4.876666220823588e-06 and parameters: {'n_estimators': 162, 'learning_rate': 0.03495315381225841, 'max_depth': 8, 'reg_alpha': 0.0649933142740332, 'reg_lambda': 0.16639630211883605}. Best is trial 25 with value: 4.876666220823588e-06.
[I 2025-07-28 22:14:50,916] Trial 26 finished with value: 5.019251649998546e-06 and parameters: {'n_estimators': 174, 'learning_rate': 0.029958246584866826, 'max_depth': 8, 'reg_alpha': 0.21808334421166173, 'reg_lambda': 0.017887616940401613}. Best is trial 25 with value: 4.876666220823588e-06.
[I 2025-07-28 22:14:54,846] Trial 27 finished with value: 4.843067767665167e-06 and parameters: {'n_estimators': 172, 'learning_rate': 0.031932248422740964, 'max_depth': 7, 'reg_alpha': 0.05984918580781165, 'reg_lambda': 0.12546958628738505}. Best is trial 27 with value: 4.843067767665167e-06.
[I 2025-07-28 22:14:56,820] Trial 28 finished with value: 5.019251649998546e-06 and parameters: {'n_estimators': 175, 'learning_rate': 0.04809521547051106, 'max_depth': 7, 'reg_alpha': 0.34750090965174263, 'reg_lambda': 0.16626078765178925}. Best is trial 27 with value: 4.843067767665167e-06.
[I 2025-07-28 22:14:58,337] Trial 29 finished with value: 5.019251649998546e-06 and parameters: {'n_estimators': 156, 'learning_rate': 0.011407154296073564, 'max_depth': 6, 'reg_alpha': 0.21620575325137104, 'reg_lambda': 0.12778819051791063}. Best is trial 27 with value: 4.843067767665167e-06.
[I 2025-07-28 22:15:00,662] Trial 30 finished with value: 5.019251649998546e-06 and parameters: {'n_estimators': 260, 'learning_rate': 0.07171260302240488, 'max_depth': 6, 'reg_alpha': 0.2555788885578548, 'reg_lambda': 0.18758199441771167}. Best is trial 27 with value: 4.843067767665167e-06.
[I 2025-07-28 22:15:05,651] Trial 31 finished with value: 4.883742015988456e-06 and parameters: {'n_estimators': 372, 'learning_rate': 0.04069502089238708, 'max_depth': 8, 'reg_alpha': 0.06622786708529127, 'reg_lambda': 0.07300335812193177}. Best is trial 27 with value: 4.843067767665167e-06.
[I 2025-07-28 22:15:11,351] Trial 32 finished with value: 4.830581532849576e-06 and parameters: {'n_estimators': 390, 'learning_rate': 0.041880797860106796, 'max_depth': 7, 'reg_alpha': 0.04348986671324595, 'reg_lambda': 0.07678506464938852}. Best is trial 32 with value: 4.830581532849576e-06.
[I 2025-07-28 22:15:14,845] Trial 33 finished with value: 5.01216458137604e-06 and parameters: {'n_estimators': 403, 'learning_rate': 0.044382028373376826, 'max_depth': 7, 'reg_alpha': 0.16970046721933987, 'reg_lambda': 0.23212031814552642}. Best is trial 32 with value: 4.830581532849576e-06.
[I 2025-07-28 22:15:18,819] Trial 34 finished with value: 5.019251649998546e-06 and parameters: {'n_estimators': 478, 'learning_rate': 0.06818116850729491, 'max_depth': 8, 'reg_alpha': 0.28421828205839994, 'reg_lambda': 0.10181625680301096}. Best is trial 32 with value: 4.830581532849576e-06.
[I 2025-07-28 22:15:22,134] Trial 35 finished with value: 4.867803890277803e-06 and parameters: {'n_estimators': 273, 'learning_rate': 0.09029527104753751, 'max_depth': 7, 'reg_alpha': 0.061642936355527395, 'reg_lambda': 0.06831348125816479}. Best is trial 32 with value: 4.830581532849576e-06.
[I 2025-07-28 22:15:25,189] Trial 36 finished with value: 4.855851321426021e-06 and parameters: {'n_estimators': 266, 'learning_rate': 0.09440033947313585, 'max_depth': 5, 'reg_alpha': 0.048840433362293156, 'reg_lambda': 0.2875542634498415}. Best is trial 32 with value: 4.830581532849576e-06.
