[I 2025-07-28 23:46:38,568] Trial 6 finished with value: 5.019251649998546e-06 and parameters: {'n_estimators': 410, 'learning_rate': 0.16969271830161903, 'max_depth': 4, 'reg_alpha': 0.3849056048935152, 'reg_lambda': 0.8327806670619987}. Best is trial 0 with value: 5.019251649998546e-06.
[I 2025-07-28 23:46:44,434] Trial 7 finished with value: 5.019251649998546e-06 and parameters: {'n_estimators': 799, 'learning_rate': 0.17110568582301594, 'max_depth': 10, 'reg_alpha': 0.5548012636030056, 'reg_lambda': 0.04179563762190264}. Best is trial 0 with value: 5.019251649998546e-06.
[I 2025-07-28 23:46:48,396] Trial 8 finished with value: 5.019251649998546e-06 and parameters: {'n_estimators': 526, 'learning_rate': 0.015891290919283922, 'max_depth': 7, 'reg_alpha': 0.9901625340599559, 'reg_lambda': 0.9273984551148797}. Best is trial 0 with value: 5.019251649998546e-06.
[I 2025-07-28 23:46:53,383] Trial 9 finished with value: 5.019251649998546e-06 and parameters: {'n_estimators': 680, 'learning_rate': 0.1641324414431175, 'max_depth': 6, 'reg_alpha': 0.5491182620146438, 'reg_lambda': 0.3248005985466643}. Best is trial 0 with value: 5.019251649998546e-06.
[I 2025-07-28 23:46:54,866] Trial 10 finished with value: 5.166874376733437e-06 and parameters: {'n_estimators': 104, 'learning_rate': 0.29281965969919466, 'max_depth': 3, 'reg_alpha': 0.018515448454440142, 'reg_lambda': 0.7409074343245261}. Best is trial 0 with value: 5.019251649998546e-06.
[I 2025-07-28 23:46:57,509] Trial 11 finished with value: 4.977984951586558e-06 and parameters: {'n_estimators': 324, 'learning_rate': 0.22893311526194715, 'max_depth': 3, 'reg_alpha': 0.12518087638533365, 'reg_lambda': 0.18265683174597747}. Best is trial 11 with value: 4.977984951586558e-06.
[I 2025-07-28 23:46:59,893] Trial 12 finished with value: 4.978259076403139e-06 and parameters: {'n_estimators': 282, 'learning_rate': 0.2251007270869299, 'max_depth': 3, 'reg_alpha': 0.12557025908305602, 'reg_lambda': 0.09233403600318746}. Best is trial 11 with value: 4.977984951586558e-06.
[I 2025-07-28 23:47:02,567] Trial 13 finished with value: 4.997954069400083e-06 and parameters: {'n_estimators': 250, 'learning_rate': 0.2353574204102751, 'max_depth': 5, 'reg_alpha': 0.025459215780725547, 'reg_lambda': 0.04926603953764064}. Best is trial 11 with value: 4.977984951586558e-06.
[I 2025-07-28 23:47:05,169] Trial 14 finished with value: 5.014155223669849e-06 and parameters: {'n_estimators': 313, 'learning_rate': 0.23599725120359297, 'max_depth': 3, 'reg_alpha': 0.17547739953816704, 'reg_lambda': 0.1945658002554952}. Best is trial 11 with value: 4.977984951586558e-06.
[I 2025-07-28 23:47:06,631] Trial 15 finished with value: 5.019251649998546e-06 and parameters: {'n_estimators': 120, 'learning_rate': 0.2961227208658204, 'max_depth': 5, 'reg_alpha': 0.19624128474963579, 'reg_lambda': 0.21162086781228373}. Best is trial 11 with value: 4.977984951586558e-06.
[I 2025-07-28 23:47:08,955] Trial 16 finished with value: 4.980930623639694e-06 and parameters: {'n_estimators': 274, 'learning_rate': 0.23959128261839008, 'max_depth': 4, 'reg_alpha': 0.12625310881288843, 'reg_lambda': 0.1803246292362716}. Best is trial 11 with value: 4.977984951586558e-06.
[I 2025-07-28 23:47:11,956] Trial 17 finished with value: 5.019251649998546e-06 and parameters: {'n_estimators': 378, 'learning_rate': 0.09561496212139697, 'max_depth': 8, 'reg_alpha': 0.31372039455888023, 'reg_lambda': 0.36627425252911705}. Best is trial 11 with value: 4.977984951586558e-06.
[I 2025-07-28 23:47:13,993] Trial 18 finished with value: 4.9420484304331066e-06 and parameters: {'n_estimators': 229, 'learning_rate': 0.20448378355316305, 'max_depth': 3, 'reg_alpha': 0.10251089426143811, 'reg_lambda': 0.013050669754679362}. Best is trial 18 with value: 4.9420484304331066e-06.
[I 2025-07-28 23:47:15,630] Trial 19 finished with value: 5.019251649998546e-06 and parameters: {'n_estimators': 181, 'learning_rate': 0.26857829639620473, 'max_depth': 6, 'reg_alpha': 0.29532012668407703, 'reg_lambda': 0.2580340617734035}. Best is trial 18 with value: 4.9420484304331066e-06.
[I 2025-07-28 23:47:21,261] Trial 20 finished with value: 5.230044231071098e-06 and parameters: {'n_estimators': 624, 'learning_rate': 0.19793073775837194, 'max_depth': 4, 'reg_alpha': 0.009587423788942173, 'reg_lambda': 0.015889168624048655}. Best is trial 18 with value: 4.9420484304331066e-06.
[I 2025-07-28 23:47:24,255] Trial 21 finished with value: 4.971155621946725e-06 and parameters: {'n_estimators': 370, 'learning_rate': 0.21842379488330363, 'max_depth': 3, 'reg_alpha': 0.12137748949669619, 'reg_lambda': 0.12083028291898568}. Best is trial 18 with value: 4.9420484304331066e-06.
[I 2025-07-28 23:47:27,498] Trial 22 finished with value: 4.910203389591676e-06 and parameters: {'n_estimators': 405, 'learning_rate': 0.2547267112370309, 'max_depth': 3, 'reg_alpha': 0.09368197787602646, 'reg_lambda': 0.13572087120970444}. Best is trial 22 with value: 4.910203389591676e-06.
[I 2025-07-28 23:47:30,929] Trial 23 finished with value: 5.019251649998546e-06 and parameters: {'n_estimators': 444, 'learning_rate': 0.25920670402800444, 'max_depth': 4, 'reg_alpha': 0.2554304335205123, 'reg_lambda': 0.11009232833252247}. Best is trial 22 with value: 4.910203389591676e-06.
[I 2025-07-28 23:47:32,992] Trial 24 finished with value: 4.923746128276165e-06 and parameters: {'n_estimators': 215, 'learning_rate': 0.19169863582564162, 'max_depth': 5, 'reg_alpha': 0.09090238846278971, 'reg_lambda': 0.4348532100890422}. Best is trial 22 with value: 4.910203389591676e-06.
[I 2025-07-28 23:47:34,615] Trial 25 finished with value: 5.019251649998546e-06 and parameters: {'n_estimators': 182, 'learning_rate': 0.19209873939697283, 'max_depth': 5, 'reg_alpha': 0.45134035140360174, 'reg_lambda': 0.41818722394225366}. Best is trial 22 with value: 4.910203389591676e-06.
[I 2025-07-28 23:47:37,023] Trial 26 finished with value: 4.89932808378075e-06 and parameters: {'n_estimators': 198, 'learning_rate': 0.14154850962928306, 'max_depth': 6, 'reg_alpha': 0.07686902450150629, 'reg_lambda': 0.46933116631387894}. Best is trial 26 with value: 4.89932808378075e-06.
[I 2025-07-28 23:47:38,560] Trial 27 finished with value: 5.019251649998546e-06 and parameters: {'n_estimators': 169, 'learning_rate': 0.11181441181936916, 'max_depth': 6, 'reg_alpha': 0.3661845387653279, 'reg_lambda': 0.6855609503658263}. Best is trial 26 with value: 4.89932808378075e-06.
[I 2025-07-28 23:47:44,694] Trial 28 finished with value: 4.845470328223819e-06 and parameters: {'n_estimators': 639, 'learning_rate': 0.0780755035457864, 'max_depth': 8, 'reg_alpha': 0.052765404736973776, 'reg_lambda': 0.4821105596995285}. Best is trial 28 with value: 4.845470328223819e-06.
[I 2025-07-28 23:47:49,322] Trial 29 finished with value: 5.019251649998546e-06 and parameters: {'n_estimators': 611, 'learning_rate': 0.0745600995748969, 'max_depth': 8, 'reg_alpha': 0.24124976286884825, 'reg_lambda': 0.48857935242118783}. Best is trial 28 with value: 4.845470328223819e-06.
[I 2025-07-28 23:47:55,467] Trial 30 finished with value: 4.850430744229476e-06 and parameters: {'n_estimators': 462, 'learning_rate': 0.034863519006769324, 'max_depth': 8, 'reg_alpha': 0.05555702552070611, 'reg_lambda': 0.3068483322330309}. Best is trial 28 with value: 4.845470328223819e-06.
[I 2025-07-28 23:48:04,034] Trial 31 finished with value: 4.862910755177666e-06 and parameters: {'n_estimators': 466, 'learning_rate': 0.01557189021288194, 'max_depth': 8, 'reg_alpha': 0.05944727760554161, 'reg_lambda': 0.29277803806286384}. Best is trial 28 with value: 4.845470328223819e-06.
[I 2025-07-28 23:48:14,474] Trial 32 finished with value: 4.859699680186154e-06 and parameters: {'n_estimators': 581, 'learning_rate': 0.013091866402576043, 'max_depth': 8, 'reg_alpha': 0.058436921466942696, 'reg_lambda': 0.3038150303504366}. Best is trial 28 with value: 4.845470328223819e-06.
[I 2025-07-28 23:48:19,768] Trial 33 finished with value: 5.019251649998546e-06 and parameters: {'n_estimators': 695, 'learning_rate': 0.020703192597327696, 'max_depth': 8, 'reg_alpha': 0.20651789238422275, 'reg_lambda': 0.3099683798084766}. Best is trial 28 with value: 4.845470328223819e-06.
[I 2025-07-28 23:48:26,646] Trial 34 finished with value: 4.872934152447453e-06 and parameters: {'n_estimators': 468, 'learning_rate': 0.044435752349875166, 'max_depth': 9, 'reg_alpha': 0.044668539064620434, 'reg_lambda': 0.2728664637448994}. Best is trial 28 with value: 4.845470328223819e-06.
[I 2025-07-28 23:48:31,226] Trial 35 finished with value: 5.015776489692807e-06 and parameters: {'n_estimators': 588, 'learning_rate': 0.036756389762184455, 'max_depth': 9, 'reg_alpha': 0.17472842167355102, 'reg_lambda': 0.5588714722193686}. Best is trial 28 with value: 4.845470328223819e-06.
[I 2025-07-28 23:48:38,019] Trial 36 finished with value: 4.853901162089262e-06 and parameters: {'n_estimators': 697, 'learning_rate': 0.06265610957691702, 'max_depth': 8, 'reg_alpha': 0.0523613131022393, 'reg_lambda': 0.3367943139647802}. Best is trial 28 with value: 4.845470328223819e-06.
[I 2025-07-28 23:48:49,940] Trial 37 finished with value: 5.222798245380757e-06 and parameters: {'n_estimators': 728, 'learning_rate': 0.06716306805530835, 'max_depth': 10, 'reg_alpha': 0.0015753880551775887, 'reg_lambda': 0.37136078803816647}. Best is trial 28 with value: 4.845470328223819e-06.
[I 2025-07-28 23:48:56,678] Trial 38 finished with value: 5.019251649998546e-06 and parameters: {'n_estimators': 925, 'learning_rate': 0.08389293903814303, 'max_depth': 9, 'reg_alpha': 0.7164667751384446, 'reg_lambda': 0.6182259606159844}. Best is trial 28 with value: 4.845470328223819e-06.
[I 2025-07-28 23:49:01,007] Trial 39 finished with value: 5.019251649998546e-06 and parameters: {'n_estimators': 573, 'learning_rate': 0.04841374049821405, 'max_depth': 7, 'reg_alpha': 0.8858946263205181, 'reg_lambda': 0.5440948737557554}. Best is trial 28 with value: 4.845470328223819e-06.
[I 2025-07-28 23:49:06,785] Trial 40 finished with value: 5.007460422674999e-06 and parameters: {'n_estimators': 756, 'learning_rate': 0.030317262383967307, 'max_depth': 8, 'reg_alpha': 0.15515402457638292, 'reg_lambda': 0.35857687250288317}. Best is trial 28 with value: 4.845470328223819e-06.
[I 2025-07-28 23:49:12,945] Trial 41 finished with value: 4.8936833593029495e-06 and parameters: {'n_estimators': 645, 'learning_rate': 0.054683456130589767, 'max_depth': 8, 'reg_alpha': 0.07185827880275292, 'reg_lambda': 0.25001239718774315}. Best is trial 28 with value: 4.845470328223819e-06.
[I 2025-07-28 23:49:24,002] Trial 42 finished with value: 4.834880353677518e-06 and parameters: {'n_estimators': 524, 'learning_rate': 0.010611046354396674, 'max_depth': 7, 'reg_alpha': 0.05634458132405376, 'reg_lambda': 0.33512705945298676}. Best is trial 42 with value: 4.834880353677518e-06.
[I 2025-07-28 23:49:28,081] Trial 43 finished with value: 5.019251649998546e-06 and parameters: {'n_estimators': 533, 'learning_rate': 0.03027703697001139, 'max_depth': 7, 'reg_alpha': 0.234268055058139, 'reg_lambda': 0.44959074737742005}. Best is trial 42 with value: 4.834880353677518e-06.
[I 2025-07-28 23:49:41,033] Trial 44 finished with value: 4.825342262314632e-06 and parameters: {'n_estimators': 843, 'learning_rate': 0.011757968063460026, 'max_depth': 7, 'reg_alpha': 0.05192733796698808, 'reg_lambda': 0.39564761453728775}. Best is trial 44 with value: 4.825342262314632e-06.
[I 2025-07-28 23:49:47,439] Trial 45 finished with value: 5.002405532475795e-06 and parameters: {'n_estimators': 844, 'learning_rate': 0.09997036424506262, 'max_depth': 7, 'reg_alpha': 0.14932605256081388, 'reg_lambda': 0.5215398595880991}. Best is trial 44 with value: 4.825342262314632e-06.
[I 2025-07-28 23:49:56,639] Trial 46 finished with value: 4.86245255026511e-06 and parameters: {'n_estimators': 972, 'learning_rate': 0.06316750536601516, 'max_depth': 7, 'reg_alpha': 0.037155048754734424, 'reg_lambda': 0.3940258378996337}. Best is trial 44 with value: 4.825342262314632e-06.
[I 2025-07-28 23:50:03,243] Trial 47 finished with value: 5.019251649998546e-06 and parameters: {'n_estimators': 893, 'learning_rate': 0.039013765836459546, 'max_depth': 9, 'reg_alpha': 0.5716949645873354, 'reg_lambda': 0.3480279791101885}. Best is trial 44 with value: 4.825342262314632e-06.
[I 2025-07-28 23:50:13,758] Trial 48 finished with value: 5.334000269646594e-06 and parameters: {'n_estimators': 785, 'learning_rate': 0.07628175428283654, 'max_depth': 7, 'reg_alpha': 0.0008468135925431969, 'reg_lambda': 0.582837162285292}. Best is trial 44 with value: 4.825342262314632e-06.
[I 2025-07-28 23:50:18,724] Trial 49 finished with value: 5.019251649998546e-06 and parameters: {'n_estimators': 669, 'learning_rate': 0.029519117061750297, 'max_depth': 9, 'reg_alpha': 0.27542067045630747, 'reg_lambda': 0.4047878253538085}. Best is trial 44 with value: 4.825342262314632e-06.
[I 2025-07-28 23:50:18,724] A new study created in memory with name: no-name-16291dc5-7999-41b1-bdef-4c85c055c9a7
[I 2025-07-28 23:50:23,055] Trial 0 finished with value: 5.115583318549655e-06 and parameters: {'n_estimators': 435, 'max_depth': 9, 'min_samples_split': 9, 'min_samples_leaf': 4, 'max_features': 'log2'}. Best is trial 0 with value: 5.115583318549655e-06.
[I 2025-07-28 23:50:34,737] Trial 1 finished with value: 5.225395968902172e-06 and parameters: {'n_estimators': 407, 'max_depth': 15, 'min_samples_split': 2, 'min_samples_leaf': 2, 'max_features': 'sqrt'}. Best is trial 0 with value: 5.115583318549655e-06.
[I 2025-07-28 23:50:39,036] Trial 2 finished with value: 5.154016829519534e-06 and parameters: {'n_estimators': 368, 'max_depth': 15, 'min_samples_split': 13, 'min_samples_leaf': 4, 'max_features': 'log2'}. Best is trial 0 with value: 5.115583318549655e-06.
[I 2025-07-28 23:52:15,862] Trial 3 finished with value: 5.068584370775463e-06 and parameters: {'n_estimators': 228, 'max_depth': 12, 'min_samples_split': 13, 'min_samples_leaf': 1, 'max_features': None}. Best is trial 3 with value: 5.068584370775463e-06.
[I 2025-07-28 23:56:19,082] Trial 4 finished with value: 5.053825141000578e-06 and parameters: {'n_estimators': 476, 'max_depth': 20, 'min_samples_split': 4, 'min_samples_leaf': 3, 'max_features': None}. Best is trial 4 with value: 5.053825141000578e-06.
[I 2025-07-28 23:57:22,500] Trial 5 finished with value: 4.751450066080719e-06 and parameters: {'n_estimators': 481, 'max_depth': 3, 'min_samples_split': 11, 'min_samples_leaf': 7, 'max_features': None}. Best is trial 5 with value: 4.751450066080719e-06.
[I 2025-07-28 23:57:25,972] Trial 6 finished with value: 5.021377732971633e-06 and parameters: {'n_estimators': 367, 'max_depth': 3, 'min_samples_split': 5, 'min_samples_leaf': 2, 'max_features': 'sqrt'}. Best is trial 5 with value: 4.751450066080719e-06.
[I 2025-07-28 23:57:33,418] Trial 7 finished with value: 5.0388971382646586e-06 and parameters: {'n_estimators': 379, 'max_depth': 12, 'min_samples_split': 7, 'min_samples_leaf': 10, 'max_features': 'sqrt'}. Best is trial 5 with value: 4.751450066080719e-06.
[I 2025-07-28 23:57:37,020] Trial 8 finished with value: 4.983799443294601e-06 and parameters: {'n_estimators': 389, 'max_depth': 3, 'min_samples_split': 4, 'min_samples_leaf': 9, 'max_features': 'sqrt'}. Best is trial 5 with value: 4.751450066080719e-06.
[I 2025-07-28 23:57:41,449] Trial 9 finished with value: 5.21712409738871e-06 and parameters: {'n_estimators': 370, 'max_depth': 11, 'min_samples_split': 3, 'min_samples_leaf': 1, 'max_features': 'log2'}. Best is trial 5 with value: 4.751450066080719e-06.
[I 2025-07-28 23:58:21,915] Trial 10 finished with value: 4.7876620996574684e-06 and parameters: {'n_estimators': 151, 'max_depth': 7, 'min_samples_split': 18, 'min_samples_leaf': 7, 'max_features': None}. Best is trial 5 with value: 4.751450066080719e-06.
[I 2025-07-28 23:58:54,096] Trial 11 finished with value: 4.778425870801329e-06 and parameters: {'n_estimators': 135, 'max_depth': 6, 'min_samples_split': 19, 'min_samples_leaf': 7, 'max_features': None}. Best is trial 5 with value: 4.751450066080719e-06.
[I 2025-07-28 23:59:20,443] Trial 12 finished with value: 4.75841689187815e-06 and parameters: {'n_estimators': 111, 'max_depth': 6, 'min_samples_split': 20, 'min_samples_leaf': 7, 'max_features': None}. Best is trial 5 with value: 4.751450066080719e-06.
[I 2025-07-29 00:00:11,350] Trial 13 finished with value: 4.795971964240597e-06 and parameters: {'n_estimators': 246, 'max_depth': 5, 'min_samples_split': 16, 'min_samples_leaf': 7, 'max_features': None}. Best is trial 5 with value: 4.751450066080719e-06.
[I 2025-07-29 00:01:34,343] Trial 14 finished with value: 4.864874362215017e-06 and parameters: {'n_estimators': 276, 'max_depth': 8, 'min_samples_split': 11, 'min_samples_leaf': 6, 'max_features': None}. Best is trial 5 with value: 4.751450066080719e-06.
[I 2025-07-29 00:01:54,700] Trial 15 finished with value: 4.7336394019522835e-06 and parameters: {'n_estimators': 100, 'max_depth': 5, 'min_samples_split': 16, 'min_samples_leaf': 9, 'max_features': None}. Best is trial 15 with value: 4.7336394019522835e-06.
[I 2025-07-29 00:02:19,724] Trial 16 finished with value: 4.725984965932265e-06 and parameters: {'n_estimators': 190, 'max_depth': 3, 'min_samples_split': 15, 'min_samples_leaf': 9, 'max_features': None}. Best is trial 16 with value: 4.725984965932265e-06.
[I 2025-07-29 00:02:54,745] Trial 17 finished with value: 4.7636253063811594e-06 and parameters: {'n_estimators': 172, 'max_depth': 5, 'min_samples_split': 16, 'min_samples_leaf': 9, 'max_features': None}. Best is trial 16 with value: 4.725984965932265e-06.
[I 2025-07-29 00:03:56,341] Trial 18 finished with value: 4.817031306470385e-06 and parameters: {'n_estimators': 192, 'max_depth': 10, 'min_samples_split': 15, 'min_samples_leaf': 10, 'max_features': None}. Best is trial 16 with value: 4.725984965932265e-06.
[I 2025-07-29 00:03:57,471] Trial 19 finished with value: 5.093231553428287e-06 and parameters: {'n_estimators': 106, 'max_depth': 20, 'min_samples_split': 14, 'min_samples_leaf': 9, 'max_features': 'log2'}. Best is trial 16 with value: 4.725984965932265e-06.
[I 2025-07-29 00:05:18,773] Trial 20 finished with value: 4.869479631748097e-06 and parameters: {'n_estimators': 213, 'max_depth': 15, 'min_samples_split': 17, 'min_samples_leaf': 8, 'max_features': None}. Best is trial 16 with value: 4.725984965932265e-06.
[I 2025-07-29 00:06:00,342] Trial 21 finished with value: 4.732531655606261e-06 and parameters: {'n_estimators': 316, 'max_depth': 3, 'min_samples_split': 11, 'min_samples_leaf': 8, 'max_features': None}. Best is trial 16 with value: 4.725984965932265e-06.
[I 2025-07-29 00:06:54,604] Trial 22 finished with value: 4.761388966944537e-06 and parameters: {'n_estimators': 320, 'max_depth': 4, 'min_samples_split': 9, 'min_samples_leaf': 8, 'max_features': None}. Best is trial 16 with value: 4.725984965932265e-06.
[I 2025-07-29 00:07:57,848] Trial 23 finished with value: 4.760253538139041e-06 and parameters: {'n_estimators': 314, 'max_depth': 5, 'min_samples_split': 13, 'min_samples_leaf': 10, 'max_features': None}. Best is trial 16 with value: 4.725984965932265e-06.
[I 2025-07-29 00:09:11,253] Trial 24 finished with value: 4.809063537839827e-06 and parameters: {'n_estimators': 276, 'max_depth': 7, 'min_samples_split': 10, 'min_samples_leaf': 8, 'max_features': None}. Best is trial 16 with value: 4.725984965932265e-06.
[I 2025-07-29 00:09:41,972] Trial 25 finished with value: 4.787302825692942e-06 and parameters: {'n_estimators': 177, 'max_depth': 4, 'min_samples_split': 15, 'min_samples_leaf': 5, 'max_features': None}. Best is trial 16 with value: 4.725984965932265e-06.
[I 2025-07-29 00:10:25,752] Trial 26 finished with value: 4.732365444595643e-06 and parameters: {'n_estimators': 331, 'max_depth': 3, 'min_samples_split': 7, 'min_samples_leaf': 9, 'max_features': None}. Best is trial 16 with value: 4.725984965932265e-06.
[I 2025-07-29 00:11:10,241] Trial 27 finished with value: 4.770049022516275e-06 and parameters: {'n_estimators': 334, 'max_depth': 3, 'min_samples_split': 7, 'min_samples_leaf': 6, 'max_features': None}. Best is trial 16 with value: 4.725984965932265e-06.
[I 2025-07-29 00:11:15,016] Trial 28 finished with value: 4.997657011650873e-06 and parameters: {'n_estimators': 268, 'max_depth': 8, 'min_samples_split': 7, 'min_samples_leaf': 8, 'max_features': 'sqrt'}. Best is trial 16 with value: 4.725984965932265e-06.
[I 2025-07-29 00:11:18,838] Trial 29 finished with value: 5.044429972245522e-06 and parameters: {'n_estimators': 443, 'max_depth': 8, 'min_samples_split': 9, 'min_samples_leaf': 10, 'max_features': 'log2'}. Best is trial 16 with value: 4.725984965932265e-06.
[I 2025-07-29 00:11:22,915] Trial 30 finished with value: 5.1444783831436005e-06 and parameters: {'n_estimators': 344, 'max_depth': 18, 'min_samples_split': 8, 'min_samples_leaf': 5, 'max_features': 'log2'}. Best is trial 16 with value: 4.725984965932265e-06.
[I 2025-07-29 00:12:13,385] Trial 31 finished with value: 4.735774458462428e-06 and parameters: {'n_estimators': 297, 'max_depth': 4, 'min_samples_split': 12, 'min_samples_leaf': 9, 'max_features': None}. Best is trial 16 with value: 4.725984965932265e-06.
[I 2025-07-29 00:12:45,652] Trial 32 finished with value: 4.754567710872249e-06 and parameters: {'n_estimators': 137, 'max_depth': 6, 'min_samples_split': 17, 'min_samples_leaf': 9, 'max_features': None}. Best is trial 16 with value: 4.725984965932265e-06.
[I 2025-07-29 00:13:56,207] Trial 33 finished with value: 4.769735055154531e-06 and parameters: {'n_estimators': 412, 'max_depth': 4, 'min_samples_split': 14, 'min_samples_leaf': 8, 'max_features': None}. Best is trial 16 with value: 4.725984965932265e-06.
