[I 2025-07-28 20:14:13,616] Trial 7 finished with value: 4.832546774287484e-06 and parameters: {'n_estimators': 464, 'max_depth': 4}. Best is trial 3 with value: 4.773465651123224e-06.
[I 2025-07-28 20:17:32,428] Trial 8 finished with value: 5.034668828609547e-06 and parameters: {'n_estimators': 498, 'max_depth': 10}. Best is trial 3 with value: 4.773465651123224e-06.
[I 2025-07-28 20:18:56,912] Trial 9 finished with value: 4.886274987329123e-06 and parameters: {'n_estimators': 390, 'max_depth': 5}. Best is trial 3 with value: 4.773465651123224e-06.
[I 2025-07-28 20:19:54,919] Trial 10 finished with value: 4.867872308109369e-06 and parameters: {'n_estimators': 267, 'max_depth': 5}. Best is trial 3 with value: 4.773465651123224e-06.
[I 2025-07-28 20:20:44,370] Trial 11 finished with value: 4.789783240649252e-06 and parameters: {'n_estimators': 370, 'max_depth': 3}. Best is trial 3 with value: 4.773465651123224e-06.
[I 2025-07-28 20:21:32,466] Trial 12 finished with value: 4.789096165208282e-06 and parameters: {'n_estimators': 360, 'max_depth': 3}. Best is trial 3 with value: 4.773465651123224e-06.
[I 2025-07-28 20:22:40,522] Trial 13 finished with value: 4.867125468575954e-06 and parameters: {'n_estimators': 314, 'max_depth': 5}. Best is trial 3 with value: 4.773465651123224e-06.
[I 2025-07-28 20:23:37,979] Trial 14 finished with value: 4.782921142544499e-06 and parameters: {'n_estimators': 430, 'max_depth': 3}. Best is trial 3 with value: 4.773465651123224e-06.
[I 2025-07-28 20:24:53,606] Trial 15 finished with value: 4.830950806558509e-06 and parameters: {'n_estimators': 431, 'max_depth': 4}. Best is trial 3 with value: 4.773465651123224e-06.
[I 2025-07-28 20:25:53,498] Trial 16 finished with value: 4.920912668540307e-06 and parameters: {'n_estimators': 233, 'max_depth': 6}. Best is trial 3 with value: 4.773465651123224e-06.
[I 2025-07-28 20:27:10,552] Trial 17 finished with value: 4.833690329832628e-06 and parameters: {'n_estimators': 439, 'max_depth': 4}. Best is trial 3 with value: 4.773465651123224e-06.
[I 2025-07-28 20:28:06,613] Trial 18 finished with value: 4.9770782516959224e-06 and parameters: {'n_estimators': 168, 'max_depth': 8}. Best is trial 3 with value: 4.773465651123224e-06.
[I 2025-07-28 20:29:01,296] Trial 19 finished with value: 4.7849333081808e-06 and parameters: {'n_estimators': 409, 'max_depth': 3}. Best is trial 3 with value: 4.773465651123224e-06.
[I 2025-07-28 20:30:22,331] Trial 20 finished with value: 4.903997618952048e-06 and parameters: {'n_estimators': 315, 'max_depth': 6}. Best is trial 3 with value: 4.773465651123224e-06.
[I 2025-07-28 20:31:16,521] Trial 21 finished with value: 4.785434137013127e-06 and parameters: {'n_estimators': 405, 'max_depth': 3}. Best is trial 3 with value: 4.773465651123224e-06.
[I 2025-07-28 20:32:44,207] Trial 22 finished with value: 4.828617720185029e-06 and parameters: {'n_estimators': 500, 'max_depth': 4}. Best is trial 3 with value: 4.773465651123224e-06.
[I 2025-07-28 20:33:18,679] Trial 23 finished with value: 4.780282835076504e-06 and parameters: {'n_estimators': 257, 'max_depth': 3}. Best is trial 3 with value: 4.773465651123224e-06.
[I 2025-07-28 20:34:02,820] Trial 24 finished with value: 4.8236905973592755e-06 and parameters: {'n_estimators': 251, 'max_depth': 4}. Best is trial 3 with value: 4.773465651123224e-06.
[I 2025-07-28 20:35:00,120] Trial 25 finished with value: 4.869395538408349e-06 and parameters: {'n_estimators': 264, 'max_depth': 5}. Best is trial 3 with value: 4.773465651123224e-06.
[I 2025-07-28 20:35:44,202] Trial 26 finished with value: 4.789419067874766e-06 and parameters: {'n_estimators': 330, 'max_depth': 3}. Best is trial 3 with value: 4.773465651123224e-06.
[I 2025-07-28 20:36:34,470] Trial 27 finished with value: 4.814957785821897e-06 and parameters: {'n_estimators': 286, 'max_depth': 4}. Best is trial 3 with value: 4.773465651123224e-06.
[I 2025-07-28 20:37:02,694] Trial 28 finished with value: 4.777456762855798e-06 and parameters: {'n_estimators': 211, 'max_depth': 3}. Best is trial 3 with value: 4.773465651123224e-06.
[I 2025-07-28 20:37:46,003] Trial 29 finished with value: 4.877845593204693e-06 and parameters: {'n_estimators': 168, 'max_depth': 6}. Best is trial 3 with value: 4.773465651123224e-06.
[I 2025-07-28 20:38:47,714] Trial 30 finished with value: 4.974284244751559e-06 and parameters: {'n_estimators': 208, 'max_depth': 7}. Best is trial 3 with value: 4.773465651123224e-06.
[I 2025-07-28 20:39:20,004] Trial 31 finished with value: 4.785949466654429e-06 and parameters: {'n_estimators': 241, 'max_depth': 3}. Best is trial 3 with value: 4.773465651123224e-06.
[I 2025-07-28 20:39:43,450] Trial 32 finished with value: 4.7816347346824605e-06 and parameters: {'n_estimators': 175, 'max_depth': 3}. Best is trial 3 with value: 4.773465651123224e-06.
[I 2025-07-28 20:40:15,490] Trial 33 finished with value: 4.8299412236606165e-06 and parameters: {'n_estimators': 182, 'max_depth': 4}. Best is trial 3 with value: 4.773465651123224e-06.
[I 2025-07-28 20:40:33,848] Trial 34 finished with value: 4.749954189141547e-06 and parameters: {'n_estimators': 137, 'max_depth': 3}. Best is trial 34 with value: 4.749954189141547e-06.
[I 2025-07-28 20:40:53,175] Trial 35 finished with value: 4.785218573708365e-06 and parameters: {'n_estimators': 110, 'max_depth': 4}. Best is trial 34 with value: 4.749954189141547e-06.
[I 2025-07-28 20:41:12,716] Trial 36 finished with value: 4.756904136980181e-06 and parameters: {'n_estimators': 146, 'max_depth': 3}. Best is trial 34 with value: 4.749954189141547e-06.
[I 2025-07-28 20:42:06,306] Trial 37 finished with value: 4.981766594094845e-06 and parameters: {'n_estimators': 146, 'max_depth': 9}. Best is trial 34 with value: 4.749954189141547e-06.
[I 2025-07-28 20:42:30,560] Trial 38 finished with value: 4.795103847540406e-06 and parameters: {'n_estimators': 138, 'max_depth': 4}. Best is trial 34 with value: 4.749954189141547e-06.
[I 2025-07-28 20:42:58,991] Trial 39 finished with value: 4.832586247747255e-06 and parameters: {'n_estimators': 131, 'max_depth': 5}. Best is trial 34 with value: 4.749954189141547e-06.
[I 2025-07-28 20:43:28,207] Trial 40 finished with value: 4.774286282283336e-06 and parameters: {'n_estimators': 217, 'max_depth': 3}. Best is trial 34 with value: 4.749954189141547e-06.
[I 2025-07-28 20:43:56,869] Trial 41 finished with value: 4.775948471306555e-06 and parameters: {'n_estimators': 213, 'max_depth': 3}. Best is trial 34 with value: 4.749954189141547e-06.
[I 2025-07-28 20:44:26,306] Trial 42 finished with value: 4.776177664672539e-06 and parameters: {'n_estimators': 220, 'max_depth': 3}. Best is trial 34 with value: 4.749954189141547e-06.
[I 2025-07-28 20:44:51,744] Trial 43 finished with value: 4.773609649894972e-06 and parameters: {'n_estimators': 190, 'max_depth': 3}. Best is trial 34 with value: 4.749954189141547e-06.
[I 2025-07-28 20:45:18,470] Trial 44 finished with value: 4.804231498951523e-06 and parameters: {'n_estimators': 152, 'max_depth': 4}. Best is trial 34 with value: 4.749954189141547e-06.
[I 2025-07-28 20:45:31,877] Trial 45 finished with value: 4.75395453770225e-06 and parameters: {'n_estimators': 100, 'max_depth': 3}. Best is trial 34 with value: 4.749954189141547e-06.
[I 2025-07-28 20:45:53,567] Trial 46 finished with value: 4.855552359576783e-06 and parameters: {'n_estimators': 100, 'max_depth': 5}. Best is trial 34 with value: 4.749954189141547e-06.
[I 2025-07-28 20:46:14,837] Trial 47 finished with value: 4.790664359938938e-06 and parameters: {'n_estimators': 121, 'max_depth': 4}. Best is trial 34 with value: 4.749954189141547e-06.
[I 2025-07-28 20:46:40,266] Trial 48 finished with value: 4.773609649894972e-06 and parameters: {'n_estimators': 190, 'max_depth': 3}. Best is trial 34 with value: 4.749954189141547e-06.
[I 2025-07-28 20:47:30,505] Trial 49 finished with value: 4.969059957329254e-06 and parameters: {'n_estimators': 151, 'max_depth': 8}. Best is trial 34 with value: 4.749954189141547e-06.
[I 2025-07-28 20:47:30,505] A new study created in memory with name: no-name-949cab9a-fdb8-4e88-a122-c0247f679468
[I 2025-07-28 20:47:31,164] Trial 0 finished with value: 5.019251650211013e-06 and parameters: {'n_estimators': 779, 'learning_rate': 0.18542237692640393, 'max_depth': 7, 'num_leaves': 50, 'reg_alpha': 0.3309471113059409, 'reg_lambda': 0.7427621622023368}. Best is trial 0 with value: 5.019251650211013e-06.
[I 2025-07-28 20:47:31,572] Trial 1 finished with value: 5.019251650211013e-06 and parameters: {'n_estimators': 395, 'learning_rate': 0.2455229005218984, 'max_depth': 3, 'num_leaves': 65, 'reg_alpha': 0.38342724300793074, 'reg_lambda': 0.6536532799479958}. Best is trial 0 with value: 5.019251650211013e-06.
[I 2025-07-28 20:47:32,176] Trial 2 finished with value: 5.019251650211013e-06 and parameters: {'n_estimators': 783, 'learning_rate': 0.15620160282929654, 'max_depth': 4, 'num_leaves': 53, 'reg_alpha': 0.841914498045584, 'reg_lambda': 0.2046007379393323}. Best is trial 0 with value: 5.019251650211013e-06.
[I 2025-07-28 20:47:32,396] Trial 3 finished with value: 5.019251650211013e-06 and parameters: {'n_estimators': 126, 'learning_rate': 0.02916725270143946, 'max_depth': 7, 'num_leaves': 44, 'reg_alpha': 0.21422383363665565, 'reg_lambda': 0.2231416511719223}. Best is trial 0 with value: 5.019251650211013e-06.
[I 2025-07-28 20:47:32,998] Trial 4 finished with value: 5.019251650211013e-06 and parameters: {'n_estimators': 870, 'learning_rate': 0.07575122806526192, 'max_depth': 3, 'num_leaves': 37, 'reg_alpha': 0.3625910384573231, 'reg_lambda': 0.5722917943516687}. Best is trial 0 with value: 5.019251650211013e-06.
[I 2025-07-28 20:47:33,398] Trial 5 finished with value: 5.019251650211013e-06 and parameters: {'n_estimators': 476, 'learning_rate': 0.2887669676748085, 'max_depth': 4, 'num_leaves': 13, 'reg_alpha': 0.5218016681243061, 'reg_lambda': 0.7901126575479059}. Best is trial 0 with value: 5.019251650211013e-06.
[I 2025-07-28 20:47:33,815] Trial 6 finished with value: 5.019251650211013e-06 and parameters: {'n_estimators': 525, 'learning_rate': 0.29179564999926616, 'max_depth': 10, 'num_leaves': 30, 'reg_alpha': 0.878877897648605, 'reg_lambda': 0.729052322577451}. Best is trial 0 with value: 5.019251650211013e-06.
[I 2025-07-28 20:47:34,395] Trial 7 finished with value: 5.019251650211013e-06 and parameters: {'n_estimators': 743, 'learning_rate': 0.07288838568438868, 'max_depth': 3, 'num_leaves': 30, 'reg_alpha': 0.2827879141590953, 'reg_lambda': 0.5471761621199932}. Best is trial 0 with value: 5.019251650211013e-06.
[I 2025-07-28 20:47:34,882] Trial 8 finished with value: 5.019251650211013e-06 and parameters: {'n_estimators': 538, 'learning_rate': 0.1257167515796923, 'max_depth': 5, 'num_leaves': 78, 'reg_alpha': 0.7159375152984698, 'reg_lambda': 0.13220048435883558}. Best is trial 0 with value: 5.019251650211013e-06.
[I 2025-07-28 20:47:35,290] Trial 9 finished with value: 5.019251650211013e-06 and parameters: {'n_estimators': 361, 'learning_rate': 0.1231572407765906, 'max_depth': 5, 'num_leaves': 98, 'reg_alpha': 0.22560176204723825, 'reg_lambda': 0.4335131668864387}. Best is trial 0 with value: 5.019251650211013e-06.
[I 2025-07-28 20:47:36,080] Trial 10 finished with value: 5.019251650211013e-06 and parameters: {'n_estimators': 968, 'learning_rate': 0.21017481041078018, 'max_depth': 8, 'num_leaves': 74, 'reg_alpha': 0.6358163510924564, 'reg_lambda': 0.9984181795356826}. Best is trial 0 with value: 5.019251650211013e-06.
[I 2025-07-28 20:47:36,491] Trial 11 finished with value: 4.927397570109488e-06 and parameters: {'n_estimators': 323, 'learning_rate': 0.22389619267905392, 'max_depth': 8, 'num_leaves': 66, 'reg_alpha': 0.04761605930053869, 'reg_lambda': 0.8202279391637388}. Best is trial 11 with value: 4.927397570109488e-06.
[I 2025-07-28 20:47:37,029] Trial 12 finished with value: 5.187128980058001e-06 and parameters: {'n_estimators': 205, 'learning_rate': 0.18811795663789266, 'max_depth': 9, 'num_leaves': 60, 'reg_alpha': 0.02115609518913074, 'reg_lambda': 0.9192433408425351}. Best is trial 11 with value: 4.927397570109488e-06.
[I 2025-07-28 20:47:37,768] Trial 13 finished with value: 5.1551414988271475e-06 and parameters: {'n_estimators': 676, 'learning_rate': 0.22183623290706608, 'max_depth': 7, 'num_leaves': 88, 'reg_alpha': 0.02808963299342294, 'reg_lambda': 0.841943573031853}. Best is trial 11 with value: 4.927397570109488e-06.
[I 2025-07-28 20:47:38,129] Trial 14 finished with value: 4.946579911888135e-06 and parameters: {'n_estimators': 297, 'learning_rate': 0.1708653196081018, 'max_depth': 8, 'num_leaves': 54, 'reg_alpha': 0.11529251638908, 'reg_lambda': 0.3788083218770558}. Best is trial 11 with value: 4.927397570109488e-06.
[I 2025-07-28 20:47:38,506] Trial 15 finished with value: 4.877229286673337e-06 and parameters: {'n_estimators': 279, 'learning_rate': 0.2484153487541201, 'max_depth': 9, 'num_leaves': 67, 'reg_alpha': 0.08918141189890351, 'reg_lambda': 0.3778009225149694}. Best is trial 15 with value: 4.877229286673337e-06.
[I 2025-07-28 20:47:38,867] Trial 16 finished with value: 4.9567932314947446e-06 and parameters: {'n_estimators': 250, 'learning_rate': 0.2543523204112172, 'max_depth': 10, 'num_leaves': 73, 'reg_alpha': 0.12300057041747814, 'reg_lambda': 0.4657090590369437}. Best is trial 15 with value: 4.877229286673337e-06.
[I 2025-07-28 20:47:39,165] Trial 17 finished with value: 5.019251650211013e-06 and parameters: {'n_estimators': 134, 'learning_rate': 0.2557470631696066, 'max_depth': 9, 'num_leaves': 82, 'reg_alpha': 0.5334184069007192, 'reg_lambda': 0.31742091493875824}. Best is trial 15 with value: 4.877229286673337e-06.
[I 2025-07-28 20:47:39,573] Trial 18 finished with value: 4.979945279071383e-06 and parameters: {'n_estimators': 420, 'learning_rate': 0.23120183507027975, 'max_depth': 9, 'num_leaves': 67, 'reg_alpha': 0.14368383484693506, 'reg_lambda': 0.08105719635283476}. Best is trial 15 with value: 4.877229286673337e-06.
[I 2025-07-28 20:47:39,988] Trial 19 finished with value: 5.019251650211013e-06 and parameters: {'n_estimators': 325, 'learning_rate': 0.26585334254772325, 'max_depth': 8, 'num_leaves': 94, 'reg_alpha': 0.44283324724513057, 'reg_lambda': 0.2994571204287233}. Best is trial 15 with value: 4.877229286673337e-06.
[I 2025-07-28 20:47:41,133] Trial 20 finished with value: 5.6005505137445095e-06 and parameters: {'n_estimators': 629, 'learning_rate': 0.20545646099721573, 'max_depth': 6, 'num_leaves': 85, 'reg_alpha': 0.006708793234369126, 'reg_lambda': 0.015989213210661823}. Best is trial 15 with value: 4.877229286673337e-06.
[I 2025-07-28 20:47:41,509] Trial 21 finished with value: 4.9689268792868746e-06 and parameters: {'n_estimators': 279, 'learning_rate': 0.16032314925596397, 'max_depth': 8, 'num_leaves': 60, 'reg_alpha': 0.13112330173975253, 'reg_lambda': 0.372521428338045}. Best is trial 15 with value: 4.877229286673337e-06.
[I 2025-07-28 20:47:41,815] Trial 22 finished with value: 5.019251650211013e-06 and parameters: {'n_estimators': 205, 'learning_rate': 0.17860431541620322, 'max_depth': 8, 'num_leaves': 46, 'reg_alpha': 0.9938540133943239, 'reg_lambda': 0.6239611825641943}. Best is trial 15 with value: 4.877229286673337e-06.
[I 2025-07-28 20:47:42,207] Trial 23 finished with value: 4.866324008982879e-06 and parameters: {'n_estimators': 304, 'learning_rate': 0.1069545396578284, 'max_depth': 9, 'num_leaves': 67, 'reg_alpha': 0.09078069528439293, 'reg_lambda': 0.40111758885684373}. Best is trial 23 with value: 4.866324008982879e-06.
[I 2025-07-28 20:47:42,740] Trial 24 finished with value: 4.823247118524039e-06 and parameters: {'n_estimators': 469, 'learning_rate': 0.11837176909809421, 'max_depth': 10, 'num_leaves': 69, 'reg_alpha': 0.07655333056438499, 'reg_lambda': 0.457330795996147}. Best is trial 24 with value: 4.823247118524039e-06.
[I 2025-07-28 20:47:43,211] Trial 25 finished with value: 5.019251650211013e-06 and parameters: {'n_estimators': 429, 'learning_rate': 0.10574900948876415, 'max_depth': 10, 'num_leaves': 72, 'reg_alpha': 0.21349527306851462, 'reg_lambda': 0.5104360026234246}. Best is trial 24 with value: 4.823247118524039e-06.
[I 2025-07-28 20:47:43,768] Trial 26 finished with value: 5.019251650211013e-06 and parameters: {'n_estimators': 610, 'learning_rate': 0.08392690783727923, 'max_depth': 9, 'num_leaves': 63, 'reg_alpha': 0.25696218967611656, 'reg_lambda': 0.2530720095359145}. Best is trial 24 with value: 4.823247118524039e-06.
[I 2025-07-28 20:47:44,270] Trial 27 finished with value: 5.002716300214456e-06 and parameters: {'n_estimators': 456, 'learning_rate': 0.0375420747865919, 'max_depth': 10, 'num_leaves': 90, 'reg_alpha': 0.16324491386230258, 'reg_lambda': 0.4070710504251434}. Best is trial 24 with value: 4.823247118524039e-06.
[I 2025-07-28 20:47:44,615] Trial 28 finished with value: 4.815007230403972e-06 and parameters: {'n_estimators': 195, 'learning_rate': 0.12851790310448308, 'max_depth': 9, 'num_leaves': 79, 'reg_alpha': 0.07313088426342085, 'reg_lambda': 0.4867983643990536}. Best is trial 28 with value: 4.815007230403972e-06.
[I 2025-07-28 20:47:44,945] Trial 29 finished with value: 5.019251650211013e-06 and parameters: {'n_estimators': 195, 'learning_rate': 0.12607920973814277, 'max_depth': 10, 'num_leaves': 81, 'reg_alpha': 0.2934732265743193, 'reg_lambda': 0.7072433214697902}. Best is trial 28 with value: 4.815007230403972e-06.
[I 2025-07-28 20:47:45,211] Trial 30 finished with value: 4.826761935513945e-06 and parameters: {'n_estimators': 104, 'learning_rate': 0.10415897836260433, 'max_depth': 9, 'num_leaves': 76, 'reg_alpha': 0.07447228019318418, 'reg_lambda': 0.5054144395574037}. Best is trial 28 with value: 4.815007230403972e-06.
[I 2025-07-28 20:47:45,509] Trial 31 finished with value: 4.841154157334592e-06 and parameters: {'n_estimators': 115, 'learning_rate': 0.09926220167571784, 'max_depth': 9, 'num_leaves': 76, 'reg_alpha': 0.08349887811372915, 'reg_lambda': 0.4881843541109564}. Best is trial 28 with value: 4.815007230403972e-06.
[I 2025-07-28 20:47:45,799] Trial 32 finished with value: 5.016312054022742e-06 and parameters: {'n_estimators': 141, 'learning_rate': 0.058255610146253675, 'max_depth': 10, 'num_leaves': 76, 'reg_alpha': 0.18673925257046609, 'reg_lambda': 0.6236012491431484}. Best is trial 28 with value: 4.815007230403972e-06.
[I 2025-07-28 20:47:46,082] Trial 33 finished with value: 4.81991183623488e-06 and parameters: {'n_estimators': 102, 'learning_rate': 0.0952192247507595, 'max_depth': 9, 'num_leaves': 84, 'reg_alpha': 0.07223465564414566, 'reg_lambda': 0.5313249059647523}. Best is trial 28 with value: 4.815007230403972e-06.
[I 2025-07-28 20:47:46,332] Trial 34 finished with value: 5.019251650211013e-06 and parameters: {'n_estimators': 103, 'learning_rate': 0.14629734375687764, 'max_depth': 6, 'num_leaves': 87, 'reg_alpha': 0.4474297164276505, 'reg_lambda': 0.5784608643023591}. Best is trial 28 with value: 4.815007230403972e-06.
[I 2025-07-28 20:47:48,271] Trial 35 finished with value: 5.516102234215988e-06 and parameters: {'n_estimators': 175, 'learning_rate': 0.13804488797939962, 'max_depth': 7, 'num_leaves': 99, 'reg_alpha': 0.0016778990944942007, 'reg_lambda': 0.6770313571568892}. Best is trial 28 with value: 4.815007230403972e-06.
[I 2025-07-28 20:47:48,616] Trial 36 finished with value: 5.019251650211013e-06 and parameters: {'n_estimators': 233, 'learning_rate': 0.09062912719592418, 'max_depth': 10, 'num_leaves': 92, 'reg_alpha': 0.35544025463990037, 'reg_lambda': 0.5528773088842908}. Best is trial 28 with value: 4.815007230403972e-06.
[I 2025-07-28 20:47:49,039] Trial 37 finished with value: 5.019251650211013e-06 and parameters: {'n_estimators': 381, 'learning_rate': 0.0446741449827802, 'max_depth': 9, 'num_leaves': 82, 'reg_alpha': 0.30890305692534603, 'reg_lambda': 0.46788023793795547}. Best is trial 28 with value: 4.815007230403972e-06.
[I 2025-07-28 20:47:49,353] Trial 38 finished with value: 5.015765671581269e-06 and parameters: {'n_estimators': 164, 'learning_rate': 0.11335905677792066, 'max_depth': 10, 'num_leaves': 71, 'reg_alpha': 0.18591805500686093, 'reg_lambda': 0.3170713840173705}. Best is trial 28 with value: 4.815007230403972e-06.
[I 2025-07-28 20:47:49,956] Trial 39 finished with value: 4.80994774288196e-06 and parameters: {'n_estimators': 237, 'learning_rate': 0.016434260873507384, 'max_depth': 9, 'num_leaves': 14, 'reg_alpha': 0.05733514145090168, 'reg_lambda': 0.5177103400008807}. Best is trial 39 with value: 4.80994774288196e-06.
[I 2025-07-28 20:47:50,317] Trial 40 finished with value: 5.019251650211013e-06 and parameters: {'n_estimators': 360, 'learning_rate': 0.022510841992192433, 'max_depth': 8, 'num_leaves': 16, 'reg_alpha': 0.23641772120162016, 'reg_lambda': 0.5921127720616175}. Best is trial 39 with value: 4.80994774288196e-06.
[I 2025-07-28 20:47:50,693] Trial 41 finished with value: 4.830074203601545e-06 and parameters: {'n_estimators': 238, 'learning_rate': 0.06742736462572965, 'max_depth': 9, 'num_leaves': 20, 'reg_alpha': 0.06529817262528034, 'reg_lambda': 0.5199915321130475}. Best is trial 39 with value: 4.80994774288196e-06.
[I 2025-07-28 20:47:51,305] Trial 42 finished with value: 4.795144608285914e-06 and parameters: {'n_estimators': 177, 'learning_rate': 0.016383132099123978, 'max_depth': 9, 'num_leaves': 48, 'reg_alpha': 0.053496635402486725, 'reg_lambda': 0.44615249320182526}. Best is trial 42 with value: 4.795144608285914e-06.
[I 2025-07-28 20:47:51,799] Trial 43 finished with value: 5.003606994508661e-06 and parameters: {'n_estimators': 501, 'learning_rate': 0.01215168625574135, 'max_depth': 10, 'num_leaves': 35, 'reg_alpha': 0.1649805625978807, 'reg_lambda': 0.45850627483764766}. Best is trial 42 with value: 4.795144608285914e-06.
