[I 2025-07-29 08:26:28,026] Trial 43 finished with value: 5.017290588968422e-06 and parameters: {'n_estimators': 457, 'learning_rate': 0.186562194951384, 'max_depth': 5, 'reg_alpha': 0.18090120429987386, 'reg_lambda': 0.23532911762318942}. Best is trial 33 with value: 4.811798512956182e-06.
[I 2025-07-29 08:26:33,688] Trial 44 finished with value: 6.353564281522416e-06 and parameters: {'n_estimators': 521, 'learning_rate': 0.2693402000646764, 'max_depth': 3, 'reg_alpha': 0.0009757182912733878, 'reg_lambda': 0.17876041017986244}. Best is trial 33 with value: 4.811798512956182e-06.
[I 2025-07-29 08:26:39,723] Trial 45 finished with value: 4.983240269329202e-06 and parameters: {'n_estimators': 690, 'learning_rate': 0.14890935998790467, 'max_depth': 5, 'reg_alpha': 0.12680959383632567, 'reg_lambda': 0.10012862123889904}. Best is trial 33 with value: 4.811798512956182e-06.
[I 2025-07-29 08:26:43,590] Trial 46 finished with value: 5.019251649998546e-06 and parameters: {'n_estimators': 441, 'learning_rate': 0.20780307800632153, 'max_depth': 3, 'reg_alpha': 0.2715590452921027, 'reg_lambda': 0.05010522040577203}. Best is trial 33 with value: 4.811798512956182e-06.
[I 2025-07-29 08:26:49,095] Trial 47 finished with value: 4.90891312049271e-06 and parameters: {'n_estimators': 594, 'learning_rate': 0.23780619563741806, 'max_depth': 5, 'reg_alpha': 0.03961553320564382, 'reg_lambda': 0.250595259291763}. Best is trial 33 with value: 4.811798512956182e-06.
[I 2025-07-29 08:26:53,724] Trial 48 finished with value: 5.019251649998546e-06 and parameters: {'n_estimators': 541, 'learning_rate': 0.18196848952133138, 'max_depth': 4, 'reg_alpha': 0.5898153029668398, 'reg_lambda': 0.18502896768175103}. Best is trial 33 with value: 4.811798512956182e-06.
[I 2025-07-29 08:26:57,485] Trial 49 finished with value: 4.9775402772165775e-06 and parameters: {'n_estimators': 369, 'learning_rate': 0.16052298193184986, 'max_depth': 6, 'reg_alpha': 0.11449766869679022, 'reg_lambda': 0.5103638488682809}. Best is trial 33 with value: 4.811798512956182e-06.
[I 2025-07-29 08:26:57,486] A new study created in memory with name: no-name-0b64400b-8678-48bf-8501-5e1e3fd2ae4f
[I 2025-07-29 08:27:28,884] Trial 0 finished with value: 4.762895203898698e-06 and parameters: {'n_estimators': 183, 'max_depth': 4, 'min_samples_split': 14, 'min_samples_leaf': 7, 'max_features': None}. Best is trial 0 with value: 4.762895203898698e-06.
[I 2025-07-29 08:27:30,755] Trial 1 finished with value: 5.055374224313452e-06 and parameters: {'n_estimators': 291, 'max_depth': 4, 'min_samples_split': 6, 'min_samples_leaf': 4, 'max_features': 'log2'}. Best is trial 0 with value: 4.762895203898698e-06.
[I 2025-07-29 08:30:13,192] Trial 2 finished with value: 4.937510850183115e-06 and parameters: {'n_estimators': 398, 'max_depth': 19, 'min_samples_split': 3, 'min_samples_leaf': 7, 'max_features': None}. Best is trial 0 with value: 4.762895203898698e-06.
[I 2025-07-29 08:31:13,811] Trial 3 finished with value: 4.846112954891666e-06 and parameters: {'n_estimators': 193, 'max_depth': 9, 'min_samples_split': 5, 'min_samples_leaf': 8, 'max_features': None}. Best is trial 0 with value: 4.762895203898698e-06.
[I 2025-07-29 08:31:15,715] Trial 4 finished with value: 5.01914052812964e-06 and parameters: {'n_estimators': 115, 'max_depth': 7, 'min_samples_split': 10, 'min_samples_leaf': 9, 'max_features': 'sqrt'}. Best is trial 0 with value: 4.762895203898698e-06.
[I 2025-07-29 08:32:15,197] Trial 5 finished with value: 4.7215593176946665e-06 and parameters: {'n_estimators': 455, 'max_depth': 3, 'min_samples_split': 7, 'min_samples_leaf': 10, 'max_features': None}. Best is trial 5 with value: 4.7215593176946665e-06.
[I 2025-07-29 08:32:16,525] Trial 6 finished with value: 5.126594894121751e-06 and parameters: {'n_estimators': 160, 'max_depth': 6, 'min_samples_split': 16, 'min_samples_leaf': 1, 'max_features': 'log2'}. Best is trial 5 with value: 4.7215593176946665e-06.
[I 2025-07-29 08:32:21,211] Trial 7 finished with value: 5.123016445021374e-06 and parameters: {'n_estimators': 417, 'max_depth': 18, 'min_samples_split': 10, 'min_samples_leaf': 6, 'max_features': 'log2'}. Best is trial 5 with value: 4.7215593176946665e-06.
[I 2025-07-29 08:32:26,237] Trial 8 finished with value: 5.215027898283079e-06 and parameters: {'n_estimators': 171, 'max_depth': 20, 'min_samples_split': 14, 'min_samples_leaf': 2, 'max_features': 'sqrt'}. Best is trial 5 with value: 4.7215593176946665e-06.
[I 2025-07-29 08:35:24,218] Trial 9 finished with value: 5.0481356313809024e-06 and parameters: {'n_estimators': 370, 'max_depth': 14, 'min_samples_split': 4, 'min_samples_leaf': 2, 'max_features': None}. Best is trial 5 with value: 4.7215593176946665e-06.
[I 2025-07-29 08:38:14,749] Trial 10 finished with value: 4.8404028788826e-06 and parameters: {'n_estimators': 496, 'max_depth': 12, 'min_samples_split': 20, 'min_samples_leaf': 10, 'max_features': None}. Best is trial 5 with value: 4.7215593176946665e-06.
[I 2025-07-29 08:38:49,250] Trial 11 finished with value: 4.769484545772151e-06 and parameters: {'n_estimators': 259, 'max_depth': 3, 'min_samples_split': 13, 'min_samples_leaf': 5, 'max_features': None}. Best is trial 5 with value: 4.7215593176946665e-06.
[I 2025-07-29 08:39:54,643] Trial 12 finished with value: 4.723378146795799e-06 and parameters: {'n_estimators': 500, 'max_depth': 3, 'min_samples_split': 8, 'min_samples_leaf': 10, 'max_features': None}. Best is trial 5 with value: 4.7215593176946665e-06.
[I 2025-07-29 08:42:12,017] Trial 13 finished with value: 4.8212340285172964e-06 and parameters: {'n_estimators': 453, 'max_depth': 9, 'min_samples_split': 7, 'min_samples_leaf': 10, 'max_features': None}. Best is trial 5 with value: 4.7215593176946665e-06.
[I 2025-07-29 08:44:04,081] Trial 14 finished with value: 4.7883509202383445e-06 and parameters: {'n_estimators': 478, 'max_depth': 6, 'min_samples_split': 8, 'min_samples_leaf': 9, 'max_features': None}. Best is trial 5 with value: 4.7215593176946665e-06.
[I 2025-07-29 08:44:11,102] Trial 15 finished with value: 5.044860911526945e-06 and parameters: {'n_estimators': 344, 'max_depth': 15, 'min_samples_split': 2, 'min_samples_leaf': 10, 'max_features': 'sqrt'}. Best is trial 5 with value: 4.7215593176946665e-06.
[I 2025-07-29 08:46:33,096] Trial 16 finished with value: 4.850757559613587e-06 and parameters: {'n_estimators': 452, 'max_depth': 9, 'min_samples_split': 8, 'min_samples_leaf': 8, 'max_features': None}. Best is trial 5 with value: 4.7215593176946665e-06.
[I 2025-07-29 08:47:17,970] Trial 17 finished with value: 4.739117394712233e-06 and parameters: {'n_estimators': 341, 'max_depth': 3, 'min_samples_split': 11, 'min_samples_leaf': 8, 'max_features': None}. Best is trial 5 with value: 4.7215593176946665e-06.
[I 2025-07-29 08:47:21,633] Trial 18 finished with value: 5.102059690773344e-06 and parameters: {'n_estimators': 423, 'max_depth': 7, 'min_samples_split': 9, 'min_samples_leaf': 4, 'max_features': 'log2'}. Best is trial 5 with value: 4.7215593176946665e-06.
[I 2025-07-29 08:47:31,370] Trial 19 finished with value: 5.027193948530448e-06 and parameters: {'n_estimators': 494, 'max_depth': 11, 'min_samples_split': 6, 'min_samples_leaf': 9, 'max_features': 'sqrt'}. Best is trial 5 with value: 4.7215593176946665e-06.
[I 2025-07-29 08:49:04,315] Trial 20 finished with value: 4.819731366494041e-06 and parameters: {'n_estimators': 448, 'max_depth': 5, 'min_samples_split': 17, 'min_samples_leaf': 6, 'max_features': None}. Best is trial 5 with value: 4.7215593176946665e-06.
[I 2025-07-29 08:49:51,674] Trial 21 finished with value: 4.741675724590098e-06 and parameters: {'n_estimators': 359, 'max_depth': 3, 'min_samples_split': 11, 'min_samples_leaf': 8, 'max_features': None}. Best is trial 5 with value: 4.7215593176946665e-06.
[I 2025-07-29 08:50:55,098] Trial 22 finished with value: 4.760253538139041e-06 and parameters: {'n_estimators': 314, 'max_depth': 5, 'min_samples_split': 13, 'min_samples_leaf': 10, 'max_features': None}. Best is trial 5 with value: 4.7215593176946665e-06.
[I 2025-07-29 08:51:26,903] Trial 23 finished with value: 4.728725551524282e-06 and parameters: {'n_estimators': 242, 'max_depth': 3, 'min_samples_split': 12, 'min_samples_leaf': 9, 'max_features': None}. Best is trial 5 with value: 4.7215593176946665e-06.
[I 2025-07-29 08:52:31,019] Trial 24 finished with value: 4.795640759907292e-06 and parameters: {'n_estimators': 244, 'max_depth': 7, 'min_samples_split': 8, 'min_samples_leaf': 9, 'max_features': None}. Best is trial 5 with value: 4.7215593176946665e-06.
[I 2025-07-29 08:53:50,294] Trial 25 finished with value: 4.774288025088228e-06 and parameters: {'n_estimators': 393, 'max_depth': 5, 'min_samples_split': 12, 'min_samples_leaf': 10, 'max_features': None}. Best is trial 5 with value: 4.7215593176946665e-06.
[I 2025-07-29 08:54:21,650] Trial 26 finished with value: 4.728777871923216e-06 and parameters: {'n_estimators': 238, 'max_depth': 3, 'min_samples_split': 16, 'min_samples_leaf': 9, 'max_features': None}. Best is trial 5 with value: 4.7215593176946665e-06.
[I 2025-07-29 08:55:43,987] Trial 27 finished with value: 4.833411439625414e-06 and parameters: {'n_estimators': 278, 'max_depth': 8, 'min_samples_split': 5, 'min_samples_leaf': 7, 'max_features': None}. Best is trial 5 with value: 4.7215593176946665e-06.
[I 2025-07-29 08:55:48,269] Trial 28 finished with value: 5.020203939481169e-06 and parameters: {'n_estimators': 218, 'max_depth': 11, 'min_samples_split': 9, 'min_samples_leaf': 10, 'max_features': 'sqrt'}. Best is trial 5 with value: 4.7215593176946665e-06.
[I 2025-07-29 08:55:51,207] Trial 29 finished with value: 5.037450069907266e-06 and parameters: {'n_estimators': 469, 'max_depth': 4, 'min_samples_split': 6, 'min_samples_leaf': 7, 'max_features': 'log2'}. Best is trial 5 with value: 4.7215593176946665e-06.
[I 2025-07-29 08:56:18,094] Trial 30 finished with value: 4.731594534249666e-06 and parameters: {'n_estimators': 132, 'max_depth': 5, 'min_samples_split': 12, 'min_samples_leaf': 9, 'max_features': None}. Best is trial 5 with value: 4.7215593176946665e-06.
[I 2025-07-29 08:56:46,081] Trial 31 finished with value: 4.724803934137521e-06 and parameters: {'n_estimators': 213, 'max_depth': 3, 'min_samples_split': 16, 'min_samples_leaf': 9, 'max_features': None}. Best is trial 5 with value: 4.7215593176946665e-06.
[I 2025-07-29 08:57:21,658] Trial 32 finished with value: 4.748582847458961e-06 and parameters: {'n_estimators': 209, 'max_depth': 4, 'min_samples_split': 19, 'min_samples_leaf': 8, 'max_features': None}. Best is trial 5 with value: 4.7215593176946665e-06.
[I 2025-07-29 08:58:13,003] Trial 33 finished with value: 4.738789193318377e-06 and parameters: {'n_estimators': 303, 'max_depth': 4, 'min_samples_split': 18, 'min_samples_leaf': 9, 'max_features': None}. Best is trial 5 with value: 4.7215593176946665e-06.
[I 2025-07-29 08:58:33,157] Trial 34 finished with value: 4.710157774586412e-06 and parameters: {'n_estimators': 153, 'max_depth': 3, 'min_samples_split': 15, 'min_samples_leaf': 10, 'max_features': None}. Best is trial 34 with value: 4.710157774586412e-06.
[I 2025-07-29 08:59:08,441] Trial 35 finished with value: 4.7565803577666005e-06 and parameters: {'n_estimators': 150, 'max_depth': 6, 'min_samples_split': 15, 'min_samples_leaf': 10, 'max_features': None}. Best is trial 34 with value: 4.710157774586412e-06.
[I 2025-07-29 08:59:09,625] Trial 36 finished with value: 5.02555269496653e-06 and parameters: {'n_estimators': 185, 'max_depth': 4, 'min_samples_split': 15, 'min_samples_leaf': 10, 'max_features': 'log2'}. Best is trial 34 with value: 4.710157774586412e-06.
[I 2025-07-29 09:00:28,166] Trial 37 finished with value: 4.886910307061023e-06 and parameters: {'n_estimators': 203, 'max_depth': 17, 'min_samples_split': 17, 'min_samples_leaf': 8, 'max_features': None}. Best is trial 34 with value: 4.710157774586412e-06.
[I 2025-07-29 09:00:51,760] Trial 38 finished with value: 4.742642373442006e-06 and parameters: {'n_estimators': 102, 'max_depth': 6, 'min_samples_split': 4, 'min_samples_leaf': 10, 'max_features': None}. Best is trial 34 with value: 4.710157774586412e-06.
[I 2025-07-29 09:00:54,240] Trial 39 finished with value: 5.004621590850783e-06 and parameters: {'n_estimators': 137, 'max_depth': 8, 'min_samples_split': 15, 'min_samples_leaf': 7, 'max_features': 'sqrt'}. Best is trial 34 with value: 4.710157774586412e-06.
[I 2025-07-29 09:00:55,347] Trial 40 finished with value: 5.031121338325723e-06 and parameters: {'n_estimators': 170, 'max_depth': 4, 'min_samples_split': 10, 'min_samples_leaf': 5, 'max_features': 'log2'}. Best is trial 34 with value: 4.710157774586412e-06.
[I 2025-07-29 09:01:32,687] Trial 41 finished with value: 4.7174752513134685e-06 and parameters: {'n_estimators': 285, 'max_depth': 3, 'min_samples_split': 14, 'min_samples_leaf': 9, 'max_features': None}. Best is trial 34 with value: 4.710157774586412e-06.
[I 2025-07-29 09:02:09,710] Trial 42 finished with value: 4.716138348907694e-06 and parameters: {'n_estimators': 283, 'max_depth': 3, 'min_samples_split': 13, 'min_samples_leaf': 9, 'max_features': None}. Best is trial 34 with value: 4.710157774586412e-06.
[I 2025-07-29 09:03:05,532] Trial 43 finished with value: 4.789367378314078e-06 and parameters: {'n_estimators': 273, 'max_depth': 5, 'min_samples_split': 14, 'min_samples_leaf': 8, 'max_features': None}. Best is trial 34 with value: 4.710157774586412e-06.
[I 2025-07-29 09:03:47,973] Trial 44 finished with value: 4.730398304960189e-06 and parameters: {'n_estimators': 325, 'max_depth': 3, 'min_samples_split': 13, 'min_samples_leaf': 9, 'max_features': None}. Best is trial 34 with value: 4.710157774586412e-06.
[I 2025-07-29 09:05:17,208] Trial 45 finished with value: 4.794712552326023e-06 and parameters: {'n_estimators': 386, 'max_depth': 6, 'min_samples_split': 7, 'min_samples_leaf': 10, 'max_features': None}. Best is trial 34 with value: 4.710157774586412e-06.
[I 2025-07-29 09:06:30,881] Trial 46 finished with value: 4.811493621799256e-06 and parameters: {'n_estimators': 426, 'max_depth': 4, 'min_samples_split': 14, 'min_samples_leaf': 3, 'max_features': None}. Best is trial 34 with value: 4.710157774586412e-06.
[I 2025-07-29 09:08:13,296] Trial 47 finished with value: 4.841582928621967e-06 and parameters: {'n_estimators': 292, 'max_depth': 13, 'min_samples_split': 11, 'min_samples_leaf': 10, 'max_features': None}. Best is trial 34 with value: 4.710157774586412e-06.
[I 2025-07-29 09:09:50,112] Trial 48 finished with value: 4.767778138308486e-06 and parameters: {'n_estimators': 478, 'max_depth': 5, 'min_samples_split': 9, 'min_samples_leaf': 9, 'max_features': None}. Best is trial 34 with value: 4.710157774586412e-06.
[I 2025-07-29 09:09:57,200] Trial 49 finished with value: 5.004039583866944e-06 and parameters: {'n_estimators': 436, 'max_depth': 7, 'min_samples_split': 10, 'min_samples_leaf': 8, 'max_features': 'sqrt'}. Best is trial 34 with value: 4.710157774586412e-06.
[I 2025-07-29 09:09:57,201] A new study created in memory with name: no-name-4c920ce7-7c6a-43f5-95e2-4c01bb1c4fc1
[I 2025-07-29 09:10:40,951] Trial 0 finished with value: 4.876135385020436e-06 and parameters: {'n_estimators': 170, 'max_depth': 6}. Best is trial 0 with value: 4.876135385020436e-06.
[I 2025-07-29 09:11:46,942] Trial 1 finished with value: 4.872764902124862e-06 and parameters: {'n_estimators': 304, 'max_depth': 5}. Best is trial 1 with value: 4.872764902124862e-06.
[I 2025-07-29 09:12:59,755] Trial 2 finished with value: 4.984862002602242e-06 and parameters: {'n_estimators': 218, 'max_depth': 8}. Best is trial 1 with value: 4.872764902124862e-06.
[I 2025-07-29 09:15:45,715] Trial 3 finished with value: 4.98508191608549e-06 and parameters: {'n_estimators': 498, 'max_depth': 8}. Best is trial 1 with value: 4.872764902124862e-06.
[I 2025-07-29 09:16:49,692] Trial 4 finished with value: 4.996316541088125e-06 and parameters: {'n_estimators': 192, 'max_depth': 8}. Best is trial 1 with value: 4.872764902124862e-06.
[I 2025-07-29 09:18:34,093] Trial 5 finished with value: 4.9292800380539655e-06 and parameters: {'n_estimators': 406, 'max_depth': 6}. Best is trial 1 with value: 4.872764902124862e-06.
[I 2025-07-29 09:20:15,107] Trial 6 finished with value: 4.974705536713245e-06 and parameters: {'n_estimators': 341, 'max_depth': 7}. Best is trial 1 with value: 4.872764902124862e-06.
[I 2025-07-29 09:20:53,031] Trial 7 finished with value: 4.953149372493621e-06 and parameters: {'n_estimators': 114, 'max_depth': 8}. Best is trial 1 with value: 4.872764902124862e-06.
[I 2025-07-29 09:22:49,071] Trial 8 finished with value: 4.921445014857621e-06 and parameters: {'n_estimators': 451, 'max_depth': 6}. Best is trial 1 with value: 4.872764902124862e-06.
[I 2025-07-29 09:24:26,436] Trial 9 finished with value: 5.0520356384104645e-06 and parameters: {'n_estimators': 243, 'max_depth': 10}. Best is trial 1 with value: 4.872764902124862e-06.
[I 2025-07-29 09:25:12,856] Trial 10 finished with value: 4.786965392211029e-06 and parameters: {'n_estimators': 347, 'max_depth': 3}. Best is trial 10 with value: 4.786965392211029e-06.
[I 2025-07-29 09:25:55,184] Trial 11 finished with value: 4.781943242373876e-06 and parameters: {'n_estimators': 316, 'max_depth': 3}. Best is trial 11 with value: 4.781943242373876e-06.
[I 2025-07-29 09:26:44,442] Trial 12 finished with value: 4.788701110179454e-06 and parameters: {'n_estimators': 368, 'max_depth': 3}. Best is trial 11 with value: 4.781943242373876e-06.
[I 2025-07-29 09:27:22,886] Trial 13 finished with value: 4.77434393673109e-06 and parameters: {'n_estimators': 287, 'max_depth': 3}. Best is trial 13 with value: 4.77434393673109e-06.
[I 2025-07-29 09:28:11,257] Trial 14 finished with value: 4.816802999996944e-06 and parameters: {'n_estimators': 275, 'max_depth': 4}. Best is trial 13 with value: 4.77434393673109e-06.
[I 2025-07-29 09:29:02,510] Trial 15 finished with value: 4.820237450831633e-06 and parameters: {'n_estimators': 291, 'max_depth': 4}. Best is trial 13 with value: 4.77434393673109e-06.
[I 2025-07-29 09:30:13,505] Trial 16 finished with value: 4.840563955231995e-06 and parameters: {'n_estimators': 404, 'max_depth': 4}. Best is trial 13 with value: 4.77434393673109e-06.
[I 2025-07-29 09:30:47,280] Trial 17 finished with value: 4.780294833145724e-06 and parameters: {'n_estimators': 252, 'max_depth': 3}. Best is trial 13 with value: 4.77434393673109e-06.
[I 2025-07-29 09:31:16,841] Trial 18 finished with value: 4.842897582878962e-06 and parameters: {'n_estimators': 136, 'max_depth': 5}. Best is trial 13 with value: 4.77434393673109e-06.
[I 2025-07-29 09:32:58,953] Trial 19 finished with value: 5.049192492613239e-06 and parameters: {'n_estimators': 252, 'max_depth': 10}. Best is trial 13 with value: 4.77434393673109e-06.
[I 2025-07-29 09:33:42,481] Trial 20 finished with value: 4.876725558561866e-06 and parameters: {'n_estimators': 199, 'max_depth': 5}. Best is trial 13 with value: 4.77434393673109e-06.
[I 2025-07-29 09:34:24,904] Trial 21 finished with value: 4.778877662590668e-06 and parameters: {'n_estimators': 315, 'max_depth': 3}. Best is trial 13 with value: 4.77434393673109e-06.
[I 2025-07-29 09:34:59,541] Trial 22 finished with value: 4.780282835076504e-06 and parameters: {'n_estimators': 257, 'max_depth': 3}. Best is trial 13 with value: 4.77434393673109e-06.
[I 2025-07-29 09:35:57,359] Trial 23 finished with value: 4.837585355304415e-06 and parameters: {'n_estimators': 327, 'max_depth': 4}. Best is trial 13 with value: 4.77434393673109e-06.
[I 2025-07-29 09:36:47,421] Trial 24 finished with value: 4.788877451744711e-06 and parameters: {'n_estimators': 372, 'max_depth': 3}. Best is trial 13 with value: 4.77434393673109e-06.
[I 2025-07-29 09:37:36,107] Trial 25 finished with value: 4.816802999996944e-06 and parameters: {'n_estimators': 275, 'max_depth': 4}. Best is trial 13 with value: 4.77434393673109e-06.
[I 2025-07-29 09:38:24,401] Trial 26 finished with value: 4.8591861548705825e-06 and parameters: {'n_estimators': 221, 'max_depth': 5}. Best is trial 13 with value: 4.77434393673109e-06.
[I 2025-07-29 09:38:45,954] Trial 27 finished with value: 4.765832464697014e-06 and parameters: {'n_estimators': 160, 'max_depth': 3}. Best is trial 27 with value: 4.765832464697014e-06.
[I 2025-07-29 09:39:13,797] Trial 28 finished with value: 4.811330890874345e-06 and parameters: {'n_estimators': 157, 'max_depth': 4}. Best is trial 27 with value: 4.765832464697014e-06.
[I 2025-07-29 09:39:28,631] Trial 29 finished with value: 4.736242615887749e-06 and parameters: {'n_estimators': 110, 'max_depth': 3}. Best is trial 29 with value: 4.736242615887749e-06.
[I 2025-07-29 09:39:58,668] Trial 30 finished with value: 4.962085878704989e-06 and parameters: {'n_estimators': 101, 'max_depth': 7}. Best is trial 29 with value: 4.736242615887749e-06.
[I 2025-07-29 09:40:18,350] Trial 31 finished with value: 4.756904136980181e-06 and parameters: {'n_estimators': 146, 'max_depth': 3}. Best is trial 29 with value: 4.736242615887749e-06.
[I 2025-07-29 09:40:46,416] Trial 32 finished with value: 4.8127568491587284e-06 and parameters: {'n_estimators': 158, 'max_depth': 4}. Best is trial 29 with value: 4.736242615887749e-06.
[I 2025-07-29 09:41:04,502] Trial 33 finished with value: 4.744257531669876e-06 and parameters: {'n_estimators': 134, 'max_depth': 3}. Best is trial 29 with value: 4.736242615887749e-06.
[I 2025-07-29 09:41:31,795] Trial 34 finished with value: 4.8364864142912805e-06 and parameters: {'n_estimators': 125, 'max_depth': 5}. Best is trial 29 with value: 4.736242615887749e-06.
[I 2025-07-29 09:42:03,289] Trial 35 finished with value: 4.826482601421809e-06 and parameters: {'n_estimators': 178, 'max_depth': 4}. Best is trial 29 with value: 4.736242615887749e-06.
