[I 2025-07-29 05:20:05,289] Trial 31 finished with value: 4.839494447226457e-06 and parameters: {'n_estimators': 346, 'learning_rate': 0.279430070581011, 'max_depth': 3, 'reg_alpha': 0.07366552772312651, 'reg_lambda': 0.5737501418135728}. Best is trial 12 with value: 4.804658986591854e-06.
[I 2025-07-29 05:20:08,505] Trial 32 finished with value: 4.841214428224997e-06 and parameters: {'n_estimators': 348, 'learning_rate': 0.2740462304048138, 'max_depth': 3, 'reg_alpha': 0.06778937735198143, 'reg_lambda': 0.5293467158701501}. Best is trial 12 with value: 4.804658986591854e-06.
[I 2025-07-29 05:20:13,936] Trial 33 finished with value: 4.995740577893362e-06 and parameters: {'n_estimators': 619, 'learning_rate': 0.2392777004800864, 'max_depth': 4, 'reg_alpha': 0.14911981082201345, 'reg_lambda': 0.7062883651866295}. Best is trial 12 with value: 4.804658986591854e-06.
[I 2025-07-29 05:20:20,305] Trial 34 finished with value: 5.019251649998546e-06 and parameters: {'n_estimators': 804, 'learning_rate': 0.258343424887153, 'max_depth': 3, 'reg_alpha': 0.23267440539471324, 'reg_lambda': 0.2686774714528399}. Best is trial 12 with value: 4.804658986591854e-06.
[I 2025-07-29 05:20:23,753] Trial 35 finished with value: 4.845446164587778e-06 and parameters: {'n_estimators': 378, 'learning_rate': 0.17831757860314496, 'max_depth': 4, 'reg_alpha': 0.06072138738358641, 'reg_lambda': 0.6105067564650017}. Best is trial 12 with value: 4.804658986591854e-06.
[I 2025-07-29 05:20:26,521] Trial 36 finished with value: 5.019251649998546e-06 and parameters: {'n_estimators': 320, 'learning_rate': 0.21043186962531263, 'max_depth': 5, 'reg_alpha': 0.3021613365738356, 'reg_lambda': 0.7968190823720457}. Best is trial 12 with value: 4.804658986591854e-06.
[I 2025-07-29 05:20:31,878] Trial 37 finished with value: 5.019251649998546e-06 and parameters: {'n_estimators': 675, 'learning_rate': 0.27725454840631414, 'max_depth': 3, 'reg_alpha': 0.19705705955578248, 'reg_lambda': 0.7481029458764331}. Best is trial 12 with value: 4.804658986591854e-06.
[I 2025-07-29 05:20:35,736] Trial 38 finished with value: 4.983082341578741e-06 and parameters: {'n_estimators': 461, 'learning_rate': 0.09855107893000752, 'max_depth': 3, 'reg_alpha': 0.13435775611831685, 'reg_lambda': 0.8601151072536406}. Best is trial 12 with value: 4.804658986591854e-06.
[I 2025-07-29 05:20:38,378] Trial 39 finished with value: 4.926123314780666e-06 and parameters: {'n_estimators': 239, 'learning_rate': 0.23527892592696384, 'max_depth': 8, 'reg_alpha': 0.06791582613198088, 'reg_lambda': 0.9496605832605086}. Best is trial 12 with value: 4.804658986591854e-06.
[I 2025-07-29 05:20:41,785] Trial 40 finished with value: 5.019251649998546e-06 and parameters: {'n_estimators': 405, 'learning_rate': 0.2630095224484597, 'max_depth': 4, 'reg_alpha': 0.2500704966394297, 'reg_lambda': 0.36912830863264784}. Best is trial 12 with value: 4.804658986591854e-06.
[I 2025-07-29 05:20:44,867] Trial 41 finished with value: 4.828783530087231e-06 and parameters: {'n_estimators': 343, 'learning_rate': 0.2822290233979797, 'max_depth': 3, 'reg_alpha': 0.06445200205478781, 'reg_lambda': 0.5199796246377593}. Best is trial 12 with value: 4.804658986591854e-06.
[I 2025-07-29 05:20:46,505] Trial 42 finished with value: 4.84154030718112e-06 and parameters: {'n_estimators': 150, 'learning_rate': 0.2864266308001232, 'max_depth': 3, 'reg_alpha': 0.053935725541384566, 'reg_lambda': 0.5075208750488108}. Best is trial 12 with value: 4.804658986591854e-06.
[I 2025-07-29 05:20:50,302] Trial 43 finished with value: 5.019251649998546e-06 and parameters: {'n_estimators': 418, 'learning_rate': 0.2505283158655756, 'max_depth': 3, 'reg_alpha': 0.7273489030628002, 'reg_lambda': 0.583237099873465}. Best is trial 12 with value: 4.804658986591854e-06.
[I 2025-07-29 05:20:52,388] Trial 44 finished with value: 5.019251649998546e-06 and parameters: {'n_estimators': 237, 'learning_rate': 0.13924521858463174, 'max_depth': 4, 'reg_alpha': 0.19302146341560092, 'reg_lambda': 0.678425944838008}. Best is trial 12 with value: 4.804658986591854e-06.
[I 2025-07-29 05:20:55,093] Trial 45 finished with value: 4.861378022816297e-06 and parameters: {'n_estimators': 295, 'learning_rate': 0.2840456956050244, 'max_depth': 3, 'reg_alpha': 0.04464774224861355, 'reg_lambda': 0.4456949976298473}. Best is trial 12 with value: 4.804658986591854e-06.
[I 2025-07-29 05:20:59,368] Trial 46 finished with value: 6.543523258322191e-06 and parameters: {'n_estimators': 384, 'learning_rate': 0.29531560368147286, 'max_depth': 4, 'reg_alpha': 0.00031973518834671477, 'reg_lambda': 0.2069150481359479}. Best is trial 12 with value: 4.804658986591854e-06.
[I 2025-07-29 05:21:02,176] Trial 47 finished with value: 4.992095101244574e-06 and parameters: {'n_estimators': 322, 'learning_rate': 0.2616099070760841, 'max_depth': 3, 'reg_alpha': 0.14631723772771071, 'reg_lambda': 0.5948571886537771}. Best is trial 12 with value: 4.804658986591854e-06.
[I 2025-07-29 05:21:06,254] Trial 48 finished with value: 4.928205524802262e-06 and parameters: {'n_estimators': 484, 'learning_rate': 0.24281399404209741, 'max_depth': 5, 'reg_alpha': 0.09066569848506412, 'reg_lambda': 0.011082837722041217}. Best is trial 12 with value: 4.804658986591854e-06.
[I 2025-07-29 05:21:10,725] Trial 49 finished with value: 5.019251649998546e-06 and parameters: {'n_estimators': 559, 'learning_rate': 0.19934626433059285, 'max_depth': 7, 'reg_alpha': 0.5717479838198478, 'reg_lambda': 0.7464284242562492}. Best is trial 12 with value: 4.804658986591854e-06.
[I 2025-07-29 05:21:10,725] A new study created in memory with name: no-name-3ac1c192-49e1-4c2b-aa5b-b21e62c0f89b
[I 2025-07-29 05:21:52,308] Trial 0 finished with value: 4.824290271341984e-06 and parameters: {'n_estimators': 174, 'max_depth': 6, 'min_samples_split': 7, 'min_samples_leaf': 7, 'max_features': None}. Best is trial 0 with value: 4.824290271341984e-06.
[I 2025-07-29 05:21:55,652] Trial 1 finished with value: 5.082639111835715e-06 and parameters: {'n_estimators': 332, 'max_depth': 19, 'min_samples_split': 5, 'min_samples_leaf': 9, 'max_features': 'log2'}. Best is trial 0 with value: 4.824290271341984e-06.
[I 2025-07-29 05:23:53,957] Trial 2 finished with value: 4.863816929152749e-06 and parameters: {'n_estimators': 354, 'max_depth': 10, 'min_samples_split': 20, 'min_samples_leaf': 7, 'max_features': None}. Best is trial 0 with value: 4.824290271341984e-06.
[I 2025-07-29 05:23:56,835] Trial 3 finished with value: 5.108227063901298e-06 and parameters: {'n_estimators': 266, 'max_depth': 19, 'min_samples_split': 11, 'min_samples_leaf': 7, 'max_features': 'log2'}. Best is trial 0 with value: 4.824290271341984e-06.
[I 2025-07-29 05:23:59,102] Trial 4 finished with value: 5.027088307598396e-06 and parameters: {'n_estimators': 168, 'max_depth': 5, 'min_samples_split': 20, 'min_samples_leaf': 3, 'max_features': 'sqrt'}. Best is trial 0 with value: 4.824290271341984e-06.
[I 2025-07-29 05:24:02,960] Trial 5 finished with value: 5.110544659291307e-06 and parameters: {'n_estimators': 412, 'max_depth': 8, 'min_samples_split': 14, 'min_samples_leaf': 2, 'max_features': 'log2'}. Best is trial 0 with value: 4.824290271341984e-06.
[I 2025-07-29 05:24:04,867] Trial 6 finished with value: 5.0686497904990265e-06 and parameters: {'n_estimators': 299, 'max_depth': 4, 'min_samples_split': 5, 'min_samples_leaf': 2, 'max_features': 'log2'}. Best is trial 0 with value: 4.824290271341984e-06.
[I 2025-07-29 05:24:10,518] Trial 7 finished with value: 5.04658453174355e-06 and parameters: {'n_estimators': 250, 'max_depth': 17, 'min_samples_split': 17, 'min_samples_leaf': 7, 'max_features': 'sqrt'}. Best is trial 0 with value: 4.824290271341984e-06.
[I 2025-07-29 05:25:12,509] Trial 8 finished with value: 4.872649147530078e-06 and parameters: {'n_estimators': 174, 'max_depth': 11, 'min_samples_split': 9, 'min_samples_leaf': 7, 'max_features': None}. Best is trial 0 with value: 4.824290271341984e-06.
[I 2025-07-29 05:25:13,369] Trial 9 finished with value: 5.079252788086067e-06 and parameters: {'n_estimators': 107, 'max_depth': 6, 'min_samples_split': 12, 'min_samples_leaf': 6, 'max_features': 'log2'}. Best is trial 0 with value: 4.824290271341984e-06.
[I 2025-07-29 05:28:08,427] Trial 10 finished with value: 4.84987556041356e-06 and parameters: {'n_estimators': 496, 'max_depth': 14, 'min_samples_split': 2, 'min_samples_leaf': 10, 'max_features': None}. Best is trial 0 with value: 4.824290271341984e-06.
[I 2025-07-29 05:30:54,516] Trial 11 finished with value: 4.8539220282346155e-06 and parameters: {'n_estimators': 465, 'max_depth': 15, 'min_samples_split': 2, 'min_samples_leaf': 10, 'max_features': None}. Best is trial 0 with value: 4.824290271341984e-06.
[I 2025-07-29 05:33:53,736] Trial 12 finished with value: 4.856202107780646e-06 and parameters: {'n_estimators': 492, 'max_depth': 14, 'min_samples_split': 7, 'min_samples_leaf': 9, 'max_features': None}. Best is trial 0 with value: 4.824290271341984e-06.
[I 2025-07-29 05:35:15,699] Trial 13 finished with value: 4.95991146273597e-06 and parameters: {'n_estimators': 194, 'max_depth': 13, 'min_samples_split': 2, 'min_samples_leaf': 4, 'max_features': None}. Best is trial 0 with value: 4.824290271341984e-06.
[I 2025-07-29 05:37:09,399] Trial 14 finished with value: 4.822228980888076e-06 and parameters: {'n_estimators': 403, 'max_depth': 8, 'min_samples_split': 6, 'min_samples_leaf': 10, 'max_features': None}. Best is trial 14 with value: 4.822228980888076e-06.
[I 2025-07-29 05:39:09,985] Trial 15 finished with value: 4.917452913840502e-06 and parameters: {'n_estimators': 396, 'max_depth': 8, 'min_samples_split': 7, 'min_samples_leaf': 5, 'max_features': None}. Best is trial 14 with value: 4.822228980888076e-06.
[I 2025-07-29 05:39:11,838] Trial 16 finished with value: 5.001641870442635e-06 and parameters: {'n_estimators': 105, 'max_depth': 8, 'min_samples_split': 9, 'min_samples_leaf': 9, 'max_features': 'sqrt'}. Best is trial 14 with value: 4.822228980888076e-06.
[I 2025-07-29 05:40:50,410] Trial 17 finished with value: 4.819761408312788e-06 and parameters: {'n_estimators': 418, 'max_depth': 6, 'min_samples_split': 5, 'min_samples_leaf': 8, 'max_features': None}. Best is trial 17 with value: 4.819761408312788e-06.
[I 2025-07-29 05:41:45,207] Trial 18 finished with value: 4.743494922373324e-06 and parameters: {'n_estimators': 419, 'max_depth': 3, 'min_samples_split': 5, 'min_samples_leaf': 8, 'max_features': None}. Best is trial 18 with value: 4.743494922373324e-06.
[I 2025-07-29 05:42:42,505] Trial 19 finished with value: 4.740032540946052e-06 and parameters: {'n_estimators': 438, 'max_depth': 3, 'min_samples_split': 4, 'min_samples_leaf': 8, 'max_features': None}. Best is trial 19 with value: 4.740032540946052e-06.
[I 2025-07-29 05:42:47,620] Trial 20 finished with value: 5.010109810494912e-06 and parameters: {'n_estimators': 446, 'max_depth': 4, 'min_samples_split': 4, 'min_samples_leaf': 5, 'max_features': 'sqrt'}. Best is trial 19 with value: 4.740032540946052e-06.
[I 2025-07-29 05:43:35,570] Trial 21 finished with value: 4.743515893789005e-06 and parameters: {'n_estimators': 366, 'max_depth': 3, 'min_samples_split': 4, 'min_samples_leaf': 8, 'max_features': None}. Best is trial 19 with value: 4.740032540946052e-06.
[I 2025-07-29 05:44:22,537] Trial 22 finished with value: 4.741675724590098e-06 and parameters: {'n_estimators': 359, 'max_depth': 3, 'min_samples_split': 9, 'min_samples_leaf': 8, 'max_features': None}. Best is trial 19 with value: 4.740032540946052e-06.
[I 2025-07-29 05:45:22,003] Trial 23 finished with value: 4.737739855457887e-06 and parameters: {'n_estimators': 445, 'max_depth': 3, 'min_samples_split': 9, 'min_samples_leaf': 8, 'max_features': None}. Best is trial 23 with value: 4.737739855457887e-06.
[I 2025-07-29 05:46:22,082] Trial 24 finished with value: 4.761242508547799e-06 and parameters: {'n_estimators': 453, 'max_depth': 3, 'min_samples_split': 9, 'min_samples_leaf': 6, 'max_features': None}. Best is trial 23 with value: 4.737739855457887e-06.
[I 2025-07-29 05:47:47,134] Trial 25 finished with value: 4.813246581113599e-06 and parameters: {'n_estimators': 359, 'max_depth': 6, 'min_samples_split': 14, 'min_samples_leaf': 8, 'max_features': None}. Best is trial 23 with value: 4.737739855457887e-06.
[I 2025-07-29 05:48:51,395] Trial 26 finished with value: 4.7675310359595135e-06 and parameters: {'n_estimators': 316, 'max_depth': 5, 'min_samples_split': 13, 'min_samples_leaf': 9, 'max_features': None}. Best is trial 23 with value: 4.737739855457887e-06.
[I 2025-07-29 05:51:00,991] Trial 27 finished with value: 4.927213118418942e-06 and parameters: {'n_estimators': 373, 'max_depth': 10, 'min_samples_split': 9, 'min_samples_leaf': 6, 'max_features': None}. Best is trial 23 with value: 4.737739855457887e-06.
[I 2025-07-29 05:51:06,019] Trial 28 finished with value: 4.993298774322047e-06 and parameters: {'n_estimators': 444, 'max_depth': 4, 'min_samples_split': 11, 'min_samples_leaf': 8, 'max_features': 'sqrt'}. Best is trial 23 with value: 4.737739855457887e-06.
[I 2025-07-29 05:53:12,620] Trial 29 finished with value: 4.843136317448261e-06 and parameters: {'n_estimators': 472, 'max_depth': 7, 'min_samples_split': 16, 'min_samples_leaf': 7, 'max_features': None}. Best is trial 23 with value: 4.737739855457887e-06.
[I 2025-07-29 05:54:36,087] Trial 30 finished with value: 4.893421880974916e-06 and parameters: {'n_estimators': 386, 'max_depth': 5, 'min_samples_split': 8, 'min_samples_leaf': 1, 'max_features': None}. Best is trial 23 with value: 4.737739855457887e-06.
[I 2025-07-29 05:55:31,720] Trial 31 finished with value: 4.741304982567844e-06 and parameters: {'n_estimators': 432, 'max_depth': 3, 'min_samples_split': 7, 'min_samples_leaf': 8, 'max_features': None}. Best is trial 23 with value: 4.737739855457887e-06.
[I 2025-07-29 05:56:28,517] Trial 32 finished with value: 4.732526330175277e-06 and parameters: {'n_estimators': 433, 'max_depth': 3, 'min_samples_split': 10, 'min_samples_leaf': 9, 'max_features': None}. Best is trial 32 with value: 4.732526330175277e-06.
[I 2025-07-29 05:57:41,568] Trial 33 finished with value: 4.74718835059722e-06 and parameters: {'n_estimators': 432, 'max_depth': 4, 'min_samples_split': 10, 'min_samples_leaf': 9, 'max_features': None}. Best is trial 32 with value: 4.732526330175277e-06.
[I 2025-07-29 05:59:18,378] Trial 34 finished with value: 4.763814592188752e-06 and parameters: {'n_estimators': 479, 'max_depth': 5, 'min_samples_split': 7, 'min_samples_leaf': 10, 'max_features': None}. Best is trial 32 with value: 4.732526330175277e-06.
[I 2025-07-29 05:59:20,237] Trial 35 finished with value: 5.0259292617907e-06 and parameters: {'n_estimators': 333, 'max_depth': 3, 'min_samples_split': 11, 'min_samples_leaf': 9, 'max_features': 'log2'}. Best is trial 32 with value: 4.732526330175277e-06.
[I 2025-07-29 06:02:19,371] Trial 36 finished with value: 4.931806398432333e-06 and parameters: {'n_estimators': 439, 'max_depth': 20, 'min_samples_split': 3, 'min_samples_leaf': 7, 'max_features': None}. Best is trial 32 with value: 4.732526330175277e-06.
[I 2025-07-29 06:04:22,206] Trial 37 finished with value: 4.80681366085e-06 and parameters: {'n_estimators': 468, 'max_depth': 7, 'min_samples_split': 6, 'min_samples_leaf': 9, 'max_features': None}. Best is trial 32 with value: 4.732526330175277e-06.
[I 2025-07-29 06:04:24,710] Trial 38 finished with value: 5.047812225282763e-06 and parameters: {'n_estimators': 388, 'max_depth': 4, 'min_samples_split': 8, 'min_samples_leaf': 6, 'max_features': 'log2'}. Best is trial 32 with value: 4.732526330175277e-06.
[I 2025-07-29 06:04:28,464] Trial 39 finished with value: 4.969414846506173e-06 and parameters: {'n_estimators': 281, 'max_depth': 5, 'min_samples_split': 12, 'min_samples_leaf': 8, 'max_features': 'sqrt'}. Best is trial 32 with value: 4.732526330175277e-06.
[I 2025-07-29 06:06:33,097] Trial 40 finished with value: 4.950158430727631e-06 and parameters: {'n_estimators': 341, 'max_depth': 10, 'min_samples_split': 6, 'min_samples_leaf': 4, 'max_features': None}. Best is trial 32 with value: 4.732526330175277e-06.
[I 2025-07-29 06:07:29,155] Trial 41 finished with value: 4.741642020239039e-06 and parameters: {'n_estimators': 423, 'max_depth': 3, 'min_samples_split': 10, 'min_samples_leaf': 8, 'max_features': None}. Best is trial 32 with value: 4.732526330175277e-06.
[I 2025-07-29 06:08:25,748] Trial 42 finished with value: 4.7550821686871065e-06 and parameters: {'n_estimators': 425, 'max_depth': 3, 'min_samples_split': 10, 'min_samples_leaf': 7, 'max_features': None}. Best is trial 32 with value: 4.732526330175277e-06.
[I 2025-07-29 06:09:34,986] Trial 43 finished with value: 4.75121373415047e-06 and parameters: {'n_estimators': 407, 'max_depth': 4, 'min_samples_split': 10, 'min_samples_leaf': 9, 'max_features': None}. Best is trial 32 with value: 4.732526330175277e-06.
[I 2025-07-29 06:09:38,564] Trial 44 finished with value: 5.04999226040968e-06 and parameters: {'n_estimators': 458, 'max_depth': 6, 'min_samples_split': 8, 'min_samples_leaf': 8, 'max_features': 'log2'}. Best is trial 32 with value: 4.732526330175277e-06.
[I 2025-07-29 06:11:15,846] Trial 45 finished with value: 4.7637589259328204e-06 and parameters: {'n_estimators': 480, 'max_depth': 5, 'min_samples_split': 12, 'min_samples_leaf': 10, 'max_features': None}. Best is trial 32 with value: 4.732526330175277e-06.
[I 2025-07-29 06:12:20,049] Trial 46 finished with value: 4.832794753621374e-06 and parameters: {'n_estimators': 237, 'max_depth': 7, 'min_samples_split': 4, 'min_samples_leaf': 7, 'max_features': None}. Best is trial 32 with value: 4.732526330175277e-06.
[I 2025-07-29 06:13:45,399] Trial 47 finished with value: 4.757227502982472e-06 and parameters: {'n_estimators': 499, 'max_depth': 4, 'min_samples_split': 18, 'min_samples_leaf': 8, 'max_features': None}. Best is trial 32 with value: 4.732526330175277e-06.
[I 2025-07-29 06:16:05,410] Trial 48 finished with value: 4.86739143220809e-06 and parameters: {'n_estimators': 386, 'max_depth': 17, 'min_samples_split': 8, 'min_samples_leaf': 10, 'max_features': None}. Best is trial 32 with value: 4.732526330175277e-06.
[I 2025-07-29 06:16:07,775] Trial 49 finished with value: 5.0250050605783705e-06 and parameters: {'n_estimators': 429, 'max_depth': 3, 'min_samples_split': 13, 'min_samples_leaf': 9, 'max_features': 'log2'}. Best is trial 32 with value: 4.732526330175277e-06.
[I 2025-07-29 06:16:07,775] A new study created in memory with name: no-name-af6ec9d2-790a-4322-8f7d-4a428e1876b6
[I 2025-07-29 06:17:03,924] Trial 0 finished with value: 4.9770782516959224e-06 and parameters: {'n_estimators': 168, 'max_depth': 8}. Best is trial 0 with value: 4.9770782516959224e-06.
[I 2025-07-29 06:17:40,783] Trial 1 finished with value: 4.943407003120818e-06 and parameters: {'n_estimators': 124, 'max_depth': 7}. Best is trial 1 with value: 4.943407003120818e-06.
[I 2025-07-29 06:18:18,146] Trial 2 finished with value: 4.8657434290146864e-06 and parameters: {'n_estimators': 171, 'max_depth': 5}. Best is trial 2 with value: 4.8657434290146864e-06.
[I 2025-07-29 06:20:04,176] Trial 3 finished with value: 4.974081137528055e-06 and parameters: {'n_estimators': 357, 'max_depth': 7}. Best is trial 2 with value: 4.8657434290146864e-06.
[I 2025-07-29 06:21:30,113] Trial 4 finished with value: 4.962272536877857e-06 and parameters: {'n_estimators': 289, 'max_depth': 7}. Best is trial 2 with value: 4.8657434290146864e-06.
[I 2025-07-29 06:21:49,343] Trial 5 finished with value: 4.785395170698339e-06 and parameters: {'n_estimators': 109, 'max_depth': 4}. Best is trial 5 with value: 4.785395170698339e-06.
[I 2025-07-29 06:23:58,748] Trial 6 finished with value: 4.994142300832985e-06 and parameters: {'n_estimators': 388, 'max_depth': 8}. Best is trial 5 with value: 4.785395170698339e-06.
[I 2025-07-29 06:25:17,799] Trial 7 finished with value: 4.909028411258884e-06 and parameters: {'n_estimators': 307, 'max_depth': 6}. Best is trial 5 with value: 4.785395170698339e-06.
[I 2025-07-29 06:26:53,349] Trial 8 finished with value: 4.8791210036585e-06 and parameters: {'n_estimators': 439, 'max_depth': 5}. Best is trial 5 with value: 4.785395170698339e-06.
[I 2025-07-29 06:27:40,155] Trial 9 finished with value: 4.958296251930185e-06 and parameters: {'n_estimators': 158, 'max_depth': 7}. Best is trial 5 with value: 4.785395170698339e-06.
[I 2025-07-29 06:28:11,009] Trial 10 finished with value: 4.784639916602256e-06 and parameters: {'n_estimators': 230, 'max_depth': 3}. Best is trial 10 with value: 4.784639916602256e-06.
[I 2025-07-29 06:28:43,298] Trial 11 finished with value: 4.7872659526345675e-06 and parameters: {'n_estimators': 240, 'max_depth': 3}. Best is trial 10 with value: 4.784639916602256e-06.
[I 2025-07-29 06:29:14,867] Trial 12 finished with value: 4.787780185817779e-06 and parameters: {'n_estimators': 235, 'max_depth': 3}. Best is trial 10 with value: 4.784639916602256e-06.
[I 2025-07-29 06:30:00,508] Trial 13 finished with value: 5.017736964712997e-06 and parameters: {'n_estimators': 114, 'max_depth': 10}. Best is trial 10 with value: 4.784639916602256e-06.
[I 2025-07-29 06:30:39,396] Trial 14 finished with value: 4.82288501783648e-06 and parameters: {'n_estimators': 220, 'max_depth': 4}. Best is trial 10 with value: 4.784639916602256e-06.
[I 2025-07-29 06:32:03,554] Trial 15 finished with value: 4.830821289176904e-06 and parameters: {'n_estimators': 477, 'max_depth': 4}. Best is trial 10 with value: 4.784639916602256e-06.
[I 2025-07-29 06:32:21,556] Trial 16 finished with value: 4.811678139857358e-06 and parameters: {'n_estimators': 102, 'max_depth': 4}. Best is trial 10 with value: 4.784639916602256e-06.
[I 2025-07-29 06:32:48,709] Trial 17 finished with value: 4.781517649912095e-06 and parameters: {'n_estimators': 202, 'max_depth': 3}. Best is trial 17 with value: 4.781517649912095e-06.
