[I 2025-07-29 04:17:26,139] Trial 13 finished with value: 5.020413536837652e-06 and parameters: {'n_estimators': 276, 'max_depth': 3, 'min_samples_split': 14, 'min_samples_leaf': 9, 'max_features': 'log2'}. Best is trial 11 with value: 4.728683365788026e-06.
[I 2025-07-29 04:17:50,051] Trial 14 finished with value: 4.731284739648599e-06 and parameters: {'n_estimators': 182, 'max_depth': 3, 'min_samples_split': 15, 'min_samples_leaf': 8, 'max_features': None}. Best is trial 11 with value: 4.728683365788026e-06.
[I 2025-07-29 04:18:43,514] Trial 15 finished with value: 4.786907490695615e-06 and parameters: {'n_estimators': 228, 'max_depth': 6, 'min_samples_split': 12, 'min_samples_leaf': 9, 'max_features': None}. Best is trial 11 with value: 4.728683365788026e-06.
[I 2025-07-29 04:18:45,898] Trial 16 finished with value: 5.048071690891361e-06 and parameters: {'n_estimators': 309, 'max_depth': 6, 'min_samples_split': 5, 'min_samples_leaf': 10, 'max_features': 'log2'}. Best is trial 11 with value: 4.728683365788026e-06.
[I 2025-07-29 04:19:33,925] Trial 17 finished with value: 4.832898468477342e-06 and parameters: {'n_estimators': 162, 'max_depth': 8, 'min_samples_split': 19, 'min_samples_leaf': 6, 'max_features': None}. Best is trial 11 with value: 4.728683365788026e-06.
[I 2025-07-29 04:20:12,054] Trial 18 finished with value: 4.7345076298858395e-06 and parameters: {'n_estimators': 224, 'max_depth': 4, 'min_samples_split': 6, 'min_samples_leaf': 9, 'max_features': None}. Best is trial 11 with value: 4.728683365788026e-06.
[I 2025-07-29 04:21:47,799] Trial 19 finished with value: 4.848203828135006e-06 and parameters: {'n_estimators': 305, 'max_depth': 9, 'min_samples_split': 13, 'min_samples_leaf': 8, 'max_features': None}. Best is trial 11 with value: 4.728683365788026e-06.
[I 2025-07-29 04:21:48,856] Trial 20 finished with value: 5.041803377226278e-06 and parameters: {'n_estimators': 141, 'max_depth': 5, 'min_samples_split': 17, 'min_samples_leaf': 6, 'max_features': 'log2'}. Best is trial 11 with value: 4.728683365788026e-06.
[I 2025-07-29 04:22:13,812] Trial 21 finished with value: 4.734818241626817e-06 and parameters: {'n_estimators': 188, 'max_depth': 3, 'min_samples_split': 15, 'min_samples_leaf': 8, 'max_features': None}. Best is trial 11 with value: 4.728683365788026e-06.
[I 2025-07-29 04:22:37,747] Trial 22 finished with value: 4.731284739648599e-06 and parameters: {'n_estimators': 182, 'max_depth': 3, 'min_samples_split': 11, 'min_samples_leaf': 8, 'max_features': None}. Best is trial 11 with value: 4.728683365788026e-06.
[I 2025-07-29 04:23:04,171] Trial 23 finished with value: 4.7524598337308345e-06 and parameters: {'n_estimators': 102, 'max_depth': 7, 'min_samples_split': 17, 'min_samples_leaf': 10, 'max_features': None}. Best is trial 11 with value: 4.728683365788026e-06.
[I 2025-07-29 04:23:58,300] Trial 24 finished with value: 4.767246016391066e-06 and parameters: {'n_estimators': 265, 'max_depth': 5, 'min_samples_split': 14, 'min_samples_leaf': 9, 'max_features': None}. Best is trial 11 with value: 4.728683365788026e-06.
[I 2025-07-29 04:24:32,503] Trial 25 finished with value: 4.754994110484149e-06 and parameters: {'n_estimators': 201, 'max_depth': 4, 'min_samples_split': 12, 'min_samples_leaf': 8, 'max_features': None}. Best is trial 11 with value: 4.728683365788026e-06.
[I 2025-07-29 04:25:18,805] Trial 26 finished with value: 4.78014108386148e-06 and parameters: {'n_estimators': 145, 'max_depth': 10, 'min_samples_split': 18, 'min_samples_leaf': 10, 'max_features': None}. Best is trial 11 with value: 4.728683365788026e-06.
[I 2025-07-29 04:26:00,230] Trial 27 finished with value: 4.735549238969016e-06 and parameters: {'n_estimators': 245, 'max_depth': 4, 'min_samples_split': 15, 'min_samples_leaf': 9, 'max_features': None}. Best is trial 11 with value: 4.728683365788026e-06.
[I 2025-07-29 04:26:01,570] Trial 28 finished with value: 5.030656590606492e-06 and parameters: {'n_estimators': 152, 'max_depth': 7, 'min_samples_split': 20, 'min_samples_leaf': 5, 'max_features': 'log2'}. Best is trial 11 with value: 4.728683365788026e-06.
[I 2025-07-29 04:26:59,193] Trial 29 finished with value: 4.760300661183498e-06 and parameters: {'n_estimators': 283, 'max_depth': 5, 'min_samples_split': 7, 'min_samples_leaf': 9, 'max_features': None}. Best is trial 11 with value: 4.728683365788026e-06.
[I 2025-07-29 04:27:00,327] Trial 30 finished with value: 4.973948323079724e-06 and parameters: {'n_estimators': 114, 'max_depth': 3, 'min_samples_split': 10, 'min_samples_leaf': 10, 'max_features': 'sqrt'}. Best is trial 11 with value: 4.728683365788026e-06.
[I 2025-07-29 04:27:24,606] Trial 31 finished with value: 4.7276513700733345e-06 and parameters: {'n_estimators': 184, 'max_depth': 3, 'min_samples_split': 11, 'min_samples_leaf': 8, 'max_features': None}. Best is trial 31 with value: 4.7276513700733345e-06.
[I 2025-07-29 04:28:46,450] Trial 32 finished with value: 4.912247828977603e-06 and parameters: {'n_estimators': 200, 'max_depth': 20, 'min_samples_split': 13, 'min_samples_leaf': 7, 'max_features': None}. Best is trial 31 with value: 4.7276513700733345e-06.
[I 2025-07-29 04:29:25,916] Trial 33 finished with value: 4.758417364636763e-06 and parameters: {'n_estimators': 232, 'max_depth': 4, 'min_samples_split': 9, 'min_samples_leaf': 8, 'max_features': None}. Best is trial 31 with value: 4.7276513700733345e-06.
[I 2025-07-29 04:29:59,528] Trial 34 finished with value: 4.783837496868515e-06 and parameters: {'n_estimators': 163, 'max_depth': 5, 'min_samples_split': 16, 'min_samples_leaf': 7, 'max_features': None}. Best is trial 31 with value: 4.7276513700733345e-06.
[I 2025-07-29 04:30:56,017] Trial 35 finished with value: 4.859751342912694e-06 and parameters: {'n_estimators': 207, 'max_depth': 7, 'min_samples_split': 10, 'min_samples_leaf': 6, 'max_features': None}. Best is trial 31 with value: 4.7276513700733345e-06.
[I 2025-07-29 04:30:57,395] Trial 36 finished with value: 5.006704041362405e-06 and parameters: {'n_estimators': 139, 'max_depth': 3, 'min_samples_split': 7, 'min_samples_leaf': 5, 'max_features': 'sqrt'}. Best is trial 31 with value: 4.7276513700733345e-06.
[I 2025-07-29 04:31:54,363] Trial 37 finished with value: 4.813354875731955e-06 and parameters: {'n_estimators': 327, 'max_depth': 4, 'min_samples_split': 14, 'min_samples_leaf': 2, 'max_features': None}. Best is trial 31 with value: 4.7276513700733345e-06.
[I 2025-07-29 04:32:53,784] Trial 38 finished with value: 4.803358609361358e-06 and parameters: {'n_estimators': 251, 'max_depth': 6, 'min_samples_split': 12, 'min_samples_leaf': 8, 'max_features': None}. Best is trial 31 with value: 4.7276513700733345e-06.
[I 2025-07-29 04:32:57,511] Trial 39 finished with value: 5.02278401118316e-06 and parameters: {'n_estimators': 175, 'max_depth': 19, 'min_samples_split': 4, 'min_samples_leaf': 9, 'max_features': 'sqrt'}. Best is trial 31 with value: 4.7276513700733345e-06.
[I 2025-07-29 04:33:53,296] Trial 40 finished with value: 4.970171631608535e-06 and parameters: {'n_estimators': 128, 'max_depth': 13, 'min_samples_split': 8, 'min_samples_leaf': 3, 'max_features': None}. Best is trial 31 with value: 4.7276513700733345e-06.
[I 2025-07-29 04:34:17,802] Trial 41 finished with value: 4.7308608590811435e-06 and parameters: {'n_estimators': 186, 'max_depth': 3, 'min_samples_split': 11, 'min_samples_leaf': 8, 'max_features': None}. Best is trial 31 with value: 4.7276513700733345e-06.
[I 2025-07-29 04:34:45,914] Trial 42 finished with value: 4.7433752115931045e-06 and parameters: {'n_estimators': 213, 'max_depth': 3, 'min_samples_split': 10, 'min_samples_leaf': 7, 'max_features': None}. Best is trial 31 with value: 4.7276513700733345e-06.
[I 2025-07-29 04:35:24,640] Trial 43 finished with value: 4.771792807128376e-06 and parameters: {'n_estimators': 192, 'max_depth': 5, 'min_samples_split': 11, 'min_samples_leaf': 10, 'max_features': None}. Best is trial 31 with value: 4.7276513700733345e-06.
[I 2025-07-29 04:35:53,364] Trial 44 finished with value: 4.7540852604386015e-06 and parameters: {'n_estimators': 168, 'max_depth': 4, 'min_samples_split': 13, 'min_samples_leaf': 7, 'max_features': None}. Best is trial 31 with value: 4.7276513700733345e-06.
[I 2025-07-29 04:36:24,233] Trial 45 finished with value: 4.7298621707262156e-06 and parameters: {'n_estimators': 235, 'max_depth': 3, 'min_samples_split': 15, 'min_samples_leaf': 9, 'max_features': None}. Best is trial 31 with value: 4.7276513700733345e-06.
[I 2025-07-29 04:37:51,213] Trial 46 finished with value: 4.847652790818687e-06 and parameters: {'n_estimators': 241, 'max_depth': 16, 'min_samples_split': 16, 'min_samples_leaf': 10, 'max_features': None}. Best is trial 31 with value: 4.7276513700733345e-06.
[I 2025-07-29 04:37:54,028] Trial 47 finished with value: 5.071376344761368e-06 and parameters: {'n_estimators': 283, 'max_depth': 12, 'min_samples_split': 8, 'min_samples_leaf': 9, 'max_features': 'log2'}. Best is trial 31 with value: 4.7276513700733345e-06.
[I 2025-07-29 04:37:57,268] Trial 48 finished with value: 4.982867291603149e-06 and parameters: {'n_estimators': 219, 'max_depth': 6, 'min_samples_split': 14, 'min_samples_leaf': 9, 'max_features': 'sqrt'}. Best is trial 31 with value: 4.7276513700733345e-06.
[I 2025-07-29 04:39:11,828] Trial 49 finished with value: 4.798745829794908e-06 and parameters: {'n_estimators': 263, 'max_depth': 8, 'min_samples_split': 2, 'min_samples_leaf': 10, 'max_features': None}. Best is trial 31 with value: 4.7276513700733345e-06.
[I 2025-07-29 04:39:11,829] A new study created in memory with name: no-name-51b6c1ea-008a-4c73-a928-d3ceaf11796f
[I 2025-07-29 04:40:08,176] Trial 0 finished with value: 4.900039392057785e-06 and parameters: {'n_estimators': 218, 'max_depth': 6}. Best is trial 0 with value: 4.900039392057785e-06.
[I 2025-07-29 04:42:04,113] Trial 1 finished with value: 4.922167205431146e-06 and parameters: {'n_estimators': 450, 'max_depth': 6}. Best is trial 0 with value: 4.900039392057785e-06.
[I 2025-07-29 04:42:36,917] Trial 2 finished with value: 4.784576632458881e-06 and parameters: {'n_estimators': 244, 'max_depth': 3}. Best is trial 2 with value: 4.784576632458881e-06.
[I 2025-07-29 04:43:50,261] Trial 3 finished with value: 4.8331623507972034e-06 and parameters: {'n_estimators': 416, 'max_depth': 4}. Best is trial 2 with value: 4.784576632458881e-06.
[I 2025-07-29 04:46:21,152] Trial 4 finished with value: 5.054705631128912e-06 and parameters: {'n_estimators': 376, 'max_depth': 10}. Best is trial 2 with value: 4.784576632458881e-06.
[I 2025-07-29 04:48:34,067] Trial 5 finished with value: 4.96218706333366e-06 and parameters: {'n_estimators': 450, 'max_depth': 7}. Best is trial 2 with value: 4.784576632458881e-06.
[I 2025-07-29 04:51:18,646] Trial 6 finished with value: 5.010221334153781e-06 and parameters: {'n_estimators': 448, 'max_depth': 9}. Best is trial 2 with value: 4.784576632458881e-06.
[I 2025-07-29 04:53:22,332] Trial 7 finished with value: 4.991355084638877e-06 and parameters: {'n_estimators': 372, 'max_depth': 8}. Best is trial 2 with value: 4.784576632458881e-06.
[I 2025-07-29 04:55:01,252] Trial 8 finished with value: 4.870451428937069e-06 and parameters: {'n_estimators': 457, 'max_depth': 5}. Best is trial 2 with value: 4.784576632458881e-06.
[I 2025-07-29 04:56:09,302] Trial 9 finished with value: 4.8404581882834e-06 and parameters: {'n_estimators': 388, 'max_depth': 4}. Best is trial 2 with value: 4.784576632458881e-06.
[I 2025-07-29 04:56:27,752] Trial 10 finished with value: 4.749966571806315e-06 and parameters: {'n_estimators': 138, 'max_depth': 3}. Best is trial 10 with value: 4.749966571806315e-06.
[I 2025-07-29 04:56:42,458] Trial 11 finished with value: 4.736242615887749e-06 and parameters: {'n_estimators': 110, 'max_depth': 3}. Best is trial 11 with value: 4.736242615887749e-06.
[I 2025-07-29 04:56:57,712] Trial 12 finished with value: 4.741690663391845e-06 and parameters: {'n_estimators': 114, 'max_depth': 3}. Best is trial 11 with value: 4.736242615887749e-06.
[I 2025-07-29 04:57:15,457] Trial 13 finished with value: 4.814576416346677e-06 and parameters: {'n_estimators': 101, 'max_depth': 4}. Best is trial 11 with value: 4.736242615887749e-06.
[I 2025-07-29 04:57:39,524] Trial 14 finished with value: 4.782454611991935e-06 and parameters: {'n_estimators': 180, 'max_depth': 3}. Best is trial 11 with value: 4.736242615887749e-06.
[I 2025-07-29 04:58:44,128] Trial 15 finished with value: 4.8723387535481584e-06 and parameters: {'n_estimators': 298, 'max_depth': 5}. Best is trial 11 with value: 4.736242615887749e-06.
[I 2025-07-29 04:59:08,024] Trial 16 finished with value: 4.825154737297329e-06 and parameters: {'n_estimators': 110, 'max_depth': 5}. Best is trial 11 with value: 4.736242615887749e-06.
[I 2025-07-29 04:59:31,007] Trial 17 finished with value: 4.779362404445238e-06 and parameters: {'n_estimators': 172, 'max_depth': 3}. Best is trial 11 with value: 4.736242615887749e-06.
[I 2025-07-29 05:00:54,171] Trial 18 finished with value: 4.947818217518e-06 and parameters: {'n_estimators': 281, 'max_depth': 7}. Best is trial 11 with value: 4.736242615887749e-06.
[I 2025-07-29 05:01:20,863] Trial 19 finished with value: 4.804231498951523e-06 and parameters: {'n_estimators': 152, 'max_depth': 4}. Best is trial 11 with value: 4.736242615887749e-06.
[I 2025-07-29 05:02:07,587] Trial 20 finished with value: 4.862888026881642e-06 and parameters: {'n_estimators': 215, 'max_depth': 5}. Best is trial 11 with value: 4.736242615887749e-06.
[I 2025-07-29 05:02:27,274] Trial 21 finished with value: 4.7586154235543265e-06 and parameters: {'n_estimators': 147, 'max_depth': 3}. Best is trial 11 with value: 4.736242615887749e-06.
[I 2025-07-29 05:02:44,255] Trial 22 finished with value: 4.74642152393231e-06 and parameters: {'n_estimators': 127, 'max_depth': 3}. Best is trial 11 with value: 4.736242615887749e-06.
[I 2025-07-29 05:03:05,160] Trial 23 finished with value: 4.790074831528408e-06 and parameters: {'n_estimators': 119, 'max_depth': 4}. Best is trial 11 with value: 4.736242615887749e-06.
[I 2025-07-29 05:03:30,027] Trial 24 finished with value: 4.7765786420443595e-06 and parameters: {'n_estimators': 186, 'max_depth': 3}. Best is trial 11 with value: 4.736242615887749e-06.
[I 2025-07-29 05:04:14,653] Trial 25 finished with value: 4.820846491976457e-06 and parameters: {'n_estimators': 254, 'max_depth': 4}. Best is trial 11 with value: 4.736242615887749e-06.
[I 2025-07-29 05:04:42,273] Trial 26 finished with value: 4.781721946125921e-06 and parameters: {'n_estimators': 206, 'max_depth': 3}. Best is trial 11 with value: 4.736242615887749e-06.
[I 2025-07-29 05:06:09,968] Trial 27 finished with value: 4.9287944089397316e-06 and parameters: {'n_estimators': 338, 'max_depth': 6}. Best is trial 11 with value: 4.736242615887749e-06.
[I 2025-07-29 05:06:39,722] Trial 28 finished with value: 4.842897582878962e-06 and parameters: {'n_estimators': 136, 'max_depth': 5}. Best is trial 11 with value: 4.736242615887749e-06.
[I 2025-07-29 05:07:41,546] Trial 29 finished with value: 4.916653200370036e-06 and parameters: {'n_estimators': 239, 'max_depth': 6}. Best is trial 11 with value: 4.736242615887749e-06.
[I 2025-07-29 05:08:12,463] Trial 30 finished with value: 4.823037072122266e-06 and parameters: {'n_estimators': 176, 'max_depth': 4}. Best is trial 11 with value: 4.736242615887749e-06.
[I 2025-07-29 05:08:30,128] Trial 31 finished with value: 4.744190959655025e-06 and parameters: {'n_estimators': 131, 'max_depth': 3}. Best is trial 11 with value: 4.736242615887749e-06.
[I 2025-07-29 05:08:47,377] Trial 32 finished with value: 4.747531179276429e-06 and parameters: {'n_estimators': 128, 'max_depth': 3}. Best is trial 11 with value: 4.736242615887749e-06.
[I 2025-07-29 05:09:00,852] Trial 33 finished with value: 4.75395453770225e-06 and parameters: {'n_estimators': 100, 'max_depth': 3}. Best is trial 11 with value: 4.736242615887749e-06.
[I 2025-07-29 05:09:28,819] Trial 34 finished with value: 4.809126351945215e-06 and parameters: {'n_estimators': 159, 'max_depth': 4}. Best is trial 11 with value: 4.736242615887749e-06.
[I 2025-07-29 05:09:55,382] Trial 35 finished with value: 4.783743433960137e-06 and parameters: {'n_estimators': 197, 'max_depth': 3}. Best is trial 11 with value: 4.736242615887749e-06.
[I 2025-07-29 05:10:18,025] Trial 36 finished with value: 4.79481391755454e-06 and parameters: {'n_estimators': 129, 'max_depth': 4}. Best is trial 11 with value: 4.736242615887749e-06.
[I 2025-07-29 05:11:21,682] Trial 37 finished with value: 5.036550117211978e-06 and parameters: {'n_estimators': 159, 'max_depth': 10}. Best is trial 11 with value: 4.736242615887749e-06.
[I 2025-07-29 05:12:41,118] Trial 38 finished with value: 5.001049818833044e-06 and parameters: {'n_estimators': 239, 'max_depth': 8}. Best is trial 11 with value: 4.736242615887749e-06.
[I 2025-07-29 05:13:44,993] Trial 39 finished with value: 4.78337869829367e-06 and parameters: {'n_estimators': 479, 'max_depth': 3}. Best is trial 11 with value: 4.736242615887749e-06.
[I 2025-07-29 05:14:27,894] Trial 40 finished with value: 4.974988756374427e-06 and parameters: {'n_estimators': 117, 'max_depth': 9}. Best is trial 11 with value: 4.736242615887749e-06.
[I 2025-07-29 05:14:44,992] Trial 41 finished with value: 4.747531179276429e-06 and parameters: {'n_estimators': 128, 'max_depth': 3}. Best is trial 11 with value: 4.736242615887749e-06.
[I 2025-07-29 05:15:04,649] Trial 42 finished with value: 4.7586154235543265e-06 and parameters: {'n_estimators': 147, 'max_depth': 3}. Best is trial 11 with value: 4.736242615887749e-06.
[I 2025-07-29 05:15:20,410] Trial 43 finished with value: 4.750530227427065e-06 and parameters: {'n_estimators': 118, 'max_depth': 3}. Best is trial 11 with value: 4.736242615887749e-06.
[I 2025-07-29 05:15:49,039] Trial 44 finished with value: 4.80920662018259e-06 and parameters: {'n_estimators': 163, 'max_depth': 4}. Best is trial 11 with value: 4.736242615887749e-06.
[I 2025-07-29 05:16:13,080] Trial 45 finished with value: 4.7953945429960605e-06 and parameters: {'n_estimators': 137, 'max_depth': 4}. Best is trial 11 with value: 4.736242615887749e-06.
[I 2025-07-29 05:16:26,968] Trial 46 finished with value: 4.745463204119955e-06 and parameters: {'n_estimators': 104, 'max_depth': 3}. Best is trial 11 with value: 4.736242615887749e-06.
[I 2025-07-29 05:16:49,049] Trial 47 finished with value: 4.849132006301053e-06 and parameters: {'n_estimators': 102, 'max_depth': 5}. Best is trial 11 with value: 4.736242615887749e-06.
[I 2025-07-29 05:17:21,141] Trial 48 finished with value: 4.827016923704673e-06 and parameters: {'n_estimators': 183, 'max_depth': 4}. Best is trial 11 with value: 4.736242615887749e-06.
[I 2025-07-29 05:17:36,502] Trial 49 finished with value: 4.744295533721255e-06 and parameters: {'n_estimators': 115, 'max_depth': 3}. Best is trial 11 with value: 4.736242615887749e-06.
[I 2025-07-29 05:17:36,503] A new study created in memory with name: no-name-422a02a7-ecea-4fe1-8156-769391464f0f
[I 2025-07-29 05:17:37,034] Trial 0 finished with value: 5.019251650211013e-06 and parameters: {'n_estimators': 686, 'learning_rate': 0.26614519082669064, 'max_depth': 4, 'num_leaves': 17, 'reg_alpha': 0.6507034091084661, 'reg_lambda': 0.2501246457785511}. Best is trial 0 with value: 5.019251650211013e-06.
[I 2025-07-29 05:17:37,362] Trial 1 finished with value: 5.019251650211013e-06 and parameters: {'n_estimators': 309, 'learning_rate': 0.0794290117697864, 'max_depth': 6, 'num_leaves': 61, 'reg_alpha': 0.7859326839775678, 'reg_lambda': 0.6443089085831798}. Best is trial 0 with value: 5.019251650211013e-06.
[I 2025-07-29 05:17:37,839] Trial 2 finished with value: 5.019251650211013e-06 and parameters: {'n_estimators': 532, 'learning_rate': 0.19909393304764245, 'max_depth': 5, 'num_leaves': 32, 'reg_alpha': 0.37110617054459594, 'reg_lambda': 0.029261439316328075}. Best is trial 0 with value: 5.019251650211013e-06.
[I 2025-07-29 05:17:38,531] Trial 3 finished with value: 5.019251650211013e-06 and parameters: {'n_estimators': 887, 'learning_rate': 0.18409021333260916, 'max_depth': 6, 'num_leaves': 92, 'reg_alpha': 0.9002948515946712, 'reg_lambda': 0.23940411372914971}. Best is trial 0 with value: 5.019251650211013e-06.
[I 2025-07-29 05:17:38,981] Trial 4 finished with value: 5.019251650211013e-06 and parameters: {'n_estimators': 535, 'learning_rate': 0.1491677573188871, 'max_depth': 4, 'num_leaves': 42, 'reg_alpha': 0.6717047200339082, 'reg_lambda': 0.924348528022787}. Best is trial 0 with value: 5.019251650211013e-06.
[I 2025-07-29 05:17:39,390] Trial 5 finished with value: 5.019251650211013e-06 and parameters: {'n_estimators': 448, 'learning_rate': 0.05336612663691804, 'max_depth': 8, 'num_leaves': 14, 'reg_alpha': 0.47778680348748315, 'reg_lambda': 0.4448680112334127}. Best is trial 0 with value: 5.019251650211013e-06.
[I 2025-07-29 05:17:39,828] Trial 6 finished with value: 5.019251650211013e-06 and parameters: {'n_estimators': 483, 'learning_rate': 0.03645461725314893, 'max_depth': 5, 'num_leaves': 56, 'reg_alpha': 0.4970796155433649, 'reg_lambda': 0.7838080825979821}. Best is trial 0 with value: 5.019251650211013e-06.
[I 2025-07-29 05:17:40,323] Trial 7 finished with value: 5.094861547073549e-06 and parameters: {'n_estimators': 434, 'learning_rate': 0.2593735799546349, 'max_depth': 4, 'num_leaves': 18, 'reg_alpha': 0.029348218171120655, 'reg_lambda': 0.925419359507746}. Best is trial 0 with value: 5.019251650211013e-06.
[I 2025-07-29 05:17:40,672] Trial 8 finished with value: 4.987108905017229e-06 and parameters: {'n_estimators': 377, 'learning_rate': 0.21665763777180083, 'max_depth': 8, 'num_leaves': 27, 'reg_alpha': 0.15349272455484586, 'reg_lambda': 0.20121068715579615}. Best is trial 8 with value: 4.987108905017229e-06.
