[I 2025-07-29 04:01:58,614] Trial 38 finished with value: 4.983137989616248e-06 and parameters: {'n_estimators': 692, 'learning_rate': 0.19947716936922077, 'max_depth': 6, 'num_leaves': 64, 'reg_alpha': 0.1482459091338443, 'reg_lambda': 0.5385411515366726}. Best is trial 30 with value: 4.829376147945051e-06.
[I 2025-07-29 04:01:59,074] Trial 39 finished with value: 5.019251650211013e-06 and parameters: {'n_estimators': 358, 'learning_rate': 0.1384670148681697, 'max_depth': 10, 'num_leaves': 50, 'reg_alpha': 0.47339979041142477, 'reg_lambda': 0.832911025445854}. Best is trial 30 with value: 4.829376147945051e-06.
[I 2025-07-29 04:01:59,438] Trial 40 finished with value: 5.019251650211013e-06 and parameters: {'n_estimators': 221, 'learning_rate': 0.29645112779445115, 'max_depth': 5, 'num_leaves': 71, 'reg_alpha': 0.3829279726077609, 'reg_lambda': 0.7192598316047388}. Best is trial 30 with value: 4.829376147945051e-06.
[I 2025-07-29 04:02:00,108] Trial 41 finished with value: 4.858314467928443e-06 and parameters: {'n_estimators': 614, 'learning_rate': 0.2547181320355396, 'max_depth': 7, 'num_leaves': 28, 'reg_alpha': 0.05776745930757267, 'reg_lambda': 0.7941037746936097}. Best is trial 30 with value: 4.829376147945051e-06.
[I 2025-07-29 04:02:00,761] Trial 42 finished with value: 4.894919983805185e-06 and parameters: {'n_estimators': 548, 'learning_rate': 0.26693816248998736, 'max_depth': 7, 'num_leaves': 29, 'reg_alpha': 0.04777048617887031, 'reg_lambda': 0.7463489480931077}. Best is trial 30 with value: 4.829376147945051e-06.
[I 2025-07-29 04:02:01,307] Trial 43 finished with value: 4.953667016929809e-06 and parameters: {'n_estimators': 454, 'learning_rate': 0.1720047729615433, 'max_depth': 7, 'num_leaves': 46, 'reg_alpha': 0.12200627352814102, 'reg_lambda': 0.654794178508759}. Best is trial 30 with value: 4.829376147945051e-06.
[I 2025-07-29 04:02:02,151] Trial 44 finished with value: 5.097024400356012e-06 and parameters: {'n_estimators': 603, 'learning_rate': 0.2496752916065533, 'max_depth': 8, 'num_leaves': 14, 'reg_alpha': 0.021708569960402616, 'reg_lambda': 0.8179018595807729}. Best is trial 30 with value: 4.829376147945051e-06.
[I 2025-07-29 04:02:02,653] Trial 45 finished with value: 5.010995604623629e-06 and parameters: {'n_estimators': 408, 'learning_rate': 0.2832680614353423, 'max_depth': 6, 'num_leaves': 23, 'reg_alpha': 0.17838120965358545, 'reg_lambda': 0.5212437388786987}. Best is trial 30 with value: 4.829376147945051e-06.
[I 2025-07-29 04:02:03,583] Trial 46 finished with value: 4.86978418721764e-06 and parameters: {'n_estimators': 911, 'learning_rate': 0.23610082651238873, 'max_depth': 7, 'num_leaves': 36, 'reg_alpha': 0.0880271922927466, 'reg_lambda': 0.6094828439110195}. Best is trial 30 with value: 4.829376147945051e-06.
[I 2025-07-29 04:02:14,255] Trial 47 finished with value: 5.5172570418432366e-06 and parameters: {'n_estimators': 778, 'learning_rate': 0.07048385574623016, 'max_depth': 10, 'num_leaves': 21, 'reg_alpha': 2.414043718262926e-05, 'reg_lambda': 0.6834726481397972}. Best is trial 30 with value: 4.829376147945051e-06.
[I 2025-07-29 04:02:14,851] Trial 48 finished with value: 5.019251650211013e-06 and parameters: {'n_estimators': 574, 'learning_rate': 0.2253182988520128, 'max_depth': 8, 'num_leaves': 32, 'reg_alpha': 0.22427160610023034, 'reg_lambda': 0.9358464649852444}. Best is trial 30 with value: 4.829376147945051e-06.
[I 2025-07-29 04:02:15,391] Trial 49 finished with value: 4.947235954145673e-06 and parameters: {'n_estimators': 465, 'learning_rate': 0.20655540839526923, 'max_depth': 9, 'num_leaves': 38, 'reg_alpha': 0.11765099275370969, 'reg_lambda': 0.7739813430297122}. Best is trial 30 with value: 4.829376147945051e-06.
[I 2025-07-29 04:02:15,400] A new study created in memory with name: no-name-fd90aa2e-4371-4446-8386-c5603391bd22
[I 2025-07-29 04:02:17,588] Trial 0 finished with value: 5.019251649998546e-06 and parameters: {'n_estimators': 234, 'learning_rate': 0.2957739398628583, 'max_depth': 10, 'reg_alpha': 0.3289792676068588, 'reg_lambda': 0.9689969369322965}. Best is trial 0 with value: 5.019251649998546e-06.
[I 2025-07-29 04:02:25,383] Trial 1 finished with value: 5.019251649998546e-06 and parameters: {'n_estimators': 953, 'learning_rate': 0.049621109746381294, 'max_depth': 7, 'reg_alpha': 0.8322450068144849, 'reg_lambda': 0.778172372304659}. Best is trial 0 with value: 5.019251649998546e-06.
[I 2025-07-29 04:02:27,432] Trial 2 finished with value: 5.011758526932414e-06 and parameters: {'n_estimators': 176, 'learning_rate': 0.1955574286838521, 'max_depth': 3, 'reg_alpha': 0.17248413055836975, 'reg_lambda': 0.005492565952011641}. Best is trial 2 with value: 5.011758526932414e-06.
[I 2025-07-29 04:02:35,105] Trial 3 finished with value: 5.019251649998546e-06 and parameters: {'n_estimators': 941, 'learning_rate': 0.2808176326214884, 'max_depth': 3, 'reg_alpha': 0.5660040549108194, 'reg_lambda': 0.9548406571691558}. Best is trial 2 with value: 5.011758526932414e-06.
[I 2025-07-29 04:02:36,852] Trial 4 finished with value: 4.863724457124244e-06 and parameters: {'n_estimators': 135, 'learning_rate': 0.1715195415111829, 'max_depth': 5, 'reg_alpha': 0.06572170876220218, 'reg_lambda': 0.833775556398163}. Best is trial 4 with value: 4.863724457124244e-06.
[I 2025-07-29 04:02:40,552] Trial 5 finished with value: 5.019251649998546e-06 and parameters: {'n_estimators': 426, 'learning_rate': 0.10563105290958923, 'max_depth': 5, 'reg_alpha': 0.6131399837749171, 'reg_lambda': 0.8073872962019548}. Best is trial 4 with value: 4.863724457124244e-06.
[I 2025-07-29 04:02:44,803] Trial 6 finished with value: 5.019251649998546e-06 and parameters: {'n_estimators': 495, 'learning_rate': 0.10436633259176115, 'max_depth': 6, 'reg_alpha': 0.8111332772780085, 'reg_lambda': 0.48796023462278637}. Best is trial 4 with value: 4.863724457124244e-06.
[I 2025-07-29 04:02:51,069] Trial 7 finished with value: 5.019251649998546e-06 and parameters: {'n_estimators': 749, 'learning_rate': 0.18148030849305194, 'max_depth': 5, 'reg_alpha': 0.4129248888502851, 'reg_lambda': 0.1405565545266576}. Best is trial 4 with value: 4.863724457124244e-06.
[I 2025-07-29 04:02:53,862] Trial 8 finished with value: 5.019251649998546e-06 and parameters: {'n_estimators': 310, 'learning_rate': 0.07291224077215648, 'max_depth': 8, 'reg_alpha': 0.3682420400218033, 'reg_lambda': 0.33008474944528143}. Best is trial 4 with value: 4.863724457124244e-06.
[I 2025-07-29 04:02:55,524] Trial 9 finished with value: 5.019251649998546e-06 and parameters: {'n_estimators': 165, 'learning_rate': 0.021496656585005075, 'max_depth': 8, 'reg_alpha': 0.6042838368027876, 'reg_lambda': 0.03904717094646948}. Best is trial 4 with value: 4.863724457124244e-06.
[I 2025-07-29 04:03:01,946] Trial 10 finished with value: 5.078475197624122e-06 and parameters: {'n_estimators': 695, 'learning_rate': 0.229705370300677, 'max_depth': 4, 'reg_alpha': 0.021327342394710347, 'reg_lambda': 0.640847282746349}. Best is trial 4 with value: 4.863724457124244e-06.
[I 2025-07-29 04:03:04,419] Trial 11 finished with value: 5.168700353791521e-06 and parameters: {'n_estimators': 113, 'learning_rate': 0.17299593933944565, 'max_depth': 3, 'reg_alpha': 0.011729667379707473, 'reg_lambda': 0.3198286400455088}. Best is trial 4 with value: 4.863724457124244e-06.
[I 2025-07-29 04:03:07,697] Trial 12 finished with value: 5.0171966178660504e-06 and parameters: {'n_estimators': 370, 'learning_rate': 0.22090243441422253, 'max_depth': 4, 'reg_alpha': 0.1806098136724562, 'reg_lambda': 0.534888710774443}. Best is trial 4 with value: 4.863724457124244e-06.
[I 2025-07-29 04:03:10,231] Trial 13 finished with value: 5.019251649998546e-06 and parameters: {'n_estimators': 273, 'learning_rate': 0.13881565642655494, 'max_depth': 5, 'reg_alpha': 0.20915918064175415, 'reg_lambda': 0.23065825798540915}. Best is trial 4 with value: 4.863724457124244e-06.
[I 2025-07-29 04:03:15,149] Trial 14 finished with value: 5.019251649998546e-06 and parameters: {'n_estimators': 584, 'learning_rate': 0.22235693009472454, 'max_depth': 3, 'reg_alpha': 0.18831091318535365, 'reg_lambda': 0.7130777262693068}. Best is trial 4 with value: 4.863724457124244e-06.
[I 2025-07-29 04:03:16,716] Trial 15 finished with value: 4.952591618804397e-06 and parameters: {'n_estimators': 130, 'learning_rate': 0.1509027664556582, 'max_depth': 4, 'reg_alpha': 0.10732410206596178, 'reg_lambda': 0.46605909812630464}. Best is trial 4 with value: 4.863724457124244e-06.
[I 2025-07-29 04:03:17,925] Trial 16 finished with value: 5.019251649998546e-06 and parameters: {'n_estimators': 104, 'learning_rate': 0.12475164233712491, 'max_depth': 6, 'reg_alpha': 0.9711425460306318, 'reg_lambda': 0.47413086702367957}. Best is trial 4 with value: 4.863724457124244e-06.
[I 2025-07-29 04:03:21,328] Trial 17 finished with value: 4.907383845013077e-06 and parameters: {'n_estimators': 351, 'learning_rate': 0.15524998676255028, 'max_depth': 4, 'reg_alpha': 0.09054232646683891, 'reg_lambda': 0.6343359708802557}. Best is trial 4 with value: 4.863724457124244e-06.
[I 2025-07-29 04:03:24,921] Trial 18 finished with value: 5.019251649998546e-06 and parameters: {'n_estimators': 411, 'learning_rate': 0.0832341035276062, 'max_depth': 7, 'reg_alpha': 0.30417848786293605, 'reg_lambda': 0.8677434989860933}. Best is trial 4 with value: 4.863724457124244e-06.
[I 2025-07-29 04:03:29,673] Trial 19 finished with value: 5.019251649998546e-06 and parameters: {'n_estimators': 556, 'learning_rate': 0.24460225823569376, 'max_depth': 10, 'reg_alpha': 0.49244203239028966, 'reg_lambda': 0.6296275335637933}. Best is trial 4 with value: 4.863724457124244e-06.
[I 2025-07-29 04:03:32,850] Trial 20 finished with value: 4.93404646746718e-06 and parameters: {'n_estimators': 328, 'learning_rate': 0.16574221491621136, 'max_depth': 5, 'reg_alpha': 0.09194993403864199, 'reg_lambda': 0.624720546929154}. Best is trial 4 with value: 4.863724457124244e-06.
[I 2025-07-29 04:03:36,250] Trial 21 finished with value: 4.955418045461576e-06 and parameters: {'n_estimators': 321, 'learning_rate': 0.16217425705253952, 'max_depth': 5, 'reg_alpha': 0.09883710298812165, 'reg_lambda': 0.6197295430195444}. Best is trial 4 with value: 4.863724457124244e-06.
[I 2025-07-29 04:03:38,631] Trial 22 finished with value: 5.019251649998546e-06 and parameters: {'n_estimators': 253, 'learning_rate': 0.19643033910342983, 'max_depth': 4, 'reg_alpha': 0.2758681497485993, 'reg_lambda': 0.7225149469064668}. Best is trial 4 with value: 4.863724457124244e-06.
[I 2025-07-29 04:03:43,218] Trial 23 finished with value: 4.8894189790993846e-06 and parameters: {'n_estimators': 471, 'learning_rate': 0.12606925240613254, 'max_depth': 6, 'reg_alpha': 0.075449157509666, 'reg_lambda': 0.9062408026227323}. Best is trial 4 with value: 4.863724457124244e-06.
[I 2025-07-29 04:03:50,237] Trial 24 finished with value: 5.183791428034963e-06 and parameters: {'n_estimators': 487, 'learning_rate': 0.1190126688781218, 'max_depth': 6, 'reg_alpha': 0.0026646823480326043, 'reg_lambda': 0.8492429304987663}. Best is trial 4 with value: 4.863724457124244e-06.
[I 2025-07-29 04:03:55,439] Trial 25 finished with value: 5.019251649998546e-06 and parameters: {'n_estimators': 623, 'learning_rate': 0.1414981387408456, 'max_depth': 7, 'reg_alpha': 0.2489714831144087, 'reg_lambda': 0.903222062765201}. Best is trial 4 with value: 4.863724457124244e-06.
[I 2025-07-29 04:03:59,525] Trial 26 finished with value: 4.97281860365321e-06 and parameters: {'n_estimators': 452, 'learning_rate': 0.19576067438913936, 'max_depth': 6, 'reg_alpha': 0.11251583567723525, 'reg_lambda': 0.7483106088366475}. Best is trial 4 with value: 4.863724457124244e-06.
[I 2025-07-29 04:04:07,505] Trial 27 finished with value: 4.919231578295593e-06 and parameters: {'n_estimators': 835, 'learning_rate': 0.08220500262112652, 'max_depth': 9, 'reg_alpha': 0.07777267832445335, 'reg_lambda': 0.8976779213220969}. Best is trial 4 with value: 4.863724457124244e-06.
[I 2025-07-29 04:04:12,953] Trial 28 finished with value: 5.019251649998546e-06 and parameters: {'n_estimators': 650, 'learning_rate': 0.13128174469977688, 'max_depth': 4, 'reg_alpha': 0.44249043639412833, 'reg_lambda': 0.9931001217738865}. Best is trial 4 with value: 4.863724457124244e-06.
[I 2025-07-29 04:04:15,023] Trial 29 finished with value: 5.019251649998546e-06 and parameters: {'n_estimators': 217, 'learning_rate': 0.2634556507400666, 'max_depth': 8, 'reg_alpha': 0.3353320782241799, 'reg_lambda': 0.5515900938531144}. Best is trial 4 with value: 4.863724457124244e-06.
[I 2025-07-29 04:04:18,285] Trial 30 finished with value: 5.019251649998546e-06 and parameters: {'n_estimators': 365, 'learning_rate': 0.10702275454129365, 'max_depth': 5, 'reg_alpha': 0.2486225670066025, 'reg_lambda': 0.8224573122011802}. Best is trial 4 with value: 4.863724457124244e-06.
[I 2025-07-29 04:04:25,588] Trial 31 finished with value: 4.976824559852286e-06 and parameters: {'n_estimators': 816, 'learning_rate': 0.07941857034674712, 'max_depth': 9, 'reg_alpha': 0.1037003093849961, 'reg_lambda': 0.9439736277537599}. Best is trial 4 with value: 4.863724457124244e-06.
[I 2025-07-29 04:04:35,778] Trial 32 finished with value: 4.913079439933461e-06 and parameters: {'n_estimators': 997, 'learning_rate': 0.049868889058988876, 'max_depth': 9, 'reg_alpha': 0.0719711604910378, 'reg_lambda': 0.8988678014276774}. Best is trial 4 with value: 4.863724457124244e-06.
[I 2025-07-29 04:04:44,239] Trial 33 finished with value: 5.006690954792088e-06 and parameters: {'n_estimators': 997, 'learning_rate': 0.019137771706030315, 'max_depth': 9, 'reg_alpha': 0.15410793058553113, 'reg_lambda': 0.6903307405920828}. Best is trial 4 with value: 4.863724457124244e-06.
[I 2025-07-29 04:04:49,988] Trial 34 finished with value: 4.840047910031464e-06 and parameters: {'n_estimators': 486, 'learning_rate': 0.053784316906534894, 'max_depth': 7, 'reg_alpha': 0.05629263758191784, 'reg_lambda': 0.9156083299727708}. Best is trial 34 with value: 4.840047910031464e-06.
[I 2025-07-29 04:04:57,396] Trial 35 finished with value: 4.823679664239875e-06 and parameters: {'n_estimators': 528, 'learning_rate': 0.03554031548999921, 'max_depth': 7, 'reg_alpha': 0.04553340121591373, 'reg_lambda': 0.7816409472046633}. Best is trial 35 with value: 4.823679664239875e-06.
[I 2025-07-29 04:05:01,799] Trial 36 finished with value: 5.019251649998546e-06 and parameters: {'n_estimators': 518, 'learning_rate': 0.04228806142565678, 'max_depth': 7, 'reg_alpha': 0.7071079497889805, 'reg_lambda': 0.7750181997284344}. Best is trial 35 with value: 4.823679664239875e-06.
[I 2025-07-29 04:05:09,003] Trial 37 finished with value: 4.87608888669278e-06 and parameters: {'n_estimators': 594, 'learning_rate': 0.05931827279093726, 'max_depth': 7, 'reg_alpha': 0.037973543156666775, 'reg_lambda': 0.9594866861018059}. Best is trial 35 with value: 4.823679664239875e-06.
[I 2025-07-29 04:05:15,117] Trial 38 finished with value: 5.011272639520989e-06 and parameters: {'n_estimators': 726, 'learning_rate': 0.05767768440435208, 'max_depth': 8, 'reg_alpha': 0.16336848742277055, 'reg_lambda': 0.9947061997382547}. Best is trial 35 with value: 4.823679664239875e-06.
[I 2025-07-29 04:05:25,108] Trial 39 finished with value: 4.9187135063041396e-06 and parameters: {'n_estimators': 597, 'learning_rate': 0.035949587609662506, 'max_depth': 7, 'reg_alpha': 0.02471224768533807, 'reg_lambda': 0.828158675219148}. Best is trial 35 with value: 4.823679664239875e-06.
[I 2025-07-29 04:05:29,831] Trial 40 finished with value: 5.019251649998546e-06 and parameters: {'n_estimators': 529, 'learning_rate': 0.011002567963126042, 'max_depth': 8, 'reg_alpha': 0.23306954260088453, 'reg_lambda': 0.936432461034719}. Best is trial 35 with value: 4.823679664239875e-06.
[I 2025-07-29 04:05:35,651] Trial 41 finished with value: 4.8822804869794254e-06 and parameters: {'n_estimators': 440, 'learning_rate': 0.05757491863938069, 'max_depth': 6, 'reg_alpha': 0.03447137514581045, 'reg_lambda': 0.7963434396116672}. Best is trial 35 with value: 4.823679664239875e-06.
[I 2025-07-29 04:05:40,666] Trial 42 finished with value: 4.819430786454372e-06 and parameters: {'n_estimators': 414, 'learning_rate': 0.06634827619941962, 'max_depth': 6, 'reg_alpha': 0.04415384660119043, 'reg_lambda': 0.7976182213112383}. Best is trial 42 with value: 4.819430786454372e-06.
[I 2025-07-29 04:05:46,674] Trial 43 finished with value: 5.002221641178226e-06 and parameters: {'n_estimators': 681, 'learning_rate': 0.03209081165022297, 'max_depth': 7, 'reg_alpha': 0.14924548600485926, 'reg_lambda': 0.7737751752509451}. Best is trial 42 with value: 4.819430786454372e-06.
[I 2025-07-29 04:05:52,456] Trial 44 finished with value: 4.827287440705189e-06 and parameters: {'n_estimators': 559, 'learning_rate': 0.09160587405497142, 'max_depth': 6, 'reg_alpha': 0.045873287036111335, 'reg_lambda': 0.9486641292351207}. Best is trial 42 with value: 4.819430786454372e-06.
[I 2025-07-29 04:05:56,175] Trial 45 finished with value: 4.995617665176821e-06 and parameters: {'n_estimators': 405, 'learning_rate': 0.09551357978449751, 'max_depth': 6, 'reg_alpha': 0.14274943478908692, 'reg_lambda': 0.8660702909962255}. Best is trial 42 with value: 4.819430786454372e-06.
[I 2025-07-29 04:06:00,914] Trial 46 finished with value: 5.0427765511445474e-06 and parameters: {'n_estimators': 203, 'learning_rate': 0.09649342548661202, 'max_depth': 6, 'reg_alpha': 0.008576345853424885, 'reg_lambda': 0.8281208864701076}. Best is trial 42 with value: 4.819430786454372e-06.
[I 2025-07-29 04:06:06,380] Trial 47 finished with value: 4.839310997960668e-06 and parameters: {'n_estimators': 547, 'learning_rate': 0.06894916402147888, 'max_depth': 5, 'reg_alpha': 0.058073136886562376, 'reg_lambda': 0.6828693830210874}. Best is trial 42 with value: 4.819430786454372e-06.
[I 2025-07-29 04:06:11,079] Trial 48 finished with value: 5.019251649998546e-06 and parameters: {'n_estimators': 556, 'learning_rate': 0.07038603369904012, 'max_depth': 5, 'reg_alpha': 0.20492571786587907, 'reg_lambda': 0.6812611440858595}. Best is trial 42 with value: 4.819430786454372e-06.
[I 2025-07-29 04:06:18,030] Trial 49 finished with value: 4.821837987425925e-06 and parameters: {'n_estimators': 513, 'learning_rate': 0.04300931507654813, 'max_depth': 7, 'reg_alpha': 0.04989229832760927, 'reg_lambda': 0.5613896516855468}. Best is trial 42 with value: 4.819430786454372e-06.
[I 2025-07-29 04:06:18,031] A new study created in memory with name: no-name-6030bc92-965e-4435-81e6-a753bcb8a2e4
[I 2025-07-29 04:06:21,676] Trial 0 finished with value: 5.297531145790832e-06 and parameters: {'n_estimators': 119, 'max_depth': 20, 'min_samples_split': 8, 'min_samples_leaf': 2, 'max_features': 'sqrt'}. Best is trial 0 with value: 5.297531145790832e-06.
[I 2025-07-29 04:06:29,338] Trial 1 finished with value: 5.067836872158386e-06 and parameters: {'n_estimators': 342, 'max_depth': 15, 'min_samples_split': 9, 'min_samples_leaf': 7, 'max_features': 'sqrt'}. Best is trial 1 with value: 5.067836872158386e-06.
[I 2025-07-29 04:07:57,039] Trial 2 finished with value: 4.901054385444861e-06 and parameters: {'n_estimators': 217, 'max_depth': 17, 'min_samples_split': 2, 'min_samples_leaf': 7, 'max_features': None}. Best is trial 2 with value: 4.901054385444861e-06.
[I 2025-07-29 04:10:08,020] Trial 3 finished with value: 5.1195732665588404e-06 and parameters: {'n_estimators': 256, 'max_depth': 17, 'min_samples_split': 11, 'min_samples_leaf': 1, 'max_features': None}. Best is trial 2 with value: 4.901054385444861e-06.
[I 2025-07-29 04:10:17,346] Trial 4 finished with value: 5.120104885812383e-06 and parameters: {'n_estimators': 383, 'max_depth': 13, 'min_samples_split': 8, 'min_samples_leaf': 4, 'max_features': 'sqrt'}. Best is trial 2 with value: 4.901054385444861e-06.
[I 2025-07-29 04:13:07,609] Trial 5 finished with value: 4.977610669396978e-06 and parameters: {'n_estimators': 374, 'max_depth': 15, 'min_samples_split': 19, 'min_samples_leaf': 2, 'max_features': None}. Best is trial 2 with value: 4.901054385444861e-06.
[I 2025-07-29 04:13:17,460] Trial 6 finished with value: 5.0587284974654496e-06 and parameters: {'n_estimators': 439, 'max_depth': 15, 'min_samples_split': 3, 'min_samples_leaf': 7, 'max_features': 'sqrt'}. Best is trial 2 with value: 4.901054385444861e-06.
[I 2025-07-29 04:15:20,051] Trial 7 finished with value: 4.8882653017749645e-06 and parameters: {'n_estimators': 496, 'max_depth': 6, 'min_samples_split': 4, 'min_samples_leaf': 4, 'max_features': None}. Best is trial 7 with value: 4.8882653017749645e-06.
[I 2025-07-29 04:16:22,739] Trial 8 finished with value: 4.82894751820059e-06 and parameters: {'n_estimators': 179, 'max_depth': 13, 'min_samples_split': 9, 'min_samples_leaf': 10, 'max_features': None}. Best is trial 8 with value: 4.82894751820059e-06.
[I 2025-07-29 04:16:31,992] Trial 9 finished with value: 5.0792423427201475e-06 and parameters: {'n_estimators': 409, 'max_depth': 11, 'min_samples_split': 2, 'min_samples_leaf': 4, 'max_features': 'sqrt'}. Best is trial 8 with value: 4.82894751820059e-06.
[I 2025-07-29 04:16:33,093] Trial 10 finished with value: 5.061719661390488e-06 and parameters: {'n_estimators': 119, 'max_depth': 9, 'min_samples_split': 16, 'min_samples_leaf': 10, 'max_features': 'log2'}. Best is trial 8 with value: 4.82894751820059e-06.
[I 2025-07-29 04:16:58,710] Trial 11 finished with value: 4.728683365788026e-06 and parameters: {'n_estimators': 196, 'max_depth': 3, 'min_samples_split': 6, 'min_samples_leaf': 10, 'max_features': None}. Best is trial 11 with value: 4.728683365788026e-06.
[I 2025-07-29 04:17:24,602] Trial 12 finished with value: 4.729908961845369e-06 and parameters: {'n_estimators': 198, 'max_depth': 3, 'min_samples_split': 14, 'min_samples_leaf': 10, 'max_features': None}. Best is trial 11 with value: 4.728683365788026e-06.
