[I 2025-07-29 02:35:18,569] Trial 18 finished with value: 4.93086659480628e-06 and parameters: {'n_estimators': 454, 'learning_rate': 0.13347327261611458, 'max_depth': 3, 'reg_alpha': 0.09891406159540558, 'reg_lambda': 0.983734238092109}. Best is trial 11 with value: 4.811345799500293e-06.
[I 2025-07-29 02:35:26,317] Trial 19 finished with value: 5.019251649998546e-06 and parameters: {'n_estimators': 998, 'learning_rate': 0.09519024876784246, 'max_depth': 5, 'reg_alpha': 0.3504458879646049, 'reg_lambda': 0.16838701936689793}. Best is trial 11 with value: 4.811345799500293e-06.
[I 2025-07-29 02:35:28,786] Trial 20 finished with value: 5.011845265775114e-06 and parameters: {'n_estimators': 274, 'learning_rate': 0.060422595214766554, 'max_depth': 6, 'reg_alpha': 0.17078283277249356, 'reg_lambda': 0.3556585581714208}. Best is trial 11 with value: 4.811345799500293e-06.
[I 2025-07-29 02:35:32,489] Trial 21 finished with value: 4.902329026003191e-06 and parameters: {'n_estimators': 423, 'learning_rate': 0.11370614053408945, 'max_depth': 3, 'reg_alpha': 0.09056231397928514, 'reg_lambda': 0.9449190747399442}. Best is trial 11 with value: 4.811345799500293e-06.
[I 2025-07-29 02:35:38,276] Trial 22 finished with value: 5.3799070575175e-06 and parameters: {'n_estimators': 526, 'learning_rate': 0.11912092320378642, 'max_depth': 3, 'reg_alpha': 0.006571415851306356, 'reg_lambda': 0.8004056722736812}. Best is trial 11 with value: 4.811345799500293e-06.
[I 2025-07-29 02:35:41,487] Trial 23 finished with value: 4.920036987073861e-06 and parameters: {'n_estimators': 359, 'learning_rate': 0.15190118083678056, 'max_depth': 4, 'reg_alpha': 0.09294763296583311, 'reg_lambda': 0.996071454236215}. Best is trial 11 with value: 4.811345799500293e-06.
[I 2025-07-29 02:35:45,720] Trial 24 finished with value: 5.019251649998546e-06 and parameters: {'n_estimators': 527, 'learning_rate': 0.08987412918474484, 'max_depth': 3, 'reg_alpha': 0.2082150846564543, 'reg_lambda': 0.7831094260353997}. Best is trial 11 with value: 4.811345799500293e-06.
[I 2025-07-29 02:35:50,170] Trial 25 finished with value: 4.86913298255014e-06 and parameters: {'n_estimators': 299, 'learning_rate': 0.017414629217855512, 'max_depth': 4, 'reg_alpha': 0.07861019913101319, 'reg_lambda': 0.5034715981898756}. Best is trial 11 with value: 4.811345799500293e-06.
[I 2025-07-29 02:35:57,117] Trial 26 finished with value: 5.019251649998546e-06 and parameters: {'n_estimators': 890, 'learning_rate': 0.026370496815863564, 'max_depth': 5, 'reg_alpha': 0.2849795040623445, 'reg_lambda': 0.3275260891588332}. Best is trial 11 with value: 4.811345799500293e-06.
[I 2025-07-29 02:36:02,301] Trial 27 finished with value: 4.810083779076652e-06 and parameters: {'n_estimators': 313, 'learning_rate': 0.0188702386481405, 'max_depth': 4, 'reg_alpha': 0.04797109286586158, 'reg_lambda': 0.48197324564474703}. Best is trial 27 with value: 4.810083779076652e-06.
[I 2025-07-29 02:36:08,436] Trial 28 finished with value: 5.0062728302501345e-06 and parameters: {'n_estimators': 731, 'learning_rate': 0.013383218925929054, 'max_depth': 6, 'reg_alpha': 0.1591200413908823, 'reg_lambda': 0.4453586713473861}. Best is trial 27 with value: 4.810083779076652e-06.
[I 2025-07-29 02:36:13,277] Trial 29 finished with value: 5.019251649998546e-06 and parameters: {'n_estimators': 607, 'learning_rate': 0.05210598334693692, 'max_depth': 8, 'reg_alpha': 0.5844142834139654, 'reg_lambda': 0.01695770470652752}. Best is trial 27 with value: 4.810083779076652e-06.
[I 2025-07-29 02:36:20,568] Trial 30 finished with value: 5.019251649998546e-06 and parameters: {'n_estimators': 915, 'learning_rate': 0.29257240770018755, 'max_depth': 4, 'reg_alpha': 0.3986818049219923, 'reg_lambda': 0.18588747118690901}. Best is trial 27 with value: 4.810083779076652e-06.
[I 2025-07-29 02:36:25,167] Trial 31 finished with value: 4.831077859774559e-06 and parameters: {'n_estimators': 344, 'learning_rate': 0.04579627558137349, 'max_depth': 4, 'reg_alpha': 0.03047654428725933, 'reg_lambda': 0.52699976593425}. Best is trial 27 with value: 4.810083779076652e-06.
[I 2025-07-29 02:36:29,608] Trial 32 finished with value: 4.832404879476347e-06 and parameters: {'n_estimators': 362, 'learning_rate': 0.04444104223590015, 'max_depth': 5, 'reg_alpha': 0.05017345123724935, 'reg_lambda': 0.6638215508913051}. Best is trial 27 with value: 4.810083779076652e-06.
[I 2025-07-29 02:36:34,773] Trial 33 finished with value: 4.856274867466131e-06 and parameters: {'n_estimators': 374, 'learning_rate': 0.04265025282921242, 'max_depth': 5, 'reg_alpha': 0.03448334074649593, 'reg_lambda': 0.6916221481206384}. Best is trial 27 with value: 4.810083779076652e-06.
[I 2025-07-29 02:36:37,227] Trial 34 finished with value: 5.006132178675597e-06 and parameters: {'n_estimators': 235, 'learning_rate': 0.07578758457893991, 'max_depth': 5, 'reg_alpha': 0.16136860431119648, 'reg_lambda': 0.5763952493387596}. Best is trial 27 with value: 4.810083779076652e-06.
[I 2025-07-29 02:36:40,082] Trial 35 finished with value: 5.019251649998546e-06 and parameters: {'n_estimators': 330, 'learning_rate': 0.052462912111389357, 'max_depth': 4, 'reg_alpha': 0.4668370683248406, 'reg_lambda': 0.7223999932593401}. Best is trial 27 with value: 4.810083779076652e-06.
[I 2025-07-29 02:36:47,706] Trial 36 finished with value: 4.827947175679896e-06 and parameters: {'n_estimators': 173, 'learning_rate': 0.011737082376563332, 'max_depth': 6, 'reg_alpha': 0.039003788249726445, 'reg_lambda': 0.5598364064382013}. Best is trial 27 with value: 4.810083779076652e-06.
[I 2025-07-29 02:36:49,415] Trial 37 finished with value: 5.019251649998546e-06 and parameters: {'n_estimators': 176, 'learning_rate': 0.010992492995104604, 'max_depth': 7, 'reg_alpha': 0.7364899340146087, 'reg_lambda': 0.4452207045600425}. Best is trial 27 with value: 4.810083779076652e-06.
[I 2025-07-29 02:36:50,615] Trial 38 finished with value: 5.019251649998546e-06 and parameters: {'n_estimators': 106, 'learning_rate': 0.027661621264030215, 'max_depth': 6, 'reg_alpha': 0.5668532478206567, 'reg_lambda': 0.5663250137941319}. Best is trial 27 with value: 4.810083779076652e-06.
[I 2025-07-29 02:36:53,022] Trial 39 finished with value: 4.994406032930636e-06 and parameters: {'n_estimators': 228, 'learning_rate': 0.05818006248411747, 'max_depth': 8, 'reg_alpha': 0.13785032985074228, 'reg_lambda': 0.6114470223071549}. Best is trial 27 with value: 4.810083779076652e-06.
[I 2025-07-29 02:36:54,586] Trial 40 finished with value: 5.019251649998546e-06 and parameters: {'n_estimators': 155, 'learning_rate': 0.03001439825735798, 'max_depth': 3, 'reg_alpha': 0.2383203354268983, 'reg_lambda': 0.5343919302301365}. Best is trial 27 with value: 4.810083779076652e-06.
[I 2025-07-29 02:36:58,822] Trial 41 finished with value: 4.81885962368046e-06 and parameters: {'n_estimators': 283, 'learning_rate': 0.04248467766503558, 'max_depth': 6, 'reg_alpha': 0.051750480526585665, 'reg_lambda': 0.660529290241429}. Best is trial 27 with value: 4.810083779076652e-06.
[I 2025-07-29 02:37:05,570] Trial 42 finished with value: 5.15530404296824e-06 and parameters: {'n_estimators': 275, 'learning_rate': 0.07775318606450594, 'max_depth': 7, 'reg_alpha': 0.004158023081655637, 'reg_lambda': 0.740805029633542}. Best is trial 27 with value: 4.810083779076652e-06.
[I 2025-07-29 02:37:08,049] Trial 43 finished with value: 4.988454968014949e-06 and parameters: {'n_estimators': 194, 'learning_rate': 0.03663816841994638, 'max_depth': 8, 'reg_alpha': 0.12163041388014448, 'reg_lambda': 0.47464003003868743}. Best is trial 27 with value: 4.810083779076652e-06.
[I 2025-07-29 02:37:11,091] Trial 44 finished with value: 4.86523185676827e-06 and parameters: {'n_estimators': 250, 'learning_rate': 0.17041739524530794, 'max_depth': 6, 'reg_alpha': 0.05248632947816785, 'reg_lambda': 0.6208777823753764}. Best is trial 27 with value: 4.810083779076652e-06.
[I 2025-07-29 02:37:19,443] Trial 45 finished with value: 4.844802178102823e-06 and parameters: {'n_estimators': 490, 'learning_rate': 0.022345259240909125, 'max_depth': 6, 'reg_alpha': 0.03857378267369697, 'reg_lambda': 0.8853391841884617}. Best is trial 27 with value: 4.810083779076652e-06.
[I 2025-07-29 02:37:23,133] Trial 46 finished with value: 4.990173724352494e-06 and parameters: {'n_estimators': 400, 'learning_rate': 0.061891225550362174, 'max_depth': 7, 'reg_alpha': 0.13501253457218484, 'reg_lambda': 0.5292452293038981}. Best is trial 27 with value: 4.810083779076652e-06.
[I 2025-07-29 02:37:25,954] Trial 47 finished with value: 5.019251649998546e-06 and parameters: {'n_estimators': 319, 'learning_rate': 0.0470768207950345, 'max_depth': 4, 'reg_alpha': 0.1984130123294561, 'reg_lambda': 0.4070964824299009}. Best is trial 27 with value: 4.810083779076652e-06.
[I 2025-07-29 02:37:27,380] Trial 48 finished with value: 5.019251649998546e-06 and parameters: {'n_estimators': 135, 'learning_rate': 0.010031394153713897, 'max_depth': 3, 'reg_alpha': 0.25779980096411764, 'reg_lambda': 0.48550880370992566}. Best is trial 27 with value: 4.810083779076652e-06.
[I 2025-07-29 02:37:32,647] Trial 49 finished with value: 5.019251649998546e-06 and parameters: {'n_estimators': 645, 'learning_rate': 0.0847977511565799, 'max_depth': 5, 'reg_alpha': 0.3323026549692156, 'reg_lambda': 0.30598335354043704}. Best is trial 27 with value: 4.810083779076652e-06.
[I 2025-07-29 02:37:32,647] A new study created in memory with name: no-name-b14abd4b-9171-410b-bd24-b9800a7fa38b
[I 2025-07-29 02:40:16,050] Trial 0 finished with value: 5.052184661327319e-06 and parameters: {'n_estimators': 341, 'max_depth': 16, 'min_samples_split': 7, 'min_samples_leaf': 3, 'max_features': None}. Best is trial 0 with value: 5.052184661327319e-06.
[I 2025-07-29 02:40:16,952] Trial 1 finished with value: 5.023875622842082e-06 and parameters: {'n_estimators': 163, 'max_depth': 3, 'min_samples_split': 19, 'min_samples_leaf': 5, 'max_features': 'log2'}. Best is trial 1 with value: 5.023875622842082e-06.
[I 2025-07-29 02:40:25,337] Trial 2 finished with value: 5.148861511629684e-06 and parameters: {'n_estimators': 319, 'max_depth': 15, 'min_samples_split': 19, 'min_samples_leaf': 2, 'max_features': 'sqrt'}. Best is trial 1 with value: 5.023875622842082e-06.
[I 2025-07-29 02:42:59,579] Trial 3 finished with value: 4.881505161209172e-06 and parameters: {'n_estimators': 412, 'max_depth': 18, 'min_samples_split': 8, 'min_samples_leaf': 9, 'max_features': None}. Best is trial 3 with value: 4.881505161209172e-06.
[I 2025-07-29 02:43:04,543] Trial 4 finished with value: 5.0139627568096015e-06 and parameters: {'n_estimators': 264, 'max_depth': 10, 'min_samples_split': 9, 'min_samples_leaf': 10, 'max_features': 'sqrt'}. Best is trial 3 with value: 4.881505161209172e-06.
[I 2025-07-29 02:46:11,934] Trial 5 finished with value: 4.9274392550374645e-06 and parameters: {'n_estimators': 463, 'max_depth': 18, 'min_samples_split': 8, 'min_samples_leaf': 7, 'max_features': None}. Best is trial 3 with value: 4.881505161209172e-06.
[I 2025-07-29 02:46:13,125] Trial 6 finished with value: 5.074533239971879e-06 and parameters: {'n_estimators': 120, 'max_depth': 11, 'min_samples_split': 16, 'min_samples_leaf': 9, 'max_features': 'log2'}. Best is trial 3 with value: 4.881505161209172e-06.
[I 2025-07-29 02:46:16,729] Trial 7 finished with value: 5.096199480493331e-06 and parameters: {'n_estimators': 153, 'max_depth': 12, 'min_samples_split': 20, 'min_samples_leaf': 3, 'max_features': 'sqrt'}. Best is trial 3 with value: 4.881505161209172e-06.
[I 2025-07-29 02:47:28,259] Trial 8 finished with value: 4.80806389294453e-06 and parameters: {'n_estimators': 249, 'max_depth': 8, 'min_samples_split': 8, 'min_samples_leaf': 9, 'max_features': None}. Best is trial 8 with value: 4.80806389294453e-06.
[I 2025-07-29 02:50:14,650] Trial 9 finished with value: 4.944492418131431e-06 and parameters: {'n_estimators': 415, 'max_depth': 14, 'min_samples_split': 14, 'min_samples_leaf': 6, 'max_features': None}. Best is trial 8 with value: 4.80806389294453e-06.
[I 2025-07-29 02:51:10,317] Trial 10 finished with value: 4.810211705191663e-06 and parameters: {'n_estimators': 235, 'max_depth': 6, 'min_samples_split': 2, 'min_samples_leaf': 8, 'max_features': None}. Best is trial 8 with value: 4.80806389294453e-06.
[I 2025-07-29 02:52:06,930] Trial 11 finished with value: 4.807525748633403e-06 and parameters: {'n_estimators': 239, 'max_depth': 6, 'min_samples_split': 2, 'min_samples_leaf': 8, 'max_features': None}. Best is trial 11 with value: 4.807525748633403e-06.
[I 2025-07-29 02:53:00,333] Trial 12 finished with value: 4.7935983490035906e-06 and parameters: {'n_estimators': 206, 'max_depth': 7, 'min_samples_split': 4, 'min_samples_leaf': 10, 'max_features': None}. Best is trial 12 with value: 4.7935983490035906e-06.
[I 2025-07-29 02:53:42,439] Trial 13 finished with value: 4.769243935353693e-06 and parameters: {'n_estimators': 209, 'max_depth': 5, 'min_samples_split': 2, 'min_samples_leaf': 10, 'max_features': None}. Best is trial 13 with value: 4.769243935353693e-06.
[I 2025-07-29 02:54:06,944] Trial 14 finished with value: 4.72725673794469e-06 and parameters: {'n_estimators': 188, 'max_depth': 3, 'min_samples_split': 5, 'min_samples_leaf': 10, 'max_features': None}. Best is trial 14 with value: 4.72725673794469e-06.
[I 2025-07-29 02:54:07,563] Trial 15 finished with value: 5.0543622136165005e-06 and parameters: {'n_estimators': 106, 'max_depth': 3, 'min_samples_split': 5, 'min_samples_leaf': 6, 'max_features': 'log2'}. Best is trial 14 with value: 4.72725673794469e-06.
[I 2025-07-29 02:54:37,706] Trial 16 finished with value: 4.741567680261983e-06 and parameters: {'n_estimators': 180, 'max_depth': 4, 'min_samples_split': 12, 'min_samples_leaf': 10, 'max_features': None}. Best is trial 14 with value: 4.72725673794469e-06.
[I 2025-07-29 02:55:06,749] Trial 17 finished with value: 4.786463969725217e-06 and parameters: {'n_estimators': 169, 'max_depth': 4, 'min_samples_split': 12, 'min_samples_leaf': 5, 'max_features': None}. Best is trial 14 with value: 4.72725673794469e-06.
[I 2025-07-29 02:55:10,386] Trial 18 finished with value: 5.078798466716721e-06 and parameters: {'n_estimators': 284, 'max_depth': 9, 'min_samples_split': 12, 'min_samples_leaf': 8, 'max_features': 'log2'}. Best is trial 14 with value: 4.72725673794469e-06.
[I 2025-07-29 02:55:20,851] Trial 19 finished with value: 5.2254781638829775e-06 and parameters: {'n_estimators': 345, 'max_depth': 20, 'min_samples_split': 15, 'min_samples_leaf': 1, 'max_features': 'sqrt'}. Best is trial 14 with value: 4.72725673794469e-06.
[I 2025-07-29 02:56:00,460] Trial 20 finished with value: 4.811454835941774e-06 and parameters: {'n_estimators': 191, 'max_depth': 5, 'min_samples_split': 10, 'min_samples_leaf': 7, 'max_features': None}. Best is trial 14 with value: 4.72725673794469e-06.
[I 2025-07-29 02:56:42,517] Trial 21 finished with value: 4.769068324851289e-06 and parameters: {'n_estimators': 208, 'max_depth': 5, 'min_samples_split': 5, 'min_samples_leaf': 10, 'max_features': None}. Best is trial 14 with value: 4.72725673794469e-06.
[I 2025-07-29 02:57:00,095] Trial 22 finished with value: 4.6985028073254696e-06 and parameters: {'n_estimators': 135, 'max_depth': 3, 'min_samples_split': 5, 'min_samples_leaf': 10, 'max_features': None}. Best is trial 22 with value: 4.6985028073254696e-06.
[I 2025-07-29 02:57:18,773] Trial 23 finished with value: 4.703635657744935e-06 and parameters: {'n_estimators': 142, 'max_depth': 3, 'min_samples_split': 6, 'min_samples_leaf': 9, 'max_features': None}. Best is trial 22 with value: 4.6985028073254696e-06.
[I 2025-07-29 02:57:36,271] Trial 24 finished with value: 4.695574055199697e-06 and parameters: {'n_estimators': 133, 'max_depth': 3, 'min_samples_split': 6, 'min_samples_leaf': 9, 'max_features': None}. Best is trial 24 with value: 4.695574055199697e-06.
[I 2025-07-29 02:58:12,108] Trial 25 finished with value: 4.785606519429078e-06 and parameters: {'n_estimators': 133, 'max_depth': 7, 'min_samples_split': 6, 'min_samples_leaf': 7, 'max_features': None}. Best is trial 24 with value: 4.695574055199697e-06.
[I 2025-07-29 02:58:30,160] Trial 26 finished with value: 4.70326543031429e-06 and parameters: {'n_estimators': 138, 'max_depth': 3, 'min_samples_split': 4, 'min_samples_leaf': 9, 'max_features': None}. Best is trial 24 with value: 4.695574055199697e-06.
[I 2025-07-29 02:58:59,793] Trial 27 finished with value: 4.776594924316044e-06 and parameters: {'n_estimators': 102, 'max_depth': 8, 'min_samples_split': 4, 'min_samples_leaf': 8, 'max_features': None}. Best is trial 24 with value: 4.695574055199697e-06.
[I 2025-07-29 02:59:00,899] Trial 28 finished with value: 5.058058930029047e-06 and parameters: {'n_estimators': 140, 'max_depth': 6, 'min_samples_split': 3, 'min_samples_leaf': 9, 'max_features': 'log2'}. Best is trial 24 with value: 4.695574055199697e-06.
[I 2025-07-29 02:59:09,083] Trial 29 finished with value: 5.1354660559380886e-06 and parameters: {'n_estimators': 346, 'max_depth': 12, 'min_samples_split': 7, 'min_samples_leaf': 4, 'max_features': 'sqrt'}. Best is trial 24 with value: 4.695574055199697e-06.
[I 2025-07-29 02:59:30,063] Trial 30 finished with value: 4.720178138736623e-06 and parameters: {'n_estimators': 123, 'max_depth': 4, 'min_samples_split': 10, 'min_samples_leaf': 7, 'max_features': None}. Best is trial 24 with value: 4.695574055199697e-06.
[I 2025-07-29 02:59:49,224] Trial 31 finished with value: 4.7032920833567674e-06 and parameters: {'n_estimators': 146, 'max_depth': 3, 'min_samples_split': 6, 'min_samples_leaf': 9, 'max_features': None}. Best is trial 24 with value: 4.695574055199697e-06.
[I 2025-07-29 03:00:09,767] Trial 32 finished with value: 4.712655255975743e-06 and parameters: {'n_estimators': 157, 'max_depth': 3, 'min_samples_split': 4, 'min_samples_leaf': 9, 'max_features': None}. Best is trial 24 with value: 4.695574055199697e-06.
[I 2025-07-29 03:00:37,431] Trial 33 finished with value: 4.734444852704068e-06 and parameters: {'n_estimators': 163, 'max_depth': 4, 'min_samples_split': 6, 'min_samples_leaf': 8, 'max_features': None}. Best is trial 24 with value: 4.695574055199697e-06.
[I 2025-07-29 03:00:58,306] Trial 34 finished with value: 4.726939048586451e-06 and parameters: {'n_estimators': 103, 'max_depth': 5, 'min_samples_split': 7, 'min_samples_leaf': 9, 'max_features': None}. Best is trial 24 with value: 4.695574055199697e-06.
[I 2025-07-29 03:01:39,051] Trial 35 finished with value: 4.728554847177362e-06 and parameters: {'n_estimators': 311, 'max_depth': 3, 'min_samples_split': 3, 'min_samples_leaf': 8, 'max_features': None}. Best is trial 24 with value: 4.695574055199697e-06.
[I 2025-07-29 03:01:41,102] Trial 36 finished with value: 5.01126182172012e-06 and parameters: {'n_estimators': 127, 'max_depth': 7, 'min_samples_split': 9, 'min_samples_leaf': 10, 'max_features': 'sqrt'}. Best is trial 24 with value: 4.695574055199697e-06.
[I 2025-07-29 03:01:42,914] Trial 37 finished with value: 5.077511773814163e-06 and parameters: {'n_estimators': 178, 'max_depth': 14, 'min_samples_split': 7, 'min_samples_leaf': 9, 'max_features': 'log2'}. Best is trial 24 with value: 4.695574055199697e-06.
[I 2025-07-29 03:03:07,858] Trial 38 finished with value: 4.7810974259307055e-06 and parameters: {'n_estimators': 499, 'max_depth': 4, 'min_samples_split': 3, 'min_samples_leaf': 7, 'max_features': None}. Best is trial 24 with value: 4.695574055199697e-06.
[I 2025-07-29 03:04:38,086] Trial 39 finished with value: 4.808315464420543e-06 and parameters: {'n_estimators': 282, 'max_depth': 10, 'min_samples_split': 9, 'min_samples_leaf': 10, 'max_features': None}. Best is trial 24 with value: 4.695574055199697e-06.
[I 2025-07-29 03:04:43,294] Trial 40 finished with value: 5.051962785913268e-06 and parameters: {'n_estimators': 223, 'max_depth': 17, 'min_samples_split': 17, 'min_samples_leaf': 6, 'max_features': 'sqrt'}. Best is trial 24 with value: 4.695574055199697e-06.
[I 2025-07-29 03:05:01,737] Trial 41 finished with value: 4.702284503781693e-06 and parameters: {'n_estimators': 141, 'max_depth': 3, 'min_samples_split': 6, 'min_samples_leaf': 9, 'max_features': None}. Best is trial 24 with value: 4.695574055199697e-06.
[I 2025-07-29 03:05:21,358] Trial 42 finished with value: 4.708556188547565e-06 and parameters: {'n_estimators': 150, 'max_depth': 3, 'min_samples_split': 6, 'min_samples_leaf': 9, 'max_features': None}. Best is trial 24 with value: 4.695574055199697e-06.
[I 2025-07-29 03:05:46,304] Trial 43 finished with value: 4.754564624036044e-06 and parameters: {'n_estimators': 122, 'max_depth': 5, 'min_samples_split': 8, 'min_samples_leaf': 8, 'max_features': None}. Best is trial 24 with value: 4.695574055199697e-06.
[I 2025-07-29 03:06:22,348] Trial 44 finished with value: 4.759532933176038e-06 and parameters: {'n_estimators': 154, 'max_depth': 6, 'min_samples_split': 5, 'min_samples_leaf': 9, 'max_features': None}. Best is trial 24 with value: 4.695574055199697e-06.
[I 2025-07-29 03:07:24,980] Trial 45 finished with value: 4.7542844759622735e-06 and parameters: {'n_estimators': 374, 'max_depth': 4, 'min_samples_split': 4, 'min_samples_leaf': 10, 'max_features': None}. Best is trial 24 with value: 4.695574055199697e-06.
[I 2025-07-29 03:07:50,750] Trial 46 finished with value: 4.731545435831937e-06 and parameters: {'n_estimators': 197, 'max_depth': 3, 'min_samples_split': 8, 'min_samples_leaf': 9, 'max_features': None}. Best is trial 24 with value: 4.695574055199697e-06.
[I 2025-07-29 03:08:14,693] Trial 47 finished with value: 4.757956336124323e-06 and parameters: {'n_estimators': 117, 'max_depth': 5, 'min_samples_split': 3, 'min_samples_leaf': 8, 'max_features': None}. Best is trial 24 with value: 4.695574055199697e-06.
