[I 2025-07-29 03:08:16,108] Trial 48 finished with value: 5.023876897545076e-06 and parameters: {'n_estimators': 221, 'max_depth': 4, 'min_samples_split': 5, 'min_samples_leaf': 10, 'max_features': 'log2'}. Best is trial 24 with value: 4.695574055199697e-06.
[I 2025-07-29 03:08:59,007] Trial 49 finished with value: 4.846701095113351e-06 and parameters: {'n_estimators': 172, 'max_depth': 6, 'min_samples_split': 7, 'min_samples_leaf': 4, 'max_features': None}. Best is trial 24 with value: 4.695574055199697e-06.
[I 2025-07-29 03:08:59,008] A new study created in memory with name: no-name-a53a690e-ed30-4bec-82c4-4b09903482d2
[I 2025-07-29 03:09:39,390] Trial 0 finished with value: 4.828843240966678e-06 and parameters: {'n_estimators': 229, 'max_depth': 4}. Best is trial 0 with value: 4.828843240966678e-06.
[I 2025-07-29 03:11:26,074] Trial 1 finished with value: 5.048116734863347e-06 and parameters: {'n_estimators': 266, 'max_depth': 10}. Best is trial 0 with value: 4.828843240966678e-06.
[I 2025-07-29 03:12:41,815] Trial 2 finished with value: 4.885074021035018e-06 and parameters: {'n_estimators': 343, 'max_depth': 5}. Best is trial 0 with value: 4.828843240966678e-06.
[I 2025-07-29 03:14:23,801] Trial 3 finished with value: 4.973459432390598e-06 and parameters: {'n_estimators': 343, 'max_depth': 7}. Best is trial 0 with value: 4.828843240966678e-06.
[I 2025-07-29 03:16:26,870] Trial 4 finished with value: 4.991355084638877e-06 and parameters: {'n_estimators': 372, 'max_depth': 8}. Best is trial 0 with value: 4.828843240966678e-06.
[I 2025-07-29 03:16:59,436] Trial 5 finished with value: 4.784576632458881e-06 and parameters: {'n_estimators': 244, 'max_depth': 3}. Best is trial 5 with value: 4.784576632458881e-06.
[I 2025-07-29 03:19:51,831] Trial 6 finished with value: 5.004832332586294e-06 and parameters: {'n_estimators': 469, 'max_depth': 9}. Best is trial 5 with value: 4.784576632458881e-06.
[I 2025-07-29 03:20:29,055] Trial 7 finished with value: 4.773914162972079e-06 and parameters: {'n_estimators': 278, 'max_depth': 3}. Best is trial 7 with value: 4.773914162972079e-06.
[I 2025-07-29 03:21:13,510] Trial 8 finished with value: 4.8889537683590786e-06 and parameters: {'n_estimators': 172, 'max_depth': 6}. Best is trial 7 with value: 4.773914162972079e-06.
[I 2025-07-29 03:21:58,788] Trial 9 finished with value: 5.008062993808201e-06 and parameters: {'n_estimators': 113, 'max_depth': 10}. Best is trial 7 with value: 4.773914162972079e-06.
[I 2025-07-29 03:22:59,768] Trial 10 finished with value: 4.780991835115482e-06 and parameters: {'n_estimators': 456, 'max_depth': 3}. Best is trial 7 with value: 4.773914162972079e-06.
[I 2025-07-29 03:24:04,724] Trial 11 finished with value: 4.785871883494079e-06 and parameters: {'n_estimators': 486, 'max_depth': 3}. Best is trial 7 with value: 4.773914162972079e-06.
[I 2025-07-29 03:25:32,643] Trial 12 finished with value: 4.883759461890448e-06 and parameters: {'n_estimators': 405, 'max_depth': 5}. Best is trial 7 with value: 4.773914162972079e-06.
[I 2025-07-29 03:26:28,804] Trial 13 finished with value: 4.782965397364079e-06 and parameters: {'n_estimators': 420, 'max_depth': 3}. Best is trial 7 with value: 4.773914162972079e-06.
[I 2025-07-29 03:27:21,865] Trial 14 finished with value: 4.825277394095448e-06 and parameters: {'n_estimators': 301, 'max_depth': 4}. Best is trial 7 with value: 4.773914162972079e-06.
[I 2025-07-29 03:28:26,847] Trial 15 finished with value: 4.8723387535481584e-06 and parameters: {'n_estimators': 298, 'max_depth': 5}. Best is trial 7 with value: 4.773914162972079e-06.
[I 2025-07-29 03:29:03,214] Trial 16 finished with value: 4.828429242020472e-06 and parameters: {'n_estimators': 206, 'max_depth': 4}. Best is trial 7 with value: 4.773914162972079e-06.
[I 2025-07-29 03:30:52,475] Trial 17 finished with value: 4.921561729740744e-06 and parameters: {'n_estimators': 426, 'max_depth': 6}. Best is trial 7 with value: 4.773914162972079e-06.
[I 2025-07-29 03:32:17,886] Trial 18 finished with value: 4.961915892252841e-06 and parameters: {'n_estimators': 291, 'max_depth': 7}. Best is trial 7 with value: 4.773914162972079e-06.
[I 2025-07-29 03:32:39,928] Trial 19 finished with value: 4.767773530922466e-06 and parameters: {'n_estimators': 165, 'max_depth': 3}. Best is trial 19 with value: 4.767773530922466e-06.
[I 2025-07-29 03:32:58,719] Trial 20 finished with value: 4.787870084476781e-06 and parameters: {'n_estimators': 107, 'max_depth': 4}. Best is trial 19 with value: 4.767773530922466e-06.
[I 2025-07-29 03:33:22,420] Trial 21 finished with value: 4.78451607044074e-06 and parameters: {'n_estimators': 177, 'max_depth': 3}. Best is trial 19 with value: 4.767773530922466e-06.
[I 2025-07-29 03:33:48,102] Trial 22 finished with value: 4.782483071675901e-06 and parameters: {'n_estimators': 193, 'max_depth': 3}. Best is trial 19 with value: 4.767773530922466e-06.
[I 2025-07-29 03:34:14,349] Trial 23 finished with value: 4.802732175608403e-06 and parameters: {'n_estimators': 150, 'max_depth': 4}. Best is trial 19 with value: 4.767773530922466e-06.
[I 2025-07-29 03:35:31,301] Trial 24 finished with value: 4.8826462767043115e-06 and parameters: {'n_estimators': 357, 'max_depth': 5}. Best is trial 19 with value: 4.767773530922466e-06.
[I 2025-07-29 03:36:02,679] Trial 25 finished with value: 4.7880208233427514e-06 and parameters: {'n_estimators': 236, 'max_depth': 3}. Best is trial 19 with value: 4.767773530922466e-06.
[I 2025-07-29 03:36:27,180] Trial 26 finished with value: 4.794761633744839e-06 and parameters: {'n_estimators': 140, 'max_depth': 4}. Best is trial 19 with value: 4.767773530922466e-06.
[I 2025-07-29 03:37:27,340] Trial 27 finished with value: 4.780686960750893e-06 and parameters: {'n_estimators': 453, 'max_depth': 3}. Best is trial 19 with value: 4.767773530922466e-06.
[I 2025-07-29 03:38:48,593] Trial 28 finished with value: 4.892502762427951e-06 and parameters: {'n_estimators': 377, 'max_depth': 5}. Best is trial 19 with value: 4.767773530922466e-06.
[I 2025-07-29 03:39:44,374] Trial 29 finished with value: 4.826258810219214e-06 and parameters: {'n_estimators': 319, 'max_depth': 4}. Best is trial 19 with value: 4.767773530922466e-06.
[I 2025-07-29 03:40:51,376] Trial 30 finished with value: 4.903080800530868e-06 and parameters: {'n_estimators': 262, 'max_depth': 6}. Best is trial 19 with value: 4.767773530922466e-06.
[I 2025-07-29 03:41:49,400] Trial 31 finished with value: 4.7822028040254645e-06 and parameters: {'n_estimators': 437, 'max_depth': 3}. Best is trial 19 with value: 4.767773530922466e-06.
[I 2025-07-29 03:42:55,620] Trial 32 finished with value: 4.784282510843371e-06 and parameters: {'n_estimators': 499, 'max_depth': 3}. Best is trial 19 with value: 4.767773530922466e-06.
[I 2025-07-29 03:44:15,922] Trial 33 finished with value: 4.831299168112716e-06 and parameters: {'n_estimators': 459, 'max_depth': 4}. Best is trial 19 with value: 4.767773530922466e-06.
[I 2025-07-29 03:45:10,680] Trial 34 finished with value: 4.786677366215132e-06 and parameters: {'n_estimators': 404, 'max_depth': 3}. Best is trial 19 with value: 4.767773530922466e-06.
[I 2025-07-29 03:46:33,388] Trial 35 finished with value: 4.831356866740675e-06 and parameters: {'n_estimators': 471, 'max_depth': 4}. Best is trial 19 with value: 4.767773530922466e-06.
[I 2025-07-29 03:47:33,169] Trial 36 finished with value: 4.781800795269233e-06 and parameters: {'n_estimators': 448, 'max_depth': 3}. Best is trial 19 with value: 4.767773530922466e-06.
[I 2025-07-29 03:48:52,169] Trial 37 finished with value: 5.017244745016764e-06 and parameters: {'n_estimators': 214, 'max_depth': 9}. Best is trial 19 with value: 4.767773530922466e-06.
[I 2025-07-29 03:49:49,669] Trial 38 finished with value: 4.837585355304415e-06 and parameters: {'n_estimators': 327, 'max_depth': 4}. Best is trial 19 with value: 4.767773530922466e-06.
[I 2025-07-29 03:51:16,803] Trial 39 finished with value: 4.984502158830893e-06 and parameters: {'n_estimators': 262, 'max_depth': 8}. Best is trial 19 with value: 4.767773530922466e-06.
[I 2025-07-29 03:52:38,572] Trial 40 finished with value: 4.895055855025848e-06 and parameters: {'n_estimators': 378, 'max_depth': 5}. Best is trial 19 with value: 4.767773530922466e-06.
[I 2025-07-29 03:53:38,553] Trial 41 finished with value: 4.781800795269233e-06 and parameters: {'n_estimators': 448, 'max_depth': 3}. Best is trial 19 with value: 4.767773530922466e-06.
[I 2025-07-29 03:54:42,836] Trial 42 finished with value: 4.784179315356549e-06 and parameters: {'n_estimators': 476, 'max_depth': 3}. Best is trial 19 with value: 4.767773530922466e-06.
[I 2025-07-29 03:55:36,821] Trial 43 finished with value: 4.784779272941485e-06 and parameters: {'n_estimators': 401, 'max_depth': 3}. Best is trial 19 with value: 4.767773530922466e-06.
[I 2025-07-29 03:56:37,008] Trial 44 finished with value: 4.781854477208592e-06 and parameters: {'n_estimators': 451, 'max_depth': 3}. Best is trial 19 with value: 4.767773530922466e-06.
[I 2025-07-29 03:57:51,177] Trial 45 finished with value: 4.832403615008393e-06 and parameters: {'n_estimators': 422, 'max_depth': 4}. Best is trial 19 with value: 4.767773530922466e-06.
[I 2025-07-29 03:58:57,172] Trial 46 finished with value: 4.7856919285242144e-06 and parameters: {'n_estimators': 493, 'max_depth': 3}. Best is trial 19 with value: 4.767773530922466e-06.
[I 2025-07-29 03:59:20,943] Trial 47 finished with value: 4.790384925337665e-06 and parameters: {'n_estimators': 135, 'max_depth': 4}. Best is trial 19 with value: 4.767773530922466e-06.
[I 2025-07-29 04:00:08,740] Trial 48 finished with value: 4.788571076678749e-06 and parameters: {'n_estimators': 357, 'max_depth': 3}. Best is trial 19 with value: 4.767773530922466e-06.
[I 2025-07-29 04:01:32,011] Trial 49 finished with value: 4.890197090084109e-06 and parameters: {'n_estimators': 384, 'max_depth': 5}. Best is trial 19 with value: 4.767773530922466e-06.
[I 2025-07-29 04:01:32,012] A new study created in memory with name: no-name-3f6f22b0-8091-4de1-b87d-fa8a18e64018
[I 2025-07-29 04:01:32,918] Trial 0 finished with value: 5.019251650211013e-06 and parameters: {'n_estimators': 979, 'learning_rate': 0.2764352990518475, 'max_depth': 4, 'num_leaves': 45, 'reg_alpha': 0.7542995801176542, 'reg_lambda': 0.7763521275100734}. Best is trial 0 with value: 5.019251650211013e-06.
[I 2025-07-29 04:01:33,483] Trial 1 finished with value: 4.831010636529073e-06 and parameters: {'n_estimators': 495, 'learning_rate': 0.2532275133683992, 'max_depth': 10, 'num_leaves': 39, 'reg_alpha': 0.05439507915410968, 'reg_lambda': 0.5268394066369607}. Best is trial 1 with value: 4.831010636529073e-06.
[I 2025-07-29 04:01:33,830] Trial 2 finished with value: 5.019251650211013e-06 and parameters: {'n_estimators': 264, 'learning_rate': 0.0796596784028232, 'max_depth': 3, 'num_leaves': 65, 'reg_alpha': 0.7000578998724147, 'reg_lambda': 0.5038606736042702}. Best is trial 1 with value: 4.831010636529073e-06.
[I 2025-07-29 04:01:34,072] Trial 3 finished with value: 5.019251650211013e-06 and parameters: {'n_estimators': 147, 'learning_rate': 0.12100873470642454, 'max_depth': 10, 'num_leaves': 49, 'reg_alpha': 0.20067796636233504, 'reg_lambda': 0.825374390921696}. Best is trial 1 with value: 4.831010636529073e-06.
[I 2025-07-29 04:01:34,501] Trial 4 finished with value: 5.019251650211013e-06 and parameters: {'n_estimators': 389, 'learning_rate': 0.07573061505540522, 'max_depth': 9, 'num_leaves': 61, 'reg_alpha': 0.9095167402867524, 'reg_lambda': 0.6375840957463873}. Best is trial 1 with value: 4.831010636529073e-06.
[I 2025-07-29 04:01:35,173] Trial 5 finished with value: 5.019251650211013e-06 and parameters: {'n_estimators': 759, 'learning_rate': 0.04109851467434235, 'max_depth': 4, 'num_leaves': 50, 'reg_alpha': 0.3680378365280742, 'reg_lambda': 0.5567307958061323}. Best is trial 1 with value: 4.831010636529073e-06.
[I 2025-07-29 04:01:35,621] Trial 6 finished with value: 4.9811823139345335e-06 and parameters: {'n_estimators': 435, 'learning_rate': 0.06109585506774251, 'max_depth': 4, 'num_leaves': 10, 'reg_alpha': 0.14571255628848667, 'reg_lambda': 0.3229198820750113}. Best is trial 1 with value: 4.831010636529073e-06.
[I 2025-07-29 04:01:36,176] Trial 7 finished with value: 5.019251650211013e-06 and parameters: {'n_estimators': 605, 'learning_rate': 0.05438616459959938, 'max_depth': 10, 'num_leaves': 70, 'reg_alpha': 0.8764560175799229, 'reg_lambda': 0.5394795991030371}. Best is trial 1 with value: 4.831010636529073e-06.
[I 2025-07-29 04:01:36,788] Trial 8 finished with value: 5.019251650211013e-06 and parameters: {'n_estimators': 723, 'learning_rate': 0.15816387522191888, 'max_depth': 7, 'num_leaves': 47, 'reg_alpha': 0.4457656846505048, 'reg_lambda': 0.794135960841587}. Best is trial 1 with value: 4.831010636529073e-06.
[I 2025-07-29 04:01:37,221] Trial 9 finished with value: 5.019251650211013e-06 and parameters: {'n_estimators': 402, 'learning_rate': 0.0187290963916857, 'max_depth': 5, 'num_leaves': 47, 'reg_alpha': 0.40531744346224663, 'reg_lambda': 0.27633309654846605}. Best is trial 1 with value: 4.831010636529073e-06.
[I 2025-07-29 04:01:38,602] Trial 10 finished with value: 5.721160749201488e-06 and parameters: {'n_estimators': 976, 'learning_rate': 0.28635156012171786, 'max_depth': 8, 'num_leaves': 96, 'reg_alpha': 0.006593992470311311, 'reg_lambda': 0.017603897254296452}. Best is trial 1 with value: 4.831010636529073e-06.
[I 2025-07-29 04:01:40,384] Trial 11 finished with value: 5.962496681559185e-06 and parameters: {'n_estimators': 451, 'learning_rate': 0.21246318782856996, 'max_depth': 6, 'num_leaves': 11, 'reg_alpha': 0.0018595154324717034, 'reg_lambda': 0.22939231287350614}. Best is trial 1 with value: 4.831010636529073e-06.
[I 2025-07-29 04:01:40,939] Trial 12 finished with value: 5.019251650211013e-06 and parameters: {'n_estimators': 583, 'learning_rate': 0.20861670567071777, 'max_depth': 7, 'num_leaves': 18, 'reg_alpha': 0.21585867457505228, 'reg_lambda': 0.32919778692500523}. Best is trial 1 with value: 4.831010636529073e-06.
[I 2025-07-29 04:01:41,300] Trial 13 finished with value: 5.016380133042626e-06 and parameters: {'n_estimators': 275, 'learning_rate': 0.22767105220632558, 'max_depth': 6, 'num_leaves': 25, 'reg_alpha': 0.18684211509116855, 'reg_lambda': 0.9739320423493854}. Best is trial 1 with value: 4.831010636529073e-06.
[I 2025-07-29 04:01:41,893] Trial 14 finished with value: 4.94647648104859e-06 and parameters: {'n_estimators': 515, 'learning_rate': 0.1581397491581375, 'max_depth': 3, 'num_leaves': 31, 'reg_alpha': 0.11564222066547458, 'reg_lambda': 0.37283394645545076}. Best is trial 1 with value: 4.831010636529073e-06.
[I 2025-07-29 04:01:42,558] Trial 15 finished with value: 5.019251650211013e-06 and parameters: {'n_estimators': 711, 'learning_rate': 0.16143456076945556, 'max_depth': 8, 'num_leaves': 32, 'reg_alpha': 0.3250091966094222, 'reg_lambda': 0.4025974150173816}. Best is trial 1 with value: 4.831010636529073e-06.
[I 2025-07-29 04:01:43,071] Trial 16 finished with value: 5.019251650211013e-06 and parameters: {'n_estimators': 531, 'learning_rate': 0.24763667443473528, 'max_depth': 3, 'num_leaves': 34, 'reg_alpha': 0.5858271862063822, 'reg_lambda': 0.14231007501916204}. Best is trial 1 with value: 4.831010636529073e-06.
[I 2025-07-29 04:01:43,887] Trial 17 finished with value: 4.848399987239203e-06 and parameters: {'n_estimators': 823, 'learning_rate': 0.11717730556550363, 'max_depth': 9, 'num_leaves': 35, 'reg_alpha': 0.08416049937494285, 'reg_lambda': 0.6425843198597682}. Best is trial 1 with value: 4.831010636529073e-06.
[I 2025-07-29 04:01:44,688] Trial 18 finished with value: 5.019251650211013e-06 and parameters: {'n_estimators': 854, 'learning_rate': 0.11929598570521417, 'max_depth': 9, 'num_leaves': 97, 'reg_alpha': 0.5416451214559076, 'reg_lambda': 0.6814238586384886}. Best is trial 1 with value: 4.831010636529073e-06.
[I 2025-07-29 04:01:45,461] Trial 19 finished with value: 5.019251650211013e-06 and parameters: {'n_estimators': 835, 'learning_rate': 0.1164242696796356, 'max_depth': 9, 'num_leaves': 78, 'reg_alpha': 0.31982448419247655, 'reg_lambda': 0.6509765136515921}. Best is trial 1 with value: 4.831010636529073e-06.
[I 2025-07-29 04:01:46,129] Trial 20 finished with value: 4.868245321444001e-06 and parameters: {'n_estimators': 642, 'learning_rate': 0.19234011474187676, 'max_depth': 10, 'num_leaves': 36, 'reg_alpha': 0.056329934764437053, 'reg_lambda': 0.9120107388864566}. Best is trial 1 with value: 4.831010636529073e-06.
[I 2025-07-29 04:01:46,772] Trial 21 finished with value: 4.841178599625984e-06 and parameters: {'n_estimators': 660, 'learning_rate': 0.19905987795079538, 'max_depth': 10, 'num_leaves': 38, 'reg_alpha': 0.07273816332244029, 'reg_lambda': 0.9515577352764448}. Best is trial 1 with value: 4.831010636529073e-06.
[I 2025-07-29 04:01:47,489] Trial 22 finished with value: 5.019251650211013e-06 and parameters: {'n_estimators': 871, 'learning_rate': 0.2595646576085688, 'max_depth': 9, 'num_leaves': 39, 'reg_alpha': 0.25305569893826213, 'reg_lambda': 0.4462823480248481}. Best is trial 1 with value: 4.831010636529073e-06.
[I 2025-07-29 04:01:48,097] Trial 23 finished with value: 4.887801735997978e-06 and parameters: {'n_estimators': 652, 'learning_rate': 0.1828634960954783, 'max_depth': 10, 'num_leaves': 23, 'reg_alpha': 0.09628619245321705, 'reg_lambda': 0.7240257192835506}. Best is trial 1 with value: 4.831010636529073e-06.
[I 2025-07-29 04:01:48,819] Trial 24 finished with value: 5.019251650211013e-06 and parameters: {'n_estimators': 785, 'learning_rate': 0.23558029210960524, 'max_depth': 8, 'num_leaves': 57, 'reg_alpha': 0.260179998089186, 'reg_lambda': 0.8628281135734652}. Best is trial 1 with value: 4.831010636529073e-06.
[I 2025-07-29 04:01:49,526] Trial 25 finished with value: 4.8511266564042754e-06 and parameters: {'n_estimators': 682, 'learning_rate': 0.10118748595540986, 'max_depth': 10, 'num_leaves': 39, 'reg_alpha': 0.08388731067439226, 'reg_lambda': 0.581704827561414}. Best is trial 1 with value: 4.831010636529073e-06.
[I 2025-07-29 04:01:50,820] Trial 26 finished with value: 5.473434536180049e-06 and parameters: {'n_estimators': 506, 'learning_rate': 0.18534201801765687, 'max_depth': 9, 'num_leaves': 25, 'reg_alpha': 0.00600870959868717, 'reg_lambda': 0.9906629585162252}. Best is trial 1 with value: 4.831010636529073e-06.
[I 2025-07-29 04:01:51,636] Trial 27 finished with value: 4.985405880662492e-06 and parameters: {'n_estimators': 914, 'learning_rate': 0.1379665607065201, 'max_depth': 8, 'num_leaves': 41, 'reg_alpha': 0.15171157093795407, 'reg_lambda': 0.8949954023267626}. Best is trial 1 with value: 4.831010636529073e-06.
[I 2025-07-29 04:01:52,066] Trial 28 finished with value: 5.019251650211013e-06 and parameters: {'n_estimators': 337, 'learning_rate': 0.21438260882152008, 'max_depth': 10, 'num_leaves': 55, 'reg_alpha': 0.2875971549291928, 'reg_lambda': 0.45865329297445717}. Best is trial 1 with value: 4.831010636529073e-06.
[I 2025-07-29 04:01:52,960] Trial 29 finished with value: 5.019251650211013e-06 and parameters: {'n_estimators': 978, 'learning_rate': 0.27050905250329615, 'max_depth': 9, 'num_leaves': 20, 'reg_alpha': 0.6673546422329548, 'reg_lambda': 0.7089901216983994}. Best is trial 1 with value: 4.831010636529073e-06.
[I 2025-07-29 04:01:53,556] Trial 30 finished with value: 4.829376147945051e-06 and parameters: {'n_estimators': 582, 'learning_rate': 0.25290710489575075, 'max_depth': 7, 'num_leaves': 29, 'reg_alpha': 0.07059986482408978, 'reg_lambda': 0.7673174660733947}. Best is trial 30 with value: 4.829376147945051e-06.
[I 2025-07-29 04:01:54,237] Trial 31 finished with value: 4.849413006883081e-06 and parameters: {'n_estimators': 598, 'learning_rate': 0.2560418206276988, 'max_depth': 7, 'num_leaves': 30, 'reg_alpha': 0.064186275961732, 'reg_lambda': 0.7725109341547074}. Best is trial 30 with value: 4.829376147945051e-06.
[I 2025-07-29 04:01:54,994] Trial 32 finished with value: 5.004841118776725e-06 and parameters: {'n_estimators': 789, 'learning_rate': 0.29535561493630347, 'max_depth': 8, 'num_leaves': 44, 'reg_alpha': 0.16744786961592312, 'reg_lambda': 0.5886092919321178}. Best is trial 30 with value: 4.829376147945051e-06.
[I 2025-07-29 04:01:55,548] Trial 33 finished with value: 4.8711684060371e-06 and parameters: {'n_estimators': 481, 'learning_rate': 0.27442728983010756, 'max_depth': 10, 'num_leaves': 54, 'reg_alpha': 0.06171341315297878, 'reg_lambda': 0.766006753044443}. Best is trial 30 with value: 4.829376147945051e-06.
[I 2025-07-29 04:01:56,128] Trial 34 finished with value: 5.019251650211013e-06 and parameters: {'n_estimators': 566, 'learning_rate': 0.23828655782040348, 'max_depth': 5, 'num_leaves': 16, 'reg_alpha': 0.221048311918981, 'reg_lambda': 0.8509520076304238}. Best is trial 30 with value: 4.829376147945051e-06.
[I 2025-07-29 04:01:56,442] Trial 35 finished with value: 4.938885591566433e-06 and parameters: {'n_estimators': 141, 'learning_rate': 0.2237123505538871, 'max_depth': 9, 'num_leaves': 28, 'reg_alpha': 0.11074245312814693, 'reg_lambda': 0.9398446471475548}. Best is trial 30 with value: 4.829376147945051e-06.
[I 2025-07-29 04:01:57,132] Trial 36 finished with value: 5.019251650211013e-06 and parameters: {'n_estimators': 648, 'learning_rate': 0.13871819747836145, 'max_depth': 10, 'num_leaves': 42, 'reg_alpha': 0.798819686950511, 'reg_lambda': 0.6163644871970163}. Best is trial 30 with value: 4.829376147945051e-06.
[I 2025-07-29 04:01:57,872] Trial 37 finished with value: 5.019251650211013e-06 and parameters: {'n_estimators': 745, 'learning_rate': 0.0943843001922328, 'max_depth': 9, 'num_leaves': 35, 'reg_alpha': 0.989409362431508, 'reg_lambda': 0.4881178334997679}. Best is trial 30 with value: 4.829376147945051e-06.
