[I 2025-07-29 06:33:27,488] Trial 18 finished with value: 4.776301227959901e-06 and parameters: {'n_estimators': 289, 'max_depth': 3}. Best is trial 18 with value: 4.776301227959901e-06.
[I 2025-07-29 06:34:36,949] Trial 19 finished with value: 4.876694471357365e-06 and parameters: {'n_estimators': 320, 'max_depth': 5}. Best is trial 18 with value: 4.776301227959901e-06.
[I 2025-07-29 06:36:27,051] Trial 20 finished with value: 5.037679417851835e-06 and parameters: {'n_estimators': 275, 'max_depth': 10}. Best is trial 18 with value: 4.776301227959901e-06.
[I 2025-07-29 06:36:56,406] Trial 21 finished with value: 4.774478965929143e-06 and parameters: {'n_estimators': 218, 'max_depth': 3}. Best is trial 21 with value: 4.774478965929143e-06.
[I 2025-07-29 06:37:22,959] Trial 22 finished with value: 4.783743433960137e-06 and parameters: {'n_estimators': 197, 'max_depth': 3}. Best is trial 21 with value: 4.774478965929143e-06.
[I 2025-07-29 06:37:59,092] Trial 23 finished with value: 4.777625167834601e-06 and parameters: {'n_estimators': 268, 'max_depth': 3}. Best is trial 21 with value: 4.774478965929143e-06.
[I 2025-07-29 06:38:46,481] Trial 24 finished with value: 4.823006289396051e-06 and parameters: {'n_estimators': 268, 'max_depth': 4}. Best is trial 21 with value: 4.774478965929143e-06.
[I 2025-07-29 06:40:01,962] Trial 25 finished with value: 4.881548504611881e-06 and parameters: {'n_estimators': 346, 'max_depth': 5}. Best is trial 21 with value: 4.774478965929143e-06.
[I 2025-07-29 06:40:36,090] Trial 26 finished with value: 4.781027207901917e-06 and parameters: {'n_estimators': 253, 'max_depth': 3}. Best is trial 21 with value: 4.774478965929143e-06.
[I 2025-07-29 06:42:17,802] Trial 27 finished with value: 4.933001482058618e-06 and parameters: {'n_estimators': 394, 'max_depth': 6}. Best is trial 21 with value: 4.774478965929143e-06.
[I 2025-07-29 06:43:14,969] Trial 28 finished with value: 4.831374118357852e-06 and parameters: {'n_estimators': 324, 'max_depth': 4}. Best is trial 21 with value: 4.774478965929143e-06.
[I 2025-07-29 06:44:18,896] Trial 29 finished with value: 5.017796032366167e-06 and parameters: {'n_estimators': 173, 'max_depth': 9}. Best is trial 21 with value: 4.774478965929143e-06.
[I 2025-07-29 06:44:57,919] Trial 30 finished with value: 4.775643525012808e-06 and parameters: {'n_estimators': 290, 'max_depth': 3}. Best is trial 21 with value: 4.774478965929143e-06.
[I 2025-07-29 06:45:36,678] Trial 31 finished with value: 4.774258944046376e-06 and parameters: {'n_estimators': 288, 'max_depth': 3}. Best is trial 31 with value: 4.774258944046376e-06.
[I 2025-07-29 06:46:28,823] Trial 32 finished with value: 4.819200128144063e-06 and parameters: {'n_estimators': 294, 'max_depth': 4}. Best is trial 31 with value: 4.774258944046376e-06.
[I 2025-07-29 06:47:14,479] Trial 33 finished with value: 4.788384134175056e-06 and parameters: {'n_estimators': 341, 'max_depth': 3}. Best is trial 31 with value: 4.774258944046376e-06.
[I 2025-07-29 06:48:34,792] Trial 34 finished with value: 4.886959573072976e-06 and parameters: {'n_estimators': 370, 'max_depth': 5}. Best is trial 31 with value: 4.774258944046376e-06.
[I 2025-07-29 06:49:02,262] Trial 35 finished with value: 4.783995198176744e-06 and parameters: {'n_estimators': 205, 'max_depth': 3}. Best is trial 31 with value: 4.774258944046376e-06.
[I 2025-07-29 06:49:27,430] Trial 36 finished with value: 4.794456194638346e-06 and parameters: {'n_estimators': 143, 'max_depth': 4}. Best is trial 31 with value: 4.774258944046376e-06.
[I 2025-07-29 06:50:43,105] Trial 37 finished with value: 4.902353115544567e-06 and parameters: {'n_estimators': 293, 'max_depth': 6}. Best is trial 31 with value: 4.774258944046376e-06.
[I 2025-07-29 06:52:07,672] Trial 38 finished with value: 4.986218852489589e-06 and parameters: {'n_estimators': 254, 'max_depth': 8}. Best is trial 31 with value: 4.774258944046376e-06.
[I 2025-07-29 06:53:02,159] Trial 39 finished with value: 4.821511376494258e-06 and parameters: {'n_estimators': 310, 'max_depth': 4}. Best is trial 31 with value: 4.774258944046376e-06.
[I 2025-07-29 06:53:56,866] Trial 40 finished with value: 4.7849333081808e-06 and parameters: {'n_estimators': 409, 'max_depth': 3}. Best is trial 31 with value: 4.774258944046376e-06.
[I 2025-07-29 06:54:33,610] Trial 41 finished with value: 4.774838780821417e-06 and parameters: {'n_estimators': 274, 'max_depth': 3}. Best is trial 31 with value: 4.774258944046376e-06.
[I 2025-07-29 06:55:10,967] Trial 42 finished with value: 4.773636644986066e-06 and parameters: {'n_estimators': 279, 'max_depth': 3}. Best is trial 42 with value: 4.773636644986066e-06.
[I 2025-07-29 06:55:55,635] Trial 43 finished with value: 4.820846491976457e-06 and parameters: {'n_estimators': 254, 'max_depth': 4}. Best is trial 42 with value: 4.773636644986066e-06.
[I 2025-07-29 06:56:39,846] Trial 44 finished with value: 4.789419067874766e-06 and parameters: {'n_estimators': 330, 'max_depth': 3}. Best is trial 42 with value: 4.773636644986066e-06.
[I 2025-07-29 06:57:04,105] Trial 45 finished with value: 4.7814881771253385e-06 and parameters: {'n_estimators': 181, 'max_depth': 3}. Best is trial 42 with value: 4.773636644986066e-06.
[I 2025-07-29 06:57:53,069] Trial 46 finished with value: 4.8170612182402394e-06 and parameters: {'n_estimators': 278, 'max_depth': 4}. Best is trial 42 with value: 4.773636644986066e-06.
[I 2025-07-29 06:58:22,715] Trial 47 finished with value: 4.77405728822735e-06 and parameters: {'n_estimators': 221, 'max_depth': 3}. Best is trial 42 with value: 4.773636644986066e-06.
[I 2025-07-29 06:59:10,658] Trial 48 finished with value: 4.861999049585033e-06 and parameters: {'n_estimators': 220, 'max_depth': 5}. Best is trial 42 with value: 4.773636644986066e-06.
[I 2025-07-29 06:59:34,411] Trial 49 finished with value: 4.790384925337665e-06 and parameters: {'n_estimators': 135, 'max_depth': 4}. Best is trial 42 with value: 4.773636644986066e-06.
[I 2025-07-29 06:59:34,411] A new study created in memory with name: no-name-3a52fd48-c11d-4a53-b31e-ccd60331b40d
[I 2025-07-29 06:59:34,699] Trial 0 finished with value: 5.019251650211013e-06 and parameters: {'n_estimators': 177, 'learning_rate': 0.042255165399621236, 'max_depth': 9, 'num_leaves': 82, 'reg_alpha': 0.9203968395561392, 'reg_lambda': 0.81836575299828}. Best is trial 0 with value: 5.019251650211013e-06.
[I 2025-07-29 06:59:35,216] Trial 1 finished with value: 5.019251650211013e-06 and parameters: {'n_estimators': 642, 'learning_rate': 0.13061397004626601, 'max_depth': 8, 'num_leaves': 11, 'reg_alpha': 0.6228489182877904, 'reg_lambda': 0.9755910511473703}. Best is trial 0 with value: 5.019251650211013e-06.
[I 2025-07-29 06:59:35,970] Trial 2 finished with value: 5.019251650211013e-06 and parameters: {'n_estimators': 903, 'learning_rate': 0.14607893225114732, 'max_depth': 7, 'num_leaves': 18, 'reg_alpha': 0.21879869641815797, 'reg_lambda': 0.8915055719792881}. Best is trial 0 with value: 5.019251650211013e-06.
[I 2025-07-29 06:59:36,377] Trial 3 finished with value: 5.019251650211013e-06 and parameters: {'n_estimators': 405, 'learning_rate': 0.03409722598347607, 'max_depth': 4, 'num_leaves': 29, 'reg_alpha': 0.3446827047406871, 'reg_lambda': 0.7943231294110125}. Best is trial 0 with value: 5.019251650211013e-06.
[I 2025-07-29 06:59:37,076] Trial 4 finished with value: 4.9374479157279645e-06 and parameters: {'n_estimators': 736, 'learning_rate': 0.13294595254604444, 'max_depth': 5, 'num_leaves': 42, 'reg_alpha': 0.11020387194418979, 'reg_lambda': 0.5514806920788801}. Best is trial 4 with value: 4.9374479157279645e-06.
[I 2025-07-29 06:59:37,484] Trial 5 finished with value: 5.019251650211013e-06 and parameters: {'n_estimators': 334, 'learning_rate': 0.06418243652939232, 'max_depth': 5, 'num_leaves': 89, 'reg_alpha': 0.7955238713401168, 'reg_lambda': 0.7363029308387856}. Best is trial 4 with value: 4.9374479157279645e-06.
[I 2025-07-29 06:59:37,955] Trial 6 finished with value: 5.019251650211013e-06 and parameters: {'n_estimators': 424, 'learning_rate': 0.276303659697164, 'max_depth': 3, 'num_leaves': 69, 'reg_alpha': 0.4810591579934561, 'reg_lambda': 0.0018523135523142997}. Best is trial 4 with value: 4.9374479157279645e-06.
[I 2025-07-29 06:59:38,648] Trial 7 finished with value: 4.966490280023093e-06 and parameters: {'n_estimators': 695, 'learning_rate': 0.06229477245434374, 'max_depth': 5, 'num_leaves': 24, 'reg_alpha': 0.13017877942596268, 'reg_lambda': 0.09776327098115634}. Best is trial 4 with value: 4.9374479157279645e-06.
[I 2025-07-29 06:59:39,517] Trial 8 finished with value: 4.830449601337824e-06 and parameters: {'n_estimators': 609, 'learning_rate': 0.010963938975273185, 'max_depth': 7, 'num_leaves': 55, 'reg_alpha': 0.07768234312233924, 'reg_lambda': 0.031155875548025014}. Best is trial 8 with value: 4.830449601337824e-06.
[I 2025-07-29 06:59:40,226] Trial 9 finished with value: 5.019251650211013e-06 and parameters: {'n_estimators': 729, 'learning_rate': 0.08191510271141249, 'max_depth': 7, 'num_leaves': 76, 'reg_alpha': 0.526848889849651, 'reg_lambda': 0.8587694578340944}. Best is trial 8 with value: 4.830449601337824e-06.
[I 2025-07-29 06:59:41,451] Trial 10 finished with value: 5.094913146349891e-06 and parameters: {'n_estimators': 993, 'learning_rate': 0.23871242285637506, 'max_depth': 10, 'num_leaves': 56, 'reg_alpha': 0.024375357578238166, 'reg_lambda': 0.26502045915048744}. Best is trial 8 with value: 4.830449601337824e-06.
[I 2025-07-29 06:59:42,409] Trial 11 finished with value: 5.030816977236583e-06 and parameters: {'n_estimators': 811, 'learning_rate': 0.21416237865970367, 'max_depth': 6, 'num_leaves': 42, 'reg_alpha': 0.027119775163353455, 'reg_lambda': 0.5204701411813863}. Best is trial 8 with value: 4.830449601337824e-06.
[I 2025-07-29 06:59:43,004] Trial 12 finished with value: 5.019251650211013e-06 and parameters: {'n_estimators': 531, 'learning_rate': 0.1922088997666419, 'max_depth': 6, 'num_leaves': 49, 'reg_alpha': 0.28671721092486196, 'reg_lambda': 0.4728385330733336}. Best is trial 8 with value: 4.830449601337824e-06.
[I 2025-07-29 06:59:43,578] Trial 13 finished with value: 4.9861639918725415e-06 and parameters: {'n_estimators': 569, 'learning_rate': 0.11593675763277309, 'max_depth': 8, 'num_leaves': 63, 'reg_alpha': 0.15232964269537644, 'reg_lambda': 0.5354442544690419}. Best is trial 8 with value: 4.830449601337824e-06.
[I 2025-07-29 06:59:44,325] Trial 14 finished with value: 5.019251650211013e-06 and parameters: {'n_estimators': 812, 'learning_rate': 0.17657660759887756, 'max_depth': 5, 'num_leaves': 38, 'reg_alpha': 0.39731516151236174, 'reg_lambda': 0.3300137392360579}. Best is trial 8 with value: 4.830449601337824e-06.
[I 2025-07-29 06:59:44,952] Trial 15 finished with value: 4.960022555328582e-06 and parameters: {'n_estimators': 549, 'learning_rate': 0.015612761314023615, 'max_depth': 3, 'num_leaves': 54, 'reg_alpha': 0.1260671924793308, 'reg_lambda': 0.6296460869653613}. Best is trial 8 with value: 4.830449601337824e-06.
[I 2025-07-29 06:59:45,695] Trial 16 finished with value: 5.019251650211013e-06 and parameters: {'n_estimators': 812, 'learning_rate': 0.1002732916108745, 'max_depth': 8, 'num_leaves': 36, 'reg_alpha': 0.2508212568469665, 'reg_lambda': 0.3072045083649426}. Best is trial 8 with value: 4.830449601337824e-06.
[I 2025-07-29 06:59:46,601] Trial 17 finished with value: 5.927251519985353e-06 and parameters: {'n_estimators': 133, 'learning_rate': 0.27294515185139445, 'max_depth': 4, 'num_leaves': 64, 'reg_alpha': 0.004548345175581975, 'reg_lambda': 0.18407616031542662}. Best is trial 8 with value: 4.830449601337824e-06.
[I 2025-07-29 06:59:47,280] Trial 18 finished with value: 5.019251650211013e-06 and parameters: {'n_estimators': 629, 'learning_rate': 0.16579052931704988, 'max_depth': 6, 'num_leaves': 98, 'reg_alpha': 0.6687996813660169, 'reg_lambda': 0.40169286910934743}. Best is trial 8 with value: 4.830449601337824e-06.
[I 2025-07-29 06:59:47,625] Trial 19 finished with value: 5.019251650211013e-06 and parameters: {'n_estimators': 260, 'learning_rate': 0.1057315433371328, 'max_depth': 7, 'num_leaves': 45, 'reg_alpha': 0.3864476252758994, 'reg_lambda': 0.6286254255149858}. Best is trial 8 with value: 4.830449601337824e-06.
[I 2025-07-29 06:59:48,143] Trial 20 finished with value: 5.013260253967666e-06 and parameters: {'n_estimators': 470, 'learning_rate': 0.013033180782460602, 'max_depth': 4, 'num_leaves': 31, 'reg_alpha': 0.18202467974856212, 'reg_lambda': 0.6714349658784583}. Best is trial 8 with value: 4.830449601337824e-06.
[I 2025-07-29 06:59:48,859] Trial 21 finished with value: 4.931124726798204e-06 and parameters: {'n_estimators': 583, 'learning_rate': 0.011401726770732666, 'max_depth': 3, 'num_leaves': 52, 'reg_alpha': 0.10788775259973132, 'reg_lambda': 0.636778279885001}. Best is trial 8 with value: 4.830449601337824e-06.
[I 2025-07-29 06:59:49,673] Trial 22 finished with value: 4.885669528900117e-06 and parameters: {'n_estimators': 698, 'learning_rate': 0.05242670399980558, 'max_depth': 3, 'num_leaves': 54, 'reg_alpha': 0.09788713846953265, 'reg_lambda': 0.44370570099798196}. Best is trial 8 with value: 4.830449601337824e-06.
[I 2025-07-29 06:59:50,410] Trial 23 finished with value: 4.807652543675859e-06 and parameters: {'n_estimators': 603, 'learning_rate': 0.03786410615264503, 'max_depth': 3, 'num_leaves': 56, 'reg_alpha': 0.061588240566919486, 'reg_lambda': 0.18348915869202648}. Best is trial 23 with value: 4.807652543675859e-06.
[I 2025-07-29 06:59:51,076] Trial 24 finished with value: 5.019251650211013e-06 and parameters: {'n_estimators': 666, 'learning_rate': 0.05407392396329695, 'max_depth': 4, 'num_leaves': 59, 'reg_alpha': 0.274005567743936, 'reg_lambda': 0.0007901149005587783}. Best is trial 23 with value: 4.807652543675859e-06.
[I 2025-07-29 06:59:51,671] Trial 25 finished with value: 4.802827884759702e-06 and parameters: {'n_estimators': 484, 'learning_rate': 0.08248572606474433, 'max_depth': 3, 'num_leaves': 72, 'reg_alpha': 0.06253701523100887, 'reg_lambda': 0.20428279671363925}. Best is trial 25 with value: 4.802827884759702e-06.
[I 2025-07-29 06:59:52,346] Trial 26 finished with value: 4.821060119365205e-06 and parameters: {'n_estimators': 475, 'learning_rate': 0.082735015148653, 'max_depth': 9, 'num_leaves': 71, 'reg_alpha': 0.059336605327321434, 'reg_lambda': 0.16627043678427003}. Best is trial 25 with value: 4.802827884759702e-06.
[I 2025-07-29 06:59:52,904] Trial 27 finished with value: 5.0178616767593025e-06 and parameters: {'n_estimators': 494, 'learning_rate': 0.08397814156188295, 'max_depth': 10, 'num_leaves': 73, 'reg_alpha': 0.18903129003998465, 'reg_lambda': 0.18587111232917197}. Best is trial 25 with value: 4.802827884759702e-06.
[I 2025-07-29 06:59:53,343] Trial 28 finished with value: 5.019251650211013e-06 and parameters: {'n_estimators': 305, 'learning_rate': 0.08193040136928673, 'max_depth': 9, 'num_leaves': 81, 'reg_alpha': 0.3179059316209584, 'reg_lambda': 0.1587837852589544}. Best is trial 25 with value: 4.802827884759702e-06.
[I 2025-07-29 06:59:53,704] Trial 29 finished with value: 5.019251650211013e-06 and parameters: {'n_estimators': 220, 'learning_rate': 0.03803364623797098, 'max_depth': 9, 'num_leaves': 87, 'reg_alpha': 0.958453306923194, 'reg_lambda': 0.2469102056729417}. Best is trial 25 with value: 4.802827884759702e-06.
[I 2025-07-29 06:59:54,190] Trial 30 finished with value: 5.019251650211013e-06 and parameters: {'n_estimators': 376, 'learning_rate': 0.09146655749262862, 'max_depth': 4, 'num_leaves': 67, 'reg_alpha': 0.85984516836224, 'reg_lambda': 0.09245271543769046}. Best is trial 25 with value: 4.802827884759702e-06.
[I 2025-07-29 06:59:55,122] Trial 31 finished with value: 4.821916583708675e-06 and parameters: {'n_estimators': 488, 'learning_rate': 0.03274088901212567, 'max_depth': 9, 'num_leaves': 76, 'reg_alpha': 0.04636124527818848, 'reg_lambda': 0.08248475846997144}. Best is trial 25 with value: 4.802827884759702e-06.
[I 2025-07-29 06:59:56,112] Trial 32 finished with value: 4.856924745370234e-06 and parameters: {'n_estimators': 463, 'learning_rate': 0.03260814456787273, 'max_depth': 9, 'num_leaves': 74, 'reg_alpha': 0.041052184062950074, 'reg_lambda': 0.10534522481234196}. Best is trial 25 with value: 4.802827884759702e-06.
[I 2025-07-29 06:59:56,659] Trial 33 finished with value: 5.019251650211013e-06 and parameters: {'n_estimators': 505, 'learning_rate': 0.0696240554370757, 'max_depth': 8, 'num_leaves': 81, 'reg_alpha': 0.1927217174156996, 'reg_lambda': 0.36462616989998664}. Best is trial 25 with value: 4.802827884759702e-06.
[I 2025-07-29 06:59:57,189] Trial 34 finished with value: 4.836088245967043e-06 and parameters: {'n_estimators': 364, 'learning_rate': 0.11990600815743876, 'max_depth': 10, 'num_leaves': 89, 'reg_alpha': 0.07716628819282192, 'reg_lambda': 0.2288760552036127}. Best is trial 25 with value: 4.802827884759702e-06.
[I 2025-07-29 06:59:57,729] Trial 35 finished with value: 5.019251650211013e-06 and parameters: {'n_estimators': 457, 'learning_rate': 0.1468906004218864, 'max_depth': 8, 'num_leaves': 97, 'reg_alpha': 0.24777903882065838, 'reg_lambda': 0.14646588211012895}. Best is trial 25 with value: 4.802827884759702e-06.
[I 2025-07-29 07:00:03,995] Trial 36 finished with value: 5.350776905312447e-06 and parameters: {'n_estimators': 423, 'learning_rate': 0.03655287391995041, 'max_depth': 9, 'num_leaves': 71, 'reg_alpha': 0.0013705351791702958, 'reg_lambda': 0.0608221519180967}. Best is trial 25 with value: 4.802827884759702e-06.
[I 2025-07-29 07:00:04,400] Trial 37 finished with value: 5.019251650211013e-06 and parameters: {'n_estimators': 273, 'learning_rate': 0.04834537350765954, 'max_depth': 3, 'num_leaves': 78, 'reg_alpha': 0.6731822462490769, 'reg_lambda': 0.9901661510502957}. Best is trial 25 with value: 4.802827884759702e-06.
[I 2025-07-29 07:00:05,088] Trial 38 finished with value: 4.812692473753348e-06 and parameters: {'n_estimators': 533, 'learning_rate': 0.06961649233203107, 'max_depth': 9, 'num_leaves': 63, 'reg_alpha': 0.06415233905445616, 'reg_lambda': 0.294802811460046}. Best is trial 25 with value: 4.802827884759702e-06.
[I 2025-07-29 07:00:05,749] Trial 39 finished with value: 4.999627409610551e-06 and parameters: {'n_estimators': 640, 'learning_rate': 0.13494354483044316, 'max_depth': 10, 'num_leaves': 61, 'reg_alpha': 0.16130361501128873, 'reg_lambda': 0.27879688602031716}. Best is trial 25 with value: 4.802827884759702e-06.
[I 2025-07-29 07:00:06,367] Trial 40 finished with value: 5.019251650211013e-06 and parameters: {'n_estimators': 593, 'learning_rate': 0.06759037394546788, 'max_depth': 4, 'num_leaves': 68, 'reg_alpha': 0.4812963572023759, 'reg_lambda': 0.2202810439446553}. Best is trial 25 with value: 4.802827884759702e-06.
[I 2025-07-29 07:00:07,014] Trial 41 finished with value: 4.824431580070158e-06 and parameters: {'n_estimators': 527, 'learning_rate': 0.027385472323891852, 'max_depth': 9, 'num_leaves': 11, 'reg_alpha': 0.07653954545757183, 'reg_lambda': 0.11956352040522839}. Best is trial 25 with value: 4.802827884759702e-06.
[I 2025-07-29 07:00:07,556] Trial 42 finished with value: 4.824604006931722e-06 and parameters: {'n_estimators': 380, 'learning_rate': 0.06949091547778065, 'max_depth': 9, 'num_leaves': 85, 'reg_alpha': 0.0732593650960236, 'reg_lambda': 0.05829994973841085}. Best is trial 25 with value: 4.802827884759702e-06.
[I 2025-07-29 07:00:08,050] Trial 43 finished with value: 5.019251650211013e-06 and parameters: {'n_estimators': 425, 'learning_rate': 0.05264547235103342, 'max_depth': 8, 'num_leaves': 66, 'reg_alpha': 0.21964789612758612, 'reg_lambda': 0.2041395175211131}. Best is trial 25 with value: 4.802827884759702e-06.
[I 2025-07-29 07:00:08,720] Trial 44 finished with value: 4.817236041322676e-06 and parameters: {'n_estimators': 559, 'learning_rate': 0.10406048774238913, 'max_depth': 10, 'num_leaves': 59, 'reg_alpha': 0.06109679646102792, 'reg_lambda': 0.3458288525448444}. Best is trial 25 with value: 4.802827884759702e-06.
[I 2025-07-29 07:00:09,433] Trial 45 finished with value: 4.968275292202466e-06 and parameters: {'n_estimators': 677, 'learning_rate': 0.10066082848817495, 'max_depth': 10, 'num_leaves': 59, 'reg_alpha': 0.13080036066999384, 'reg_lambda': 0.3773392618774623}. Best is trial 25 with value: 4.802827884759702e-06.
[I 2025-07-29 07:00:10,187] Trial 46 finished with value: 4.8299621382109815e-06 and parameters: {'n_estimators': 740, 'learning_rate': 0.11621450943661352, 'max_depth': 10, 'num_leaves': 48, 'reg_alpha': 0.06345112786477775, 'reg_lambda': 0.3081886637282557}. Best is trial 25 with value: 4.802827884759702e-06.
[I 2025-07-29 07:00:10,789] Trial 47 finished with value: 5.019251650211013e-06 and parameters: {'n_estimators': 548, 'learning_rate': 0.08900595686121565, 'max_depth': 7, 'num_leaves': 58, 'reg_alpha': 0.5381466488105362, 'reg_lambda': 0.41486480280621196}. Best is trial 25 with value: 4.802827884759702e-06.
[I 2025-07-29 07:00:11,413] Trial 48 finished with value: 5.019251650211013e-06 and parameters: {'n_estimators': 596, 'learning_rate': 0.12824196834215643, 'max_depth': 5, 'num_leaves': 70, 'reg_alpha': 0.2142980531619023, 'reg_lambda': 0.3322752208802736}. Best is trial 25 with value: 4.802827884759702e-06.
[I 2025-07-29 07:00:11,876] Trial 49 finished with value: 4.979622642364755e-06 and parameters: {'n_estimators': 334, 'learning_rate': 0.07172607700947965, 'max_depth': 3, 'num_leaves': 63, 'reg_alpha': 0.14355697300874817, 'reg_lambda': 0.27254157825137487}. Best is trial 25 with value: 4.802827884759702e-06.
[I 2025-07-29 07:00:11,877] A new study created in memory with name: no-name-d3fc372e-a710-4f8e-8285-333f5de5fb31
