[I 2025-07-29 02:31:04,940] Trial 46 finished with value: 4.747488410510075e-06 and parameters: {'n_estimators': 125, 'max_depth': 3}. Best is trial 44 with value: 4.74174884168738e-06.
[I 2025-07-29 02:31:48,300] Trial 47 finished with value: 4.952171620609826e-06 and parameters: {'n_estimators': 129, 'max_depth': 8}. Best is trial 44 with value: 4.74174884168738e-06.
[I 2025-07-29 02:32:32,417] Trial 48 finished with value: 4.945327184145211e-06 and parameters: {'n_estimators': 149, 'max_depth': 7}. Best is trial 44 with value: 4.74174884168738e-06.
[I 2025-07-29 02:32:56,557] Trial 49 finished with value: 4.795173956315841e-06 and parameters: {'n_estimators': 136, 'max_depth': 4}. Best is trial 44 with value: 4.74174884168738e-06.
[I 2025-07-29 02:32:56,558] A new study created in memory with name: no-name-de4282ce-9a24-422c-9dd8-ea19e46d8f4f
[I 2025-07-29 02:32:56,926] Trial 0 finished with value: 5.019251650211013e-06 and parameters: {'n_estimators': 203, 'learning_rate': 0.18909381034310993, 'max_depth': 3, 'num_leaves': 71, 'reg_alpha': 0.33134202149881176, 'reg_lambda': 0.6124543694611582}. Best is trial 0 with value: 5.019251650211013e-06.
[I 2025-07-29 02:32:57,795] Trial 1 finished with value: 5.019251650211013e-06 and parameters: {'n_estimators': 896, 'learning_rate': 0.11532992891846719, 'max_depth': 6, 'num_leaves': 26, 'reg_alpha': 0.9835400597059432, 'reg_lambda': 0.06471369944509842}. Best is trial 0 with value: 5.019251650211013e-06.
[I 2025-07-29 02:32:58,522] Trial 2 finished with value: 5.019251650211013e-06 and parameters: {'n_estimators': 619, 'learning_rate': 0.24531970552757462, 'max_depth': 8, 'num_leaves': 83, 'reg_alpha': 0.6681526349533649, 'reg_lambda': 0.8019621201067944}. Best is trial 0 with value: 5.019251650211013e-06.
[I 2025-07-29 02:32:59,494] Trial 3 finished with value: 5.019251650211013e-06 and parameters: {'n_estimators': 876, 'learning_rate': 0.22112948054176604, 'max_depth': 9, 'num_leaves': 93, 'reg_alpha': 0.6698419172392628, 'reg_lambda': 0.16851343637264893}. Best is trial 0 with value: 5.019251650211013e-06.
[I 2025-07-29 02:33:00,033] Trial 4 finished with value: 5.019251650211013e-06 and parameters: {'n_estimators': 410, 'learning_rate': 0.29138552372783966, 'max_depth': 7, 'num_leaves': 64, 'reg_alpha': 0.621055140756483, 'reg_lambda': 0.8913170511737685}. Best is trial 0 with value: 5.019251650211013e-06.
[I 2025-07-29 02:33:00,964] Trial 5 finished with value: 5.019251650211013e-06 and parameters: {'n_estimators': 892, 'learning_rate': 0.17965042696584102, 'max_depth': 5, 'num_leaves': 60, 'reg_alpha': 0.9903697386533035, 'reg_lambda': 0.8890864895590064}. Best is trial 0 with value: 5.019251650211013e-06.
[I 2025-07-29 02:33:01,347] Trial 6 finished with value: 5.019251650211013e-06 and parameters: {'n_estimators': 272, 'learning_rate': 0.02279265106757127, 'max_depth': 4, 'num_leaves': 45, 'reg_alpha': 0.6081888363679556, 'reg_lambda': 0.9086112771727295}. Best is trial 0 with value: 5.019251650211013e-06.
[I 2025-07-29 02:33:02,261] Trial 7 finished with value: 5.019251650211013e-06 and parameters: {'n_estimators': 860, 'learning_rate': 0.11866515091419, 'max_depth': 7, 'num_leaves': 56, 'reg_alpha': 0.294641562001839, 'reg_lambda': 0.9110445435788661}. Best is trial 0 with value: 5.019251650211013e-06.
[I 2025-07-29 02:33:02,827] Trial 8 finished with value: 5.019251650211013e-06 and parameters: {'n_estimators': 492, 'learning_rate': 0.15756328897044503, 'max_depth': 6, 'num_leaves': 44, 'reg_alpha': 0.6682624202808921, 'reg_lambda': 0.023039076875525977}. Best is trial 0 with value: 5.019251650211013e-06.
[I 2025-07-29 02:33:03,505] Trial 9 finished with value: 5.019251650211013e-06 and parameters: {'n_estimators': 663, 'learning_rate': 0.1744044491935999, 'max_depth': 5, 'num_leaves': 30, 'reg_alpha': 0.49097717504589156, 'reg_lambda': 0.16904430519345226}. Best is trial 0 with value: 5.019251650211013e-06.
[I 2025-07-29 02:33:04,113] Trial 10 finished with value: 4.8171207596592504e-06 and parameters: {'n_estimators': 107, 'learning_rate': 0.0561623408479473, 'max_depth': 3, 'num_leaves': 78, 'reg_alpha': 0.017626930462402268, 'reg_lambda': 0.5627022368059382}. Best is trial 10 with value: 4.8171207596592504e-06.
[I 2025-07-29 02:33:04,788] Trial 11 finished with value: 4.680603366038245e-06 and parameters: {'n_estimators': 143, 'learning_rate': 0.01559349353308681, 'max_depth': 3, 'num_leaves': 78, 'reg_alpha': 0.011690182951536185, 'reg_lambda': 0.5570088862881082}. Best is trial 11 with value: 4.680603366038245e-06.
[I 2025-07-29 02:33:05,431] Trial 12 finished with value: 4.711096853720136e-06 and parameters: {'n_estimators': 110, 'learning_rate': 0.016489103783206203, 'max_depth': 3, 'num_leaves': 99, 'reg_alpha': 0.005384101509529589, 'reg_lambda': 0.43062912836870526}. Best is trial 11 with value: 4.680603366038245e-06.
[I 2025-07-29 02:33:06,928] Trial 13 finished with value: 4.95236744190561e-06 and parameters: {'n_estimators': 333, 'learning_rate': 0.017153969599135604, 'max_depth': 3, 'num_leaves': 98, 'reg_alpha': 0.004398953743290544, 'reg_lambda': 0.3833601297132091}. Best is trial 11 with value: 4.680603366038245e-06.
[I 2025-07-29 02:33:07,258] Trial 14 finished with value: 5.018663423010088e-06 and parameters: {'n_estimators': 115, 'learning_rate': 0.07168981895605324, 'max_depth': 10, 'num_leaves': 87, 'reg_alpha': 0.19019398219605718, 'reg_lambda': 0.4030150533270622}. Best is trial 11 with value: 4.680603366038245e-06.
[I 2025-07-29 02:33:07,719] Trial 15 finished with value: 4.975128103084657e-06 and parameters: {'n_estimators': 235, 'learning_rate': 0.06770863644274835, 'max_depth': 4, 'num_leaves': 98, 'reg_alpha': 0.1364483939716521, 'reg_lambda': 0.6680495256978366}. Best is trial 11 with value: 4.680603366038245e-06.
[I 2025-07-29 02:33:08,286] Trial 16 finished with value: 5.0080468788876365e-06 and parameters: {'n_estimators': 427, 'learning_rate': 0.10494567899233215, 'max_depth': 4, 'num_leaves': 75, 'reg_alpha': 0.17334278881162266, 'reg_lambda': 0.41720496383733663}. Best is trial 11 with value: 4.680603366038245e-06.
[I 2025-07-29 02:33:09,133] Trial 17 finished with value: 5.019251650211013e-06 and parameters: {'n_estimators': 722, 'learning_rate': 0.012920259598177358, 'max_depth': 5, 'num_leaves': 89, 'reg_alpha': 0.3910884139536123, 'reg_lambda': 0.2956488137785984}. Best is trial 11 with value: 4.680603366038245e-06.
[I 2025-07-29 02:33:09,494] Trial 18 finished with value: 4.9500066412850375e-06 and parameters: {'n_estimators': 178, 'learning_rate': 0.05237410965342103, 'max_depth': 3, 'num_leaves': 66, 'reg_alpha': 0.11960258529136561, 'reg_lambda': 0.7203117484646322}. Best is trial 11 with value: 4.680603366038245e-06.
[I 2025-07-29 02:33:09,947] Trial 19 finished with value: 5.019251650211013e-06 and parameters: {'n_estimators': 331, 'learning_rate': 0.08730580376618458, 'max_depth': 4, 'num_leaves': 17, 'reg_alpha': 0.2626788503393418, 'reg_lambda': 0.5119547266442943}. Best is trial 11 with value: 4.680603366038245e-06.
[I 2025-07-29 02:33:10,660] Trial 20 finished with value: 5.019251650211013e-06 and parameters: {'n_estimators': 538, 'learning_rate': 0.042284096601264226, 'max_depth': 5, 'num_leaves': 82, 'reg_alpha': 0.8267286130845924, 'reg_lambda': 0.313809240499796}. Best is trial 11 with value: 4.680603366038245e-06.
[I 2025-07-29 02:33:11,334] Trial 21 finished with value: 4.8410141705085716e-06 and parameters: {'n_estimators': 116, 'learning_rate': 0.04405063751327522, 'max_depth': 3, 'num_leaves': 77, 'reg_alpha': 0.009556816650778045, 'reg_lambda': 0.5377024090169766}. Best is trial 11 with value: 4.680603366038245e-06.
[I 2025-07-29 02:33:11,699] Trial 22 finished with value: 4.860369270275539e-06 and parameters: {'n_estimators': 107, 'learning_rate': 0.01120505165646965, 'max_depth': 3, 'num_leaves': 46, 'reg_alpha': 0.07151857134189428, 'reg_lambda': 0.5861818859575898}. Best is trial 11 with value: 4.680603366038245e-06.
[I 2025-07-29 02:33:12,286] Trial 23 finished with value: 4.805642164387871e-06 and parameters: {'n_estimators': 291, 'learning_rate': 0.041152180616937914, 'max_depth': 4, 'num_leaves': 77, 'reg_alpha': 0.06523298881852078, 'reg_lambda': 0.7529992878332235}. Best is trial 11 with value: 4.680603366038245e-06.
[I 2025-07-29 02:33:12,788] Trial 24 finished with value: 5.019251650211013e-06 and parameters: {'n_estimators': 293, 'learning_rate': 0.08112282894285001, 'max_depth': 4, 'num_leaves': 100, 'reg_alpha': 0.2206199620072174, 'reg_lambda': 0.7538236375125477}. Best is trial 11 with value: 4.680603366038245e-06.
[I 2025-07-29 02:33:13,212] Trial 25 finished with value: 4.8576476171089286e-06 and parameters: {'n_estimators': 196, 'learning_rate': 0.03461792320403821, 'max_depth': 4, 'num_leaves': 70, 'reg_alpha': 0.09073115615720828, 'reg_lambda': 0.6591311868013744}. Best is trial 11 with value: 4.680603366038245e-06.
[I 2025-07-29 02:33:13,806] Trial 26 finished with value: 5.019251650211013e-06 and parameters: {'n_estimators': 395, 'learning_rate': 0.0978951079828954, 'max_depth': 6, 'num_leaves': 89, 'reg_alpha': 0.44111219259047335, 'reg_lambda': 0.46488306864481144}. Best is trial 11 with value: 4.680603366038245e-06.
[I 2025-07-29 02:33:14,192] Trial 27 finished with value: 4.820652555207489e-06 and parameters: {'n_estimators': 181, 'learning_rate': 0.12730693582778504, 'max_depth': 3, 'num_leaves': 52, 'reg_alpha': 0.07396720866257155, 'reg_lambda': 0.7934646095105358}. Best is trial 11 with value: 4.680603366038245e-06.
[I 2025-07-29 02:33:14,644] Trial 28 finished with value: 5.019251650211013e-06 and parameters: {'n_estimators': 251, 'learning_rate': 0.14157777323880433, 'max_depth': 5, 'num_leaves': 92, 'reg_alpha': 0.203899045650766, 'reg_lambda': 0.3141807157228097}. Best is trial 11 with value: 4.680603366038245e-06.
[I 2025-07-29 02:33:15,004] Trial 29 finished with value: 5.019251650211013e-06 and parameters: {'n_estimators': 172, 'learning_rate': 0.029026596391377973, 'max_depth': 3, 'num_leaves': 70, 'reg_alpha': 0.3463540319129968, 'reg_lambda': 0.6503277915517098}. Best is trial 11 with value: 4.680603366038245e-06.
[I 2025-07-29 02:33:15,520] Trial 30 finished with value: 5.019251650211013e-06 and parameters: {'n_estimators': 348, 'learning_rate': 0.04897699269111651, 'max_depth': 4, 'num_leaves': 81, 'reg_alpha': 0.2648305951038685, 'reg_lambda': 0.47938538763528865}. Best is trial 11 with value: 4.680603366038245e-06.
[I 2025-07-29 02:33:16,092] Trial 31 finished with value: 5.018344765667974e-06 and parameters: {'n_estimators': 100, 'learning_rate': 0.067494408930857, 'max_depth': 3, 'num_leaves': 75, 'reg_alpha': 0.0008164205573949895, 'reg_lambda': 0.5667452238524748}. Best is trial 11 with value: 4.680603366038245e-06.
[I 2025-07-29 02:33:16,497] Trial 32 finished with value: 4.8109049076038075e-06 and parameters: {'n_estimators': 161, 'learning_rate': 0.05532995492374048, 'max_depth': 3, 'num_leaves': 78, 'reg_alpha': 0.058188589600026125, 'reg_lambda': 0.624562085282731}. Best is trial 11 with value: 4.680603366038245e-06.
[I 2025-07-29 02:33:16,977] Trial 33 finished with value: 4.827276751715754e-06 and parameters: {'n_estimators': 221, 'learning_rate': 0.030870128371816158, 'max_depth': 3, 'num_leaves': 85, 'reg_alpha': 0.0812439464872248, 'reg_lambda': 0.7161159890515976}. Best is trial 11 with value: 4.680603366038245e-06.
[I 2025-07-29 02:33:17,393] Trial 34 finished with value: 4.973923301363707e-06 and parameters: {'n_estimators': 177, 'learning_rate': 0.06050069699922825, 'max_depth': 4, 'num_leaves': 94, 'reg_alpha': 0.13526122391352963, 'reg_lambda': 0.8109302632578299}. Best is trial 11 with value: 4.680603366038245e-06.
[I 2025-07-29 02:33:17,940] Trial 35 finished with value: 4.817479175736205e-06 and parameters: {'n_estimators': 272, 'learning_rate': 0.09116937314568978, 'max_depth': 8, 'num_leaves': 65, 'reg_alpha': 0.05711505183533911, 'reg_lambda': 0.6185329452920739}. Best is trial 11 with value: 4.680603366038245e-06.
[I 2025-07-29 02:33:18,647] Trial 36 finished with value: 4.986068545196644e-06 and parameters: {'n_estimators': 457, 'learning_rate': 0.2117534442421865, 'max_depth': 3, 'num_leaves': 72, 'reg_alpha': 0.15178443493431035, 'reg_lambda': 0.8199632813800621}. Best is trial 11 with value: 4.680603366038245e-06.
[I 2025-07-29 02:33:19,023] Trial 37 finished with value: 5.019251650211013e-06 and parameters: {'n_estimators': 148, 'learning_rate': 0.2777053278419096, 'max_depth': 4, 'num_leaves': 62, 'reg_alpha': 0.7810604718444151, 'reg_lambda': 0.24229371812656214}. Best is trial 11 with value: 4.680603366038245e-06.
[I 2025-07-29 02:33:19,510] Trial 38 finished with value: 5.019251650211013e-06 and parameters: {'n_estimators': 293, 'learning_rate': 0.02880153651108462, 'max_depth': 5, 'num_leaves': 55, 'reg_alpha': 0.23227201718365476, 'reg_lambda': 0.9700018178393089}. Best is trial 11 with value: 4.680603366038245e-06.
[I 2025-07-29 02:33:19,942] Trial 39 finished with value: 5.019251650211013e-06 and parameters: {'n_estimators': 226, 'learning_rate': 0.012808801302626746, 'max_depth': 6, 'num_leaves': 37, 'reg_alpha': 0.31736874673685844, 'reg_lambda': 0.6231927641841737}. Best is trial 11 with value: 4.680603366038245e-06.
[I 2025-07-29 02:33:21,268] Trial 40 finished with value: 4.802368436938918e-06 and parameters: {'n_estimators': 999, 'learning_rate': 0.07991657471119229, 'max_depth': 8, 'num_leaves': 94, 'reg_alpha': 0.05431620357998833, 'reg_lambda': 0.4686243837375877}. Best is trial 11 with value: 4.680603366038245e-06.
[I 2025-07-29 02:33:22,709] Trial 41 finished with value: 4.816626197610572e-06 and parameters: {'n_estimators': 938, 'learning_rate': 0.041680402210216225, 'max_depth': 8, 'num_leaves': 95, 'reg_alpha': 0.05648912193143886, 'reg_lambda': 0.46115961007920253}. Best is trial 11 with value: 4.680603366038245e-06.
[I 2025-07-29 02:33:23,752] Trial 42 finished with value: 4.935569522166391e-06 and parameters: {'n_estimators': 820, 'learning_rate': 0.07767926821929791, 'max_depth': 9, 'num_leaves': 83, 'reg_alpha': 0.10931558621071645, 'reg_lambda': 0.5125426575863643}. Best is trial 11 with value: 4.680603366038245e-06.
[I 2025-07-29 02:33:25,604] Trial 43 finished with value: 4.842800783012012e-06 and parameters: {'n_estimators': 994, 'learning_rate': 0.026395429643559253, 'max_depth': 7, 'num_leaves': 92, 'reg_alpha': 0.04437013074477429, 'reg_lambda': 0.37368465386447075}. Best is trial 11 with value: 4.680603366038245e-06.
[I 2025-07-29 02:33:26,496] Trial 44 finished with value: 4.99816928898093e-06 and parameters: {'n_estimators': 600, 'learning_rate': 0.05732729567536835, 'max_depth': 8, 'num_leaves': 89, 'reg_alpha': 0.1604244300062657, 'reg_lambda': 0.44258669740591466}. Best is trial 11 with value: 4.680603366038245e-06.
[I 2025-07-29 02:33:27,385] Trial 45 finished with value: 4.871996050229785e-06 and parameters: {'n_estimators': 144, 'learning_rate': 0.03857321839086372, 'max_depth': 9, 'num_leaves': 79, 'reg_alpha': 0.03710090682792165, 'reg_lambda': 0.6915036524793191}. Best is trial 11 with value: 4.680603366038245e-06.
[I 2025-07-29 02:33:28,208] Trial 46 finished with value: 4.898926940019861e-06 and parameters: {'n_estimators': 766, 'learning_rate': 0.10679960493686533, 'max_depth': 3, 'num_leaves': 85, 'reg_alpha': 0.10045925615924464, 'reg_lambda': 0.546631880139087}. Best is trial 11 with value: 4.680603366038245e-06.
[I 2025-07-29 02:33:28,819] Trial 47 finished with value: 5.008680579162681e-06 and parameters: {'n_estimators': 528, 'learning_rate': 0.1215574880600782, 'max_depth': 10, 'num_leaves': 95, 'reg_alpha': 0.1744538313037012, 'reg_lambda': 0.36512673951095315}. Best is trial 11 with value: 4.680603366038245e-06.
[I 2025-07-29 02:33:29,321] Trial 48 finished with value: 5.019251650211013e-06 and parameters: {'n_estimators': 366, 'learning_rate': 0.06648934111191265, 'max_depth': 7, 'num_leaves': 100, 'reg_alpha': 0.5666116456803706, 'reg_lambda': 0.13308434739420422}. Best is trial 11 with value: 4.680603366038245e-06.
[I 2025-07-29 02:33:32,835] Trial 49 finished with value: 5.478865494193445e-06 and parameters: {'n_estimators': 675, 'learning_rate': 0.02160818796599876, 'max_depth': 4, 'num_leaves': 59, 'reg_alpha': 0.0017929938941883528, 'reg_lambda': 0.6179294640863888}. Best is trial 11 with value: 4.680603366038245e-06.
[I 2025-07-29 02:33:32,836] A new study created in memory with name: no-name-3d0c0eac-05da-490d-b316-ecb1438136e4
[I 2025-07-29 02:33:36,223] Trial 0 finished with value: 5.019251649998546e-06 and parameters: {'n_estimators': 414, 'learning_rate': 0.037576490678660125, 'max_depth': 7, 'reg_alpha': 0.5550211432704389, 'reg_lambda': 0.09953869030798779}. Best is trial 0 with value: 5.019251649998546e-06.
[I 2025-07-29 02:33:38,239] Trial 1 finished with value: 5.019251649998546e-06 and parameters: {'n_estimators': 224, 'learning_rate': 0.14939590382186213, 'max_depth': 6, 'reg_alpha': 0.4350969724349043, 'reg_lambda': 0.8438887731936909}. Best is trial 0 with value: 5.019251649998546e-06.
[I 2025-07-29 02:33:43,556] Trial 2 finished with value: 5.019251649998546e-06 and parameters: {'n_estimators': 679, 'learning_rate': 0.26640879607366813, 'max_depth': 9, 'reg_alpha': 0.7669123545429858, 'reg_lambda': 0.6517574473102343}. Best is trial 0 with value: 5.019251649998546e-06.
[I 2025-07-29 02:33:48,813] Trial 3 finished with value: 5.019251649998546e-06 and parameters: {'n_estimators': 663, 'learning_rate': 0.17267378374658074, 'max_depth': 7, 'reg_alpha': 0.6553386380884954, 'reg_lambda': 0.5077119253732223}. Best is trial 0 with value: 5.019251649998546e-06.
[I 2025-07-29 02:33:50,003] Trial 4 finished with value: 5.019251649998546e-06 and parameters: {'n_estimators': 115, 'learning_rate': 0.18152039425985297, 'max_depth': 7, 'reg_alpha': 0.8566772146260964, 'reg_lambda': 0.3858781101154076}. Best is trial 0 with value: 5.019251649998546e-06.
[I 2025-07-29 02:33:58,050] Trial 5 finished with value: 4.995696403512431e-06 and parameters: {'n_estimators': 956, 'learning_rate': 0.08438214258582089, 'max_depth': 10, 'reg_alpha': 0.13278557287391468, 'reg_lambda': 0.12923947175337303}. Best is trial 5 with value: 4.995696403512431e-06.
[I 2025-07-29 02:34:02,677] Trial 6 finished with value: 5.019251649998546e-06 and parameters: {'n_estimators': 590, 'learning_rate': 0.22589602371404904, 'max_depth': 9, 'reg_alpha': 0.4958617911579781, 'reg_lambda': 0.08137630371939297}. Best is trial 5 with value: 4.995696403512431e-06.
[I 2025-07-29 02:34:11,446] Trial 7 finished with value: 5.314865777351615e-06 and parameters: {'n_estimators': 846, 'learning_rate': 0.22994620615754385, 'max_depth': 9, 'reg_alpha': 0.004863036597600234, 'reg_lambda': 0.6422120374840824}. Best is trial 5 with value: 4.995696403512431e-06.
[I 2025-07-29 02:34:18,050] Trial 8 finished with value: 5.019251649998546e-06 and parameters: {'n_estimators': 856, 'learning_rate': 0.032082609518441524, 'max_depth': 10, 'reg_alpha': 0.2705998464238656, 'reg_lambda': 0.00970239295379971}. Best is trial 5 with value: 4.995696403512431e-06.
[I 2025-07-29 02:34:19,571] Trial 9 finished with value: 5.019251649998546e-06 and parameters: {'n_estimators': 157, 'learning_rate': 0.0396062388900879, 'max_depth': 3, 'reg_alpha': 0.37112293141353925, 'reg_lambda': 0.4344281987539046}. Best is trial 5 with value: 4.995696403512431e-06.
[I 2025-07-29 02:34:27,621] Trial 10 finished with value: 4.8606286121829554e-06 and parameters: {'n_estimators': 991, 'learning_rate': 0.10182328621264419, 'max_depth': 4, 'reg_alpha': 0.07474045583779093, 'reg_lambda': 0.2529087275215266}. Best is trial 10 with value: 4.8606286121829554e-06.
[I 2025-07-29 02:34:35,780] Trial 11 finished with value: 4.811345799500293e-06 and parameters: {'n_estimators': 994, 'learning_rate': 0.09976390499546745, 'max_depth': 3, 'reg_alpha': 0.04737307670299171, 'reg_lambda': 0.24984674649741911}. Best is trial 11 with value: 4.811345799500293e-06.
[I 2025-07-29 02:34:44,179] Trial 12 finished with value: 4.986150268001579e-06 and parameters: {'n_estimators': 960, 'learning_rate': 0.11480576494829786, 'max_depth': 3, 'reg_alpha': 0.018153270666604743, 'reg_lambda': 0.26516575740427134}. Best is trial 11 with value: 4.811345799500293e-06.
[I 2025-07-29 02:34:50,396] Trial 13 finished with value: 5.019251649998546e-06 and parameters: {'n_estimators': 792, 'learning_rate': 0.10177240545667786, 'max_depth': 5, 'reg_alpha': 0.23129019470865878, 'reg_lambda': 0.2643612180209963}. Best is trial 11 with value: 4.811345799500293e-06.
[I 2025-07-29 02:34:57,972] Trial 14 finished with value: 5.019251649998546e-06 and parameters: {'n_estimators': 976, 'learning_rate': 0.06928750845406724, 'max_depth': 4, 'reg_alpha': 0.19715864987326787, 'reg_lambda': 0.25937193620182114}. Best is trial 11 with value: 4.811345799500293e-06.
[I 2025-07-29 02:35:01,767] Trial 15 finished with value: 4.945537862482583e-06 and parameters: {'n_estimators': 439, 'learning_rate': 0.13221013257970543, 'max_depth': 4, 'reg_alpha': 0.10095197473169602, 'reg_lambda': 0.2191861043395685}. Best is trial 11 with value: 4.811345799500293e-06.
[I 2025-07-29 02:35:07,666] Trial 16 finished with value: 5.019251649998546e-06 and parameters: {'n_estimators': 751, 'learning_rate': 0.06986786810325903, 'max_depth': 5, 'reg_alpha': 0.9941289545976282, 'reg_lambda': 0.38406154780284896}. Best is trial 11 with value: 4.811345799500293e-06.
[I 2025-07-29 02:35:14,743] Trial 17 finished with value: 5.019251649998546e-06 and parameters: {'n_estimators': 873, 'learning_rate': 0.20215195470701558, 'max_depth': 4, 'reg_alpha': 0.30307822424072217, 'reg_lambda': 0.5743545052125715}. Best is trial 11 with value: 4.811345799500293e-06.
