[I 2025-07-28 21:09:00,984] Trial 20 finished with value: 5.163837461617459e-06 and parameters: {'n_estimators': 292, 'max_depth': 19, 'min_samples_split': 14, 'min_samples_leaf': 3, 'max_features': 'log2'}. Best is trial 14 with value: 4.759859142264874e-06.
[I 2025-07-28 21:09:47,320] Trial 21 finished with value: 4.778252905028589e-06 and parameters: {'n_estimators': 351, 'max_depth': 3, 'min_samples_split': 8, 'min_samples_leaf': 5, 'max_features': None}. Best is trial 14 with value: 4.759859142264874e-06.
[I 2025-07-28 21:10:32,991] Trial 22 finished with value: 4.767565425237628e-06 and parameters: {'n_estimators': 347, 'max_depth': 3, 'min_samples_split': 9, 'min_samples_leaf': 6, 'max_features': None}. Best is trial 14 with value: 4.759859142264874e-06.
[I 2025-07-28 21:11:47,200] Trial 23 finished with value: 4.835101431651788e-06 and parameters: {'n_estimators': 308, 'max_depth': 6, 'min_samples_split': 10, 'min_samples_leaf': 6, 'max_features': None}. Best is trial 14 with value: 4.759859142264874e-06.
[I 2025-07-28 21:12:59,736] Trial 24 finished with value: 4.785460204102519e-06 and parameters: {'n_estimators': 427, 'max_depth': 4, 'min_samples_split': 12, 'min_samples_leaf': 7, 'max_features': None}. Best is trial 14 with value: 4.759859142264874e-06.
[I 2025-07-28 21:14:28,216] Trial 25 finished with value: 4.851004583844142e-06 and parameters: {'n_estimators': 371, 'max_depth': 6, 'min_samples_split': 6, 'min_samples_leaf': 7, 'max_features': None}. Best is trial 14 with value: 4.759859142264874e-06.
[I 2025-07-28 21:15:12,589] Trial 26 finished with value: 4.775767803152698e-06 and parameters: {'n_estimators': 336, 'max_depth': 3, 'min_samples_split': 18, 'min_samples_leaf': 4, 'max_features': None}. Best is trial 14 with value: 4.759859142264874e-06.
[I 2025-07-28 21:16:47,569] Trial 27 finished with value: 4.866749620600444e-06 and parameters: {'n_estimators': 289, 'max_depth': 9, 'min_samples_split': 18, 'min_samples_leaf': 4, 'max_features': None}. Best is trial 14 with value: 4.759859142264874e-06.
[I 2025-07-28 21:17:57,685] Trial 28 finished with value: 4.8352483131988835e-06 and parameters: {'n_estimators': 333, 'max_depth': 5, 'min_samples_split': 20, 'min_samples_leaf': 2, 'max_features': None}. Best is trial 14 with value: 4.759859142264874e-06.
[I 2025-07-28 21:18:00,994] Trial 29 finished with value: 5.06099274202911e-06 and parameters: {'n_estimators': 393, 'max_depth': 7, 'min_samples_split': 17, 'min_samples_leaf': 6, 'max_features': 'log2'}. Best is trial 14 with value: 4.759859142264874e-06.
[I 2025-07-28 21:18:06,466] Trial 30 finished with value: 5.015945926296366e-06 and parameters: {'n_estimators': 478, 'max_depth': 4, 'min_samples_split': 15, 'min_samples_leaf': 4, 'max_features': 'sqrt'}. Best is trial 14 with value: 4.759859142264874e-06.
[I 2025-07-28 21:18:52,297] Trial 31 finished with value: 4.765232140009567e-06 and parameters: {'n_estimators': 348, 'max_depth': 3, 'min_samples_split': 19, 'min_samples_leaf': 5, 'max_features': None}. Best is trial 14 with value: 4.759859142264874e-06.
[I 2025-07-28 21:20:01,501] Trial 32 finished with value: 4.810674533725712e-06 and parameters: {'n_estimators': 404, 'max_depth': 4, 'min_samples_split': 19, 'min_samples_leaf': 4, 'max_features': None}. Best is trial 14 with value: 4.759859142264874e-06.
[I 2025-07-28 21:20:45,165] Trial 33 finished with value: 4.749177127169562e-06 and parameters: {'n_estimators': 333, 'max_depth': 3, 'min_samples_split': 18, 'min_samples_leaf': 7, 'max_features': None}. Best is trial 33 with value: 4.749177127169562e-06.
[I 2025-07-28 21:22:15,846] Trial 34 finished with value: 4.830894025256064e-06 and parameters: {'n_estimators': 383, 'max_depth': 6, 'min_samples_split': 20, 'min_samples_leaf': 7, 'max_features': None}. Best is trial 33 with value: 4.749177127169562e-06.
[I 2025-07-28 21:22:19,427] Trial 35 finished with value: 4.974779352720935e-06 and parameters: {'n_estimators': 314, 'max_depth': 4, 'min_samples_split': 18, 'min_samples_leaf': 9, 'max_features': 'sqrt'}. Best is trial 33 with value: 4.749177127169562e-06.
[I 2025-07-28 21:24:14,690] Trial 36 finished with value: 4.924893218242466e-06 and parameters: {'n_estimators': 276, 'max_depth': 16, 'min_samples_split': 12, 'min_samples_leaf': 6, 'max_features': None}. Best is trial 33 with value: 4.749177127169562e-06.
[I 2025-07-28 21:26:53,930] Trial 37 finished with value: 4.901615182981913e-06 and parameters: {'n_estimators': 422, 'max_depth': 14, 'min_samples_split': 16, 'min_samples_leaf': 8, 'max_features': None}. Best is trial 33 with value: 4.749177127169562e-06.
[I 2025-07-28 21:26:57,956] Trial 38 finished with value: 5.000449842464777e-06 and parameters: {'n_estimators': 267, 'max_depth': 6, 'min_samples_split': 19, 'min_samples_leaf': 7, 'max_features': 'sqrt'}. Best is trial 33 with value: 4.749177127169562e-06.
[I 2025-07-28 21:28:06,608] Trial 39 finished with value: 4.870099650955663e-06 and parameters: {'n_estimators': 229, 'max_depth': 8, 'min_samples_split': 17, 'min_samples_leaf': 5, 'max_features': None}. Best is trial 33 with value: 4.749177127169562e-06.
[I 2025-07-28 21:28:07,831] Trial 40 finished with value: 5.0190041440715585e-06 and parameters: {'n_estimators': 189, 'max_depth': 4, 'min_samples_split': 12, 'min_samples_leaf': 9, 'max_features': 'log2'}. Best is trial 33 with value: 4.749177127169562e-06.
[I 2025-07-28 21:28:52,619] Trial 41 finished with value: 4.761193802239167e-06 and parameters: {'n_estimators': 340, 'max_depth': 3, 'min_samples_split': 18, 'min_samples_leaf': 6, 'max_features': None}. Best is trial 33 with value: 4.749177127169562e-06.
[I 2025-07-28 21:29:41,001] Trial 42 finished with value: 4.768418004897744e-06 and parameters: {'n_estimators': 366, 'max_depth': 3, 'min_samples_split': 16, 'min_samples_leaf': 6, 'max_features': None}. Best is trial 33 with value: 4.749177127169562e-06.
[I 2025-07-28 21:30:53,206] Trial 43 finished with value: 4.808933745378414e-06 and parameters: {'n_estimators': 353, 'max_depth': 5, 'min_samples_split': 19, 'min_samples_leaf': 7, 'max_features': None}. Best is trial 33 with value: 4.749177127169562e-06.
[I 2025-07-28 21:31:36,340] Trial 44 finished with value: 4.740327229332642e-06 and parameters: {'n_estimators': 330, 'max_depth': 3, 'min_samples_split': 10, 'min_samples_leaf': 8, 'max_features': None}. Best is trial 44 with value: 4.740327229332642e-06.
[I 2025-07-28 21:32:30,086] Trial 45 finished with value: 4.759557056234403e-06 and parameters: {'n_estimators': 318, 'max_depth': 4, 'min_samples_split': 11, 'min_samples_leaf': 8, 'max_features': None}. Best is trial 44 with value: 4.740327229332642e-06.
[I 2025-07-28 21:32:33,716] Trial 46 finished with value: 4.9753034138615825e-06 and parameters: {'n_estimators': 321, 'max_depth': 4, 'min_samples_split': 11, 'min_samples_leaf': 9, 'max_features': 'sqrt'}. Best is trial 44 with value: 4.740327229332642e-06.
[I 2025-07-28 21:33:54,904] Trial 47 finished with value: 4.814062963573106e-06 and parameters: {'n_estimators': 307, 'max_depth': 7, 'min_samples_split': 10, 'min_samples_leaf': 8, 'max_features': None}. Best is trial 44 with value: 4.740327229332642e-06.
[I 2025-07-28 21:35:17,968] Trial 48 finished with value: 4.832957697367827e-06 and parameters: {'n_estimators': 242, 'max_depth': 12, 'min_samples_split': 13, 'min_samples_leaf': 10, 'max_features': None}. Best is trial 44 with value: 4.740327229332642e-06.
[I 2025-07-28 21:36:15,234] Trial 49 finished with value: 4.783446161429042e-06 and parameters: {'n_estimators': 280, 'max_depth': 5, 'min_samples_split': 13, 'min_samples_leaf': 8, 'max_features': None}. Best is trial 44 with value: 4.740327229332642e-06.
[I 2025-07-28 21:36:15,235] A new study created in memory with name: no-name-0dca93e2-842d-4950-94cc-c5f8f5a2ba2e
[I 2025-07-28 21:38:02,411] Trial 0 finished with value: 4.9739832317382426e-06 and parameters: {'n_estimators': 362, 'max_depth': 7}. Best is trial 0 with value: 4.9739832317382426e-06.
[I 2025-07-28 21:38:30,285] Trial 1 finished with value: 4.782304221728049e-06 and parameters: {'n_estimators': 208, 'max_depth': 3}. Best is trial 1 with value: 4.782304221728049e-06.
[I 2025-07-28 21:39:15,550] Trial 2 finished with value: 4.823752359541279e-06 and parameters: {'n_estimators': 257, 'max_depth': 4}. Best is trial 1 with value: 4.782304221728049e-06.
[I 2025-07-28 21:40:35,960] Trial 3 finished with value: 4.885954229596114e-06 and parameters: {'n_estimators': 371, 'max_depth': 5}. Best is trial 1 with value: 4.782304221728049e-06.
[I 2025-07-28 21:41:50,286] Trial 4 finished with value: 4.885074021035018e-06 and parameters: {'n_estimators': 343, 'max_depth': 5}. Best is trial 1 with value: 4.782304221728049e-06.
[I 2025-07-28 21:42:10,487] Trial 5 finished with value: 4.785236848007329e-06 and parameters: {'n_estimators': 115, 'max_depth': 4}. Best is trial 1 with value: 4.782304221728049e-06.
[I 2025-07-28 21:44:34,436] Trial 6 finished with value: 4.983585015442017e-06 and parameters: {'n_estimators': 433, 'max_depth': 8}. Best is trial 1 with value: 4.782304221728049e-06.
[I 2025-07-28 21:45:38,618] Trial 7 finished with value: 4.837560414549917e-06 and parameters: {'n_estimators': 365, 'max_depth': 4}. Best is trial 1 with value: 4.782304221728049e-06.
[I 2025-07-28 21:47:09,985] Trial 8 finished with value: 4.879587475759773e-06 and parameters: {'n_estimators': 421, 'max_depth': 5}. Best is trial 1 with value: 4.782304221728049e-06.
[I 2025-07-28 21:47:46,192] Trial 9 finished with value: 4.828429242020472e-06 and parameters: {'n_estimators': 206, 'max_depth': 4}. Best is trial 1 with value: 4.782304221728049e-06.
[I 2025-07-28 21:48:43,384] Trial 10 finished with value: 5.031749728636035e-06 and parameters: {'n_estimators': 143, 'max_depth': 10}. Best is trial 1 with value: 4.782304221728049e-06.
[I 2025-07-28 21:48:58,632] Trial 11 finished with value: 4.741690663391845e-06 and parameters: {'n_estimators': 114, 'max_depth': 3}. Best is trial 11 with value: 4.741690663391845e-06.
[I 2025-07-28 21:49:22,978] Trial 12 finished with value: 4.781695705044031e-06 and parameters: {'n_estimators': 182, 'max_depth': 3}. Best is trial 11 with value: 4.741690663391845e-06.
[I 2025-07-28 21:49:45,344] Trial 13 finished with value: 4.769466504532656e-06 and parameters: {'n_estimators': 167, 'max_depth': 3}. Best is trial 11 with value: 4.741690663391845e-06.
[I 2025-07-28 21:50:11,041] Trial 14 finished with value: 4.866842317510026e-06 and parameters: {'n_estimators': 100, 'max_depth': 6}. Best is trial 11 with value: 4.741690663391845e-06.
[I 2025-07-28 21:50:45,727] Trial 15 finished with value: 4.780004733046387e-06 and parameters: {'n_estimators': 259, 'max_depth': 3}. Best is trial 11 with value: 4.741690663391845e-06.
[I 2025-07-28 21:53:45,571] Trial 16 finished with value: 5.011176035837595e-06 and parameters: {'n_estimators': 489, 'max_depth': 9}. Best is trial 11 with value: 4.741690663391845e-06.
[I 2025-07-28 21:54:25,459] Trial 17 finished with value: 4.866827069184173e-06 and parameters: {'n_estimators': 155, 'max_depth': 6}. Best is trial 11 with value: 4.741690663391845e-06.
[I 2025-07-28 21:55:43,403] Trial 18 finished with value: 4.967988110164669e-06 and parameters: {'n_estimators': 263, 'max_depth': 7}. Best is trial 11 with value: 4.741690663391845e-06.
[I 2025-07-28 21:56:04,815] Trial 19 finished with value: 4.765832464697014e-06 and parameters: {'n_estimators': 160, 'max_depth': 3}. Best is trial 11 with value: 4.741690663391845e-06.
[I 2025-07-28 21:56:52,961] Trial 20 finished with value: 4.8591861548705825e-06 and parameters: {'n_estimators': 221, 'max_depth': 5}. Best is trial 11 with value: 4.741690663391845e-06.
[I 2025-07-28 21:57:13,072] Trial 21 finished with value: 4.760993844080049e-06 and parameters: {'n_estimators': 150, 'max_depth': 3}. Best is trial 11 with value: 4.741690663391845e-06.
[I 2025-07-28 21:57:30,695] Trial 22 finished with value: 4.744190959655025e-06 and parameters: {'n_estimators': 131, 'max_depth': 3}. Best is trial 11 with value: 4.741690663391845e-06.
[I 2025-07-28 21:57:52,346] Trial 23 finished with value: 4.796459868236924e-06 and parameters: {'n_estimators': 123, 'max_depth': 4}. Best is trial 11 with value: 4.741690663391845e-06.
[I 2025-07-28 21:58:06,530] Trial 24 finished with value: 4.737346877086479e-06 and parameters: {'n_estimators': 106, 'max_depth': 3}. Best is trial 24 with value: 4.737346877086479e-06.
[I 2025-07-28 21:58:24,286] Trial 25 finished with value: 4.814576416346677e-06 and parameters: {'n_estimators': 101, 'max_depth': 4}. Best is trial 24 with value: 4.737346877086479e-06.
[I 2025-07-28 21:58:49,733] Trial 26 finished with value: 4.773609649894972e-06 and parameters: {'n_estimators': 190, 'max_depth': 3}. Best is trial 24 with value: 4.737346877086479e-06.
[I 2025-07-28 21:59:18,156] Trial 27 finished with value: 4.832586247747255e-06 and parameters: {'n_estimators': 131, 'max_depth': 5}. Best is trial 24 with value: 4.737346877086479e-06.
[I 2025-07-28 22:00:30,675] Trial 28 finished with value: 4.890527166214142e-06 and parameters: {'n_estimators': 282, 'max_depth': 6}. Best is trial 24 with value: 4.737346877086479e-06.
[I 2025-07-28 22:02:15,383] Trial 29 finished with value: 4.97004097279084e-06 and parameters: {'n_estimators': 315, 'max_depth': 8}. Best is trial 24 with value: 4.737346877086479e-06.
[I 2025-07-28 22:02:56,349] Trial 30 finished with value: 4.833755753662595e-06 and parameters: {'n_estimators': 233, 'max_depth': 4}. Best is trial 24 with value: 4.737346877086479e-06.
[I 2025-07-28 22:03:14,537] Trial 31 finished with value: 4.7492166336924425e-06 and parameters: {'n_estimators': 136, 'max_depth': 3}. Best is trial 24 with value: 4.737346877086479e-06.
[I 2025-07-28 22:03:31,964] Trial 32 finished with value: 4.7445459491352896e-06 and parameters: {'n_estimators': 130, 'max_depth': 3}. Best is trial 24 with value: 4.737346877086479e-06.
[I 2025-07-28 22:03:57,296] Trial 33 finished with value: 4.779188921758112e-06 and parameters: {'n_estimators': 189, 'max_depth': 3}. Best is trial 24 with value: 4.737346877086479e-06.
[I 2025-07-28 22:04:18,207] Trial 34 finished with value: 4.790074831528408e-06 and parameters: {'n_estimators': 119, 'max_depth': 4}. Best is trial 24 with value: 4.737346877086479e-06.
[I 2025-07-28 22:04:41,092] Trial 35 finished with value: 4.775005102215608e-06 and parameters: {'n_estimators': 171, 'max_depth': 3}. Best is trial 24 with value: 4.737346877086479e-06.
[I 2025-07-28 22:04:59,011] Trial 36 finished with value: 4.811678139857358e-06 and parameters: {'n_estimators': 102, 'max_depth': 4}. Best is trial 24 with value: 4.737346877086479e-06.
[I 2025-07-28 22:05:49,103] Trial 37 finished with value: 4.879210095054644e-06 and parameters: {'n_estimators': 231, 'max_depth': 5}. Best is trial 24 with value: 4.737346877086479e-06.
[I 2025-07-28 22:06:12,106] Trial 38 finished with value: 4.788108616716491e-06 and parameters: {'n_estimators': 131, 'max_depth': 4}. Best is trial 24 with value: 4.737346877086479e-06.
[I 2025-07-28 22:06:40,326] Trial 39 finished with value: 4.777456762855798e-06 and parameters: {'n_estimators': 211, 'max_depth': 3}. Best is trial 24 with value: 4.737346877086479e-06.
[I 2025-07-28 22:07:05,647] Trial 40 finished with value: 4.792082030972604e-06 and parameters: {'n_estimators': 144, 'max_depth': 4}. Best is trial 24 with value: 4.737346877086479e-06.
[I 2025-07-28 22:07:22,910] Trial 41 finished with value: 4.748337108245533e-06 and parameters: {'n_estimators': 129, 'max_depth': 3}. Best is trial 24 with value: 4.737346877086479e-06.
[I 2025-07-28 22:07:38,713] Trial 42 finished with value: 4.750530227427065e-06 and parameters: {'n_estimators': 118, 'max_depth': 3}. Best is trial 24 with value: 4.737346877086479e-06.
[I 2025-07-28 22:08:02,091] Trial 43 finished with value: 4.7816347346824605e-06 and parameters: {'n_estimators': 175, 'max_depth': 3}. Best is trial 24 with value: 4.737346877086479e-06.
[I 2025-07-28 22:08:55,038] Trial 44 finished with value: 4.785982865274986e-06 and parameters: {'n_estimators': 397, 'max_depth': 3}. Best is trial 24 with value: 4.737346877086479e-06.
[I 2025-07-28 22:09:21,202] Trial 45 finished with value: 4.799948730895748e-06 and parameters: {'n_estimators': 149, 'max_depth': 4}. Best is trial 24 with value: 4.737346877086479e-06.
[I 2025-07-28 22:10:03,801] Trial 46 finished with value: 4.878301319209825e-06 and parameters: {'n_estimators': 197, 'max_depth': 5}. Best is trial 24 with value: 4.737346877086479e-06.
[I 2025-07-28 22:10:23,119] Trial 47 finished with value: 4.785218573708365e-06 and parameters: {'n_estimators': 110, 'max_depth': 4}. Best is trial 24 with value: 4.737346877086479e-06.
[I 2025-07-28 22:11:09,738] Trial 48 finished with value: 4.788384134175056e-06 and parameters: {'n_estimators': 341, 'max_depth': 3}. Best is trial 24 with value: 4.737346877086479e-06.
[I 2025-07-28 22:11:31,782] Trial 49 finished with value: 4.766796374586134e-06 and parameters: {'n_estimators': 164, 'max_depth': 3}. Best is trial 24 with value: 4.737346877086479e-06.
[I 2025-07-28 22:11:31,783] A new study created in memory with name: no-name-38e92763-9215-41ea-b745-d95d22123a97
[I 2025-07-28 22:11:32,128] Trial 0 finished with value: 5.019251650211013e-06 and parameters: {'n_estimators': 187, 'learning_rate': 0.03479281514286112, 'max_depth': 6, 'num_leaves': 59, 'reg_alpha': 0.9655809899813582, 'reg_lambda': 0.6318468518481106}. Best is trial 0 with value: 5.019251650211013e-06.
[I 2025-07-28 22:11:32,721] Trial 1 finished with value: 5.019251650211013e-06 and parameters: {'n_estimators': 561, 'learning_rate': 0.15583732787974736, 'max_depth': 10, 'num_leaves': 48, 'reg_alpha': 0.994199301660825, 'reg_lambda': 0.4112682117689701}. Best is trial 0 with value: 5.019251650211013e-06.
[I 2025-07-28 22:11:33,311] Trial 2 finished with value: 4.922998423839225e-06 and parameters: {'n_estimators': 602, 'learning_rate': 0.11429383512939426, 'max_depth': 10, 'num_leaves': 41, 'reg_alpha': 0.10513381842868375, 'reg_lambda': 0.46562372411826336}. Best is trial 2 with value: 4.922998423839225e-06.
[I 2025-07-28 22:11:33,663] Trial 3 finished with value: 4.9704194085365725e-06 and parameters: {'n_estimators': 218, 'learning_rate': 0.12171289892000095, 'max_depth': 7, 'num_leaves': 93, 'reg_alpha': 0.13243565308154726, 'reg_lambda': 0.8688581047115531}. Best is trial 2 with value: 4.922998423839225e-06.
[I 2025-07-28 22:11:34,053] Trial 4 finished with value: 5.019251650211013e-06 and parameters: {'n_estimators': 357, 'learning_rate': 0.23251190231414948, 'max_depth': 7, 'num_leaves': 21, 'reg_alpha': 0.26059326349735423, 'reg_lambda': 0.8137763420322859}. Best is trial 2 with value: 4.922998423839225e-06.
[I 2025-07-28 22:11:34,781] Trial 5 finished with value: 5.019251650211013e-06 and parameters: {'n_estimators': 842, 'learning_rate': 0.019539704538088416, 'max_depth': 7, 'num_leaves': 32, 'reg_alpha': 0.6137638253967074, 'reg_lambda': 0.7345529894872246}. Best is trial 2 with value: 4.922998423839225e-06.
[I 2025-07-28 22:11:35,109] Trial 6 finished with value: 5.019251650211013e-06 and parameters: {'n_estimators': 206, 'learning_rate': 0.2576137557730752, 'max_depth': 6, 'num_leaves': 94, 'reg_alpha': 0.8170308919309398, 'reg_lambda': 0.4195796412809132}. Best is trial 2 with value: 4.922998423839225e-06.
[I 2025-07-28 22:11:35,526] Trial 7 finished with value: 4.988561741137406e-06 and parameters: {'n_estimators': 321, 'learning_rate': 0.03610292526646968, 'max_depth': 8, 'num_leaves': 65, 'reg_alpha': 0.15443148933106565, 'reg_lambda': 0.6987949344735687}. Best is trial 2 with value: 4.922998423839225e-06.
[I 2025-07-28 22:11:36,050] Trial 8 finished with value: 5.019251650211013e-06 and parameters: {'n_estimators': 537, 'learning_rate': 0.17465734329058014, 'max_depth': 6, 'num_leaves': 70, 'reg_alpha': 0.4449801903921482, 'reg_lambda': 0.9812889390937793}. Best is trial 2 with value: 4.922998423839225e-06.
[I 2025-07-28 22:11:36,799] Trial 9 finished with value: 5.019251650211013e-06 and parameters: {'n_estimators': 900, 'learning_rate': 0.21177737973020447, 'max_depth': 3, 'num_leaves': 48, 'reg_alpha': 0.2430722385020454, 'reg_lambda': 0.7584871207786217}. Best is trial 2 with value: 4.922998423839225e-06.
[I 2025-07-28 22:11:37,721] Trial 10 finished with value: 4.989271028665634e-06 and parameters: {'n_estimators': 728, 'learning_rate': 0.09611767318031375, 'max_depth': 10, 'num_leaves': 12, 'reg_alpha': 0.02817517679929482, 'reg_lambda': 0.10397982155735741}. Best is trial 2 with value: 4.922998423839225e-06.
[I 2025-07-28 22:11:38,569] Trial 11 finished with value: 5.000993367862661e-06 and parameters: {'n_estimators': 578, 'learning_rate': 0.10038440176410339, 'max_depth': 4, 'num_leaves': 94, 'reg_alpha': 0.030862517455337413, 'reg_lambda': 0.22978542550402692}. Best is trial 2 with value: 4.922998423839225e-06.
[I 2025-07-28 22:11:39,102] Trial 12 finished with value: 5.019251650211013e-06 and parameters: {'n_estimators': 428, 'learning_rate': 0.10209287685349339, 'max_depth': 9, 'num_leaves': 77, 'reg_alpha': 0.41398086746231055, 'reg_lambda': 0.5304288467060234}. Best is trial 2 with value: 4.922998423839225e-06.
[I 2025-07-28 22:11:39,773] Trial 13 finished with value: 5.019251650211013e-06 and parameters: {'n_estimators': 740, 'learning_rate': 0.2995138826666897, 'max_depth': 8, 'num_leaves': 34, 'reg_alpha': 0.2858466098562395, 'reg_lambda': 0.9994199626429965}. Best is trial 2 with value: 4.922998423839225e-06.
[I 2025-07-28 22:11:40,446] Trial 14 finished with value: 4.974006751740734e-06 and parameters: {'n_estimators': 682, 'learning_rate': 0.12737551075168835, 'max_depth': 5, 'num_leaves': 81, 'reg_alpha': 0.135462073610211, 'reg_lambda': 0.28294767327047077}. Best is trial 2 with value: 4.922998423839225e-06.
