[I 2025-07-29 05:17:41,263] Trial 9 finished with value: 5.019251650211013e-06 and parameters: {'n_estimators': 646, 'learning_rate': 0.02651670451579583, 'max_depth': 4, 'num_leaves': 99, 'reg_alpha': 0.6846911330313465, 'reg_lambda': 0.3260150924940419}. Best is trial 8 with value: 4.987108905017229e-06.
[I 2025-07-29 05:17:41,565] Trial 10 finished with value: 4.855829792806808e-06 and parameters: {'n_estimators': 108, 'learning_rate': 0.11984067772488373, 'max_depth': 10, 'num_leaves': 73, 'reg_alpha': 0.08477069442175846, 'reg_lambda': 0.08272330128272742}. Best is trial 10 with value: 4.855829792806808e-06.
[I 2025-07-29 05:17:41,850] Trial 11 finished with value: 4.8426850166779475e-06 and parameters: {'n_estimators': 120, 'learning_rate': 0.11183193174296925, 'max_depth': 10, 'num_leaves': 75, 'reg_alpha': 0.08010892802892526, 'reg_lambda': 0.053324401536551796}. Best is trial 11 with value: 4.8426850166779475e-06.
[I 2025-07-29 05:17:42,126] Trial 12 finished with value: 5.019251650211013e-06 and parameters: {'n_estimators': 159, 'learning_rate': 0.11875356109447166, 'max_depth': 10, 'num_leaves': 76, 'reg_alpha': 0.22728247969119109, 'reg_lambda': 0.010744884455453158}. Best is trial 11 with value: 4.8426850166779475e-06.
[I 2025-07-29 05:17:43,827] Trial 13 finished with value: 5.378685999662852e-06 and parameters: {'n_estimators': 110, 'learning_rate': 0.1078229028640382, 'max_depth': 10, 'num_leaves': 74, 'reg_alpha': 0.0017313317051544513, 'reg_lambda': 0.10480873184835005}. Best is trial 11 with value: 4.8426850166779475e-06.
[I 2025-07-29 05:17:44,176] Trial 14 finished with value: 5.019251650211013e-06 and parameters: {'n_estimators': 245, 'learning_rate': 0.13963463637665166, 'max_depth': 9, 'num_leaves': 78, 'reg_alpha': 0.21479381710724388, 'reg_lambda': 0.5315009231648932}. Best is trial 11 with value: 4.8426850166779475e-06.
[I 2025-07-29 05:17:44,501] Trial 15 finished with value: 5.019251650211013e-06 and parameters: {'n_estimators': 205, 'learning_rate': 0.08708736015186933, 'max_depth': 8, 'num_leaves': 66, 'reg_alpha': 0.32771021456543054, 'reg_lambda': 0.40084797958619806}. Best is trial 11 with value: 4.8426850166779475e-06.
[I 2025-07-29 05:17:44,765] Trial 16 finished with value: 4.9472736750819855e-06 and parameters: {'n_estimators': 101, 'learning_rate': 0.1620225790987136, 'max_depth': 9, 'num_leaves': 86, 'reg_alpha': 0.11838610225865973, 'reg_lambda': 0.12774491221587075}. Best is trial 11 with value: 4.8426850166779475e-06.
[I 2025-07-29 05:17:45,571] Trial 17 finished with value: 5.019251650211013e-06 and parameters: {'n_estimators': 994, 'learning_rate': 0.06811531099542495, 'max_depth': 10, 'num_leaves': 48, 'reg_alpha': 0.30011914414410173, 'reg_lambda': 0.6072212653770018}. Best is trial 11 with value: 4.8426850166779475e-06.
[I 2025-07-29 05:17:46,003] Trial 18 finished with value: 4.902754492206114e-06 and parameters: {'n_estimators': 351, 'learning_rate': 0.11194320082169346, 'max_depth': 9, 'num_leaves': 67, 'reg_alpha': 0.09975751723433539, 'reg_lambda': 0.129317772141812}. Best is trial 11 with value: 4.8426850166779475e-06.
[I 2025-07-29 05:17:46,364] Trial 19 finished with value: 5.019251650211013e-06 and parameters: {'n_estimators': 260, 'learning_rate': 0.01081597457691251, 'max_depth': 8, 'num_leaves': 89, 'reg_alpha': 0.41290351081857785, 'reg_lambda': 0.3311337322173181}. Best is trial 11 with value: 4.8426850166779475e-06.
[I 2025-07-29 05:17:46,960] Trial 20 finished with value: 5.019251650211013e-06 and parameters: {'n_estimators': 650, 'learning_rate': 0.17225784065553437, 'max_depth': 7, 'num_leaves': 47, 'reg_alpha': 0.2348959084177541, 'reg_lambda': 0.059917082167068356}. Best is trial 11 with value: 4.8426850166779475e-06.
[I 2025-07-29 05:17:47,384] Trial 21 finished with value: 4.896460190444828e-06 and parameters: {'n_estimators': 346, 'learning_rate': 0.11167854544163915, 'max_depth': 9, 'num_leaves': 68, 'reg_alpha': 0.09827876558746473, 'reg_lambda': 0.1646590530570733}. Best is trial 11 with value: 4.8426850166779475e-06.
[I 2025-07-29 05:17:47,739] Trial 22 finished with value: 4.916600945542544e-06 and parameters: {'n_estimators': 187, 'learning_rate': 0.13248623267601423, 'max_depth': 10, 'num_leaves': 80, 'reg_alpha': 0.10353618585509382, 'reg_lambda': 0.20408810394074972}. Best is trial 11 with value: 4.8426850166779475e-06.
[I 2025-07-29 05:17:48,207] Trial 23 finished with value: 4.822283688652677e-06 and parameters: {'n_estimators': 291, 'learning_rate': 0.09424766142389511, 'max_depth': 9, 'num_leaves': 69, 'reg_alpha': 0.05234080675989655, 'reg_lambda': 0.12539246413828758}. Best is trial 23 with value: 4.822283688652677e-06.
[I 2025-07-29 05:17:48,757] Trial 24 finished with value: 4.8960961490087565e-06 and parameters: {'n_estimators': 272, 'learning_rate': 0.08950407785682729, 'max_depth': 10, 'num_leaves': 58, 'reg_alpha': 0.03579415630413826, 'reg_lambda': 0.32411470266094256}. Best is trial 23 with value: 4.822283688652677e-06.
[I 2025-07-29 05:17:49,055] Trial 25 finished with value: 5.0075647636155e-06 and parameters: {'n_estimators': 169, 'learning_rate': 0.051615237190098535, 'max_depth': 9, 'num_leaves': 83, 'reg_alpha': 0.1724839241185723, 'reg_lambda': 0.006860188486158339}. Best is trial 23 with value: 4.822283688652677e-06.
[I 2025-07-29 05:17:49,306] Trial 26 finished with value: 5.019251650211013e-06 and parameters: {'n_estimators': 115, 'learning_rate': 0.09665608539313864, 'max_depth': 7, 'num_leaves': 71, 'reg_alpha': 0.2502656129788252, 'reg_lambda': 0.08839016509293526}. Best is trial 23 with value: 4.822283688652677e-06.
[I 2025-07-29 05:17:50,584] Trial 27 finished with value: 5.595619767234255e-06 and parameters: {'n_estimators': 218, 'learning_rate': 0.22156588640727343, 'max_depth': 10, 'num_leaves': 96, 'reg_alpha': 0.002809038198845898, 'reg_lambda': 0.26554277150031724}. Best is trial 23 with value: 4.822283688652677e-06.
[I 2025-07-29 05:17:50,868] Trial 28 finished with value: 5.019251650211013e-06 and parameters: {'n_estimators': 158, 'learning_rate': 0.12354484655577089, 'max_depth': 9, 'num_leaves': 63, 'reg_alpha': 0.31857000196303, 'reg_lambda': 0.15293686531904432}. Best is trial 23 with value: 4.822283688652677e-06.
[I 2025-07-29 05:17:51,527] Trial 29 finished with value: 5.019251650211013e-06 and parameters: {'n_estimators': 745, 'learning_rate': 0.0626190424201078, 'max_depth': 3, 'num_leaves': 50, 'reg_alpha': 0.5758872392677676, 'reg_lambda': 0.3949382149365767}. Best is trial 23 with value: 4.822283688652677e-06.
[I 2025-07-29 05:17:52,003] Trial 30 finished with value: 5.019251650211013e-06 and parameters: {'n_estimators': 400, 'learning_rate': 0.2829551962423946, 'max_depth': 7, 'num_leaves': 72, 'reg_alpha': 0.4166933153154143, 'reg_lambda': 0.26780689890743387}. Best is trial 23 with value: 4.822283688652677e-06.
[I 2025-07-29 05:17:52,449] Trial 31 finished with value: 4.826967171112382e-06 and parameters: {'n_estimators': 284, 'learning_rate': 0.08481804923836202, 'max_depth': 10, 'num_leaves': 58, 'reg_alpha': 0.052498628089247455, 'reg_lambda': 0.3214001753143093}. Best is trial 23 with value: 4.822283688652677e-06.
[I 2025-07-29 05:17:52,864] Trial 32 finished with value: 4.816687081584918e-06 and parameters: {'n_estimators': 298, 'learning_rate': 0.0769248375296738, 'max_depth': 10, 'num_leaves': 62, 'reg_alpha': 0.07113024857811075, 'reg_lambda': 0.07823338949800862}. Best is trial 32 with value: 4.816687081584918e-06.
[I 2025-07-29 05:17:53,240] Trial 33 finished with value: 5.006711709822572e-06 and parameters: {'n_estimators': 326, 'learning_rate': 0.07725379946357776, 'max_depth': 9, 'num_leaves': 39, 'reg_alpha': 0.17094602986416113, 'reg_lambda': 0.18734377248624848}. Best is trial 32 with value: 4.816687081584918e-06.
[I 2025-07-29 05:17:53,617] Trial 34 finished with value: 4.822863046074289e-06 and parameters: {'n_estimators': 280, 'learning_rate': 0.09010639781423427, 'max_depth': 10, 'num_leaves': 59, 'reg_alpha': 0.07483739452815241, 'reg_lambda': 0.06692592057245236}. Best is trial 32 with value: 4.816687081584918e-06.
[I 2025-07-29 05:17:54,016] Trial 35 finished with value: 5.001740935964321e-06 and parameters: {'n_estimators': 287, 'learning_rate': 0.05041961121259199, 'max_depth': 10, 'num_leaves': 61, 'reg_alpha': 0.16256487052893243, 'reg_lambda': 0.2590932035465006}. Best is trial 32 with value: 4.816687081584918e-06.
[I 2025-07-29 05:17:54,371] Trial 36 finished with value: 5.019251650211013e-06 and parameters: {'n_estimators': 303, 'learning_rate': 0.0732504122788623, 'max_depth': 8, 'num_leaves': 53, 'reg_alpha': 0.7655448790088911, 'reg_lambda': 0.5189832053328916}. Best is trial 32 with value: 4.816687081584918e-06.
[I 2025-07-29 05:17:55,104] Trial 37 finished with value: 4.815211257581693e-06 and parameters: {'n_estimators': 474, 'learning_rate': 0.030883423473505693, 'max_depth': 9, 'num_leaves': 42, 'reg_alpha': 0.04925700931878724, 'reg_lambda': 0.6899853259985317}. Best is trial 37 with value: 4.815211257581693e-06.
[I 2025-07-29 05:17:55,569] Trial 38 finished with value: 5.019251650211013e-06 and parameters: {'n_estimators': 487, 'learning_rate': 0.028361119080178604, 'max_depth': 6, 'num_leaves': 37, 'reg_alpha': 0.27688962274197015, 'reg_lambda': 0.8028581868326522}. Best is trial 37 with value: 4.815211257581693e-06.
[I 2025-07-29 05:17:56,069] Trial 39 finished with value: 5.019251650211013e-06 and parameters: {'n_estimators': 579, 'learning_rate': 0.012690335187326051, 'max_depth': 9, 'num_leaves': 25, 'reg_alpha': 0.19270309712697542, 'reg_lambda': 0.6962522015658086}. Best is trial 37 with value: 4.815211257581693e-06.
[I 2025-07-29 05:17:56,496] Trial 40 finished with value: 5.019251650211013e-06 and parameters: {'n_estimators': 426, 'learning_rate': 0.041626782491449354, 'max_depth': 8, 'num_leaves': 42, 'reg_alpha': 0.9794028813405387, 'reg_lambda': 0.6667536734817083}. Best is trial 37 with value: 4.815211257581693e-06.
[I 2025-07-29 05:17:57,133] Trial 41 finished with value: 4.874676867146012e-06 and parameters: {'n_estimators': 490, 'learning_rate': 0.09468601307793224, 'max_depth': 9, 'num_leaves': 57, 'reg_alpha': 0.0419356770816609, 'reg_lambda': 0.8290511120535593}. Best is trial 37 with value: 4.815211257581693e-06.
[I 2025-07-29 05:17:57,615] Trial 42 finished with value: 4.8286897187733066e-06 and parameters: {'n_estimators': 369, 'learning_rate': 0.062388900463624955, 'max_depth': 10, 'num_leaves': 54, 'reg_alpha': 0.06808144496919613, 'reg_lambda': 0.7324503683471875}. Best is trial 37 with value: 4.815211257581693e-06.
[I 2025-07-29 05:17:58,220] Trial 43 finished with value: 4.976198229068509e-06 and parameters: {'n_estimators': 570, 'learning_rate': 0.038837916095582, 'max_depth': 10, 'num_leaves': 63, 'reg_alpha': 0.13762009441982037, 'reg_lambda': 0.5564321103540903}. Best is trial 37 with value: 4.815211257581693e-06.
[I 2025-07-29 05:17:58,671] Trial 44 finished with value: 4.840113357711248e-06 and parameters: {'n_estimators': 243, 'learning_rate': 0.07896815950277562, 'max_depth': 9, 'num_leaves': 33, 'reg_alpha': 0.05090110549459337, 'reg_lambda': 0.9743966431390866}. Best is trial 37 with value: 4.815211257581693e-06.
[I 2025-07-29 05:18:00,773] Trial 45 finished with value: 5.401755512496945e-06 and parameters: {'n_estimators': 395, 'learning_rate': 0.15056301222135424, 'max_depth': 10, 'num_leaves': 60, 'reg_alpha': 0.0023112937433064015, 'reg_lambda': 0.45705672731155084}. Best is trial 37 with value: 4.815211257581693e-06.
[I 2025-07-29 05:18:01,196] Trial 46 finished with value: 4.9762564597682e-06 and parameters: {'n_estimators': 310, 'learning_rate': 0.09710749254418542, 'max_depth': 5, 'num_leaves': 44, 'reg_alpha': 0.13754403300707796, 'reg_lambda': 0.058044989677370144}. Best is trial 37 with value: 4.815211257581693e-06.
[I 2025-07-29 05:18:01,925] Trial 47 finished with value: 5.019251650211013e-06 and parameters: {'n_estimators': 764, 'learning_rate': 0.0246609441353753, 'max_depth': 9, 'num_leaves': 52, 'reg_alpha': 0.5668374467944248, 'reg_lambda': 0.22122456531569007}. Best is trial 37 with value: 4.815211257581693e-06.
[I 2025-07-29 05:18:02,568] Trial 48 finished with value: 4.79900738121666e-06 and parameters: {'n_estimators': 450, 'learning_rate': 0.06030715303379237, 'max_depth': 10, 'num_leaves': 65, 'reg_alpha': 0.057769907464481296, 'reg_lambda': 0.5954677731088353}. Best is trial 48 with value: 4.79900738121666e-06.
[I 2025-07-29 05:18:03,106] Trial 49 finished with value: 5.019251650211013e-06 and parameters: {'n_estimators': 454, 'learning_rate': 0.04932836326781595, 'max_depth': 8, 'num_leaves': 69, 'reg_alpha': 0.2030816694058507, 'reg_lambda': 0.6235741454044074}. Best is trial 48 with value: 4.79900738121666e-06.
[I 2025-07-29 05:18:03,106] A new study created in memory with name: no-name-2d44db28-e9fd-40da-8a45-c197c0274a9b
[I 2025-07-29 05:18:08,411] Trial 0 finished with value: 5.019251649998546e-06 and parameters: {'n_estimators': 678, 'learning_rate': 0.18068615141396646, 'max_depth': 3, 'reg_alpha': 0.2036705336159651, 'reg_lambda': 0.5836098557097023}. Best is trial 0 with value: 5.019251649998546e-06.
[I 2025-07-29 05:18:14,128] Trial 1 finished with value: 5.019251649998546e-06 and parameters: {'n_estimators': 734, 'learning_rate': 0.08433449927077416, 'max_depth': 8, 'reg_alpha': 0.6084165268833329, 'reg_lambda': 0.7072161777734101}. Best is trial 0 with value: 5.019251649998546e-06.
[I 2025-07-29 05:18:20,286] Trial 2 finished with value: 5.019251649998546e-06 and parameters: {'n_estimators': 786, 'learning_rate': 0.19510529407145394, 'max_depth': 8, 'reg_alpha': 0.31661383847323865, 'reg_lambda': 0.2257941425343688}. Best is trial 0 with value: 5.019251649998546e-06.
[I 2025-07-29 05:18:24,764] Trial 3 finished with value: 5.019251649998546e-06 and parameters: {'n_estimators': 561, 'learning_rate': 0.25728728506774745, 'max_depth': 6, 'reg_alpha': 0.624701075183134, 'reg_lambda': 0.1062269414151995}. Best is trial 0 with value: 5.019251649998546e-06.
[I 2025-07-29 05:18:30,113] Trial 4 finished with value: 5.019251649998546e-06 and parameters: {'n_estimators': 683, 'learning_rate': 0.2033937491054118, 'max_depth': 7, 'reg_alpha': 0.18551824983329823, 'reg_lambda': 0.0817377869149355}. Best is trial 0 with value: 5.019251649998546e-06.
[I 2025-07-29 05:18:37,493] Trial 5 finished with value: 5.019251649998546e-06 and parameters: {'n_estimators': 955, 'learning_rate': 0.07444882251652943, 'max_depth': 7, 'reg_alpha': 0.7946370396293834, 'reg_lambda': 0.048144689426633414}. Best is trial 0 with value: 5.019251649998546e-06.
[I 2025-07-29 05:18:38,708] Trial 6 finished with value: 5.019251649998546e-06 and parameters: {'n_estimators': 115, 'learning_rate': 0.12013813458306734, 'max_depth': 9, 'reg_alpha': 0.2515499167645905, 'reg_lambda': 0.8953499553352726}. Best is trial 0 with value: 5.019251649998546e-06.
[I 2025-07-29 05:18:42,375] Trial 7 finished with value: 5.019251649998546e-06 and parameters: {'n_estimators': 405, 'learning_rate': 0.07753443716835169, 'max_depth': 4, 'reg_alpha': 0.8816483988563658, 'reg_lambda': 0.3406893454697386}. Best is trial 0 with value: 5.019251649998546e-06.
[I 2025-07-29 05:18:45,781] Trial 8 finished with value: 5.019251649998546e-06 and parameters: {'n_estimators': 424, 'learning_rate': 0.24348098909935836, 'max_depth': 9, 'reg_alpha': 0.8767864653773123, 'reg_lambda': 0.16620110930051923}. Best is trial 0 with value: 5.019251649998546e-06.
[I 2025-07-29 05:18:53,017] Trial 9 finished with value: 5.019251649998546e-06 and parameters: {'n_estimators': 929, 'learning_rate': 0.13787295315855494, 'max_depth': 7, 'reg_alpha': 0.6506375808208068, 'reg_lambda': 0.07694869454766384}. Best is trial 0 with value: 5.019251649998546e-06.
[I 2025-07-29 05:18:55,134] Trial 10 finished with value: 4.895211472450803e-06 and parameters: {'n_estimators': 201, 'learning_rate': 0.29676953153043484, 'max_depth': 3, 'reg_alpha': 0.02853776666685867, 'reg_lambda': 0.5716565942229478}. Best is trial 10 with value: 4.895211472450803e-06.
[I 2025-07-29 05:18:57,288] Trial 11 finished with value: 5.218676658927756e-06 and parameters: {'n_estimators': 170, 'learning_rate': 0.28848714306311546, 'max_depth': 3, 'reg_alpha': 0.016010975161442592, 'reg_lambda': 0.5570517056332647}. Best is trial 10 with value: 4.895211472450803e-06.
[I 2025-07-29 05:19:01,379] Trial 12 finished with value: 4.804658986591854e-06 and parameters: {'n_estimators': 291, 'learning_rate': 0.028951288866817998, 'max_depth': 4, 'reg_alpha': 0.05100657991600399, 'reg_lambda': 0.5562799457462341}. Best is trial 12 with value: 4.804658986591854e-06.
[I 2025-07-29 05:19:11,102] Trial 13 finished with value: 5.111253545289743e-06 and parameters: {'n_estimators': 277, 'learning_rate': 0.012829962864299965, 'max_depth': 5, 'reg_alpha': 0.00014521049282590487, 'reg_lambda': 0.4107920346833084}. Best is trial 12 with value: 4.804658986591854e-06.
[I 2025-07-29 05:19:13,671] Trial 14 finished with value: 5.019251649998546e-06 and parameters: {'n_estimators': 296, 'learning_rate': 0.29508141848339237, 'max_depth': 5, 'reg_alpha': 0.405655092186213, 'reg_lambda': 0.7529415700922869}. Best is trial 12 with value: 4.804658986591854e-06.
[I 2025-07-29 05:19:17,072] Trial 15 finished with value: 4.956933199910125e-06 and parameters: {'n_estimators': 275, 'learning_rate': 0.02220702337863295, 'max_depth': 4, 'reg_alpha': 0.10956532407791916, 'reg_lambda': 0.9877825173172836}. Best is trial 12 with value: 4.804658986591854e-06.
[I 2025-07-29 05:19:20,772] Trial 16 finished with value: 5.019251649998546e-06 and parameters: {'n_estimators': 453, 'learning_rate': 0.22855324404349842, 'max_depth': 4, 'reg_alpha': 0.40130537684362744, 'reg_lambda': 0.6977321452355345}. Best is trial 12 with value: 4.804658986591854e-06.
[I 2025-07-29 05:19:22,678] Trial 17 finished with value: 4.9367938644207895e-06 and parameters: {'n_estimators': 191, 'learning_rate': 0.1598314432123145, 'max_depth': 3, 'reg_alpha': 0.10232745173199981, 'reg_lambda': 0.44466928337421996}. Best is trial 12 with value: 4.804658986591854e-06.
[I 2025-07-29 05:19:26,850] Trial 18 finished with value: 5.019251649998546e-06 and parameters: {'n_estimators': 522, 'learning_rate': 0.04279820276468183, 'max_depth': 5, 'reg_alpha': 0.45724786062488676, 'reg_lambda': 0.2988454537648517}. Best is trial 12 with value: 4.804658986591854e-06.
[I 2025-07-29 05:19:29,911] Trial 19 finished with value: 4.956426843133637e-06 and parameters: {'n_estimators': 339, 'learning_rate': 0.1056169626641159, 'max_depth': 4, 'reg_alpha': 0.10982971998190968, 'reg_lambda': 0.6250730475340603}. Best is trial 12 with value: 4.804658986591854e-06.
[I 2025-07-29 05:19:31,661] Trial 20 finished with value: 5.019251649998546e-06 and parameters: {'n_estimators': 185, 'learning_rate': 0.05129602745563082, 'max_depth': 10, 'reg_alpha': 0.9987944534520203, 'reg_lambda': 0.8241100065984172}. Best is trial 12 with value: 4.804658986591854e-06.
[I 2025-07-29 05:19:32,907] Trial 21 finished with value: 4.9190640568079035e-06 and parameters: {'n_estimators': 101, 'learning_rate': 0.16018243147619254, 'max_depth': 3, 'reg_alpha': 0.09529634607845348, 'reg_lambda': 0.47013676051727327}. Best is trial 12 with value: 4.804658986591854e-06.
[I 2025-07-29 05:19:34,066] Trial 22 finished with value: 5.019251649998546e-06 and parameters: {'n_estimators': 108, 'learning_rate': 0.16316958825680095, 'max_depth': 3, 'reg_alpha': 0.28821487482766706, 'reg_lambda': 0.48251171746962895}. Best is trial 12 with value: 4.804658986591854e-06.
[I 2025-07-29 05:19:36,128] Trial 23 finished with value: 4.822686434798187e-06 and parameters: {'n_estimators': 210, 'learning_rate': 0.26561124802711666, 'max_depth': 3, 'reg_alpha': 0.06409085638900695, 'reg_lambda': 0.5567832519366883}. Best is trial 12 with value: 4.804658986591854e-06.
[I 2025-07-29 05:19:40,333] Trial 24 finished with value: 5.5947394294659975e-06 and parameters: {'n_estimators': 366, 'learning_rate': 0.26873414688536884, 'max_depth': 4, 'reg_alpha': 0.0064267733797950324, 'reg_lambda': 0.6565534829889079}. Best is trial 12 with value: 4.804658986591854e-06.
[I 2025-07-29 05:19:42,239] Trial 25 finished with value: 5.010363716693544e-06 and parameters: {'n_estimators': 206, 'learning_rate': 0.22404305729806967, 'max_depth': 5, 'reg_alpha': 0.16986168158097625, 'reg_lambda': 0.5386240257827037}. Best is trial 12 with value: 4.804658986591854e-06.
[I 2025-07-29 05:19:44,487] Trial 26 finished with value: 5.019251649998546e-06 and parameters: {'n_estimators': 249, 'learning_rate': 0.27372304977139333, 'max_depth': 6, 'reg_alpha': 0.34314211005008466, 'reg_lambda': 0.3819101498122361}. Best is trial 12 with value: 4.804658986591854e-06.
[I 2025-07-29 05:19:48,797] Trial 27 finished with value: 4.829244776457456e-06 and parameters: {'n_estimators': 512, 'learning_rate': 0.24536223943440963, 'max_depth': 3, 'reg_alpha': 0.06500485761459504, 'reg_lambda': 0.828429843925144}. Best is trial 12 with value: 4.804658986591854e-06.
[I 2025-07-29 05:19:53,010] Trial 28 finished with value: 5.019251649998546e-06 and parameters: {'n_estimators': 518, 'learning_rate': 0.21676140409274214, 'max_depth': 4, 'reg_alpha': 0.5332771790914171, 'reg_lambda': 0.9036712000896828}. Best is trial 12 with value: 4.804658986591854e-06.
[I 2025-07-29 05:19:57,871] Trial 29 finished with value: 5.019251649998546e-06 and parameters: {'n_estimators': 591, 'learning_rate': 0.19063755798236134, 'max_depth': 3, 'reg_alpha': 0.22508316518224966, 'reg_lambda': 0.7970752147129108}. Best is trial 12 with value: 4.804658986591854e-06.
[I 2025-07-29 05:20:02,049] Trial 30 finished with value: 5.007323678501741e-06 and parameters: {'n_estimators': 481, 'learning_rate': 0.2506904628942964, 'max_depth': 6, 'reg_alpha': 0.15987085384604172, 'reg_lambda': 0.6356170227907894}. Best is trial 12 with value: 4.804658986591854e-06.
