[I 2025-07-29 01:12:25,122] Trial 49 finished with value: 5.019251649998546e-06 and parameters: {'n_estimators': 680, 'learning_rate': 0.0492587419795963, 'max_depth': 10, 'reg_alpha': 0.21517769836854914, 'reg_lambda': 0.7384142275975639}. Best is trial 41 with value: 4.88170146744196e-06.
[I 2025-07-29 01:12:25,123] A new study created in memory with name: no-name-c63fd90c-5176-411f-b488-3e1fcf75979b
[I 2025-07-29 01:12:34,370] Trial 0 finished with value: 5.1428522350133365e-06 and parameters: {'n_estimators': 342, 'max_depth': 15, 'min_samples_split': 7, 'min_samples_leaf': 3, 'max_features': 'sqrt'}. Best is trial 0 with value: 5.1428522350133365e-06.
[I 2025-07-29 01:12:37,333] Trial 1 finished with value: 5.09283261074063e-06 and parameters: {'n_estimators': 304, 'max_depth': 10, 'min_samples_split': 14, 'min_samples_leaf': 7, 'max_features': 'log2'}. Best is trial 1 with value: 5.09283261074063e-06.
[I 2025-07-29 01:12:39,099] Trial 2 finished with value: 5.0371815337232396e-06 and parameters: {'n_estimators': 246, 'max_depth': 5, 'min_samples_split': 4, 'min_samples_leaf': 5, 'max_features': 'log2'}. Best is trial 2 with value: 5.0371815337232396e-06.
[I 2025-07-29 01:12:41,467] Trial 3 finished with value: 5.035188601105855e-06 and parameters: {'n_estimators': 103, 'max_depth': 18, 'min_samples_split': 13, 'min_samples_leaf': 7, 'max_features': 'sqrt'}. Best is trial 3 with value: 5.035188601105855e-06.
[I 2025-07-29 01:12:45,529] Trial 4 finished with value: 5.007917118348283e-06 and parameters: {'n_estimators': 355, 'max_depth': 4, 'min_samples_split': 16, 'min_samples_leaf': 4, 'max_features': 'sqrt'}. Best is trial 4 with value: 5.007917118348283e-06.
[I 2025-07-29 01:14:11,836] Trial 5 finished with value: 4.96598529463662e-06 and parameters: {'n_estimators': 185, 'max_depth': 19, 'min_samples_split': 11, 'min_samples_leaf': 4, 'max_features': None}. Best is trial 5 with value: 4.96598529463662e-06.
[I 2025-07-29 01:14:15,943] Trial 6 finished with value: 5.1000621741533425e-06 and parameters: {'n_estimators': 479, 'max_depth': 7, 'min_samples_split': 15, 'min_samples_leaf': 3, 'max_features': 'log2'}. Best is trial 5 with value: 4.96598529463662e-06.
[I 2025-07-29 01:14:18,208] Trial 7 finished with value: 5.070537313305975e-06 and parameters: {'n_estimators': 208, 'max_depth': 14, 'min_samples_split': 17, 'min_samples_leaf': 6, 'max_features': 'log2'}. Best is trial 5 with value: 4.96598529463662e-06.
[I 2025-07-29 01:14:22,223] Trial 8 finished with value: 5.076243253264285e-06 and parameters: {'n_estimators': 420, 'max_depth': 11, 'min_samples_split': 20, 'min_samples_leaf': 9, 'max_features': 'log2'}. Best is trial 5 with value: 4.96598529463662e-06.
[I 2025-07-29 01:17:20,870] Trial 9 finished with value: 4.95017566443004e-06 and parameters: {'n_estimators': 424, 'max_depth': 19, 'min_samples_split': 14, 'min_samples_leaf': 6, 'max_features': None}. Best is trial 9 with value: 4.95017566443004e-06.
[I 2025-07-29 01:21:31,909] Trial 10 finished with value: 5.117008908279558e-06 and parameters: {'n_estimators': 498, 'max_depth': 16, 'min_samples_split': 9, 'min_samples_leaf': 1, 'max_features': None}. Best is trial 9 with value: 4.95017566443004e-06.
[I 2025-07-29 01:22:26,089] Trial 11 finished with value: 4.817459540399746e-06 and parameters: {'n_estimators': 145, 'max_depth': 19, 'min_samples_split': 10, 'min_samples_leaf': 9, 'max_features': None}. Best is trial 11 with value: 4.817459540399746e-06.
[I 2025-07-29 01:23:10,775] Trial 12 finished with value: 4.804593972362491e-06 and parameters: {'n_estimators': 124, 'max_depth': 20, 'min_samples_split': 7, 'min_samples_leaf': 10, 'max_features': None}. Best is trial 12 with value: 4.804593972362491e-06.
[I 2025-07-29 01:24:00,961] Trial 13 finished with value: 4.811645515829329e-06 and parameters: {'n_estimators': 139, 'max_depth': 20, 'min_samples_split': 3, 'min_samples_leaf': 10, 'max_features': None}. Best is trial 12 with value: 4.804593972362491e-06.
[I 2025-07-29 01:24:38,301] Trial 14 finished with value: 4.8082658597909e-06 and parameters: {'n_estimators': 104, 'max_depth': 20, 'min_samples_split': 2, 'min_samples_leaf': 10, 'max_features': None}. Best is trial 12 with value: 4.804593972362491e-06.
[I 2025-07-29 01:26:04,867] Trial 15 finished with value: 4.8348602353303335e-06 and parameters: {'n_estimators': 247, 'max_depth': 13, 'min_samples_split': 6, 'min_samples_leaf': 10, 'max_features': None}. Best is trial 12 with value: 4.804593972362491e-06.
[I 2025-07-29 01:26:43,543] Trial 16 finished with value: 4.845359356639602e-06 and parameters: {'n_estimators': 100, 'max_depth': 17, 'min_samples_split': 2, 'min_samples_leaf': 8, 'max_features': None}. Best is trial 12 with value: 4.804593972362491e-06.
[I 2025-07-29 01:27:33,344] Trial 17 finished with value: 4.795088372564132e-06 and parameters: {'n_estimators': 174, 'max_depth': 8, 'min_samples_split': 6, 'min_samples_leaf': 9, 'max_features': None}. Best is trial 17 with value: 4.795088372564132e-06.
[I 2025-07-29 01:28:25,951] Trial 18 finished with value: 4.8295115989242875e-06 and parameters: {'n_estimators': 181, 'max_depth': 8, 'min_samples_split': 7, 'min_samples_leaf': 8, 'max_features': None}. Best is trial 17 with value: 4.795088372564132e-06.
[I 2025-07-29 01:29:37,625] Trial 19 finished with value: 4.807761212613192e-06 and parameters: {'n_estimators': 250, 'max_depth': 8, 'min_samples_split': 5, 'min_samples_leaf': 9, 'max_features': None}. Best is trial 17 with value: 4.795088372564132e-06.
[I 2025-07-29 01:29:40,768] Trial 20 finished with value: 5.024015564265729e-06 and parameters: {'n_estimators': 159, 'max_depth': 10, 'min_samples_split': 8, 'min_samples_leaf': 8, 'max_features': 'sqrt'}. Best is trial 17 with value: 4.795088372564132e-06.
[I 2025-07-29 01:30:37,844] Trial 21 finished with value: 4.7905982536551095e-06 and parameters: {'n_estimators': 218, 'max_depth': 7, 'min_samples_split': 5, 'min_samples_leaf': 9, 'max_features': None}. Best is trial 21 with value: 4.7905982536551095e-06.
[I 2025-07-29 01:31:26,281] Trial 22 finished with value: 4.786903516141433e-06 and parameters: {'n_estimators': 207, 'max_depth': 6, 'min_samples_split': 5, 'min_samples_leaf': 9, 'max_features': None}. Best is trial 22 with value: 4.786903516141433e-06.
[I 2025-07-29 01:32:20,098] Trial 23 finished with value: 4.825818633268731e-06 and parameters: {'n_estimators': 225, 'max_depth': 6, 'min_samples_split': 5, 'min_samples_leaf': 7, 'max_features': None}. Best is trial 22 with value: 4.786903516141433e-06.
[I 2025-07-29 01:33:08,192] Trial 24 finished with value: 4.731112100538123e-06 and parameters: {'n_estimators': 285, 'max_depth': 4, 'min_samples_split': 4, 'min_samples_leaf': 9, 'max_features': None}. Best is trial 24 with value: 4.731112100538123e-06.
[I 2025-07-29 01:33:48,353] Trial 25 finished with value: 4.7289109128099206e-06 and parameters: {'n_estimators': 297, 'max_depth': 3, 'min_samples_split': 4, 'min_samples_leaf': 8, 'max_features': None}. Best is trial 25 with value: 4.7289109128099206e-06.
[I 2025-07-29 01:34:24,607] Trial 26 finished with value: 4.726822165079981e-06 and parameters: {'n_estimators': 275, 'max_depth': 3, 'min_samples_split': 3, 'min_samples_leaf': 8, 'max_features': None}. Best is trial 26 with value: 4.726822165079981e-06.
[I 2025-07-29 01:35:02,854] Trial 27 finished with value: 4.727937612403077e-06 and parameters: {'n_estimators': 290, 'max_depth': 3, 'min_samples_split': 3, 'min_samples_leaf': 8, 'max_features': None}. Best is trial 26 with value: 4.726822165079981e-06.
[I 2025-07-29 01:35:05,698] Trial 28 finished with value: 5.000326683086389e-06 and parameters: {'n_estimators': 301, 'max_depth': 3, 'min_samples_split': 2, 'min_samples_leaf': 7, 'max_features': 'sqrt'}. Best is trial 26 with value: 4.726822165079981e-06.
[I 2025-07-29 01:35:50,451] Trial 29 finished with value: 4.769108904330003e-06 and parameters: {'n_estimators': 338, 'max_depth': 3, 'min_samples_split': 3, 'min_samples_leaf': 6, 'max_features': None}. Best is trial 26 with value: 4.726822165079981e-06.
[I 2025-07-29 01:35:54,495] Trial 30 finished with value: 4.990198216729414e-06 and parameters: {'n_estimators': 356, 'max_depth': 4, 'min_samples_split': 3, 'min_samples_leaf': 8, 'max_features': 'sqrt'}. Best is trial 26 with value: 4.726822165079981e-06.
[I 2025-07-29 01:36:31,159] Trial 31 finished with value: 4.725707006463049e-06 and parameters: {'n_estimators': 277, 'max_depth': 3, 'min_samples_split': 4, 'min_samples_leaf': 8, 'max_features': None}. Best is trial 31 with value: 4.725707006463049e-06.
[I 2025-07-29 01:37:14,930] Trial 32 finished with value: 4.740340136401932e-06 and parameters: {'n_estimators': 332, 'max_depth': 3, 'min_samples_split': 4, 'min_samples_leaf': 8, 'max_features': None}. Best is trial 31 with value: 4.725707006463049e-06.
[I 2025-07-29 01:38:12,009] Trial 33 finished with value: 4.803106779371049e-06 and parameters: {'n_estimators': 275, 'max_depth': 5, 'min_samples_split': 7, 'min_samples_leaf': 7, 'max_features': None}. Best is trial 31 with value: 4.725707006463049e-06.
[I 2025-07-29 01:38:14,302] Trial 34 finished with value: 5.061274486319137e-06 and parameters: {'n_estimators': 316, 'max_depth': 5, 'min_samples_split': 3, 'min_samples_leaf': 5, 'max_features': 'log2'}. Best is trial 31 with value: 4.725707006463049e-06.
[I 2025-07-29 01:39:03,993] Trial 35 finished with value: 4.760118650969459e-06 and parameters: {'n_estimators': 375, 'max_depth': 3, 'min_samples_split': 9, 'min_samples_leaf': 7, 'max_features': None}. Best is trial 31 with value: 4.725707006463049e-06.
[I 2025-07-29 01:39:59,009] Trial 36 finished with value: 4.791498671276885e-06 and parameters: {'n_estimators': 267, 'max_depth': 5, 'min_samples_split': 12, 'min_samples_leaf': 8, 'max_features': None}. Best is trial 31 with value: 4.725707006463049e-06.
[I 2025-07-29 01:40:04,945] Trial 37 finished with value: 5.0366672849018875e-06 and parameters: {'n_estimators': 388, 'max_depth': 6, 'min_samples_split': 4, 'min_samples_leaf': 6, 'max_features': 'sqrt'}. Best is trial 31 with value: 4.725707006463049e-06.
[I 2025-07-29 01:40:06,773] Trial 38 finished with value: 5.037426936209854e-06 and parameters: {'n_estimators': 289, 'max_depth': 4, 'min_samples_split': 6, 'min_samples_leaf': 7, 'max_features': 'log2'}. Best is trial 31 with value: 4.725707006463049e-06.
[I 2025-07-29 01:42:02,724] Trial 39 finished with value: 4.938884344779824e-06 and parameters: {'n_estimators': 325, 'max_depth': 10, 'min_samples_split': 2, 'min_samples_leaf': 5, 'max_features': None}. Best is trial 31 with value: 4.725707006463049e-06.
[I 2025-07-29 01:42:48,362] Trial 40 finished with value: 4.820817485207745e-06 and parameters: {'n_estimators': 259, 'max_depth': 4, 'min_samples_split': 8, 'min_samples_leaf': 1, 'max_features': None}. Best is trial 31 with value: 4.725707006463049e-06.
[I 2025-07-29 01:43:26,071] Trial 41 finished with value: 4.7258198247181455e-06 and parameters: {'n_estimators': 286, 'max_depth': 3, 'min_samples_split': 4, 'min_samples_leaf': 8, 'max_features': None}. Best is trial 31 with value: 4.725707006463049e-06.
[I 2025-07-29 01:43:57,579] Trial 42 finished with value: 4.738621390208735e-06 and parameters: {'n_estimators': 239, 'max_depth': 3, 'min_samples_split': 4, 'min_samples_leaf': 8, 'max_features': None}. Best is trial 31 with value: 4.725707006463049e-06.
[I 2025-07-29 01:44:59,421] Trial 43 finished with value: 4.788593081746816e-06 and parameters: {'n_estimators': 301, 'max_depth': 5, 'min_samples_split': 3, 'min_samples_leaf': 8, 'max_features': None}. Best is trial 31 with value: 4.725707006463049e-06.
[I 2025-07-29 01:45:01,168] Trial 44 finished with value: 5.0303922675986915e-06 and parameters: {'n_estimators': 313, 'max_depth': 3, 'min_samples_split': 20, 'min_samples_leaf': 7, 'max_features': 'log2'}. Best is trial 31 with value: 4.725707006463049e-06.
[I 2025-07-29 01:46:18,462] Trial 45 finished with value: 4.86421689300864e-06 and parameters: {'n_estimators': 277, 'max_depth': 7, 'min_samples_split': 17, 'min_samples_leaf': 3, 'max_features': None}. Best is trial 31 with value: 4.725707006463049e-06.
[I 2025-07-29 01:46:58,214] Trial 46 finished with value: 4.794045369591969e-06 and parameters: {'n_estimators': 231, 'max_depth': 4, 'min_samples_split': 4, 'min_samples_leaf': 6, 'max_features': None}. Best is trial 31 with value: 4.725707006463049e-06.
[I 2025-07-29 01:48:11,636] Trial 47 finished with value: 4.779049517043535e-06 and parameters: {'n_estimators': 361, 'max_depth': 5, 'min_samples_split': 6, 'min_samples_leaf': 9, 'max_features': None}. Best is trial 31 with value: 4.725707006463049e-06.
[I 2025-07-29 01:49:21,227] Trial 48 finished with value: 4.816438016314692e-06 and parameters: {'n_estimators': 290, 'max_depth': 6, 'min_samples_split': 2, 'min_samples_leaf': 7, 'max_features': None}. Best is trial 31 with value: 4.725707006463049e-06.
[I 2025-07-29 01:49:22,703] Trial 49 finished with value: 5.01602946527663e-06 and parameters: {'n_estimators': 261, 'max_depth': 3, 'min_samples_split': 5, 'min_samples_leaf': 10, 'max_features': 'log2'}. Best is trial 31 with value: 4.725707006463049e-06.
[I 2025-07-29 01:49:22,704] A new study created in memory with name: no-name-2e52c4ae-1b40-41c1-badc-e617a7465a94
[I 2025-07-29 01:51:40,237] Trial 0 finished with value: 4.962692154667346e-06 and parameters: {'n_estimators': 463, 'max_depth': 7}. Best is trial 0 with value: 4.962692154667346e-06.
[I 2025-07-29 01:54:05,988] Trial 1 finished with value: 4.964548050810736e-06 and parameters: {'n_estimators': 491, 'max_depth': 7}. Best is trial 0 with value: 4.962692154667346e-06.
[I 2025-07-29 01:55:01,290] Trial 2 finished with value: 4.821596851264785e-06 and parameters: {'n_estimators': 313, 'max_depth': 4}. Best is trial 2 with value: 4.821596851264785e-06.
[I 2025-07-29 01:56:43,645] Trial 3 finished with value: 4.974368545084517e-06 and parameters: {'n_estimators': 344, 'max_depth': 7}. Best is trial 2 with value: 4.821596851264785e-06.
[I 2025-07-29 01:57:18,278] Trial 4 finished with value: 4.844474217047517e-06 and parameters: {'n_estimators': 134, 'max_depth': 6}. Best is trial 2 with value: 4.821596851264785e-06.
[I 2025-07-29 01:59:53,923] Trial 5 finished with value: 5.017882127138807e-06 and parameters: {'n_estimators': 422, 'max_depth': 9}. Best is trial 2 with value: 4.821596851264785e-06.
[I 2025-07-29 02:00:58,268] Trial 6 finished with value: 4.9063634913655235e-06 and parameters: {'n_estimators': 248, 'max_depth': 6}. Best is trial 2 with value: 4.821596851264785e-06.
[I 2025-07-29 02:01:30,450] Trial 7 finished with value: 4.92817393928038e-06 and parameters: {'n_estimators': 108, 'max_depth': 7}. Best is trial 2 with value: 4.821596851264785e-06.
[I 2025-07-29 02:03:12,579] Trial 8 finished with value: 4.869207114008041e-06 and parameters: {'n_estimators': 469, 'max_depth': 5}. Best is trial 2 with value: 4.821596851264785e-06.
[I 2025-07-29 02:03:56,446] Trial 9 finished with value: 4.945093875866507e-06 and parameters: {'n_estimators': 131, 'max_depth': 8}. Best is trial 2 with value: 4.821596851264785e-06.
[I 2025-07-29 02:04:31,130] Trial 10 finished with value: 4.779294078392488e-06 and parameters: {'n_estimators': 258, 'max_depth': 3}. Best is trial 10 with value: 4.779294078392488e-06.
[I 2025-07-29 02:05:05,695] Trial 11 finished with value: 4.780282835076504e-06 and parameters: {'n_estimators': 257, 'max_depth': 3}. Best is trial 10 with value: 4.779294078392488e-06.
[I 2025-07-29 02:05:35,372] Trial 12 finished with value: 4.77405728822735e-06 and parameters: {'n_estimators': 221, 'max_depth': 3}. Best is trial 12 with value: 4.77405728822735e-06.
[I 2025-07-29 02:06:01,084] Trial 13 finished with value: 4.774708163867212e-06 and parameters: {'n_estimators': 191, 'max_depth': 3}. Best is trial 12 with value: 4.77405728822735e-06.
[I 2025-07-29 02:06:33,610] Trial 14 finished with value: 4.826870122391491e-06 and parameters: {'n_estimators': 184, 'max_depth': 4}. Best is trial 12 with value: 4.77405728822735e-06.
[I 2025-07-29 02:07:07,885] Trial 15 finished with value: 4.83163713522166e-06 and parameters: {'n_estimators': 193, 'max_depth': 4}. Best is trial 12 with value: 4.77405728822735e-06.
[I 2025-07-29 02:08:31,368] Trial 16 finished with value: 5.0584753865747e-06 and parameters: {'n_estimators': 207, 'max_depth': 10}. Best is trial 12 with value: 4.77405728822735e-06.
[I 2025-07-29 02:09:21,267] Trial 17 finished with value: 4.788701110179454e-06 and parameters: {'n_estimators': 368, 'max_depth': 3}. Best is trial 12 with value: 4.77405728822735e-06.
[I 2025-07-29 02:09:58,066] Trial 18 finished with value: 4.8598958747473e-06 and parameters: {'n_estimators': 168, 'max_depth': 5}. Best is trial 12 with value: 4.77405728822735e-06.
[I 2025-07-29 02:10:46,929] Trial 19 finished with value: 4.8590984411937016e-06 and parameters: {'n_estimators': 222, 'max_depth': 5}. Best is trial 12 with value: 4.77405728822735e-06.
[I 2025-07-29 02:11:40,490] Trial 20 finished with value: 4.825277394095448e-06 and parameters: {'n_estimators': 301, 'max_depth': 4}. Best is trial 12 with value: 4.77405728822735e-06.
[I 2025-07-29 02:12:16,491] Trial 21 finished with value: 4.778933893151949e-06 and parameters: {'n_estimators': 265, 'max_depth': 3}. Best is trial 12 with value: 4.77405728822735e-06.
[I 2025-07-29 02:12:48,441] Trial 22 finished with value: 4.787780185817779e-06 and parameters: {'n_estimators': 235, 'max_depth': 3}. Best is trial 12 with value: 4.77405728822735e-06.
[I 2025-07-29 02:13:25,846] Trial 23 finished with value: 4.77279530529163e-06 and parameters: {'n_estimators': 276, 'max_depth': 3}. Best is trial 23 with value: 4.77279530529163e-06.
[I 2025-07-29 02:13:54,091] Trial 24 finished with value: 4.809126351945215e-06 and parameters: {'n_estimators': 159, 'max_depth': 4}. Best is trial 23 with value: 4.77279530529163e-06.
[I 2025-07-29 02:14:58,015] Trial 25 finished with value: 4.868853348482591e-06 and parameters: {'n_estimators': 291, 'max_depth': 5}. Best is trial 23 with value: 4.77279530529163e-06.
[I 2025-07-29 02:15:44,932] Trial 26 finished with value: 4.787872929103306e-06 and parameters: {'n_estimators': 346, 'max_depth': 3}. Best is trial 23 with value: 4.77279530529163e-06.
[I 2025-07-29 02:16:22,978] Trial 27 finished with value: 4.823262664861098e-06 and parameters: {'n_estimators': 214, 'max_depth': 4}. Best is trial 23 with value: 4.77279530529163e-06.
[I 2025-07-29 02:17:00,836] Trial 28 finished with value: 4.773914162972079e-06 and parameters: {'n_estimators': 278, 'max_depth': 3}. Best is trial 23 with value: 4.77279530529163e-06.
[I 2025-07-29 02:18:45,634] Trial 29 finished with value: 4.9292800380539655e-06 and parameters: {'n_estimators': 406, 'max_depth': 6}. Best is trial 23 with value: 4.77279530529163e-06.
[I 2025-07-29 02:19:56,171] Trial 30 finished with value: 4.878046895481845e-06 and parameters: {'n_estimators': 323, 'max_depth': 5}. Best is trial 23 with value: 4.77279530529163e-06.
[I 2025-07-29 02:20:34,856] Trial 31 finished with value: 4.7714961386388925e-06 and parameters: {'n_estimators': 286, 'max_depth': 3}. Best is trial 31 with value: 4.7714961386388925e-06.
[I 2025-07-29 02:21:11,259] Trial 32 finished with value: 4.775524237718164e-06 and parameters: {'n_estimators': 270, 'max_depth': 3}. Best is trial 31 with value: 4.7714961386388925e-06.
[I 2025-07-29 02:22:00,059] Trial 33 finished with value: 4.816239525674907e-06 and parameters: {'n_estimators': 276, 'max_depth': 4}. Best is trial 31 with value: 4.7714961386388925e-06.
[I 2025-07-29 02:22:58,082] Trial 34 finished with value: 4.838158275177169e-06 and parameters: {'n_estimators': 328, 'max_depth': 4}. Best is trial 31 with value: 4.7714961386388925e-06.
[I 2025-07-29 02:23:48,215] Trial 35 finished with value: 4.788877451744711e-06 and parameters: {'n_estimators': 372, 'max_depth': 3}. Best is trial 31 with value: 4.7714961386388925e-06.
[I 2025-07-29 02:24:40,034] Trial 36 finished with value: 4.819898712203031e-06 and parameters: {'n_estimators': 292, 'max_depth': 4}. Best is trial 31 with value: 4.7714961386388925e-06.
[I 2025-07-29 02:25:59,428] Trial 37 finished with value: 5.003381468453178e-06 and parameters: {'n_estimators': 236, 'max_depth': 8}. Best is trial 31 with value: 4.7714961386388925e-06.
[I 2025-07-29 02:26:41,023] Trial 38 finished with value: 4.78105479804988e-06 and parameters: {'n_estimators': 306, 'max_depth': 3}. Best is trial 31 with value: 4.7714961386388925e-06.
[I 2025-07-29 02:27:42,366] Trial 39 finished with value: 4.83624081165684e-06 and parameters: {'n_estimators': 344, 'max_depth': 4}. Best is trial 31 with value: 4.7714961386388925e-06.
[I 2025-07-29 02:28:55,987] Trial 40 finished with value: 4.893637307091654e-06 and parameters: {'n_estimators': 283, 'max_depth': 6}. Best is trial 31 with value: 4.7714961386388925e-06.
[I 2025-07-29 02:29:28,079] Trial 41 finished with value: 4.7880208233427514e-06 and parameters: {'n_estimators': 236, 'max_depth': 3}. Best is trial 31 with value: 4.7714961386388925e-06.
[I 2025-07-29 02:29:54,646] Trial 42 finished with value: 4.780877145932583e-06 and parameters: {'n_estimators': 195, 'max_depth': 3}. Best is trial 31 with value: 4.7714961386388925e-06.
[I 2025-07-29 02:30:15,726] Trial 43 finished with value: 4.764688933211831e-06 and parameters: {'n_estimators': 155, 'max_depth': 3}. Best is trial 43 with value: 4.764688933211831e-06.
[I 2025-07-29 02:30:30,019] Trial 44 finished with value: 4.74174884168738e-06 and parameters: {'n_estimators': 105, 'max_depth': 3}. Best is trial 44 with value: 4.74174884168738e-06.
[I 2025-07-29 02:30:48,044] Trial 45 finished with value: 4.814576416346677e-06 and parameters: {'n_estimators': 101, 'max_depth': 4}. Best is trial 44 with value: 4.74174884168738e-06.
