[I 2025-07-28 20:47:52,226] Trial 44 finished with value: 4.790941423486016e-06 and parameters: {'n_estimators': 162, 'learning_rate': 0.05743783984069467, 'max_depth': 8, 'num_leaves': 49, 'reg_alpha': 0.053751563914026496, 'reg_lambda': 0.6640465639048538}. Best is trial 44 with value: 4.790941423486016e-06.
[I 2025-07-28 20:47:52,759] Trial 45 finished with value: 4.848965145292378e-06 and parameters: {'n_estimators': 156, 'learning_rate': 0.04513071720311236, 'max_depth': 7, 'num_leaves': 48, 'reg_alpha': 0.04342325898069751, 'reg_lambda': 0.6651570854583742}. Best is trial 44 with value: 4.790941423486016e-06.
[I 2025-07-28 20:47:53,068] Trial 46 finished with value: 5.019251650211013e-06 and parameters: {'n_estimators': 231, 'learning_rate': 0.06018894043691097, 'max_depth': 8, 'num_leaves': 42, 'reg_alpha': 0.6966719247154054, 'reg_lambda': 0.7438827280618454}. Best is trial 44 with value: 4.790941423486016e-06.
[I 2025-07-28 20:47:53,372] Trial 47 finished with value: 4.961504668607922e-06 and parameters: {'n_estimators': 173, 'learning_rate': 0.011982526209060047, 'max_depth': 8, 'num_leaves': 27, 'reg_alpha': 0.12462608388937224, 'reg_lambda': 0.6116343605176866}. Best is trial 44 with value: 4.790941423486016e-06.
[I 2025-07-28 20:47:54,458] Trial 48 finished with value: 4.9103050742731095e-06 and parameters: {'n_estimators': 258, 'learning_rate': 0.0273391407364923, 'max_depth': 9, 'num_leaves': 42, 'reg_alpha': 0.03538336603751095, 'reg_lambda': 0.5378509891319172}. Best is trial 44 with value: 4.790941423486016e-06.
[I 2025-07-28 20:47:54,788] Trial 49 finished with value: 5.019251650211013e-06 and parameters: {'n_estimators': 209, 'learning_rate': 0.053238009317123434, 'max_depth': 7, 'num_leaves': 52, 'reg_alpha': 0.5989603023835574, 'reg_lambda': 0.7602862071652388}. Best is trial 44 with value: 4.790941423486016e-06.
[I 2025-07-28 20:47:54,788] A new study created in memory with name: no-name-2a13eb02-5df1-4628-9ec7-402d1d5a5d94
[I 2025-07-28 20:48:00,505] Trial 0 finished with value: 5.019251649998546e-06 and parameters: {'n_estimators': 780, 'learning_rate': 0.08866216742323972, 'max_depth': 3, 'reg_alpha': 0.8602317286753902, 'reg_lambda': 0.4985469326396742}. Best is trial 0 with value: 5.019251649998546e-06.
[I 2025-07-28 20:48:03,133] Trial 1 finished with value: 5.019251649998546e-06 and parameters: {'n_estimators': 326, 'learning_rate': 0.05724050888942335, 'max_depth': 10, 'reg_alpha': 0.4643629395090558, 'reg_lambda': 0.12125994094492998}. Best is trial 0 with value: 5.019251649998546e-06.
[I 2025-07-28 20:48:10,379] Trial 2 finished with value: 5.019251649998546e-06 and parameters: {'n_estimators': 984, 'learning_rate': 0.07759036092202687, 'max_depth': 9, 'reg_alpha': 0.45537576029355464, 'reg_lambda': 0.2916247465973978}. Best is trial 0 with value: 5.019251649998546e-06.
[I 2025-07-28 20:48:11,831] Trial 3 finished with value: 5.019251649998546e-06 and parameters: {'n_estimators': 155, 'learning_rate': 0.13803970667065968, 'max_depth': 4, 'reg_alpha': 0.2662393016661808, 'reg_lambda': 0.6909971951085624}. Best is trial 0 with value: 5.019251649998546e-06.
[I 2025-07-28 20:48:15,912] Trial 4 finished with value: 5.019251649998546e-06 and parameters: {'n_estimators': 551, 'learning_rate': 0.22316371250593184, 'max_depth': 9, 'reg_alpha': 0.6106557670710755, 'reg_lambda': 0.9738459277759524}. Best is trial 0 with value: 5.019251649998546e-06.
[I 2025-07-28 20:48:17,227] Trial 5 finished with value: 5.019251649998546e-06 and parameters: {'n_estimators': 141, 'learning_rate': 0.111065445560602, 'max_depth': 5, 'reg_alpha': 0.8991432880073161, 'reg_lambda': 0.038709401175885505}. Best is trial 0 with value: 5.019251649998546e-06.
[I 2025-07-28 20:48:21,077] Trial 6 finished with value: 5.019251649998546e-06 and parameters: {'n_estimators': 502, 'learning_rate': 0.16464852908291536, 'max_depth': 5, 'reg_alpha': 0.7848758643719769, 'reg_lambda': 0.6504120017022063}. Best is trial 0 with value: 5.019251649998546e-06.
[I 2025-07-28 20:48:27,650] Trial 7 finished with value: 5.019251649998546e-06 and parameters: {'n_estimators': 865, 'learning_rate': 0.01881656805205572, 'max_depth': 9, 'reg_alpha': 0.6692962314549821, 'reg_lambda': 0.9441464446945578}. Best is trial 0 with value: 5.019251649998546e-06.
[I 2025-07-28 20:48:32,956] Trial 8 finished with value: 5.019251649998546e-06 and parameters: {'n_estimators': 723, 'learning_rate': 0.25148462182226605, 'max_depth': 3, 'reg_alpha': 0.5390568105071857, 'reg_lambda': 0.8614359323145637}. Best is trial 0 with value: 5.019251649998546e-06.
[I 2025-07-28 20:48:36,524] Trial 9 finished with value: 5.019251649998546e-06 and parameters: {'n_estimators': 463, 'learning_rate': 0.06112961513052881, 'max_depth': 6, 'reg_alpha': 0.8758373426743283, 'reg_lambda': 0.24803603012864128}. Best is trial 0 with value: 5.019251649998546e-06.
[I 2025-07-28 20:48:42,896] Trial 10 finished with value: 5.30231255806075e-06 and parameters: {'n_estimators': 730, 'learning_rate': 0.2938633987452509, 'max_depth': 7, 'reg_alpha': 0.01686302922406635, 'reg_lambda': 0.537212523142651}. Best is trial 0 with value: 5.019251649998546e-06.
[I 2025-07-28 20:48:45,415] Trial 11 finished with value: 5.019251649998546e-06 and parameters: {'n_estimators': 310, 'learning_rate': 0.03074781851339769, 'max_depth': 7, 'reg_alpha': 0.3103785288764312, 'reg_lambda': 0.2885205501055743}. Best is trial 0 with value: 5.019251649998546e-06.
[I 2025-07-28 20:48:48,414] Trial 12 finished with value: 5.019251649998546e-06 and parameters: {'n_estimators': 308, 'learning_rate': 0.08981802865836716, 'max_depth': 10, 'reg_alpha': 0.3657416016945485, 'reg_lambda': 0.001420027573209623}. Best is trial 0 with value: 5.019251649998546e-06.
[I 2025-07-28 20:48:54,396] Trial 13 finished with value: 4.981510599282004e-06 and parameters: {'n_estimators': 688, 'learning_rate': 0.15750982483628814, 'max_depth': 3, 'reg_alpha': 0.1327483346822289, 'reg_lambda': 0.431132657927783}. Best is trial 13 with value: 4.981510599282004e-06.
[I 2025-07-28 20:49:00,333] Trial 14 finished with value: 4.9054465582223734e-06 and parameters: {'n_estimators': 672, 'learning_rate': 0.17260469445645388, 'max_depth': 3, 'reg_alpha': 0.09136627677301179, 'reg_lambda': 0.44457337042615885}. Best is trial 14 with value: 4.9054465582223734e-06.
[I 2025-07-28 20:49:07,475] Trial 15 finished with value: 5.449865377147097e-06 and parameters: {'n_estimators': 608, 'learning_rate': 0.19014134230913815, 'max_depth': 4, 'reg_alpha': 0.0032330213330324375, 'reg_lambda': 0.42254980054919256}. Best is trial 14 with value: 4.9054465582223734e-06.
[I 2025-07-28 20:49:13,054] Trial 16 finished with value: 5.019251649998546e-06 and parameters: {'n_estimators': 644, 'learning_rate': 0.19677149683281464, 'max_depth': 3, 'reg_alpha': 0.2012688285670141, 'reg_lambda': 0.4017183131396876}. Best is trial 14 with value: 4.9054465582223734e-06.
[I 2025-07-28 20:49:20,505] Trial 17 finished with value: 4.987697736846225e-06 and parameters: {'n_estimators': 866, 'learning_rate': 0.1434875559051154, 'max_depth': 4, 'reg_alpha': 0.1390670142789531, 'reg_lambda': 0.6707807928796512}. Best is trial 14 with value: 4.9054465582223734e-06.
[I 2025-07-28 20:49:24,340] Trial 18 finished with value: 4.9855626371511785e-06 and parameters: {'n_estimators': 418, 'learning_rate': 0.17444212765214878, 'max_depth': 5, 'reg_alpha': 0.13321330589255326, 'reg_lambda': 0.5489107151769679}. Best is trial 14 with value: 4.9054465582223734e-06.
[I 2025-07-28 20:49:30,099] Trial 19 finished with value: 4.963994765863286e-06 and parameters: {'n_estimators': 639, 'learning_rate': 0.2338274458558729, 'max_depth': 6, 'reg_alpha': 0.09727102390319875, 'reg_lambda': 0.3892060886780515}. Best is trial 14 with value: 4.9054465582223734e-06.
[I 2025-07-28 20:49:37,123] Trial 20 finished with value: 5.019251649998546e-06 and parameters: {'n_estimators': 844, 'learning_rate': 0.2517911205713911, 'max_depth': 8, 'reg_alpha': 0.38156374415342054, 'reg_lambda': 0.1683310349249445}. Best is trial 14 with value: 4.9054465582223734e-06.
[I 2025-07-28 20:49:42,866] Trial 21 finished with value: 4.974186857154286e-06 and parameters: {'n_estimators': 652, 'learning_rate': 0.2146898874222898, 'max_depth': 6, 'reg_alpha': 0.10447800277955284, 'reg_lambda': 0.3784180740613926}. Best is trial 14 with value: 4.9054465582223734e-06.
[I 2025-07-28 20:49:48,512] Trial 22 finished with value: 4.902467426191409e-06 and parameters: {'n_estimators': 614, 'learning_rate': 0.22160149383157396, 'max_depth': 6, 'reg_alpha': 0.07367464676964189, 'reg_lambda': 0.3223344673880162}. Best is trial 22 with value: 4.902467426191409e-06.
[I 2025-07-28 20:49:54,019] Trial 23 finished with value: 5.019251649998546e-06 and parameters: {'n_estimators': 583, 'learning_rate': 0.25160133906483634, 'max_depth': 6, 'reg_alpha': 0.22586238979884368, 'reg_lambda': 0.31981283071523037}. Best is trial 22 with value: 4.902467426191409e-06.
[I 2025-07-28 20:50:01,227] Trial 24 finished with value: 4.9508204482682966e-06 and parameters: {'n_estimators': 804, 'learning_rate': 0.2928896007815456, 'max_depth': 7, 'reg_alpha': 0.05658264627982146, 'reg_lambda': 0.21587478514200786}. Best is trial 22 with value: 4.902467426191409e-06.
[I 2025-07-28 20:50:10,082] Trial 25 finished with value: 5.082508338910058e-06 and parameters: {'n_estimators': 968, 'learning_rate': 0.289522284410887, 'max_depth': 8, 'reg_alpha': 0.02832938580675841, 'reg_lambda': 0.18895633645716753}. Best is trial 22 with value: 4.902467426191409e-06.
[I 2025-07-28 20:50:16,643] Trial 26 finished with value: 5.019251649998546e-06 and parameters: {'n_estimators': 805, 'learning_rate': 0.270339959764428, 'max_depth': 7, 'reg_alpha': 0.19241652997383474, 'reg_lambda': 0.10179057397679658}. Best is trial 22 with value: 4.902467426191409e-06.
[I 2025-07-28 20:50:24,273] Trial 27 finished with value: 5.019251649998546e-06 and parameters: {'n_estimators': 908, 'learning_rate': 0.20146139870745214, 'max_depth': 8, 'reg_alpha': 0.3137535566612624, 'reg_lambda': 0.22452867738818216}. Best is trial 22 with value: 4.902467426191409e-06.
[I 2025-07-28 20:50:31,198] Trial 28 finished with value: 4.867044628901111e-06 and parameters: {'n_estimators': 763, 'learning_rate': 0.12399883768269143, 'max_depth': 5, 'reg_alpha': 0.07313641719648253, 'reg_lambda': 0.5995568435285896}. Best is trial 28 with value: 4.867044628901111e-06.
[I 2025-07-28 20:50:37,634] Trial 29 finished with value: 5.019251649998546e-06 and parameters: {'n_estimators': 742, 'learning_rate': 0.12694720173659918, 'max_depth': 4, 'reg_alpha': 0.18785708142228547, 'reg_lambda': 0.6011856240885514}. Best is trial 28 with value: 4.867044628901111e-06.
[I 2025-07-28 20:50:42,252] Trial 30 finished with value: 5.019251649998546e-06 and parameters: {'n_estimators': 524, 'learning_rate': 0.11122086241112758, 'max_depth': 5, 'reg_alpha': 0.2579748311436414, 'reg_lambda': 0.7592568167094353}. Best is trial 28 with value: 4.867044628901111e-06.
[I 2025-07-28 20:50:50,133] Trial 31 finished with value: 4.872285868610077e-06 and parameters: {'n_estimators': 784, 'learning_rate': 0.18062095967143615, 'max_depth': 7, 'reg_alpha': 0.042395570631807704, 'reg_lambda': 0.5278839335584042}. Best is trial 28 with value: 4.867044628901111e-06.
[I 2025-07-28 20:50:56,741] Trial 32 finished with value: 4.8954621442578875e-06 and parameters: {'n_estimators': 771, 'learning_rate': 0.17896932319793904, 'max_depth': 5, 'reg_alpha': 0.07566905669184174, 'reg_lambda': 0.4696835485165089}. Best is trial 28 with value: 4.867044628901111e-06.
[I 2025-07-28 20:51:03,635] Trial 33 finished with value: 4.839464076168115e-06 and parameters: {'n_estimators': 780, 'learning_rate': 0.1829129144548854, 'max_depth': 5, 'reg_alpha': 0.05969315394640643, 'reg_lambda': 0.4778005281839215}. Best is trial 33 with value: 4.839464076168115e-06.
[I 2025-07-28 20:51:12,827] Trial 34 finished with value: 5.319445503960353e-06 and parameters: {'n_estimators': 936, 'learning_rate': 0.1814564544753529, 'max_depth': 5, 'reg_alpha': 0.004173177753198823, 'reg_lambda': 0.48261181577316775}. Best is trial 33 with value: 4.839464076168115e-06.
[I 2025-07-28 20:51:19,225] Trial 35 finished with value: 5.005031693149251e-06 and parameters: {'n_estimators': 772, 'learning_rate': 0.14571614934299115, 'max_depth': 4, 'reg_alpha': 0.16132702705549148, 'reg_lambda': 0.5871160993816806}. Best is trial 33 with value: 4.839464076168115e-06.
[I 2025-07-28 20:51:26,380] Trial 36 finished with value: 4.858607901783695e-06 and parameters: {'n_estimators': 819, 'learning_rate': 0.11767335703903592, 'max_depth': 5, 'reg_alpha': 0.06366624705346347, 'reg_lambda': 0.7421865930558031}. Best is trial 33 with value: 4.839464076168115e-06.
[I 2025-07-28 20:51:33,721] Trial 37 finished with value: 5.019251649998546e-06 and parameters: {'n_estimators': 894, 'learning_rate': 0.126273697313599, 'max_depth': 5, 'reg_alpha': 0.7892765551666453, 'reg_lambda': 0.754162958817802}. Best is trial 33 with value: 4.839464076168115e-06.
[I 2025-07-28 20:51:41,741] Trial 38 finished with value: 5.019251649998546e-06 and parameters: {'n_estimators': 996, 'learning_rate': 0.09954681830612291, 'max_depth': 4, 'reg_alpha': 0.4188465566643004, 'reg_lambda': 0.7459915798710643}. Best is trial 33 with value: 4.839464076168115e-06.
[I 2025-07-28 20:51:48,521] Trial 39 finished with value: 5.019251649998546e-06 and parameters: {'n_estimators': 825, 'learning_rate': 0.0747933858641471, 'max_depth': 6, 'reg_alpha': 0.9890810658755008, 'reg_lambda': 0.8923119603923065}. Best is trial 33 with value: 4.839464076168115e-06.
[I 2025-07-28 20:51:56,047] Trial 40 finished with value: 5.019251649998546e-06 and parameters: {'n_estimators': 926, 'learning_rate': 0.12670570904551207, 'max_depth': 5, 'reg_alpha': 0.4957751948538234, 'reg_lambda': 0.6157140936002531}. Best is trial 33 with value: 4.839464076168115e-06.
[I 2025-07-28 20:52:03,148] Trial 41 finished with value: 4.8494002932240485e-06 and parameters: {'n_estimators': 774, 'learning_rate': 0.15911132998549832, 'max_depth': 5, 'reg_alpha': 0.06107709723784929, 'reg_lambda': 0.506884265377062}. Best is trial 33 with value: 4.839464076168115e-06.
[I 2025-07-28 20:52:09,520] Trial 42 finished with value: 4.884694182476254e-06 and parameters: {'n_estimators': 716, 'learning_rate': 0.15916394039146894, 'max_depth': 6, 'reg_alpha': 0.052354868320671745, 'reg_lambda': 0.5056215118289545}. Best is trial 33 with value: 4.839464076168115e-06.
[I 2025-07-28 20:52:15,794] Trial 43 finished with value: 5.019251649998546e-06 and parameters: {'n_estimators': 765, 'learning_rate': 0.11317584312692953, 'max_depth': 4, 'reg_alpha': 0.25216984072937376, 'reg_lambda': 0.8159509714302461}. Best is trial 33 with value: 4.839464076168115e-06.
[I 2025-07-28 20:52:23,229] Trial 44 finished with value: 5.0041193198775e-06 and parameters: {'n_estimators': 867, 'learning_rate': 0.1481480586366687, 'max_depth': 7, 'reg_alpha': 0.1515628838541766, 'reg_lambda': 0.6971959822590139}. Best is trial 33 with value: 4.839464076168115e-06.
[I 2025-07-28 20:52:29,160] Trial 45 finished with value: 5.019251649998546e-06 and parameters: {'n_estimators': 708, 'learning_rate': 0.1640550605590889, 'max_depth': 5, 'reg_alpha': 0.6629725705964137, 'reg_lambda': 0.5365427794447837}. Best is trial 33 with value: 4.839464076168115e-06.
[I 2025-07-28 20:52:35,752] Trial 46 finished with value: 5.019251649998546e-06 and parameters: {'n_estimators': 796, 'learning_rate': 0.13252487578377406, 'max_depth': 6, 'reg_alpha': 0.30960682989881905, 'reg_lambda': 0.5511003190678075}. Best is trial 33 with value: 4.839464076168115e-06.
[I 2025-07-28 20:52:38,019] Trial 47 finished with value: 4.836324574178992e-06 and parameters: {'n_estimators': 203, 'learning_rate': 0.20908231920234427, 'max_depth': 4, 'reg_alpha': 0.03859472362710654, 'reg_lambda': 0.6402624105878476}. Best is trial 47 with value: 4.836324574178992e-06.
[I 2025-07-28 20:52:41,242] Trial 48 finished with value: 5.516749360634556e-06 and parameters: {'n_estimators': 223, 'learning_rate': 0.20841974949190978, 'max_depth': 4, 'reg_alpha': 0.004157181486586108, 'reg_lambda': 0.6469556211878486}. Best is trial 47 with value: 4.836324574178992e-06.
[I 2025-07-28 20:52:44,780] Trial 49 finished with value: 4.948371809187883e-06 and parameters: {'n_estimators': 374, 'learning_rate': 0.07718404119377706, 'max_depth': 3, 'reg_alpha': 0.10492305969855223, 'reg_lambda': 0.7064625555754954}. Best is trial 47 with value: 4.836324574178992e-06.
[I 2025-07-28 20:52:44,781] A new study created in memory with name: no-name-e61e1a34-520f-4e25-b843-fe577518bef8
[I 2025-07-28 20:52:51,633] Trial 0 finished with value: 5.0018639718608245e-06 and parameters: {'n_estimators': 400, 'max_depth': 7, 'min_samples_split': 11, 'min_samples_leaf': 8, 'max_features': 'sqrt'}. Best is trial 0 with value: 5.0018639718608245e-06.
[I 2025-07-28 20:54:03,770] Trial 1 finished with value: 4.828618924621661e-06 and parameters: {'n_estimators': 411, 'max_depth': 4, 'min_samples_split': 6, 'min_samples_leaf': 4, 'max_features': None}. Best is trial 1 with value: 4.828618924621661e-06.
[I 2025-07-28 20:54:07,449] Trial 2 finished with value: 5.02939794480744e-06 and parameters: {'n_estimators': 176, 'max_depth': 15, 'min_samples_split': 12, 'min_samples_leaf': 10, 'max_features': 'sqrt'}. Best is trial 1 with value: 4.828618924621661e-06.
[I 2025-07-28 20:54:12,507] Trial 3 finished with value: 5.015578583197396e-06 and parameters: {'n_estimators': 249, 'max_depth': 12, 'min_samples_split': 11, 'min_samples_leaf': 10, 'max_features': 'sqrt'}. Best is trial 1 with value: 4.828618924621661e-06.
[I 2025-07-28 20:54:21,385] Trial 4 finished with value: 5.017340843247261e-06 and parameters: {'n_estimators': 499, 'max_depth': 8, 'min_samples_split': 4, 'min_samples_leaf': 8, 'max_features': 'sqrt'}. Best is trial 1 with value: 4.828618924621661e-06.
[I 2025-07-28 20:54:23,087] Trial 5 finished with value: 5.085496832480318e-06 and parameters: {'n_estimators': 160, 'max_depth': 13, 'min_samples_split': 9, 'min_samples_leaf': 7, 'max_features': 'log2'}. Best is trial 1 with value: 4.828618924621661e-06.
[I 2025-07-28 20:54:26,694] Trial 6 finished with value: 5.003768164067738e-06 and parameters: {'n_estimators': 220, 'max_depth': 7, 'min_samples_split': 4, 'min_samples_leaf': 9, 'max_features': 'sqrt'}. Best is trial 1 with value: 4.828618924621661e-06.
[I 2025-07-28 20:55:32,872] Trial 7 finished with value: 4.813609811408858e-06 and parameters: {'n_estimators': 249, 'max_depth': 7, 'min_samples_split': 4, 'min_samples_leaf': 8, 'max_features': None}. Best is trial 7 with value: 4.813609811408858e-06.
[I 2025-07-28 20:55:35,113] Trial 8 finished with value: 5.068498180680565e-06 and parameters: {'n_estimators': 227, 'max_depth': 11, 'min_samples_split': 17, 'min_samples_leaf': 8, 'max_features': 'log2'}. Best is trial 7 with value: 4.813609811408858e-06.
[I 2025-07-28 20:57:32,976] Trial 9 finished with value: 4.982532233177559e-06 and parameters: {'n_estimators': 258, 'max_depth': 16, 'min_samples_split': 16, 'min_samples_leaf': 3, 'max_features': None}. Best is trial 7 with value: 4.813609811408858e-06.
[I 2025-07-28 20:58:43,331] Trial 10 finished with value: 5.088062690956437e-06 and parameters: {'n_estimators': 116, 'max_depth': 20, 'min_samples_split': 2, 'min_samples_leaf': 1, 'max_features': None}. Best is trial 7 with value: 4.813609811408858e-06.
[I 2025-07-28 20:59:30,757] Trial 11 finished with value: 4.782826559346624e-06 and parameters: {'n_estimators': 359, 'max_depth': 3, 'min_samples_split': 7, 'min_samples_leaf': 5, 'max_features': None}. Best is trial 11 with value: 4.782826559346624e-06.
[I 2025-07-28 21:00:14,474] Trial 12 finished with value: 4.783086709609283e-06 and parameters: {'n_estimators': 331, 'max_depth': 3, 'min_samples_split': 7, 'min_samples_leaf': 5, 'max_features': None}. Best is trial 11 with value: 4.782826559346624e-06.
[I 2025-07-28 21:01:00,990] Trial 13 finished with value: 4.778142084059252e-06 and parameters: {'n_estimators': 352, 'max_depth': 3, 'min_samples_split': 8, 'min_samples_leaf': 5, 'max_features': None}. Best is trial 13 with value: 4.778142084059252e-06.
[I 2025-07-28 21:01:46,051] Trial 14 finished with value: 4.759859142264874e-06 and parameters: {'n_estimators': 343, 'max_depth': 3, 'min_samples_split': 20, 'min_samples_leaf': 6, 'max_features': None}. Best is trial 14 with value: 4.759859142264874e-06.
[I 2025-07-28 21:03:18,002] Trial 15 finished with value: 4.814473883129504e-06 and parameters: {'n_estimators': 447, 'max_depth': 5, 'min_samples_split': 19, 'min_samples_leaf': 6, 'max_features': None}. Best is trial 14 with value: 4.759859142264874e-06.
[I 2025-07-28 21:05:05,912] Trial 16 finished with value: 4.9256936437768716e-06 and parameters: {'n_estimators': 320, 'max_depth': 9, 'min_samples_split': 14, 'min_samples_leaf': 3, 'max_features': None}. Best is trial 14 with value: 4.759859142264874e-06.
[I 2025-07-28 21:05:08,600] Trial 17 finished with value: 5.043544433783362e-06 and parameters: {'n_estimators': 379, 'max_depth': 5, 'min_samples_split': 20, 'min_samples_leaf': 6, 'max_features': 'log2'}. Best is trial 14 with value: 4.759859142264874e-06.
[I 2025-07-28 21:07:55,746] Trial 18 finished with value: 5.01052321682667e-06 and parameters: {'n_estimators': 448, 'max_depth': 10, 'min_samples_split': 14, 'min_samples_leaf': 1, 'max_features': None}. Best is trial 14 with value: 4.759859142264874e-06.
[I 2025-07-28 21:08:57,342] Trial 19 finished with value: 4.845795448614228e-06 and parameters: {'n_estimators': 292, 'max_depth': 5, 'min_samples_split': 9, 'min_samples_leaf': 4, 'max_features': None}. Best is trial 14 with value: 4.759859142264874e-06.
