[I 2025-07-29 00:14:47,013] Trial 34 finished with value: 4.767608528161792e-06 and parameters: {'n_estimators': 250, 'max_depth': 5, 'min_samples_split': 12, 'min_samples_leaf': 9, 'max_features': None}. Best is trial 16 with value: 4.725984965932265e-06.
[I 2025-07-29 00:15:15,008] Trial 35 finished with value: 4.720708088650962e-06 and parameters: {'n_estimators': 215, 'max_depth': 3, 'min_samples_split': 5, 'min_samples_leaf': 10, 'max_features': None}. Best is trial 35 with value: 4.720708088650962e-06.
[I 2025-07-29 00:15:40,506] Trial 36 finished with value: 4.728683365788026e-06 and parameters: {'n_estimators': 196, 'max_depth': 3, 'min_samples_split': 5, 'min_samples_leaf': 10, 'max_features': None}. Best is trial 35 with value: 4.720708088650962e-06.
[I 2025-07-29 00:15:44,794] Trial 37 finished with value: 5.029531977641315e-06 and parameters: {'n_estimators': 210, 'max_depth': 14, 'min_samples_split': 5, 'min_samples_leaf': 10, 'max_features': 'sqrt'}. Best is trial 35 with value: 4.720708088650962e-06.
[I 2025-07-29 00:16:14,035] Trial 38 finished with value: 4.725078533302704e-06 and parameters: {'n_estimators': 225, 'max_depth': 3, 'min_samples_split': 2, 'min_samples_leaf': 10, 'max_features': None}. Best is trial 35 with value: 4.720708088650962e-06.
[I 2025-07-29 00:16:15,909] Trial 39 finished with value: 5.0247241518857944e-06 and parameters: {'n_estimators': 227, 'max_depth': 7, 'min_samples_split': 2, 'min_samples_leaf': 10, 'max_features': 'log2'}. Best is trial 35 with value: 4.720708088650962e-06.
[I 2025-07-29 00:16:18,113] Trial 40 finished with value: 4.95959475775353e-06 and parameters: {'n_estimators': 193, 'max_depth': 4, 'min_samples_split': 5, 'min_samples_leaf': 10, 'max_features': 'sqrt'}. Best is trial 35 with value: 4.720708088650962e-06.
[I 2025-07-29 00:16:39,374] Trial 41 finished with value: 4.712139739478801e-06 and parameters: {'n_estimators': 163, 'max_depth': 3, 'min_samples_split': 2, 'min_samples_leaf': 10, 'max_features': None}. Best is trial 41 with value: 4.712139739478801e-06.
[I 2025-07-29 00:17:00,349] Trial 42 finished with value: 4.712702090851708e-06 and parameters: {'n_estimators': 161, 'max_depth': 3, 'min_samples_split': 2, 'min_samples_leaf': 10, 'max_features': None}. Best is trial 41 with value: 4.712139739478801e-06.
[I 2025-07-29 00:17:27,423] Trial 43 finished with value: 4.722053598790375e-06 and parameters: {'n_estimators': 161, 'max_depth': 4, 'min_samples_split': 2, 'min_samples_leaf': 10, 'max_features': None}. Best is trial 41 with value: 4.712139739478801e-06.
[I 2025-07-29 00:18:04,651] Trial 44 finished with value: 4.7597821677243164e-06 and parameters: {'n_estimators': 161, 'max_depth': 6, 'min_samples_split': 2, 'min_samples_leaf': 10, 'max_features': None}. Best is trial 41 with value: 4.712139739478801e-06.
[I 2025-07-29 00:18:26,247] Trial 45 finished with value: 4.771083932370155e-06 and parameters: {'n_estimators': 124, 'max_depth': 4, 'min_samples_split': 3, 'min_samples_leaf': 3, 'max_features': None}. Best is trial 41 with value: 4.712139739478801e-06.
[I 2025-07-29 00:18:59,355] Trial 46 finished with value: 4.746559199944143e-06 and parameters: {'n_estimators': 164, 'max_depth': 5, 'min_samples_split': 3, 'min_samples_leaf': 10, 'max_features': None}. Best is trial 41 with value: 4.712139739478801e-06.
[I 2025-07-29 00:19:17,973] Trial 47 finished with value: 4.703061450476034e-06 and parameters: {'n_estimators': 142, 'max_depth': 3, 'min_samples_split': 4, 'min_samples_leaf': 10, 'max_features': None}. Best is trial 47 with value: 4.703061450476034e-06.
[I 2025-07-29 00:19:20,757] Trial 48 finished with value: 4.988906613831128e-06 and parameters: {'n_estimators': 149, 'max_depth': 9, 'min_samples_split': 4, 'min_samples_leaf': 9, 'max_features': 'sqrt'}. Best is trial 47 with value: 4.703061450476034e-06.
[I 2025-07-29 00:20:13,514] Trial 49 finished with value: 4.813297679959257e-06 and parameters: {'n_estimators': 151, 'max_depth': 13, 'min_samples_split': 3, 'min_samples_leaf': 10, 'max_features': None}. Best is trial 47 with value: 4.703061450476034e-06.
[I 2025-07-29 00:20:13,514] A new study created in memory with name: no-name-c4298356-2632-4ed9-9e2d-6bd752241f39
[I 2025-07-29 00:21:50,099] Trial 0 finished with value: 4.966698062667693e-06 and parameters: {'n_estimators': 325, 'max_depth': 7}. Best is trial 0 with value: 4.966698062667693e-06.
[I 2025-07-29 00:23:06,487] Trial 1 finished with value: 4.877578005418744e-06 and parameters: {'n_estimators': 350, 'max_depth': 5}. Best is trial 1 with value: 4.877578005418744e-06.
[I 2025-07-29 00:25:03,283] Trial 2 finished with value: 4.986000936477458e-06 and parameters: {'n_estimators': 351, 'max_depth': 8}. Best is trial 1 with value: 4.877578005418744e-06.
[I 2025-07-29 00:25:58,925] Trial 3 finished with value: 4.981532925242443e-06 and parameters: {'n_estimators': 188, 'max_depth': 7}. Best is trial 1 with value: 4.877578005418744e-06.
[I 2025-07-29 00:27:29,405] Trial 4 finished with value: 4.98214654264682e-06 and parameters: {'n_estimators': 272, 'max_depth': 8}. Best is trial 1 with value: 4.877578005418744e-06.
[I 2025-07-29 00:29:28,655] Trial 5 finished with value: 5.0078089988989395e-06 and parameters: {'n_estimators': 325, 'max_depth': 9}. Best is trial 1 with value: 4.877578005418744e-06.
[I 2025-07-29 00:30:41,054] Trial 6 finished with value: 4.886490513522943e-06 and parameters: {'n_estimators': 334, 'max_depth': 5}. Best is trial 1 with value: 4.877578005418744e-06.
[I 2025-07-29 00:31:41,735] Trial 7 finished with value: 4.996903966565153e-06 and parameters: {'n_estimators': 182, 'max_depth': 8}. Best is trial 1 with value: 4.877578005418744e-06.
[I 2025-07-29 00:33:09,461] Trial 8 finished with value: 4.961129435956898e-06 and parameters: {'n_estimators': 296, 'max_depth': 7}. Best is trial 1 with value: 4.877578005418744e-06.
[I 2025-07-29 00:34:11,637] Trial 9 finished with value: 5.002383435749646e-06 and parameters: {'n_estimators': 169, 'max_depth': 9}. Best is trial 1 with value: 4.877578005418744e-06.
[I 2025-07-29 00:35:16,905] Trial 10 finished with value: 4.785856051990874e-06 and parameters: {'n_estimators': 489, 'max_depth': 3}. Best is trial 10 with value: 4.785856051990874e-06.
[I 2025-07-29 00:36:23,956] Trial 11 finished with value: 4.783490654706303e-06 and parameters: {'n_estimators': 500, 'max_depth': 3}. Best is trial 11 with value: 4.783490654706303e-06.
[I 2025-07-29 00:37:26,784] Trial 12 finished with value: 4.7847269639054255e-06 and parameters: {'n_estimators': 468, 'max_depth': 3}. Best is trial 11 with value: 4.783490654706303e-06.
[I 2025-07-29 00:38:30,446] Trial 13 finished with value: 4.783971373804632e-06 and parameters: {'n_estimators': 474, 'max_depth': 3}. Best is trial 11 with value: 4.783490654706303e-06.
[I 2025-07-29 00:39:44,905] Trial 14 finished with value: 4.831686302304067e-06 and parameters: {'n_estimators': 423, 'max_depth': 4}. Best is trial 11 with value: 4.783490654706303e-06.
[I 2025-07-29 00:41:16,568] Trial 15 finished with value: 4.879587475759773e-06 and parameters: {'n_estimators': 421, 'max_depth': 5}. Best is trial 11 with value: 4.783490654706303e-06.
[I 2025-07-29 00:42:31,275] Trial 16 finished with value: 4.8315487869260645e-06 and parameters: {'n_estimators': 424, 'max_depth': 4}. Best is trial 11 with value: 4.783490654706303e-06.
[I 2025-07-29 00:43:38,077] Trial 17 finished with value: 4.784282510843371e-06 and parameters: {'n_estimators': 499, 'max_depth': 3}. Best is trial 11 with value: 4.783490654706303e-06.
[I 2025-07-29 00:43:57,586] Trial 18 finished with value: 4.783668569860761e-06 and parameters: {'n_estimators': 111, 'max_depth': 4}. Best is trial 11 with value: 4.783490654706303e-06.
[I 2025-07-29 00:44:16,778] Trial 19 finished with value: 4.785395170698339e-06 and parameters: {'n_estimators': 109, 'max_depth': 4}. Best is trial 11 with value: 4.783490654706303e-06.
[I 2025-07-29 00:45:23,956] Trial 20 finished with value: 4.901331081168381e-06 and parameters: {'n_estimators': 261, 'max_depth': 6}. Best is trial 11 with value: 4.783490654706303e-06.
[I 2025-07-29 00:46:16,481] Trial 21 finished with value: 4.786966460080924e-06 and parameters: {'n_estimators': 393, 'max_depth': 3}. Best is trial 11 with value: 4.783490654706303e-06.
[I 2025-07-29 00:47:36,615] Trial 22 finished with value: 4.828159811674329e-06 and parameters: {'n_estimators': 457, 'max_depth': 4}. Best is trial 11 with value: 4.783490654706303e-06.
[I 2025-07-29 00:48:06,727] Trial 23 finished with value: 4.775875556427091e-06 and parameters: {'n_estimators': 225, 'max_depth': 3}. Best is trial 23 with value: 4.775875556427091e-06.
[I 2025-07-29 00:48:46,297] Trial 24 finished with value: 4.823087959507477e-06 and parameters: {'n_estimators': 225, 'max_depth': 4}. Best is trial 23 with value: 4.775875556427091e-06.
[I 2025-07-29 00:49:09,064] Trial 25 finished with value: 4.834695366611411e-06 and parameters: {'n_estimators': 105, 'max_depth': 5}. Best is trial 23 with value: 4.775875556427091e-06.
[I 2025-07-29 00:49:44,018] Trial 26 finished with value: 4.856242348575499e-06 and parameters: {'n_estimators': 136, 'max_depth': 6}. Best is trial 23 with value: 4.775875556427091e-06.
[I 2025-07-29 00:51:10,380] Trial 27 finished with value: 5.057606469297317e-06 and parameters: {'n_estimators': 216, 'max_depth': 10}. Best is trial 23 with value: 4.775875556427091e-06.
[I 2025-07-29 00:51:30,296] Trial 28 finished with value: 4.758433407302797e-06 and parameters: {'n_estimators': 149, 'max_depth': 3}. Best is trial 28 with value: 4.758433407302797e-06.
[I 2025-07-29 00:52:02,317] Trial 29 finished with value: 4.786327738209954e-06 and parameters: {'n_estimators': 239, 'max_depth': 3}. Best is trial 28 with value: 4.758433407302797e-06.
[I 2025-07-29 00:52:43,462] Trial 30 finished with value: 4.8652214590354446e-06 and parameters: {'n_estimators': 160, 'max_depth': 6}. Best is trial 28 with value: 4.758433407302797e-06.
[I 2025-07-29 00:53:08,583] Trial 31 finished with value: 4.794456194638346e-06 and parameters: {'n_estimators': 143, 'max_depth': 4}. Best is trial 28 with value: 4.758433407302797e-06.
[I 2025-07-29 00:53:35,337] Trial 32 finished with value: 4.782440110626463e-06 and parameters: {'n_estimators': 200, 'max_depth': 3}. Best is trial 28 with value: 4.758433407302797e-06.
[I 2025-07-29 00:54:02,507] Trial 33 finished with value: 4.7841033255700775e-06 and parameters: {'n_estimators': 203, 'max_depth': 3}. Best is trial 28 with value: 4.758433407302797e-06.
[I 2025-07-29 00:54:56,114] Trial 34 finished with value: 4.866134418921649e-06 and parameters: {'n_estimators': 247, 'max_depth': 5}. Best is trial 28 with value: 4.758433407302797e-06.
[I 2025-07-29 00:55:35,005] Trial 35 finished with value: 4.777742671691534e-06 and parameters: {'n_estimators': 291, 'max_depth': 3}. Best is trial 28 with value: 4.758433407302797e-06.
[I 2025-07-29 00:56:25,931] Trial 36 finished with value: 4.817881065290559e-06 and parameters: {'n_estimators': 290, 'max_depth': 4}. Best is trial 28 with value: 4.758433407302797e-06.
[I 2025-07-29 00:56:51,882] Trial 37 finished with value: 4.7826207201948535e-06 and parameters: {'n_estimators': 194, 'max_depth': 3}. Best is trial 28 with value: 4.758433407302797e-06.
[I 2025-07-29 00:57:27,448] Trial 38 finished with value: 4.77813697379208e-06 and parameters: {'n_estimators': 266, 'max_depth': 3}. Best is trial 28 with value: 4.758433407302797e-06.
[I 2025-07-29 00:58:45,248] Trial 39 finished with value: 4.88134532243805e-06 and parameters: {'n_estimators': 359, 'max_depth': 5}. Best is trial 28 with value: 4.758433407302797e-06.
[I 2025-07-29 00:59:34,498] Trial 40 finished with value: 4.815741394539667e-06 and parameters: {'n_estimators': 280, 'max_depth': 4}. Best is trial 28 with value: 4.758433407302797e-06.
[I 2025-07-29 01:00:16,301] Trial 41 finished with value: 4.778877662590668e-06 and parameters: {'n_estimators': 315, 'max_depth': 3}. Best is trial 28 with value: 4.758433407302797e-06.
[I 2025-07-29 01:00:58,275] Trial 42 finished with value: 4.78427331967112e-06 and parameters: {'n_estimators': 317, 'max_depth': 3}. Best is trial 28 with value: 4.758433407302797e-06.
[I 2025-07-29 01:01:33,431] Trial 43 finished with value: 4.780344057720708e-06 and parameters: {'n_estimators': 263, 'max_depth': 3}. Best is trial 28 with value: 4.758433407302797e-06.
[I 2025-07-29 01:02:28,218] Trial 44 finished with value: 4.821896551404283e-06 and parameters: {'n_estimators': 312, 'max_depth': 4}. Best is trial 28 with value: 4.758433407302797e-06.
[I 2025-07-29 01:03:08,909] Trial 45 finished with value: 4.780911050268078e-06 and parameters: {'n_estimators': 304, 'max_depth': 3}. Best is trial 28 with value: 4.758433407302797e-06.
[I 2025-07-29 01:05:01,718] Trial 46 finished with value: 4.996226185460429e-06 and parameters: {'n_estimators': 339, 'max_depth': 8}. Best is trial 28 with value: 4.758433407302797e-06.
[I 2025-07-29 01:05:50,572] Trial 47 finished with value: 4.789074631004451e-06 and parameters: {'n_estimators': 365, 'max_depth': 3}. Best is trial 28 with value: 4.758433407302797e-06.
[I 2025-07-29 01:06:39,666] Trial 48 finished with value: 4.816443533338885e-06 and parameters: {'n_estimators': 279, 'max_depth': 4}. Best is trial 28 with value: 4.758433407302797e-06.
[I 2025-07-29 01:07:11,901] Trial 49 finished with value: 4.785949466654429e-06 and parameters: {'n_estimators': 241, 'max_depth': 3}. Best is trial 28 with value: 4.758433407302797e-06.
[I 2025-07-29 01:07:11,901] A new study created in memory with name: no-name-52c88779-496f-4f4c-9b54-5ee91813f97d
[I 2025-07-29 01:07:12,175] Trial 0 finished with value: 5.019251650211013e-06 and parameters: {'n_estimators': 160, 'learning_rate': 0.04990150397014505, 'max_depth': 8, 'num_leaves': 68, 'reg_alpha': 0.9334884540987098, 'reg_lambda': 0.13789926098865846}. Best is trial 0 with value: 5.019251650211013e-06.
[I 2025-07-29 01:07:12,896] Trial 1 finished with value: 5.019251650211013e-06 and parameters: {'n_estimators': 920, 'learning_rate': 0.22891135192828593, 'max_depth': 10, 'num_leaves': 59, 'reg_alpha': 0.7827478384166251, 'reg_lambda': 0.31073011728473676}. Best is trial 0 with value: 5.019251650211013e-06.
[I 2025-07-29 01:07:13,477] Trial 2 finished with value: 5.019251650211013e-06 and parameters: {'n_estimators': 718, 'learning_rate': 0.11726040907327502, 'max_depth': 7, 'num_leaves': 28, 'reg_alpha': 0.838369297854776, 'reg_lambda': 0.02524694019260798}. Best is trial 0 with value: 5.019251650211013e-06.
[I 2025-07-29 01:07:13,752] Trial 3 finished with value: 5.019251650211013e-06 and parameters: {'n_estimators': 264, 'learning_rate': 0.20224868897320364, 'max_depth': 3, 'num_leaves': 13, 'reg_alpha': 0.8308535112451326, 'reg_lambda': 0.9497985786072742}. Best is trial 0 with value: 5.019251650211013e-06.
[I 2025-07-29 01:07:14,144] Trial 4 finished with value: 5.019251650211013e-06 and parameters: {'n_estimators': 384, 'learning_rate': 0.2552791491782727, 'max_depth': 6, 'num_leaves': 29, 'reg_alpha': 0.6306234686293046, 'reg_lambda': 0.8461752078167383}. Best is trial 0 with value: 5.019251650211013e-06.
[I 2025-07-29 01:07:14,850] Trial 5 finished with value: 5.019251650211013e-06 and parameters: {'n_estimators': 813, 'learning_rate': 0.01742079337436375, 'max_depth': 7, 'num_leaves': 99, 'reg_alpha': 0.9561036513944569, 'reg_lambda': 0.658092584313776}. Best is trial 0 with value: 5.019251650211013e-06.
[I 2025-07-29 01:07:15,270] Trial 6 finished with value: 5.019251650211013e-06 and parameters: {'n_estimators': 384, 'learning_rate': 0.09138717842407348, 'max_depth': 3, 'num_leaves': 83, 'reg_alpha': 0.5909867974989016, 'reg_lambda': 0.5430663932464794}. Best is trial 0 with value: 5.019251650211013e-06.
[I 2025-07-29 01:07:15,752] Trial 7 finished with value: 5.019251650211013e-06 and parameters: {'n_estimators': 589, 'learning_rate': 0.18842958243094526, 'max_depth': 8, 'num_leaves': 38, 'reg_alpha': 0.31987215603848596, 'reg_lambda': 0.29233190312778634}. Best is trial 0 with value: 5.019251650211013e-06.
[I 2025-07-29 01:07:16,238] Trial 8 finished with value: 5.019251650211013e-06 and parameters: {'n_estimators': 532, 'learning_rate': 0.05555924525903408, 'max_depth': 4, 'num_leaves': 37, 'reg_alpha': 0.9167696828275349, 'reg_lambda': 0.007256964280955569}. Best is trial 0 with value: 5.019251650211013e-06.
[I 2025-07-29 01:07:17,010] Trial 9 finished with value: 4.949082217963505e-06 and parameters: {'n_estimators': 839, 'learning_rate': 0.06289589443430019, 'max_depth': 7, 'num_leaves': 85, 'reg_alpha': 0.11906797372814137, 'reg_lambda': 0.4941890887618269}. Best is trial 9 with value: 4.949082217963505e-06.
[I 2025-07-29 01:07:17,799] Trial 10 finished with value: 4.970441770139101e-06 and parameters: {'n_estimators': 947, 'learning_rate': 0.13542271984705595, 'max_depth': 5, 'num_leaves': 100, 'reg_alpha': 0.13228110781979863, 'reg_lambda': 0.6997864027559794}. Best is trial 9 with value: 4.949082217963505e-06.
[I 2025-07-29 01:07:18,678] Trial 11 finished with value: 4.836310850846338e-06 and parameters: {'n_estimators': 991, 'learning_rate': 0.15223257297293105, 'max_depth': 5, 'num_leaves': 98, 'reg_alpha': 0.06449112973465809, 'reg_lambda': 0.7401049721995082}. Best is trial 11 with value: 4.836310850846338e-06.
[I 2025-07-29 01:07:19,509] Trial 12 finished with value: 5.196575341243034e-06 and parameters: {'n_estimators': 998, 'learning_rate': 0.29024072431932174, 'max_depth': 5, 'num_leaves': 80, 'reg_alpha': 0.031979007272813526, 'reg_lambda': 0.4504063131514255}. Best is trial 11 with value: 4.836310850846338e-06.
[I 2025-07-29 01:07:20,188] Trial 13 finished with value: 5.019251650211013e-06 and parameters: {'n_estimators': 785, 'learning_rate': 0.17197417303311038, 'max_depth': 9, 'num_leaves': 84, 'reg_alpha': 0.2704370265811289, 'reg_lambda': 0.7480134333790456}. Best is trial 11 with value: 4.836310850846338e-06.
[I 2025-07-29 01:07:20,788] Trial 14 finished with value: 5.019251650211013e-06 and parameters: {'n_estimators': 627, 'learning_rate': 0.08916124333984005, 'max_depth': 6, 'num_leaves': 90, 'reg_alpha': 0.32800825692466934, 'reg_lambda': 0.5445379317709744}. Best is trial 11 with value: 4.836310850846338e-06.
[I 2025-07-29 01:07:22,421] Trial 15 finished with value: 5.5647690915976955e-06 and parameters: {'n_estimators': 855, 'learning_rate': 0.14537937231979242, 'max_depth': 5, 'num_leaves': 70, 'reg_alpha': 0.0058110382944274175, 'reg_lambda': 0.3974095942298195}. Best is trial 11 with value: 4.836310850846338e-06.
[I 2025-07-29 01:07:23,114] Trial 16 finished with value: 5.0029259995742375e-06 and parameters: {'n_estimators': 694, 'learning_rate': 0.01853174341516344, 'max_depth': 8, 'num_leaves': 71, 'reg_alpha': 0.16367171900557587, 'reg_lambda': 0.8324174812476}. Best is trial 11 with value: 4.836310850846338e-06.
[I 2025-07-29 01:07:23,821] Trial 17 finished with value: 5.019251650211013e-06 and parameters: {'n_estimators': 875, 'learning_rate': 0.09730169894394003, 'max_depth': 4, 'num_leaves': 53, 'reg_alpha': 0.46023034283783965, 'reg_lambda': 0.614758048963583}. Best is trial 11 with value: 4.836310850846338e-06.
[I 2025-07-29 01:07:24,647] Trial 18 finished with value: 5.005374098488241e-06 and parameters: {'n_estimators': 999, 'learning_rate': 0.06576420818584641, 'max_depth': 6, 'num_leaves': 93, 'reg_alpha': 0.168462442214636, 'reg_lambda': 0.8269042379368255}. Best is trial 11 with value: 4.836310850846338e-06.
[I 2025-07-29 01:07:25,324] Trial 19 finished with value: 5.019251650211013e-06 and parameters: {'n_estimators': 744, 'learning_rate': 0.162602236510989, 'max_depth': 7, 'num_leaves': 55, 'reg_alpha': 0.4352067008123543, 'reg_lambda': 0.9525152482897411}. Best is trial 11 with value: 4.836310850846338e-06.
[I 2025-07-29 01:07:25,846] Trial 20 finished with value: 4.813302687595894e-06 and parameters: {'n_estimators': 522, 'learning_rate': 0.21153691782871079, 'max_depth': 4, 'num_leaves': 77, 'reg_alpha': 0.06932381478856427, 'reg_lambda': 0.34807473435647335}. Best is trial 20 with value: 4.813302687595894e-06.
[I 2025-07-29 01:07:26,348] Trial 21 finished with value: 4.883024018989278e-06 and parameters: {'n_estimators': 453, 'learning_rate': 0.22129330943402448, 'max_depth': 4, 'num_leaves': 80, 'reg_alpha': 0.09657650977297064, 'reg_lambda': 0.3215218826402441}. Best is trial 20 with value: 4.813302687595894e-06.
[I 2025-07-29 01:07:26,850] Trial 22 finished with value: 5.019251650211013e-06 and parameters: {'n_estimators': 485, 'learning_rate': 0.2244054224673113, 'max_depth': 4, 'num_leaves': 76, 'reg_alpha': 0.2337903525746213, 'reg_lambda': 0.2853303798191555}. Best is trial 20 with value: 4.813302687595894e-06.
[I 2025-07-29 01:07:27,328] Trial 23 finished with value: 4.825189768251917e-06 and parameters: {'n_estimators': 428, 'learning_rate': 0.26617651584695234, 'max_depth': 4, 'num_leaves': 93, 'reg_alpha': 0.06553863709899695, 'reg_lambda': 0.18600486930087395}. Best is trial 20 with value: 4.813302687595894e-06.
[I 2025-07-29 01:07:27,757] Trial 24 finished with value: 5.023441113782816e-06 and parameters: {'n_estimators': 293, 'learning_rate': 0.297521433769361, 'max_depth': 3, 'num_leaves': 92, 'reg_alpha': 0.03486737605332843, 'reg_lambda': 0.19122819957537507}. Best is trial 20 with value: 4.813302687595894e-06.
[I 2025-07-29 01:07:28,363] Trial 25 finished with value: 5.019251650211013e-06 and parameters: {'n_estimators': 649, 'learning_rate': 0.2542572872050211, 'max_depth': 5, 'num_leaves': 100, 'reg_alpha': 0.22723033218670974, 'reg_lambda': 0.1505472965317532}. Best is trial 20 with value: 4.813302687595894e-06.
