[I 2025-07-29 08:22:25,942] Trial 21 finished with value: 4.831284172582799e-06 and parameters: {'n_estimators': 962, 'learning_rate': 0.16704827245637402, 'max_depth': 4, 'num_leaves': 32, 'reg_alpha': 0.07696237559842811, 'reg_lambda': 0.3208299825006345}. Best is trial 20 with value: 4.821523128045701e-06.
[I 2025-07-29 08:22:26,794] Trial 22 finished with value: 4.816566701990744e-06 and parameters: {'n_estimators': 976, 'learning_rate': 0.1711693454376369, 'max_depth': 3, 'num_leaves': 49, 'reg_alpha': 0.05540775808212112, 'reg_lambda': 0.33375854102363245}. Best is trial 22 with value: 4.816566701990744e-06.
[I 2025-07-29 08:22:28,882] Trial 23 finished with value: 6.195774415978936e-06 and parameters: {'n_estimators': 996, 'learning_rate': 0.15741087555654812, 'max_depth': 3, 'num_leaves': 50, 'reg_alpha': 0.0033542242440228395, 'reg_lambda': 0.3559286359618038}. Best is trial 22 with value: 4.816566701990744e-06.
[I 2025-07-29 08:22:29,714] Trial 24 finished with value: 5.019251650211013e-06 and parameters: {'n_estimators': 1000, 'learning_rate': 0.1625179200751477, 'max_depth': 4, 'num_leaves': 53, 'reg_alpha': 0.35961685324806764, 'reg_lambda': 0.2619673415821272}. Best is trial 22 with value: 4.816566701990744e-06.
[I 2025-07-29 08:22:30,551] Trial 25 finished with value: 5.019251650211013e-06 and parameters: {'n_estimators': 911, 'learning_rate': 0.1269734733638097, 'max_depth': 4, 'num_leaves': 72, 'reg_alpha': 0.22686378712845812, 'reg_lambda': 0.4015736149138991}. Best is trial 22 with value: 4.816566701990744e-06.
[I 2025-07-29 08:22:31,422] Trial 26 finished with value: 4.807710160396e-06 and parameters: {'n_estimators': 934, 'learning_rate': 0.17107585678541506, 'max_depth': 3, 'num_leaves': 47, 'reg_alpha': 0.0710403120848388, 'reg_lambda': 0.23488234206367198}. Best is trial 26 with value: 4.807710160396e-06.
[I 2025-07-29 08:22:32,202] Trial 27 finished with value: 5.019251650211013e-06 and parameters: {'n_estimators': 848, 'learning_rate': 0.13585559207249476, 'max_depth': 3, 'num_leaves': 48, 'reg_alpha': 0.31063186087359684, 'reg_lambda': 0.23827014853272616}. Best is trial 26 with value: 4.807710160396e-06.
[I 2025-07-29 08:22:32,927] Trial 28 finished with value: 4.8187851598679966e-06 and parameters: {'n_estimators': 693, 'learning_rate': 0.19837606090038604, 'max_depth': 3, 'num_leaves': 56, 'reg_alpha': 0.06939493227715518, 'reg_lambda': 0.40954006921902647}. Best is trial 26 with value: 4.807710160396e-06.
[I 2025-07-29 08:22:33,480] Trial 29 finished with value: 5.019251650211013e-06 and parameters: {'n_estimators': 504, 'learning_rate': 0.20384799045091093, 'max_depth': 3, 'num_leaves': 60, 'reg_alpha': 0.20683755308343127, 'reg_lambda': 0.4565020086873373}. Best is trial 26 with value: 4.807710160396e-06.
[I 2025-07-29 08:22:34,154] Trial 30 finished with value: 5.0175081274830826e-06 and parameters: {'n_estimators': 682, 'learning_rate': 0.1758235315686852, 'max_depth': 3, 'num_leaves': 37, 'reg_alpha': 0.18851371421216398, 'reg_lambda': 0.5632142794156384}. Best is trial 26 with value: 4.807710160396e-06.
[I 2025-07-29 08:22:35,076] Trial 31 finished with value: 4.827683387432418e-06 and parameters: {'n_estimators': 934, 'learning_rate': 0.14757524344977183, 'max_depth': 4, 'num_leaves': 73, 'reg_alpha': 0.052331726276209814, 'reg_lambda': 0.3631278228598349}. Best is trial 26 with value: 4.807710160396e-06.
[I 2025-07-29 08:22:35,993] Trial 32 finished with value: 4.815257193481869e-06 and parameters: {'n_estimators': 873, 'learning_rate': 0.11040611591001323, 'max_depth': 3, 'num_leaves': 48, 'reg_alpha': 0.059489907168681966, 'reg_lambda': 0.2620684813704648}. Best is trial 26 with value: 4.807710160396e-06.
[I 2025-07-29 08:22:36,747] Trial 33 finished with value: 4.98646927122848e-06 and parameters: {'n_estimators': 708, 'learning_rate': 0.1076447432966081, 'max_depth': 3, 'num_leaves': 57, 'reg_alpha': 0.15307642233503946, 'reg_lambda': 0.19816064130331631}. Best is trial 26 with value: 4.807710160396e-06.
[I 2025-07-29 08:22:37,752] Trial 34 finished with value: 4.802431588065093e-06 and parameters: {'n_estimators': 868, 'learning_rate': 0.06031759981167727, 'max_depth': 3, 'num_leaves': 47, 'reg_alpha': 0.04821105687569109, 'reg_lambda': 0.4621647828205845}. Best is trial 34 with value: 4.802431588065093e-06.
[I 2025-07-29 08:22:38,652] Trial 35 finished with value: 5.019251650211013e-06 and parameters: {'n_estimators': 872, 'learning_rate': 0.08388857906529822, 'max_depth': 5, 'num_leaves': 46, 'reg_alpha': 0.24851779018035025, 'reg_lambda': 0.4923204028488364}. Best is trial 34 with value: 4.802431588065093e-06.
[I 2025-07-29 08:22:40,841] Trial 36 finished with value: 5.200492391204185e-06 and parameters: {'n_estimators': 933, 'learning_rate': 0.06213301650206506, 'max_depth': 4, 'num_leaves': 43, 'reg_alpha': 0.012368105649899694, 'reg_lambda': 0.11897940398475859}. Best is trial 34 with value: 4.802431588065093e-06.
[I 2025-07-29 08:22:41,673] Trial 37 finished with value: 5.019251650211013e-06 and parameters: {'n_estimators': 830, 'learning_rate': 0.013914942798561883, 'max_depth': 3, 'num_leaves': 36, 'reg_alpha': 0.4167427666442156, 'reg_lambda': 0.5861145908606675}. Best is trial 34 with value: 4.802431588065093e-06.
[I 2025-07-29 08:22:42,489] Trial 38 finished with value: 4.8044276670345655e-06 and parameters: {'n_estimators': 607, 'learning_rate': 0.06604490420723219, 'max_depth': 3, 'num_leaves': 70, 'reg_alpha': 0.04305941249554324, 'reg_lambda': 0.26566317352836205}. Best is trial 34 with value: 4.802431588065093e-06.
[I 2025-07-29 08:22:43,138] Trial 39 finished with value: 5.019251650211013e-06 and parameters: {'n_estimators': 591, 'learning_rate': 0.07358246050465236, 'max_depth': 5, 'num_leaves': 77, 'reg_alpha': 0.6993183922205317, 'reg_lambda': 0.9857415290924315}. Best is trial 34 with value: 4.802431588065093e-06.
[I 2025-07-29 08:22:43,672] Trial 40 finished with value: 4.997706863122925e-06 and parameters: {'n_estimators': 372, 'learning_rate': 0.052354210281174623, 'max_depth': 4, 'num_leaves': 88, 'reg_alpha': 0.16014402774799935, 'reg_lambda': 0.28008190747512074}. Best is trial 34 with value: 4.802431588065093e-06.
[I 2025-07-29 08:22:44,665] Trial 41 finished with value: 4.812928865549893e-06 and parameters: {'n_estimators': 907, 'learning_rate': 0.10088831865015002, 'max_depth': 3, 'num_leaves': 63, 'reg_alpha': 0.05224604595962609, 'reg_lambda': 0.2210632797692312}. Best is trial 34 with value: 4.802431588065093e-06.
[I 2025-07-29 08:22:45,615] Trial 42 finished with value: 4.8230826864217e-06 and parameters: {'n_estimators': 892, 'learning_rate': 0.10825255902348861, 'max_depth': 3, 'num_leaves': 68, 'reg_alpha': 0.04499664420323495, 'reg_lambda': 0.22197495172279433}. Best is trial 34 with value: 4.802431588065093e-06.
[I 2025-07-29 08:22:46,362] Trial 43 finished with value: 4.953233601110224e-06 and parameters: {'n_estimators': 622, 'learning_rate': 0.03553903082492769, 'max_depth': 4, 'num_leaves': 61, 'reg_alpha': 0.12172121594702918, 'reg_lambda': 0.11765030193797424}. Best is trial 34 with value: 4.802431588065093e-06.
[I 2025-07-29 08:22:46,811] Trial 44 finished with value: 4.865300649459695e-06 and parameters: {'n_estimators': 139, 'learning_rate': 0.1121963690213929, 'max_depth': 3, 'num_leaves': 81, 'reg_alpha': 0.03781956151245349, 'reg_lambda': 0.44034733043075136}. Best is trial 34 with value: 4.802431588065093e-06.
[I 2025-07-29 08:22:47,453] Trial 45 finished with value: 5.019251650211013e-06 and parameters: {'n_estimators': 550, 'learning_rate': 0.07144407640866379, 'max_depth': 3, 'num_leaves': 39, 'reg_alpha': 0.2719741822638206, 'reg_lambda': 0.1466139353958591}. Best is trial 34 with value: 4.802431588065093e-06.
[I 2025-07-29 08:22:51,503] Trial 46 finished with value: 5.84597585461311e-06 and parameters: {'n_estimators': 734, 'learning_rate': 0.09669289685319069, 'max_depth': 4, 'num_leaves': 68, 'reg_alpha': 0.001137848636115893, 'reg_lambda': 0.7526757945668914}. Best is trial 34 with value: 4.802431588065093e-06.
[I 2025-07-29 08:22:52,319] Trial 47 finished with value: 5.019251650211013e-06 and parameters: {'n_estimators': 819, 'learning_rate': 0.010432619034650065, 'max_depth': 6, 'num_leaves': 64, 'reg_alpha': 0.2062106043631428, 'reg_lambda': 0.38169167053444236}. Best is trial 34 with value: 4.802431588065093e-06.
[I 2025-07-29 08:22:53,265] Trial 48 finished with value: 4.9735197673490616e-06 and parameters: {'n_estimators': 895, 'learning_rate': 0.14146925534364402, 'max_depth': 3, 'num_leaves': 45, 'reg_alpha': 0.13503744454721844, 'reg_lambda': 0.057456871320594766}. Best is trial 34 with value: 4.802431588065093e-06.
[I 2025-07-29 08:22:54,206] Trial 49 finished with value: 5.019251650211013e-06 and parameters: {'n_estimators': 933, 'learning_rate': 0.04647367006395468, 'max_depth': 5, 'num_leaves': 61, 'reg_alpha': 0.5845658394427736, 'reg_lambda': 0.28988159421284576}. Best is trial 34 with value: 4.802431588065093e-06.
[I 2025-07-29 08:22:54,206] A new study created in memory with name: no-name-7b5a8cf8-af46-4339-b517-e4d9a6fbe3e3
[I 2025-07-29 08:23:01,672] Trial 0 finished with value: 5.019251649998546e-06 and parameters: {'n_estimators': 917, 'learning_rate': 0.2547326452636046, 'max_depth': 4, 'reg_alpha': 0.5175655517662083, 'reg_lambda': 0.08036647357578375}. Best is trial 0 with value: 5.019251649998546e-06.
[I 2025-07-29 08:23:09,265] Trial 1 finished with value: 5.019251649998546e-06 and parameters: {'n_estimators': 925, 'learning_rate': 0.25579999889743255, 'max_depth': 7, 'reg_alpha': 0.8004834239546663, 'reg_lambda': 0.4626169903336451}. Best is trial 0 with value: 5.019251649998546e-06.
[I 2025-07-29 08:23:12,862] Trial 2 finished with value: 5.019251649998546e-06 and parameters: {'n_estimators': 413, 'learning_rate': 0.17210504831602894, 'max_depth': 5, 'reg_alpha': 0.8862491850396796, 'reg_lambda': 0.46833531728662214}. Best is trial 0 with value: 5.019251649998546e-06.
[I 2025-07-29 08:23:19,266] Trial 3 finished with value: 5.019251649998546e-06 and parameters: {'n_estimators': 763, 'learning_rate': 0.08293442188692685, 'max_depth': 3, 'reg_alpha': 0.27262259837179004, 'reg_lambda': 0.7771559998271322}. Best is trial 0 with value: 5.019251649998546e-06.
[I 2025-07-29 08:23:26,269] Trial 4 finished with value: 5.019251649998546e-06 and parameters: {'n_estimators': 855, 'learning_rate': 0.12211744066585026, 'max_depth': 6, 'reg_alpha': 0.5451451982085727, 'reg_lambda': 0.22132263420291498}. Best is trial 0 with value: 5.019251649998546e-06.
[I 2025-07-29 08:23:28,700] Trial 5 finished with value: 5.019251649998546e-06 and parameters: {'n_estimators': 262, 'learning_rate': 0.10971681473003479, 'max_depth': 6, 'reg_alpha': 0.2539367455545227, 'reg_lambda': 0.40370083075942476}. Best is trial 0 with value: 5.019251649998546e-06.
[I 2025-07-29 08:23:33,358] Trial 6 finished with value: 5.019251649998546e-06 and parameters: {'n_estimators': 551, 'learning_rate': 0.1018156896440209, 'max_depth': 3, 'reg_alpha': 0.6431847434968924, 'reg_lambda': 0.39924207736618367}. Best is trial 0 with value: 5.019251649998546e-06.
[I 2025-07-29 08:23:36,331] Trial 7 finished with value: 5.019251649998546e-06 and parameters: {'n_estimators': 334, 'learning_rate': 0.22853999726309068, 'max_depth': 5, 'reg_alpha': 0.8891398270815394, 'reg_lambda': 0.6447920857793947}. Best is trial 0 with value: 5.019251649998546e-06.
[I 2025-07-29 08:23:42,668] Trial 8 finished with value: 5.019251649998546e-06 and parameters: {'n_estimators': 765, 'learning_rate': 0.2934751346254033, 'max_depth': 8, 'reg_alpha': 0.5709911621210082, 'reg_lambda': 0.8031805829434975}. Best is trial 0 with value: 5.019251649998546e-06.
[I 2025-07-29 08:23:48,300] Trial 9 finished with value: 5.019251649998546e-06 and parameters: {'n_estimators': 645, 'learning_rate': 0.14660870801064804, 'max_depth': 6, 'reg_alpha': 0.42820252544201587, 'reg_lambda': 0.7348944399039362}. Best is trial 0 with value: 5.019251649998546e-06.
[I 2025-07-29 08:23:52,349] Trial 10 finished with value: 4.9594022209991214e-06 and parameters: {'n_estimators': 122, 'learning_rate': 0.023955428171903048, 'max_depth': 10, 'reg_alpha': 0.08672819026864187, 'reg_lambda': 0.007111527572166473}. Best is trial 10 with value: 4.9594022209991214e-06.
[I 2025-07-29 08:24:03,771] Trial 11 finished with value: 5.0154507369568725e-06 and parameters: {'n_estimators': 196, 'learning_rate': 0.03289342371366781, 'max_depth': 10, 'reg_alpha': 0.01832652205150921, 'reg_lambda': 2.2322445197892407e-05}. Best is trial 10 with value: 4.9594022209991214e-06.
[I 2025-07-29 08:24:20,631] Trial 12 finished with value: 5.037722721422842e-06 and parameters: {'n_estimators': 112, 'learning_rate': 0.01644464945701657, 'max_depth': 10, 'reg_alpha': 0.004734538672137911, 'reg_lambda': 0.013588857444432632}. Best is trial 10 with value: 4.9594022209991214e-06.
[I 2025-07-29 08:24:25,907] Trial 13 finished with value: 4.961981848880145e-06 and parameters: {'n_estimators': 105, 'learning_rate': 0.012598536800063342, 'max_depth': 10, 'reg_alpha': 0.08803184274908842, 'reg_lambda': 0.21560656995324562}. Best is trial 10 with value: 4.9594022209991214e-06.
[I 2025-07-29 08:24:27,227] Trial 14 finished with value: 5.01000374367431e-06 and parameters: {'n_estimators': 100, 'learning_rate': 0.04854179137159781, 'max_depth': 9, 'reg_alpha': 0.16216392109236052, 'reg_lambda': 0.2144162231544078}. Best is trial 10 with value: 4.9594022209991214e-06.
[I 2025-07-29 08:24:31,071] Trial 15 finished with value: 5.006251853153522e-06 and parameters: {'n_estimators': 412, 'learning_rate': 0.04797403478877715, 'max_depth': 9, 'reg_alpha': 0.1521230901148065, 'reg_lambda': 0.2132746603765101}. Best is trial 10 with value: 4.9594022209991214e-06.
[I 2025-07-29 08:24:33,672] Trial 16 finished with value: 5.019251649998546e-06 and parameters: {'n_estimators': 282, 'learning_rate': 0.06934026238000912, 'max_depth': 8, 'reg_alpha': 0.36024558216312724, 'reg_lambda': 0.13935837246417815}. Best is trial 10 with value: 4.9594022209991214e-06.
[I 2025-07-29 08:24:37,799] Trial 17 finished with value: 4.9858957330408715e-06 and parameters: {'n_estimators': 190, 'learning_rate': 0.010832230872865715, 'max_depth': 9, 'reg_alpha': 0.12063274384425242, 'reg_lambda': 0.31337078647138794}. Best is trial 10 with value: 4.9594022209991214e-06.
[I 2025-07-29 08:24:41,829] Trial 18 finished with value: 5.019251649998546e-06 and parameters: {'n_estimators': 465, 'learning_rate': 0.16998524204714247, 'max_depth': 10, 'reg_alpha': 0.2991087034146725, 'reg_lambda': 0.942655958883187}. Best is trial 10 with value: 4.9594022209991214e-06.
[I 2025-07-29 08:24:44,669] Trial 19 finished with value: 4.9552561086439155e-06 and parameters: {'n_estimators': 210, 'learning_rate': 0.07202838162966727, 'max_depth': 8, 'reg_alpha': 0.09065039677181497, 'reg_lambda': 0.31446785062162713}. Best is trial 19 with value: 4.9552561086439155e-06.
[I 2025-07-29 08:24:47,973] Trial 20 finished with value: 5.019251649998546e-06 and parameters: {'n_estimators': 337, 'learning_rate': 0.06955722247919091, 'max_depth': 8, 'reg_alpha': 0.21766400925685553, 'reg_lambda': 0.5996675732241068}. Best is trial 19 with value: 4.9552561086439155e-06.
[I 2025-07-29 08:24:51,173] Trial 21 finished with value: 4.9416518485992126e-06 and parameters: {'n_estimators': 175, 'learning_rate': 0.04743310558217162, 'max_depth': 9, 'reg_alpha': 0.08362730122924318, 'reg_lambda': 0.2971988115504479}. Best is trial 21 with value: 4.9416518485992126e-06.
[I 2025-07-29 08:24:54,946] Trial 22 finished with value: 4.893875479463977e-06 and parameters: {'n_estimators': 208, 'learning_rate': 0.04968462420582325, 'max_depth': 9, 'reg_alpha': 0.06899190353490656, 'reg_lambda': 0.30007367269254903}. Best is trial 22 with value: 4.893875479463977e-06.
[I 2025-07-29 08:24:57,074] Trial 23 finished with value: 5.019251649998546e-06 and parameters: {'n_estimators': 223, 'learning_rate': 0.08516657743579752, 'max_depth': 7, 'reg_alpha': 0.38792917723144027, 'reg_lambda': 0.3234892515998227}. Best is trial 22 with value: 4.893875479463977e-06.
[I 2025-07-29 08:25:02,673] Trial 24 finished with value: 5.194198052758645e-06 and parameters: {'n_estimators': 325, 'learning_rate': 0.1371065730228297, 'max_depth': 8, 'reg_alpha': 0.009720724450504398, 'reg_lambda': 0.32614095636955465}. Best is trial 22 with value: 4.893875479463977e-06.
[I 2025-07-29 08:25:07,566] Trial 25 finished with value: 5.019251649998546e-06 and parameters: {'n_estimators': 575, 'learning_rate': 0.0511501496491988, 'max_depth': 9, 'reg_alpha': 0.18862485852975414, 'reg_lambda': 0.5483653418373917}. Best is trial 22 with value: 4.893875479463977e-06.
[I 2025-07-29 08:25:10,342] Trial 26 finished with value: 4.914837194821121e-06 and parameters: {'n_estimators': 191, 'learning_rate': 0.06276280582029625, 'max_depth': 7, 'reg_alpha': 0.08085141627163128, 'reg_lambda': 0.36777919919877955}. Best is trial 22 with value: 4.893875479463977e-06.
[I 2025-07-29 08:25:14,238] Trial 27 finished with value: 5.019251649998546e-06 and parameters: {'n_estimators': 454, 'learning_rate': 0.09546139503860641, 'max_depth': 7, 'reg_alpha': 0.7055503031723641, 'reg_lambda': 0.3771391742410488}. Best is trial 22 with value: 4.893875479463977e-06.
[I 2025-07-29 08:25:17,048] Trial 28 finished with value: 5.019251649998546e-06 and parameters: {'n_estimators': 271, 'learning_rate': 0.03793058815946236, 'max_depth': 9, 'reg_alpha': 0.4485090103782033, 'reg_lambda': 0.5070231136513107}. Best is trial 22 with value: 4.893875479463977e-06.
[I 2025-07-29 08:25:18,798] Trial 29 finished with value: 5.019251649998546e-06 and parameters: {'n_estimators': 174, 'learning_rate': 0.2082072330372848, 'max_depth': 5, 'reg_alpha': 0.2999077694353277, 'reg_lambda': 0.1221735701917058}. Best is trial 22 with value: 4.893875479463977e-06.
[I 2025-07-29 08:25:22,331] Trial 30 finished with value: 4.830895771903615e-06 and parameters: {'n_estimators': 361, 'learning_rate': 0.11861728436875242, 'max_depth': 4, 'reg_alpha': 0.06462922236583508, 'reg_lambda': 0.2552331254046007}. Best is trial 30 with value: 4.830895771903615e-06.
[I 2025-07-29 08:25:30,989] Trial 31 finished with value: 4.8415187867663525e-06 and parameters: {'n_estimators': 998, 'learning_rate': 0.1266511637733569, 'max_depth': 4, 'reg_alpha': 0.05804593604044824, 'reg_lambda': 0.2671777717142677}. Best is trial 30 with value: 4.830895771903615e-06.
[I 2025-07-29 08:25:38,976] Trial 32 finished with value: 5.019251649998546e-06 and parameters: {'n_estimators': 980, 'learning_rate': 0.12267936057410736, 'max_depth': 4, 'reg_alpha': 0.20649109100755414, 'reg_lambda': 0.14798817185437774}. Best is trial 30 with value: 4.830895771903615e-06.
[I 2025-07-29 08:25:42,700] Trial 33 finished with value: 4.811798512956182e-06 and parameters: {'n_estimators': 382, 'learning_rate': 0.16726012363284004, 'max_depth': 4, 'reg_alpha': 0.053806260270095024, 'reg_lambda': 0.4408845611669143}. Best is trial 33 with value: 4.811798512956182e-06.
[I 2025-07-29 08:25:46,158] Trial 34 finished with value: 5.019251649998546e-06 and parameters: {'n_estimators': 391, 'learning_rate': 0.1705189678782762, 'max_depth': 4, 'reg_alpha': 0.9985947766651327, 'reg_lambda': 0.4436373031550574}. Best is trial 33 with value: 4.811798512956182e-06.
[I 2025-07-29 08:25:50,715] Trial 35 finished with value: 4.840486831816984e-06 and parameters: {'n_estimators': 479, 'learning_rate': 0.19324362023316874, 'max_depth': 3, 'reg_alpha': 0.03426373519412857, 'reg_lambda': 0.2656274102145979}. Best is trial 33 with value: 4.811798512956182e-06.
[I 2025-07-29 08:25:55,900] Trial 36 finished with value: 4.993901968051854e-06 and parameters: {'n_estimators': 609, 'learning_rate': 0.19566436326007086, 'max_depth': 3, 'reg_alpha': 0.14809032129011973, 'reg_lambda': 0.45996039333864747}. Best is trial 33 with value: 4.811798512956182e-06.
[I 2025-07-29 08:26:00,638] Trial 37 finished with value: 4.841217699043837e-06 and parameters: {'n_estimators': 495, 'learning_rate': 0.19543284089154214, 'max_depth': 4, 'reg_alpha': 0.03614274557305483, 'reg_lambda': 0.07744317526521569}. Best is trial 33 with value: 4.811798512956182e-06.
[I 2025-07-29 08:26:05,444] Trial 38 finished with value: 4.8153663929899e-06 and parameters: {'n_estimators': 493, 'learning_rate': 0.18982202981443838, 'max_depth': 3, 'reg_alpha': 0.043139192562152526, 'reg_lambda': 0.07884175773838571}. Best is trial 33 with value: 4.811798512956182e-06.
[I 2025-07-29 08:26:09,782] Trial 39 finished with value: 5.019251649998546e-06 and parameters: {'n_estimators': 507, 'learning_rate': 0.23905383202115268, 'max_depth': 3, 'reg_alpha': 0.24084075990636597, 'reg_lambda': 0.08129050746807015}. Best is trial 33 with value: 4.811798512956182e-06.
[I 2025-07-29 08:26:15,421] Trial 40 finished with value: 4.973233291887406e-06 and parameters: {'n_estimators': 662, 'learning_rate': 0.16159871598063702, 'max_depth': 3, 'reg_alpha': 0.12272046523884705, 'reg_lambda': 0.16570196525397884}. Best is trial 33 with value: 4.811798512956182e-06.
[I 2025-07-29 08:26:20,436] Trial 41 finished with value: 4.951231047979943e-06 and parameters: {'n_estimators': 509, 'learning_rate': 0.19069913587975953, 'max_depth': 4, 'reg_alpha': 0.026496175336374946, 'reg_lambda': 0.060720539299956355}. Best is trial 33 with value: 4.811798512956182e-06.
[I 2025-07-29 08:26:24,060] Trial 42 finished with value: 4.861084660617013e-06 and parameters: {'n_estimators': 371, 'learning_rate': 0.21636688284144617, 'max_depth': 4, 'reg_alpha': 0.043659910568822596, 'reg_lambda': 0.07976613597404839}. Best is trial 33 with value: 4.811798512956182e-06.
