[I 2025-07-28 22:15:27,603] Trial 37 finished with value: 5.019251649998546e-06 and parameters: {'n_estimators': 277, 'learning_rate': 0.09918605780513004, 'max_depth': 5, 'reg_alpha': 0.3861695365212814, 'reg_lambda': 0.2740019503227682}. Best is trial 32 with value: 4.830581532849576e-06.
[I 2025-07-28 22:15:31,263] Trial 38 finished with value: 5.019251649998546e-06 and parameters: {'n_estimators': 446, 'learning_rate': 0.12558503192316273, 'max_depth': 5, 'reg_alpha': 0.29983931354657806, 'reg_lambda': 0.0620621383365437}. Best is trial 32 with value: 4.830581532849576e-06.
[I 2025-07-28 22:15:33,541] Trial 39 finished with value: 5.019251649998546e-06 and parameters: {'n_estimators': 215, 'learning_rate': 0.08832931417407247, 'max_depth': 4, 'reg_alpha': 0.8175060263986179, 'reg_lambda': 0.2268331352836908}. Best is trial 32 with value: 4.830581532849576e-06.
[I 2025-07-28 22:15:36,034] Trial 40 finished with value: 4.979528769437575e-06 and parameters: {'n_estimators': 264, 'learning_rate': 0.17013338132424313, 'max_depth': 7, 'reg_alpha': 0.10919163593192396, 'reg_lambda': 0.33954389218713515}. Best is trial 32 with value: 4.830581532849576e-06.
[I 2025-07-28 22:15:39,176] Trial 41 finished with value: 4.895403801446966e-06 and parameters: {'n_estimators': 128, 'learning_rate': 0.06898649708673354, 'max_depth': 6, 'reg_alpha': 0.029505798019319553, 'reg_lambda': 0.16589345823669785}. Best is trial 32 with value: 4.830581532849576e-06.
[I 2025-07-28 22:15:41,752] Trial 42 finished with value: 4.8856350228633126e-06 and parameters: {'n_estimators': 207, 'learning_rate': 0.09753554718439886, 'max_depth': 7, 'reg_alpha': 0.07278919388039423, 'reg_lambda': 0.44962429370776447}. Best is trial 32 with value: 4.830581532849576e-06.
[I 2025-07-28 22:15:43,258] Trial 43 finished with value: 5.019251649998546e-06 and parameters: {'n_estimators': 151, 'learning_rate': 0.21619887121972564, 'max_depth': 4, 'reg_alpha': 0.1963371798395811, 'reg_lambda': 0.206638709360085}. Best is trial 32 with value: 4.830581532849576e-06.
[I 2025-07-28 22:15:50,835] Trial 44 finished with value: 4.8197765134153475e-06 and parameters: {'n_estimators': 361, 'learning_rate': 0.011536685630193333, 'max_depth': 5, 'reg_alpha': 0.056479726196684246, 'reg_lambda': 0.08801779044896763}. Best is trial 44 with value: 4.8197765134153475e-06.
[I 2025-07-28 22:15:54,693] Trial 45 finished with value: 4.983832050583004e-06 and parameters: {'n_estimators': 378, 'learning_rate': 0.016579248175296848, 'max_depth': 5, 'reg_alpha': 0.12818003595091998, 'reg_lambda': 0.07553965883920463}. Best is trial 44 with value: 4.8197765134153475e-06.
[I 2025-07-28 22:16:00,870] Trial 46 finished with value: 4.8557606109749716e-06 and parameters: {'n_estimators': 607, 'learning_rate': 0.061830734624445494, 'max_depth': 5, 'reg_alpha': 0.03759564317543623, 'reg_lambda': 0.1264442002017815}. Best is trial 44 with value: 4.8197765134153475e-06.
[I 2025-07-28 22:16:08,239] Trial 47 finished with value: 4.952980487607503e-06 and parameters: {'n_estimators': 603, 'learning_rate': 0.05876365432721009, 'max_depth': 5, 'reg_alpha': 0.020928318023862073, 'reg_lambda': 0.31694548768005126}. Best is trial 44 with value: 4.8197765134153475e-06.
[I 2025-07-28 22:16:13,414] Trial 48 finished with value: 5.019251649998546e-06 and parameters: {'n_estimators': 644, 'learning_rate': 0.019641606416855688, 'max_depth': 4, 'reg_alpha': 0.5349952148237983, 'reg_lambda': 0.12507418018186936}. Best is trial 44 with value: 4.8197765134153475e-06.
[I 2025-07-28 22:16:17,813] Trial 49 finished with value: 5.0083168892968255e-06 and parameters: {'n_estimators': 530, 'learning_rate': 0.044301004399126556, 'max_depth': 6, 'reg_alpha': 0.1636717317089257, 'reg_lambda': 0.23507583530859125}. Best is trial 44 with value: 4.8197765134153475e-06.
[I 2025-07-28 22:16:17,814] A new study created in memory with name: no-name-8f01b19b-6668-4b27-9ae8-3fcfe43e399e
[I 2025-07-28 22:16:21,597] Trial 0 finished with value: 5.221682470570398e-06 and parameters: {'n_estimators': 312, 'max_depth': 12, 'min_samples_split': 10, 'min_samples_leaf': 1, 'max_features': 'log2'}. Best is trial 0 with value: 5.221682470570398e-06.
[I 2025-07-28 22:16:25,784] Trial 1 finished with value: 5.004757123061042e-06 and parameters: {'n_estimators': 370, 'max_depth': 4, 'min_samples_split': 3, 'min_samples_leaf': 7, 'max_features': 'sqrt'}. Best is trial 1 with value: 5.004757123061042e-06.
[I 2025-07-28 22:16:27,634] Trial 2 finished with value: 5.006296430461413e-06 and parameters: {'n_estimators': 107, 'max_depth': 8, 'min_samples_split': 3, 'min_samples_leaf': 10, 'max_features': 'sqrt'}. Best is trial 1 with value: 5.004757123061042e-06.
[I 2025-07-28 22:16:38,534] Trial 3 finished with value: 5.070350937071378e-06 and parameters: {'n_estimators': 484, 'max_depth': 12, 'min_samples_split': 20, 'min_samples_leaf': 4, 'max_features': 'sqrt'}. Best is trial 1 with value: 5.004757123061042e-06.
[I 2025-07-28 22:16:41,615] Trial 4 finished with value: 5.0767262031173745e-06 and parameters: {'n_estimators': 133, 'max_depth': 14, 'min_samples_split': 3, 'min_samples_leaf': 6, 'max_features': 'sqrt'}. Best is trial 1 with value: 5.004757123061042e-06.
[I 2025-07-28 22:19:06,647] Trial 5 finished with value: 4.965233171568693e-06 and parameters: {'n_estimators': 365, 'max_depth': 12, 'min_samples_split': 13, 'min_samples_leaf': 4, 'max_features': None}. Best is trial 5 with value: 4.965233171568693e-06.
[I 2025-07-28 22:19:08,645] Trial 6 finished with value: 5.0839530703462156e-06 and parameters: {'n_estimators': 178, 'max_depth': 14, 'min_samples_split': 3, 'min_samples_leaf': 6, 'max_features': 'log2'}. Best is trial 5 with value: 4.965233171568693e-06.
[I 2025-07-28 22:19:16,399] Trial 7 finished with value: 5.153984283751983e-06 and parameters: {'n_estimators': 317, 'max_depth': 12, 'min_samples_split': 6, 'min_samples_leaf': 3, 'max_features': 'sqrt'}. Best is trial 5 with value: 4.965233171568693e-06.
[I 2025-07-28 22:20:48,262] Trial 8 finished with value: 4.951223622899763e-06 and parameters: {'n_estimators': 245, 'max_depth': 11, 'min_samples_split': 2, 'min_samples_leaf': 5, 'max_features': None}. Best is trial 8 with value: 4.951223622899763e-06.
[I 2025-07-28 22:22:29,423] Trial 9 finished with value: 4.865003743072757e-06 and parameters: {'n_estimators': 377, 'max_depth': 7, 'min_samples_split': 3, 'min_samples_leaf': 7, 'max_features': None}. Best is trial 9 with value: 4.865003743072757e-06.
[I 2025-07-28 22:25:26,166] Trial 10 finished with value: 4.8670360387852375e-06 and parameters: {'n_estimators': 475, 'max_depth': 18, 'min_samples_split': 9, 'min_samples_leaf': 9, 'max_features': None}. Best is trial 9 with value: 4.865003743072757e-06.
[I 2025-07-28 22:28:31,173] Trial 11 finished with value: 4.862670142414374e-06 and parameters: {'n_estimators': 496, 'max_depth': 20, 'min_samples_split': 10, 'min_samples_leaf': 9, 'max_features': None}. Best is trial 11 with value: 4.862670142414374e-06.
[I 2025-07-28 22:31:19,371] Trial 12 finished with value: 4.905138242948469e-06 and parameters: {'n_estimators': 433, 'max_depth': 19, 'min_samples_split': 15, 'min_samples_leaf': 8, 'max_features': None}. Best is trial 11 with value: 4.862670142414374e-06.
[I 2025-07-28 22:32:43,300] Trial 13 finished with value: 4.803734581011645e-06 and parameters: {'n_estimators': 412, 'max_depth': 5, 'min_samples_split': 8, 'min_samples_leaf': 8, 'max_features': None}. Best is trial 13 with value: 4.803734581011645e-06.
[I 2025-07-28 22:33:53,351] Trial 14 finished with value: 4.750409912888952e-06 and parameters: {'n_estimators': 420, 'max_depth': 4, 'min_samples_split': 7, 'min_samples_leaf': 10, 'max_features': None}. Best is trial 14 with value: 4.750409912888952e-06.
[I 2025-07-28 22:34:48,062] Trial 15 finished with value: 4.727739999761627e-06 and parameters: {'n_estimators': 422, 'max_depth': 3, 'min_samples_split': 6, 'min_samples_leaf': 10, 'max_features': None}. Best is trial 15 with value: 4.727739999761627e-06.
[I 2025-07-28 22:34:49,515] Trial 16 finished with value: 5.015236818339134e-06 and parameters: {'n_estimators': 264, 'max_depth': 3, 'min_samples_split': 6, 'min_samples_leaf': 10, 'max_features': 'log2'}. Best is trial 15 with value: 4.727739999761627e-06.
[I 2025-07-28 22:36:29,666] Trial 17 finished with value: 4.792667125139093e-06 and parameters: {'n_estimators': 434, 'max_depth': 6, 'min_samples_split': 6, 'min_samples_leaf': 10, 'max_features': None}. Best is trial 15 with value: 4.727739999761627e-06.
[I 2025-07-28 22:38:23,240] Trial 18 finished with value: 4.825603750355199e-06 and parameters: {'n_estimators': 398, 'max_depth': 8, 'min_samples_split': 13, 'min_samples_leaf': 9, 'max_features': None}. Best is trial 15 with value: 4.727739999761627e-06.
[I 2025-07-28 22:40:24,797] Trial 19 finished with value: 5.024724075551198e-06 and parameters: {'n_estimators': 342, 'max_depth': 9, 'min_samples_split': 7, 'min_samples_leaf': 1, 'max_features': None}. Best is trial 15 with value: 4.727739999761627e-06.
[I 2025-07-28 22:40:27,259] Trial 20 finished with value: 5.022967685733832e-06 and parameters: {'n_estimators': 450, 'max_depth': 3, 'min_samples_split': 18, 'min_samples_leaf': 8, 'max_features': 'log2'}. Best is trial 15 with value: 4.727739999761627e-06.
[I 2025-07-28 22:41:57,295] Trial 21 finished with value: 4.767969555991412e-06 and parameters: {'n_estimators': 447, 'max_depth': 5, 'min_samples_split': 5, 'min_samples_leaf': 10, 'max_features': None}. Best is trial 15 with value: 4.727739999761627e-06.
[I 2025-07-28 22:43:29,676] Trial 22 finished with value: 4.768895915473711e-06 and parameters: {'n_estimators': 460, 'max_depth': 5, 'min_samples_split': 5, 'min_samples_leaf': 10, 'max_features': None}. Best is trial 15 with value: 4.727739999761627e-06.
[I 2025-07-28 22:44:23,212] Trial 23 finished with value: 4.734556882899894e-06 and parameters: {'n_estimators': 410, 'max_depth': 3, 'min_samples_split': 5, 'min_samples_leaf': 9, 'max_features': None}. Best is trial 15 with value: 4.727739999761627e-06.
[I 2025-07-28 22:45:16,256] Trial 24 finished with value: 4.734892412957259e-06 and parameters: {'n_estimators': 407, 'max_depth': 3, 'min_samples_split': 8, 'min_samples_leaf': 9, 'max_features': None}. Best is trial 15 with value: 4.727739999761627e-06.
[I 2025-07-28 22:45:52,035] Trial 25 finished with value: 4.738233059428313e-06 and parameters: {'n_estimators': 273, 'max_depth': 3, 'min_samples_split': 8, 'min_samples_leaf': 7, 'max_features': None}. Best is trial 15 with value: 4.727739999761627e-06.
[I 2025-07-28 22:47:21,688] Trial 26 finished with value: 4.799971980859248e-06 and parameters: {'n_estimators': 385, 'max_depth': 6, 'min_samples_split': 12, 'min_samples_leaf': 9, 'max_features': None}. Best is trial 15 with value: 4.727739999761627e-06.
[I 2025-07-28 22:49:14,541] Trial 27 finished with value: 4.85960017585987e-06 and parameters: {'n_estimators': 341, 'max_depth': 10, 'min_samples_split': 5, 'min_samples_leaf': 8, 'max_features': None}. Best is trial 15 with value: 4.727739999761627e-06.
[I 2025-07-28 22:49:16,330] Trial 28 finished with value: 5.039057712934983e-06 and parameters: {'n_estimators': 214, 'max_depth': 7, 'min_samples_split': 10, 'min_samples_leaf': 9, 'max_features': 'log2'}. Best is trial 15 with value: 4.727739999761627e-06.
[I 2025-07-28 22:50:10,553] Trial 29 finished with value: 4.820151421165151e-06 and parameters: {'n_estimators': 310, 'max_depth': 4, 'min_samples_split': 9, 'min_samples_leaf': 1, 'max_features': None}. Best is trial 15 with value: 4.727739999761627e-06.
[I 2025-07-28 22:50:13,193] Trial 30 finished with value: 5.051595188948459e-06 and parameters: {'n_estimators': 342, 'max_depth': 6, 'min_samples_split': 11, 'min_samples_leaf': 8, 'max_features': 'log2'}. Best is trial 15 with value: 4.727739999761627e-06.
[I 2025-07-28 22:50:48,852] Trial 31 finished with value: 4.738781951048558e-06 and parameters: {'n_estimators': 272, 'max_depth': 3, 'min_samples_split': 8, 'min_samples_leaf': 7, 'max_features': None}. Best is trial 15 with value: 4.727739999761627e-06.
[I 2025-07-28 22:51:25,825] Trial 32 finished with value: 4.733295243677591e-06 and parameters: {'n_estimators': 282, 'max_depth': 3, 'min_samples_split': 8, 'min_samples_leaf': 7, 'max_features': None}. Best is trial 15 with value: 4.727739999761627e-06.
[I 2025-07-28 22:52:11,750] Trial 33 finished with value: 4.770153841046297e-06 and parameters: {'n_estimators': 227, 'max_depth': 5, 'min_samples_split': 4, 'min_samples_leaf': 9, 'max_features': None}. Best is trial 15 with value: 4.727739999761627e-06.
[I 2025-07-28 22:52:15,097] Trial 34 finished with value: 4.981674456922279e-06 and parameters: {'n_estimators': 295, 'max_depth': 4, 'min_samples_split': 7, 'min_samples_leaf': 8, 'max_features': 'sqrt'}. Best is trial 15 with value: 4.727739999761627e-06.
[I 2025-07-28 22:53:16,706] Trial 35 finished with value: 4.816443754237605e-06 and parameters: {'n_estimators': 359, 'max_depth': 4, 'min_samples_split': 9, 'min_samples_leaf': 5, 'max_features': None}. Best is trial 15 with value: 4.727739999761627e-06.
[I 2025-07-28 22:53:25,726] Trial 36 finished with value: 5.065062728343579e-06 and parameters: {'n_estimators': 406, 'max_depth': 14, 'min_samples_split': 4, 'min_samples_leaf': 7, 'max_features': 'sqrt'}. Best is trial 15 with value: 4.727739999761627e-06.
[I 2025-07-28 22:54:13,039] Trial 37 finished with value: 4.8573768874991675e-06 and parameters: {'n_estimators': 175, 'max_depth': 7, 'min_samples_split': 11, 'min_samples_leaf': 6, 'max_features': None}. Best is trial 15 with value: 4.727739999761627e-06.
[I 2025-07-28 22:54:17,452] Trial 38 finished with value: 4.983217743647918e-06 and parameters: {'n_estimators': 475, 'max_depth': 3, 'min_samples_split': 2, 'min_samples_leaf': 9, 'max_features': 'sqrt'}. Best is trial 15 with value: 4.727739999761627e-06.
[I 2025-07-28 22:56:55,526] Trial 39 finished with value: 4.9368948895694235e-06 and parameters: {'n_estimators': 392, 'max_depth': 17, 'min_samples_split': 4, 'min_samples_leaf': 7, 'max_features': None}. Best is trial 15 with value: 4.727739999761627e-06.
[I 2025-07-28 22:58:46,678] Trial 40 finished with value: 4.933297536889805e-06 and parameters: {'n_estimators': 360, 'max_depth': 8, 'min_samples_split': 6, 'min_samples_leaf': 4, 'max_features': None}. Best is trial 15 with value: 4.727739999761627e-06.
[I 2025-07-28 22:59:23,370] Trial 41 finished with value: 4.753291821777022e-06 and parameters: {'n_estimators': 279, 'max_depth': 3, 'min_samples_split': 8, 'min_samples_leaf': 6, 'max_features': None}. Best is trial 15 with value: 4.727739999761627e-06.
[I 2025-07-28 23:00:03,923] Trial 42 finished with value: 4.740199889954416e-06 and parameters: {'n_estimators': 243, 'max_depth': 4, 'min_samples_split': 8, 'min_samples_leaf': 10, 'max_features': None}. Best is trial 15 with value: 4.727739999761627e-06.
[I 2025-07-28 23:00:45,418] Trial 43 finished with value: 4.747264400242809e-06 and parameters: {'n_estimators': 318, 'max_depth': 3, 'min_samples_split': 7, 'min_samples_leaf': 7, 'max_features': None}. Best is trial 15 with value: 4.727739999761627e-06.
[I 2025-07-28 23:01:45,940] Trial 44 finished with value: 4.817130470836564e-06 and parameters: {'n_estimators': 292, 'max_depth': 5, 'min_samples_split': 9, 'min_samples_leaf': 6, 'max_features': None}. Best is trial 15 with value: 4.727739999761627e-06.
[I 2025-07-28 23:02:19,362] Trial 45 finished with value: 4.7546705477059295e-06 and parameters: {'n_estimators': 197, 'max_depth': 4, 'min_samples_split': 10, 'min_samples_leaf': 8, 'max_features': None}. Best is trial 15 with value: 4.727739999761627e-06.
[I 2025-07-28 23:02:23,175] Trial 46 finished with value: 5.030006532160852e-06 and parameters: {'n_estimators': 249, 'max_depth': 6, 'min_samples_split': 5, 'min_samples_leaf': 5, 'max_features': 'sqrt'}. Best is trial 15 with value: 4.727739999761627e-06.
[I 2025-07-28 23:04:23,448] Trial 47 finished with value: 4.869641196987026e-06 and parameters: {'n_estimators': 325, 'max_depth': 16, 'min_samples_split': 7, 'min_samples_leaf': 9, 'max_features': None}. Best is trial 15 with value: 4.727739999761627e-06.
[I 2025-07-28 23:04:24,239] Trial 48 finished with value: 5.068032553373625e-06 and parameters: {'n_estimators': 135, 'max_depth': 3, 'min_samples_split': 6, 'min_samples_leaf': 3, 'max_features': 'log2'}. Best is trial 15 with value: 4.727739999761627e-06.
[I 2025-07-28 23:06:06,864] Trial 49 finished with value: 4.8210583549578424e-06 and parameters: {'n_estimators': 500, 'max_depth': 5, 'min_samples_split': 8, 'min_samples_leaf': 7, 'max_features': None}. Best is trial 15 with value: 4.727739999761627e-06.
[I 2025-07-28 23:06:06,865] A new study created in memory with name: no-name-b50b8a0b-89d6-49f5-8417-9615fe6caed2
[I 2025-07-28 23:06:36,631] Trial 0 finished with value: 4.962085878704989e-06 and parameters: {'n_estimators': 101, 'max_depth': 7}. Best is trial 0 with value: 4.962085878704989e-06.
[I 2025-07-28 23:07:17,215] Trial 1 finished with value: 4.835477409275273e-06 and parameters: {'n_estimators': 231, 'max_depth': 4}. Best is trial 1 with value: 4.835477409275273e-06.
[I 2025-07-28 23:09:39,993] Trial 2 finished with value: 4.98323794456125e-06 and parameters: {'n_estimators': 430, 'max_depth': 8}. Best is trial 1 with value: 4.835477409275273e-06.
[I 2025-07-28 23:10:27,064] Trial 3 finished with value: 4.785057156989199e-06 and parameters: {'n_estimators': 353, 'max_depth': 3}. Best is trial 3 with value: 4.785057156989199e-06.
[I 2025-07-28 23:12:18,058] Trial 4 finished with value: 4.983507195994771e-06 and parameters: {'n_estimators': 376, 'max_depth': 7}. Best is trial 3 with value: 4.785057156989199e-06.
[I 2025-07-28 23:15:29,897] Trial 5 finished with value: 5.036496658185319e-06 and parameters: {'n_estimators': 481, 'max_depth': 10}. Best is trial 3 with value: 4.785057156989199e-06.
[I 2025-07-28 23:15:56,082] Trial 6 finished with value: 4.799948730895748e-06 and parameters: {'n_estimators': 149, 'max_depth': 4}. Best is trial 3 with value: 4.785057156989199e-06.
[I 2025-07-28 23:17:37,721] Trial 7 finished with value: 4.9296101195181844e-06 and parameters: {'n_estimators': 396, 'max_depth': 6}. Best is trial 3 with value: 4.785057156989199e-06.
[I 2025-07-28 23:18:34,555] Trial 8 finished with value: 4.9017829006122935e-06 and parameters: {'n_estimators': 221, 'max_depth': 6}. Best is trial 3 with value: 4.785057156989199e-06.
[I 2025-07-28 23:21:27,464] Trial 9 finished with value: 5.040610239287814e-06 and parameters: {'n_estimators': 433, 'max_depth': 10}. Best is trial 3 with value: 4.785057156989199e-06.
[I 2025-07-28 23:22:09,815] Trial 10 finished with value: 4.78427331967112e-06 and parameters: {'n_estimators': 317, 'max_depth': 3}. Best is trial 10 with value: 4.78427331967112e-06.
[I 2025-07-28 23:22:51,408] Trial 11 finished with value: 4.777712986181618e-06 and parameters: {'n_estimators': 311, 'max_depth': 3}. Best is trial 11 with value: 4.777712986181618e-06.
[I 2025-07-28 23:23:31,149] Trial 12 finished with value: 4.777990695225706e-06 and parameters: {'n_estimators': 297, 'max_depth': 3}. Best is trial 11 with value: 4.777712986181618e-06.
[I 2025-07-28 23:24:25,644] Trial 13 finished with value: 4.866044795432359e-06 and parameters: {'n_estimators': 251, 'max_depth': 5}. Best is trial 11 with value: 4.777712986181618e-06.
[I 2025-07-28 23:25:16,289] Trial 14 finished with value: 4.8185796337270135e-06 and parameters: {'n_estimators': 288, 'max_depth': 4}. Best is trial 11 with value: 4.777712986181618e-06.
[I 2025-07-28 23:25:57,712] Trial 15 finished with value: 4.7782148487235465e-06 and parameters: {'n_estimators': 310, 'max_depth': 3}. Best is trial 11 with value: 4.777712986181618e-06.
[I 2025-07-28 23:26:41,795] Trial 16 finished with value: 4.880526964415031e-06 and parameters: {'n_estimators': 203, 'max_depth': 5}. Best is trial 11 with value: 4.777712986181618e-06.
[I 2025-07-28 23:27:41,459] Trial 17 finished with value: 4.862696928340863e-06 and parameters: {'n_estimators': 275, 'max_depth': 5}. Best is trial 11 with value: 4.777712986181618e-06.
[I 2025-07-28 23:29:36,814] Trial 18 finished with value: 4.988045690479717e-06 and parameters: {'n_estimators': 347, 'max_depth': 8}. Best is trial 11 with value: 4.777712986181618e-06.
[I 2025-07-28 23:30:02,365] Trial 19 finished with value: 4.774708163867212e-06 and parameters: {'n_estimators': 191, 'max_depth': 3}. Best is trial 19 with value: 4.774708163867212e-06.
[I 2025-07-28 23:30:34,291] Trial 20 finished with value: 4.8299412236606165e-06 and parameters: {'n_estimators': 182, 'max_depth': 4}. Best is trial 19 with value: 4.774708163867212e-06.
[I 2025-07-28 23:30:51,667] Trial 21 finished with value: 4.7445459491352896e-06 and parameters: {'n_estimators': 130, 'max_depth': 3}. Best is trial 21 with value: 4.7445459491352896e-06.
[I 2025-07-28 23:31:07,320] Trial 22 finished with value: 4.752850342784421e-06 and parameters: {'n_estimators': 117, 'max_depth': 3}. Best is trial 21 with value: 4.7445459491352896e-06.
[I 2025-07-28 23:31:27,173] Trial 23 finished with value: 4.776579554004069e-06 and parameters: {'n_estimators': 113, 'max_depth': 4}. Best is trial 21 with value: 4.7445459491352896e-06.
[I 2025-07-28 23:32:00,605] Trial 24 finished with value: 4.8476470644569815e-06 and parameters: {'n_estimators': 154, 'max_depth': 5}. Best is trial 21 with value: 4.7445459491352896e-06.
[I 2025-07-28 23:32:19,743] Trial 25 finished with value: 4.7525364711168e-06 and parameters: {'n_estimators': 143, 'max_depth': 3}. Best is trial 21 with value: 4.7445459491352896e-06.
[I 2025-07-28 23:32:45,400] Trial 26 finished with value: 4.797273969501282e-06 and parameters: {'n_estimators': 146, 'max_depth': 4}. Best is trial 21 with value: 4.7445459491352896e-06.
