[I 2025-07-29 01:07:28,758] Trial 26 finished with value: 5.019251650211013e-06 and parameters: {'n_estimators': 402, 'learning_rate': 0.24672349310287692, 'max_depth': 4, 'num_leaves': 64, 'reg_alpha': 0.3971302739287649, 'reg_lambda': 0.396853663025634}. Best is trial 20 with value: 4.813302687595894e-06.
[I 2025-07-29 01:07:29,156] Trial 27 finished with value: 4.837480286303651e-06 and parameters: {'n_estimators': 297, 'learning_rate': 0.2681419990707239, 'max_depth': 5, 'num_leaves': 91, 'reg_alpha': 0.07008046599844858, 'reg_lambda': 0.20588153976874143}. Best is trial 20 with value: 4.813302687595894e-06.
[I 2025-07-29 01:07:29,661] Trial 28 finished with value: 5.019251650211013e-06 and parameters: {'n_estimators': 543, 'learning_rate': 0.19552503112362307, 'max_depth': 3, 'num_leaves': 75, 'reg_alpha': 0.19778925819344695, 'reg_lambda': 0.3855921738307561}. Best is trial 20 with value: 4.813302687595894e-06.
[I 2025-07-29 01:07:29,950] Trial 29 finished with value: 5.019251650211013e-06 and parameters: {'n_estimators': 157, 'learning_rate': 0.2750442030050697, 'max_depth': 4, 'num_leaves': 63, 'reg_alpha': 0.5560697695089029, 'reg_lambda': 0.06587451477045717}. Best is trial 20 with value: 4.813302687595894e-06.
[I 2025-07-29 01:07:30,440] Trial 30 finished with value: 5.019251650211013e-06 and parameters: {'n_estimators': 462, 'learning_rate': 0.20978314762806152, 'max_depth': 6, 'num_leaves': 94, 'reg_alpha': 0.3585062081818431, 'reg_lambda': 0.11236771184494004}. Best is trial 20 with value: 4.813302687595894e-06.
[I 2025-07-29 01:07:30,822] Trial 31 finished with value: 4.887300323670195e-06 and parameters: {'n_estimators': 257, 'learning_rate': 0.27353669644989187, 'max_depth': 5, 'num_leaves': 91, 'reg_alpha': 0.0959481612311669, 'reg_lambda': 0.21603522867936784}. Best is trial 20 with value: 4.813302687595894e-06.
[I 2025-07-29 01:07:31,256] Trial 32 finished with value: 4.8292001969115774e-06 and parameters: {'n_estimators': 323, 'learning_rate': 0.23865570492488322, 'max_depth': 5, 'num_leaves': 88, 'reg_alpha': 0.07605694498481051, 'reg_lambda': 0.21756695354336053}. Best is trial 20 with value: 4.813302687595894e-06.
[I 2025-07-29 01:07:32,285] Trial 33 finished with value: 5.548152161673068e-06 and parameters: {'n_estimators': 218, 'learning_rate': 0.17502317359708364, 'max_depth': 4, 'num_leaves': 87, 'reg_alpha': 0.005792307191109181, 'reg_lambda': 0.1036925088523512}. Best is trial 20 with value: 4.813302687595894e-06.
[I 2025-07-29 01:07:32,709] Trial 34 finished with value: 4.8304132940296916e-06 and parameters: {'n_estimators': 329, 'learning_rate': 0.23639825918432314, 'max_depth': 3, 'num_leaves': 96, 'reg_alpha': 0.07422865023898507, 'reg_lambda': 0.24741995405392958}. Best is trial 20 with value: 4.813302687595894e-06.
[I 2025-07-29 01:07:33,086] Trial 35 finished with value: 5.019251650211013e-06 and parameters: {'n_estimators': 341, 'learning_rate': 0.2439141152978019, 'max_depth': 3, 'num_leaves': 75, 'reg_alpha': 0.6984520278840546, 'reg_lambda': 0.26602417472678014}. Best is trial 20 with value: 4.813302687595894e-06.
[I 2025-07-29 01:07:33,431] Trial 36 finished with value: 5.019251650211013e-06 and parameters: {'n_estimators': 209, 'learning_rate': 0.24083581372661433, 'max_depth': 3, 'num_leaves': 79, 'reg_alpha': 0.27061061821878524, 'reg_lambda': 0.34920400291465226}. Best is trial 20 with value: 4.813302687595894e-06.
[I 2025-07-29 01:07:33,650] Trial 37 finished with value: 4.982214601033653e-06 and parameters: {'n_estimators': 104, 'learning_rate': 0.2094367084719294, 'max_depth': 3, 'num_leaves': 48, 'reg_alpha': 0.14634055316593053, 'reg_lambda': 0.22692189162227838}. Best is trial 20 with value: 4.813302687595894e-06.
[I 2025-07-29 01:07:34,025] Trial 38 finished with value: 5.019251650211013e-06 and parameters: {'n_estimators': 353, 'learning_rate': 0.23135653563931433, 'max_depth': 4, 'num_leaves': 17, 'reg_alpha': 0.21075796971692162, 'reg_lambda': 0.1586486144298125}. Best is trial 20 with value: 4.813302687595894e-06.
[I 2025-07-29 01:07:34,465] Trial 39 finished with value: 4.866999399296058e-06 and parameters: {'n_estimators': 421, 'learning_rate': 0.2654684653052796, 'max_depth': 10, 'num_leaves': 86, 'reg_alpha': 0.07877853774738615, 'reg_lambda': 0.2596641821808444}. Best is trial 20 with value: 4.813302687595894e-06.
[I 2025-07-29 01:07:34,966] Trial 40 finished with value: 5.019251650211013e-06 and parameters: {'n_estimators': 502, 'learning_rate': 0.21696426396756338, 'max_depth': 3, 'num_leaves': 96, 'reg_alpha': 0.27609941527308585, 'reg_lambda': 0.3631155507176759}. Best is trial 20 with value: 4.813302687595894e-06.
[I 2025-07-29 01:07:35,412] Trial 41 finished with value: 4.833255828599138e-06 and parameters: {'n_estimators': 327, 'learning_rate': 0.18501878257294835, 'max_depth': 5, 'num_leaves': 98, 'reg_alpha': 0.05992534847685083, 'reg_lambda': 0.05964638610437151}. Best is trial 20 with value: 4.813302687595894e-06.
[I 2025-07-29 01:07:35,835] Trial 42 finished with value: 4.961208793561562e-06 and parameters: {'n_estimators': 359, 'learning_rate': 0.18638545328737782, 'max_depth': 4, 'num_leaves': 88, 'reg_alpha': 0.1262358067584875, 'reg_lambda': 0.053958631773320484}. Best is trial 20 with value: 4.813302687595894e-06.
[I 2025-07-29 01:07:36,270] Trial 43 finished with value: 4.950148131701665e-06 and parameters: {'n_estimators': 316, 'learning_rate': 0.23388734408084225, 'max_depth': 6, 'num_leaves': 96, 'reg_alpha': 0.05117254130700216, 'reg_lambda': 0.0942555585032934}. Best is trial 20 with value: 4.813302687595894e-06.
[I 2025-07-29 01:07:36,757] Trial 44 finished with value: 4.984210826639593e-06 and parameters: {'n_estimators': 419, 'learning_rate': 0.20151760027480897, 'max_depth': 5, 'num_leaves': 84, 'reg_alpha': 0.149639078492868, 'reg_lambda': 0.01758319472448805}. Best is trial 20 with value: 4.813302687595894e-06.
[I 2025-07-29 01:07:37,878] Trial 45 finished with value: 5.9259603682395866e-06 and parameters: {'n_estimators': 568, 'learning_rate': 0.28320849931784575, 'max_depth': 4, 'num_leaves': 96, 'reg_alpha': 0.003736347085276967, 'reg_lambda': 0.43713730594349376}. Best is trial 20 with value: 4.813302687595894e-06.
[I 2025-07-29 01:07:38,255] Trial 46 finished with value: 5.019251650211013e-06 and parameters: {'n_estimators': 246, 'learning_rate': 0.1809451874085788, 'max_depth': 5, 'num_leaves': 100, 'reg_alpha': 0.7266998440789034, 'reg_lambda': 0.17937700841869952}. Best is trial 20 with value: 4.813302687595894e-06.
[I 2025-07-29 01:07:38,742] Trial 47 finished with value: 5.019251650211013e-06 and parameters: {'n_estimators': 508, 'learning_rate': 0.25690871935177484, 'max_depth': 3, 'num_leaves': 82, 'reg_alpha': 0.9984872773397574, 'reg_lambda': 0.32084243848997296}. Best is trial 20 with value: 4.813302687595894e-06.
[I 2025-07-29 01:07:39,212] Trial 48 finished with value: 4.8860444793396115e-06 and parameters: {'n_estimators': 371, 'learning_rate': 0.12446318098169162, 'max_depth': 6, 'num_leaves': 88, 'reg_alpha': 0.09596609646152579, 'reg_lambda': 0.24394146655303206}. Best is trial 20 with value: 4.813302687595894e-06.
[I 2025-07-29 01:07:39,699] Trial 49 finished with value: 5.00602837135777e-06 and parameters: {'n_estimators': 450, 'learning_rate': 0.1981787527362587, 'max_depth': 4, 'num_leaves': 95, 'reg_alpha': 0.16968810325895722, 'reg_lambda': 0.13927756861639298}. Best is trial 20 with value: 4.813302687595894e-06.
[I 2025-07-29 01:07:39,699] A new study created in memory with name: no-name-a9197f23-5419-446e-9461-ea066215597f
[I 2025-07-29 01:07:41,697] Trial 0 finished with value: 5.019251649998546e-06 and parameters: {'n_estimators': 280, 'learning_rate': 0.2466228649811272, 'max_depth': 3, 'reg_alpha': 0.9234811810537068, 'reg_lambda': 0.3296228498007874}. Best is trial 0 with value: 5.019251649998546e-06.
[I 2025-07-29 01:07:47,456] Trial 1 finished with value: 5.019251649998546e-06 and parameters: {'n_estimators': 852, 'learning_rate': 0.20204447638566395, 'max_depth': 3, 'reg_alpha': 0.3123890325045836, 'reg_lambda': 0.4718484156484518}. Best is trial 0 with value: 5.019251649998546e-06.
[I 2025-07-29 01:07:49,979] Trial 2 finished with value: 5.019251649998546e-06 and parameters: {'n_estimators': 366, 'learning_rate': 0.2054155349936913, 'max_depth': 8, 'reg_alpha': 0.44139012291489355, 'reg_lambda': 0.34142350703797497}. Best is trial 0 with value: 5.019251649998546e-06.
[I 2025-07-29 01:07:52,901] Trial 3 finished with value: 5.292397770454445e-06 and parameters: {'n_estimators': 259, 'learning_rate': 0.23456173752822543, 'max_depth': 6, 'reg_alpha': 0.010189668135626495, 'reg_lambda': 0.027075703316129074}. Best is trial 0 with value: 5.019251649998546e-06.
[I 2025-07-29 01:07:54,997] Trial 4 finished with value: 5.019251649998546e-06 and parameters: {'n_estimators': 295, 'learning_rate': 0.2573713897242233, 'max_depth': 3, 'reg_alpha': 0.9457033744423208, 'reg_lambda': 0.2359339866682969}. Best is trial 0 with value: 5.019251649998546e-06.
[I 2025-07-29 01:08:01,289] Trial 5 finished with value: 5.019251649998546e-06 and parameters: {'n_estimators': 979, 'learning_rate': 0.046933340516316195, 'max_depth': 5, 'reg_alpha': 0.45489216024000256, 'reg_lambda': 0.26209029461674316}. Best is trial 0 with value: 5.019251649998546e-06.
[I 2025-07-29 01:08:02,304] Trial 6 finished with value: 5.019251649998546e-06 and parameters: {'n_estimators': 116, 'learning_rate': 0.1345850052783742, 'max_depth': 4, 'reg_alpha': 0.24063033360818775, 'reg_lambda': 0.9077493438959497}. Best is trial 0 with value: 5.019251649998546e-06.
[I 2025-07-29 01:08:06,992] Trial 7 finished with value: 5.019251649998546e-06 and parameters: {'n_estimators': 693, 'learning_rate': 0.20607899344643957, 'max_depth': 10, 'reg_alpha': 0.9824163291399127, 'reg_lambda': 0.19011690858905372}. Best is trial 0 with value: 5.019251649998546e-06.
[I 2025-07-29 01:08:13,572] Trial 8 finished with value: 5.019251649998546e-06 and parameters: {'n_estimators': 968, 'learning_rate': 0.194651942864303, 'max_depth': 9, 'reg_alpha': 0.4605291806180497, 'reg_lambda': 0.7669261032883231}. Best is trial 0 with value: 5.019251649998546e-06.
[I 2025-07-29 01:08:17,620] Trial 9 finished with value: 5.019251649998546e-06 and parameters: {'n_estimators': 585, 'learning_rate': 0.10211171503141396, 'max_depth': 7, 'reg_alpha': 0.8286727110964389, 'reg_lambda': 0.644943850206174}. Best is trial 0 with value: 5.019251649998546e-06.
[I 2025-07-29 01:08:21,190] Trial 10 finished with value: 5.019251649998546e-06 and parameters: {'n_estimators': 453, 'learning_rate': 0.29824288994373577, 'max_depth': 5, 'reg_alpha': 0.7157586151594206, 'reg_lambda': 0.4922546377767333}. Best is trial 0 with value: 5.019251649998546e-06.
[I 2025-07-29 01:08:26,515] Trial 11 finished with value: 5.019251649998546e-06 and parameters: {'n_estimators': 783, 'learning_rate': 0.2899865653394265, 'max_depth': 3, 'reg_alpha': 0.2131579341003878, 'reg_lambda': 0.5097259301115425}. Best is trial 0 with value: 5.019251649998546e-06.
[I 2025-07-29 01:08:31,987] Trial 12 finished with value: 5.019251649998546e-06 and parameters: {'n_estimators': 811, 'learning_rate': 0.1582446092487076, 'max_depth': 3, 'reg_alpha': 0.6822340977065501, 'reg_lambda': 0.4632875479813011}. Best is trial 0 with value: 5.019251649998546e-06.
[I 2025-07-29 01:08:35,696] Trial 13 finished with value: 5.019251649998546e-06 and parameters: {'n_estimators': 529, 'learning_rate': 0.24730872907003854, 'max_depth': 5, 'reg_alpha': 0.24959416360129294, 'reg_lambda': 0.6282198451964651}. Best is trial 0 with value: 5.019251649998546e-06.
[I 2025-07-29 01:08:37,117] Trial 14 finished with value: 5.019251649998546e-06 and parameters: {'n_estimators': 170, 'learning_rate': 0.15605694345633528, 'max_depth': 4, 'reg_alpha': 0.5957653516783411, 'reg_lambda': 0.009284523335562955}. Best is trial 0 with value: 5.019251649998546e-06.
[I 2025-07-29 01:08:41,682] Trial 15 finished with value: 5.019251649998546e-06 and parameters: {'n_estimators': 662, 'learning_rate': 0.09094309498550343, 'max_depth': 4, 'reg_alpha': 0.3212765963447442, 'reg_lambda': 0.3707990069013272}. Best is trial 0 with value: 5.019251649998546e-06.
[I 2025-07-29 01:08:45,437] Trial 16 finished with value: 4.969247483019788e-06 and parameters: {'n_estimators': 432, 'learning_rate': 0.19240000373955268, 'max_depth': 6, 'reg_alpha': 0.028414895043337163, 'reg_lambda': 0.1291460824647147}. Best is trial 16 with value: 4.969247483019788e-06.
[I 2025-07-29 01:08:48,921] Trial 17 finished with value: 5.046697111306762e-06 and parameters: {'n_estimators': 400, 'learning_rate': 0.2726231802957404, 'max_depth': 7, 'reg_alpha': 0.034372791557872186, 'reg_lambda': 0.10396310014604482}. Best is trial 16 with value: 4.969247483019788e-06.
[I 2025-07-29 01:08:50,897] Trial 18 finished with value: 5.019251649998546e-06 and parameters: {'n_estimators': 256, 'learning_rate': 0.22981818928101605, 'max_depth': 6, 'reg_alpha': 0.8605278527859074, 'reg_lambda': 0.13174352560476987}. Best is trial 16 with value: 4.969247483019788e-06.
[I 2025-07-29 01:08:55,542] Trial 19 finished with value: 4.986870664181265e-06 and parameters: {'n_estimators': 486, 'learning_rate': 0.013958515358607732, 'max_depth': 8, 'reg_alpha': 0.12251030561423581, 'reg_lambda': 0.34782094439649697}. Best is trial 16 with value: 4.969247483019788e-06.
[I 2025-07-29 01:09:00,364] Trial 20 finished with value: 4.988300168398409e-06 and parameters: {'n_estimators': 501, 'learning_rate': 0.015551524378922588, 'max_depth': 8, 'reg_alpha': 0.12635484009616504, 'reg_lambda': 0.13230707515510623}. Best is trial 16 with value: 4.969247483019788e-06.
[I 2025-07-29 01:09:04,555] Trial 21 finished with value: 4.991285745806479e-06 and parameters: {'n_estimators': 495, 'learning_rate': 0.018418268553912584, 'max_depth': 8, 'reg_alpha': 0.13556545931794706, 'reg_lambda': 0.12971284320688165}. Best is trial 16 with value: 4.969247483019788e-06.
[I 2025-07-29 01:09:10,145] Trial 22 finished with value: 4.9805931973423944e-06 and parameters: {'n_estimators': 620, 'learning_rate': 0.016211713467749606, 'max_depth': 8, 'reg_alpha': 0.11645383157643499, 'reg_lambda': 0.25604376027822834}. Best is trial 16 with value: 4.969247483019788e-06.
[I 2025-07-29 01:09:15,352] Trial 23 finished with value: 4.946933965776825e-06 and parameters: {'n_estimators': 611, 'learning_rate': 0.05393507691489906, 'max_depth': 9, 'reg_alpha': 0.08337223459116383, 'reg_lambda': 0.2513765292853698}. Best is trial 23 with value: 4.946933965776825e-06.
[I 2025-07-29 01:09:21,180] Trial 24 finished with value: 4.891347814615279e-06 and parameters: {'n_estimators': 608, 'learning_rate': 0.0553717811312222, 'max_depth': 10, 'reg_alpha': 0.06552673917353434, 'reg_lambda': 0.2398529247579085}. Best is trial 24 with value: 4.891347814615279e-06.
[I 2025-07-29 01:09:29,635] Trial 25 finished with value: 4.9931084694704e-06 and parameters: {'n_estimators': 715, 'learning_rate': 0.06474054939368036, 'max_depth': 10, 'reg_alpha': 0.025339797082279764, 'reg_lambda': 0.06934416480459973}. Best is trial 24 with value: 4.891347814615279e-06.
[I 2025-07-29 01:09:33,603] Trial 26 finished with value: 5.019251649998546e-06 and parameters: {'n_estimators': 583, 'learning_rate': 0.12342041861353005, 'max_depth': 9, 'reg_alpha': 0.32119525232469254, 'reg_lambda': 0.1906353330025505}. Best is trial 24 with value: 4.891347814615279e-06.
[I 2025-07-29 01:09:37,450] Trial 27 finished with value: 4.938914546308841e-06 and parameters: {'n_estimators': 385, 'learning_rate': 0.05552839430357079, 'max_depth': 9, 'reg_alpha': 0.0818336891343717, 'reg_lambda': 0.42538784057415524}. Best is trial 24 with value: 4.891347814615279e-06.
[I 2025-07-29 01:09:42,802] Trial 28 finished with value: 5.019251649998546e-06 and parameters: {'n_estimators': 766, 'learning_rate': 0.04933976083118387, 'max_depth': 9, 'reg_alpha': 0.1844885168427456, 'reg_lambda': 0.4070236607030886}. Best is trial 24 with value: 4.891347814615279e-06.
[I 2025-07-29 01:09:45,274] Trial 29 finished with value: 5.019251649998546e-06 and parameters: {'n_estimators': 342, 'learning_rate': 0.07593961896267205, 'max_depth': 10, 'reg_alpha': 0.3649151278756648, 'reg_lambda': 0.5953231392793329}. Best is trial 24 with value: 4.891347814615279e-06.
[I 2025-07-29 01:09:52,682] Trial 30 finished with value: 4.9249054889404375e-06 and parameters: {'n_estimators': 888, 'learning_rate': 0.04130310440279966, 'max_depth': 9, 'reg_alpha': 0.07763780920658532, 'reg_lambda': 0.2964410755041579}. Best is trial 24 with value: 4.891347814615279e-06.
[I 2025-07-29 01:09:59,665] Trial 31 finished with value: 4.976869967998246e-06 and parameters: {'n_estimators': 898, 'learning_rate': 0.03784625100224368, 'max_depth': 9, 'reg_alpha': 0.10004085425132327, 'reg_lambda': 0.31212054304617615}. Best is trial 24 with value: 4.891347814615279e-06.
[I 2025-07-29 01:10:06,710] Trial 32 finished with value: 4.9144491310638285e-06 and parameters: {'n_estimators': 867, 'learning_rate': 0.07643540457660974, 'max_depth': 10, 'reg_alpha': 0.06942703718553397, 'reg_lambda': 0.3967389989161949}. Best is trial 24 with value: 4.891347814615279e-06.
[I 2025-07-29 01:10:12,348] Trial 33 finished with value: 5.019251649998546e-06 and parameters: {'n_estimators': 845, 'learning_rate': 0.08374766266798714, 'max_depth': 10, 'reg_alpha': 0.1941971403102104, 'reg_lambda': 0.40890229325835004}. Best is trial 24 with value: 4.891347814615279e-06.
[I 2025-07-29 01:10:23,087] Trial 34 finished with value: 5.190840294006852e-06 and parameters: {'n_estimators': 926, 'learning_rate': 0.0998980811816979, 'max_depth': 10, 'reg_alpha': 0.0020253831397359506, 'reg_lambda': 0.5582415893813765}. Best is trial 24 with value: 4.891347814615279e-06.
[I 2025-07-29 01:10:30,959] Trial 35 finished with value: 4.911862514074371e-06 and parameters: {'n_estimators': 911, 'learning_rate': 0.03412284011301037, 'max_depth': 9, 'reg_alpha': 0.07498545526439662, 'reg_lambda': 0.3141702114167065}. Best is trial 24 with value: 4.891347814615279e-06.
[I 2025-07-29 01:10:36,853] Trial 36 finished with value: 5.019251649998546e-06 and parameters: {'n_estimators': 891, 'learning_rate': 0.03695052096481469, 'max_depth': 10, 'reg_alpha': 0.27408677019868133, 'reg_lambda': 0.30539365425396486}. Best is trial 24 with value: 4.891347814615279e-06.
[I 2025-07-29 01:10:42,103] Trial 37 finished with value: 5.019251649998546e-06 and parameters: {'n_estimators': 744, 'learning_rate': 0.03314596314163303, 'max_depth': 10, 'reg_alpha': 0.38212158875455077, 'reg_lambda': 0.1923380868323078}. Best is trial 24 with value: 4.891347814615279e-06.
[I 2025-07-29 01:10:48,631] Trial 38 finished with value: 5.019251649998546e-06 and parameters: {'n_estimators': 1000, 'learning_rate': 0.06731268940518843, 'max_depth': 9, 'reg_alpha': 0.1826188543108418, 'reg_lambda': 0.2978218591545319}. Best is trial 24 with value: 4.891347814615279e-06.
[I 2025-07-29 01:10:54,307] Trial 39 finished with value: 5.006679380221285e-06 and parameters: {'n_estimators': 839, 'learning_rate': 0.11795946182206324, 'max_depth': 7, 'reg_alpha': 0.15905368449090243, 'reg_lambda': 0.3612650942185982}. Best is trial 24 with value: 4.891347814615279e-06.
[I 2025-07-29 01:11:03,557] Trial 40 finished with value: 4.897919652603813e-06 and parameters: {'n_estimators': 940, 'learning_rate': 0.028121596596843244, 'max_depth': 10, 'reg_alpha': 0.0639440768635407, 'reg_lambda': 0.20446105302094797}. Best is trial 24 with value: 4.891347814615279e-06.
[I 2025-07-29 01:11:12,934] Trial 41 finished with value: 4.88170146744196e-06 and parameters: {'n_estimators': 931, 'learning_rate': 0.029393166351836093, 'max_depth': 10, 'reg_alpha': 0.059635652188483004, 'reg_lambda': 0.20321725322140446}. Best is trial 41 with value: 4.88170146744196e-06.
[I 2025-07-29 01:11:22,951] Trial 42 finished with value: 4.8845144990483924e-06 and parameters: {'n_estimators': 933, 'learning_rate': 0.02974445587410885, 'max_depth': 10, 'reg_alpha': 0.050977175830648, 'reg_lambda': 0.2114042891585712}. Best is trial 41 with value: 4.88170146744196e-06.
[I 2025-07-29 01:11:33,430] Trial 43 finished with value: 4.892358182029745e-06 and parameters: {'n_estimators': 948, 'learning_rate': 0.020133439920328768, 'max_depth': 10, 'reg_alpha': 0.06458884483523883, 'reg_lambda': 0.19499070520234588}. Best is trial 41 with value: 4.88170146744196e-06.
[I 2025-07-29 01:11:53,955] Trial 44 finished with value: 5.116088271041112e-06 and parameters: {'n_estimators': 950, 'learning_rate': 0.026581359520662363, 'max_depth': 10, 'reg_alpha': 0.005703303015723103, 'reg_lambda': 0.21057383883009465}. Best is trial 41 with value: 4.88170146744196e-06.
[I 2025-07-29 01:12:00,348] Trial 45 finished with value: 5.019251649998546e-06 and parameters: {'n_estimators': 953, 'learning_rate': 0.06382362560361923, 'max_depth': 10, 'reg_alpha': 0.2402482478691506, 'reg_lambda': 0.052710062544660596}. Best is trial 41 with value: 4.88170146744196e-06.
[I 2025-07-29 01:12:07,564] Trial 46 finished with value: 5.0073315717935544e-06 and parameters: {'n_estimators': 993, 'learning_rate': 0.02870327994594339, 'max_depth': 10, 'reg_alpha': 0.15469758928682795, 'reg_lambda': 0.17216621800259185}. Best is trial 41 with value: 4.88170146744196e-06.
[I 2025-07-29 01:12:15,143] Trial 47 finished with value: 4.889017273648282e-06 and parameters: {'n_estimators': 816, 'learning_rate': 0.0485631915845902, 'max_depth': 10, 'reg_alpha': 0.05850038856026081, 'reg_lambda': 0.0888700389883812}. Best is trial 41 with value: 4.88170146744196e-06.
[I 2025-07-29 01:12:20,458] Trial 48 finished with value: 5.019251649998546e-06 and parameters: {'n_estimators': 805, 'learning_rate': 0.17281362297878725, 'max_depth': 9, 'reg_alpha': 0.5293089837680887, 'reg_lambda': 0.06094813746370323}. Best is trial 41 with value: 4.88170146744196e-06.
