[I 2025-07-28 19:31:09,782] Trial 24 finished with value: 5.651639885620181e-06 and parameters: {'n_estimators': 200, 'learning_rate': 0.23545328740388954, 'max_depth': 10, 'reg_alpha': 3.111945929390458e-05, 'reg_lambda': 0.7853536399439193}. Best is trial 23 with value: 4.943197417680113e-06.
[I 2025-07-28 19:31:11,214] Trial 25 finished with value: 5.019251649998546e-06 and parameters: {'n_estimators': 154, 'learning_rate': 0.1829711845061719, 'max_depth': 8, 'reg_alpha': 0.25812911067681577, 'reg_lambda': 0.7028897715538591}. Best is trial 23 with value: 4.943197417680113e-06.
[I 2025-07-28 19:31:13,737] Trial 26 finished with value: 4.987364126134936e-06 and parameters: {'n_estimators': 272, 'learning_rate': 0.21773155847026243, 'max_depth': 9, 'reg_alpha': 0.10869787426000024, 'reg_lambda': 0.9880795553707103}. Best is trial 23 with value: 4.943197417680113e-06.
[I 2025-07-28 19:31:15,274] Trial 27 finished with value: 5.019251649998546e-06 and parameters: {'n_estimators': 169, 'learning_rate': 0.16991349768442476, 'max_depth': 10, 'reg_alpha': 0.3686917404410723, 'reg_lambda': 0.48020752341576534}. Best is trial 23 with value: 4.943197417680113e-06.
[I 2025-07-28 19:31:17,726] Trial 28 finished with value: 5.019251649998546e-06 and parameters: {'n_estimators': 258, 'learning_rate': 0.24528676232961, 'max_depth': 7, 'reg_alpha': 0.23040819757387554, 'reg_lambda': 0.29855464147267163}. Best is trial 23 with value: 4.943197417680113e-06.
[I 2025-07-28 19:31:20,615] Trial 29 finished with value: 5.019251649998546e-06 and parameters: {'n_estimators': 364, 'learning_rate': 0.2203959007528495, 'max_depth': 9, 'reg_alpha': 0.28321020046247714, 'reg_lambda': 0.8618829726373064}. Best is trial 23 with value: 4.943197417680113e-06.
[I 2025-07-28 19:31:22,050] Trial 30 finished with value: 4.980048076693233e-06 and parameters: {'n_estimators': 105, 'learning_rate': 0.2755473053173064, 'max_depth': 10, 'reg_alpha': 0.09363685719971562, 'reg_lambda': 0.7464528996793963}. Best is trial 23 with value: 4.943197417680113e-06.
[I 2025-07-28 19:31:25,415] Trial 31 finished with value: 4.9464037672483284e-06 and parameters: {'n_estimators': 353, 'learning_rate': 0.27151884952955196, 'max_depth': 9, 'reg_alpha': 0.06361650402369858, 'reg_lambda': 0.6122122778985217}. Best is trial 23 with value: 4.943197417680113e-06.
[I 2025-07-28 19:31:26,971] Trial 32 finished with value: 4.994091637524404e-06 and parameters: {'n_estimators': 152, 'learning_rate': 0.2344147612808681, 'max_depth': 8, 'reg_alpha': 0.12833360653166917, 'reg_lambda': 0.6094372148548253}. Best is trial 23 with value: 4.943197417680113e-06.
[I 2025-07-28 19:31:30,502] Trial 33 finished with value: 5.023783132087813e-06 and parameters: {'n_estimators': 368, 'learning_rate': 0.28191520748439547, 'max_depth': 9, 'reg_alpha': 0.05515918416824079, 'reg_lambda': 0.4609455690902834}. Best is trial 23 with value: 4.943197417680113e-06.
[I 2025-07-28 19:31:32,456] Trial 34 finished with value: 5.019251649998546e-06 and parameters: {'n_estimators': 227, 'learning_rate': 0.2977624583300434, 'max_depth': 10, 'reg_alpha': 0.210073473814389, 'reg_lambda': 0.5456579707553872}. Best is trial 23 with value: 4.943197417680113e-06.
[I 2025-07-28 19:31:36,359] Trial 35 finished with value: 5.002699608157639e-06 and parameters: {'n_estimators': 489, 'learning_rate': 0.1404156397283295, 'max_depth': 9, 'reg_alpha': 0.1464210006816944, 'reg_lambda': 0.636546651360324}. Best is trial 23 with value: 4.943197417680113e-06.
[I 2025-07-28 19:31:38,145] Trial 36 finished with value: 4.932438870038486e-06 and parameters: {'n_estimators': 153, 'learning_rate': 0.21630004977232437, 'max_depth': 8, 'reg_alpha': 0.08295074985931805, 'reg_lambda': 0.8184487289668566}. Best is trial 36 with value: 4.932438870038486e-06.
[I 2025-07-28 19:31:41,075] Trial 37 finished with value: 5.017014439326944e-06 and parameters: {'n_estimators': 362, 'learning_rate': 0.2133873845726563, 'max_depth': 8, 'reg_alpha': 0.17848958686932334, 'reg_lambda': 0.8095484650908534}. Best is trial 36 with value: 4.932438870038486e-06.
[I 2025-07-28 19:31:46,176] Trial 38 finished with value: 5.5353493109797364e-06 and parameters: {'n_estimators': 260, 'learning_rate': 0.18560377586187746, 'max_depth': 10, 'reg_alpha': 0.002672496647029926, 'reg_lambda': 0.8705714865914427}. Best is trial 36 with value: 4.932438870038486e-06.
[I 2025-07-28 19:31:48,176] Trial 39 finished with value: 4.976911372475659e-06 and parameters: {'n_estimators': 167, 'learning_rate': 0.25062499908792424, 'max_depth': 7, 'reg_alpha': 0.10082163352298451, 'reg_lambda': 0.7124142877722633}. Best is trial 36 with value: 4.932438870038486e-06.
[I 2025-07-28 19:31:50,012] Trial 40 finished with value: 5.019251649998546e-06 and parameters: {'n_estimators': 214, 'learning_rate': 0.17756978492508807, 'max_depth': 8, 'reg_alpha': 0.7684180513057057, 'reg_lambda': 0.7575908283373503}. Best is trial 36 with value: 4.932438870038486e-06.
[I 2025-07-28 19:31:51,450] Trial 41 finished with value: 5.011602319633374e-06 and parameters: {'n_estimators': 141, 'learning_rate': 0.2769918908682173, 'max_depth': 9, 'reg_alpha': 0.1516627101651214, 'reg_lambda': 0.9471553990217287}. Best is trial 36 with value: 4.932438870038486e-06.
[I 2025-07-28 19:31:53,411] Trial 42 finished with value: 4.956813073674429e-06 and parameters: {'n_estimators': 135, 'learning_rate': 0.24224319097976219, 'max_depth': 9, 'reg_alpha': 0.04756138346750546, 'reg_lambda': 0.5401501554489473}. Best is trial 36 with value: 4.932438870038486e-06.
[I 2025-07-28 19:31:55,062] Trial 43 finished with value: 5.019251649998546e-06 and parameters: {'n_estimators': 185, 'learning_rate': 0.2559083228151149, 'max_depth': 9, 'reg_alpha': 0.20198899922650015, 'reg_lambda': 0.8107605014647568}. Best is trial 36 with value: 4.932438870038486e-06.
[I 2025-07-28 19:31:57,416] Trial 44 finished with value: 5.000265692097712e-06 and parameters: {'n_estimators': 226, 'learning_rate': 0.2084632157565505, 'max_depth': 10, 'reg_alpha': 0.09508728615049988, 'reg_lambda': 0.42835913216767163}. Best is trial 36 with value: 4.932438870038486e-06.
[I 2025-07-28 19:32:00,567] Trial 45 finished with value: 4.957211462610459e-06 and parameters: {'n_estimators': 327, 'learning_rate': 0.28709675399454904, 'max_depth': 8, 'reg_alpha': 0.04841486041708287, 'reg_lambda': 0.34865089798041304}. Best is trial 36 with value: 4.932438870038486e-06.
[I 2025-07-28 19:32:04,579] Trial 46 finished with value: 5.010323972723244e-06 and parameters: {'n_estimators': 506, 'learning_rate': 0.22645665132943607, 'max_depth': 10, 'reg_alpha': 0.15336834714066622, 'reg_lambda': 0.6621807326852189}. Best is trial 36 with value: 4.932438870038486e-06.
[I 2025-07-28 19:32:06,111] Trial 47 finished with value: 5.019251649998546e-06 and parameters: {'n_estimators': 126, 'learning_rate': 0.03139788991225213, 'max_depth': 8, 'reg_alpha': 0.5272150235229274, 'reg_lambda': 0.264863358037746}. Best is trial 36 with value: 4.932438870038486e-06.
[I 2025-07-28 19:32:07,762] Trial 48 finished with value: 5.019251649998546e-06 and parameters: {'n_estimators': 185, 'learning_rate': 0.08284895092111806, 'max_depth': 9, 'reg_alpha': 0.31430907162765187, 'reg_lambda': 0.8911553366169914}. Best is trial 36 with value: 4.932438870038486e-06.
[I 2025-07-28 19:32:10,928] Trial 49 finished with value: 5.019251649998546e-06 and parameters: {'n_estimators': 399, 'learning_rate': 0.2707907839709303, 'max_depth': 9, 'reg_alpha': 0.4293220863122624, 'reg_lambda': 0.727246762259185}. Best is trial 36 with value: 4.932438870038486e-06.
[I 2025-07-28 19:32:10,928] A new study created in memory with name: no-name-276790ba-73cb-4416-83de-822f3a7f1576
[I 2025-07-28 19:32:12,946] Trial 0 finished with value: 5.081195931368956e-06 and parameters: {'n_estimators': 188, 'max_depth': 13, 'min_samples_split': 15, 'min_samples_leaf': 7, 'max_features': 'log2'}. Best is trial 0 with value: 5.081195931368956e-06.
[I 2025-07-28 19:32:15,918] Trial 1 finished with value: 5.015148962245846e-06 and parameters: {'n_estimators': 155, 'max_depth': 10, 'min_samples_split': 15, 'min_samples_leaf': 10, 'max_features': 'sqrt'}. Best is trial 1 with value: 5.015148962245846e-06.
[I 2025-07-28 19:32:19,978] Trial 2 finished with value: 5.079773816102394e-06 and parameters: {'n_estimators': 401, 'max_depth': 19, 'min_samples_split': 11, 'min_samples_leaf': 9, 'max_features': 'log2'}. Best is trial 1 with value: 5.015148962245846e-06.
[I 2025-07-28 19:32:21,194] Trial 3 finished with value: 5.059270568613957e-06 and parameters: {'n_estimators': 217, 'max_depth': 3, 'min_samples_split': 4, 'min_samples_leaf': 2, 'max_features': 'log2'}. Best is trial 1 with value: 5.015148962245846e-06.
[I 2025-07-28 19:32:27,328] Trial 4 finished with value: 5.241483259177567e-06 and parameters: {'n_estimators': 434, 'max_depth': 17, 'min_samples_split': 2, 'min_samples_leaf': 2, 'max_features': 'log2'}. Best is trial 1 with value: 5.015148962245846e-06.
[I 2025-07-28 19:32:30,513] Trial 5 finished with value: 5.054809294943916e-06 and parameters: {'n_estimators': 450, 'max_depth': 5, 'min_samples_split': 15, 'min_samples_leaf': 4, 'max_features': 'log2'}. Best is trial 1 with value: 5.015148962245846e-06.
[I 2025-07-28 19:32:36,366] Trial 6 finished with value: 5.0148409935805485e-06 and parameters: {'n_estimators': 369, 'max_depth': 7, 'min_samples_split': 16, 'min_samples_leaf': 10, 'max_features': 'sqrt'}. Best is trial 6 with value: 5.0148409935805485e-06.
[I 2025-07-28 19:32:42,574] Trial 7 finished with value: 5.079307771442496e-06 and parameters: {'n_estimators': 252, 'max_depth': 16, 'min_samples_split': 13, 'min_samples_leaf': 5, 'max_features': 'sqrt'}. Best is trial 6 with value: 5.0148409935805485e-06.
[I 2025-07-28 19:32:49,956] Trial 8 finished with value: 5.094104946740725e-06 and parameters: {'n_estimators': 309, 'max_depth': 16, 'min_samples_split': 12, 'min_samples_leaf': 6, 'max_features': 'sqrt'}. Best is trial 6 with value: 5.0148409935805485e-06.
[I 2025-07-28 19:32:52,755] Trial 9 finished with value: 5.021164447916788e-06 and parameters: {'n_estimators': 397, 'max_depth': 5, 'min_samples_split': 9, 'min_samples_leaf': 8, 'max_features': 'log2'}. Best is trial 6 with value: 5.0148409935805485e-06.
[I 2025-07-28 19:34:30,524] Trial 10 finished with value: 4.818268282495869e-06 and parameters: {'n_estimators': 323, 'max_depth': 9, 'min_samples_split': 19, 'min_samples_leaf': 10, 'max_features': None}. Best is trial 10 with value: 4.818268282495869e-06.
[I 2025-07-28 19:36:07,893] Trial 11 finished with value: 4.817853045650023e-06 and parameters: {'n_estimators': 322, 'max_depth': 9, 'min_samples_split': 20, 'min_samples_leaf': 10, 'max_features': None}. Best is trial 11 with value: 4.817853045650023e-06.
[I 2025-07-28 19:37:47,777] Trial 12 finished with value: 4.843593290491415e-06 and parameters: {'n_estimators': 304, 'max_depth': 10, 'min_samples_split': 20, 'min_samples_leaf': 8, 'max_features': None}. Best is trial 11 with value: 4.817853045650023e-06.
[I 2025-07-28 19:39:45,756] Trial 13 finished with value: 4.846008495429188e-06 and parameters: {'n_estimators': 345, 'max_depth': 12, 'min_samples_split': 20, 'min_samples_leaf': 10, 'max_features': None}. Best is trial 11 with value: 4.817853045650023e-06.
[I 2025-07-28 19:42:05,989] Trial 14 finished with value: 4.831694917428186e-06 and parameters: {'n_estimators': 486, 'max_depth': 8, 'min_samples_split': 18, 'min_samples_leaf': 8, 'max_features': None}. Best is trial 11 with value: 4.817853045650023e-06.
[I 2025-07-28 19:43:23,454] Trial 15 finished with value: 4.848333863859799e-06 and parameters: {'n_estimators': 255, 'max_depth': 8, 'min_samples_split': 18, 'min_samples_leaf': 4, 'max_features': None}. Best is trial 11 with value: 4.817853045650023e-06.
[I 2025-07-28 19:45:27,093] Trial 16 finished with value: 4.866003802957457e-06 and parameters: {'n_estimators': 337, 'max_depth': 14, 'min_samples_split': 8, 'min_samples_leaf': 9, 'max_features': None}. Best is trial 11 with value: 4.817853045650023e-06.
[I 2025-07-28 19:46:02,287] Trial 17 finished with value: 4.85319355559747e-06 and parameters: {'n_estimators': 103, 'max_depth': 10, 'min_samples_split': 17, 'min_samples_leaf': 6, 'max_features': None}. Best is trial 11 with value: 4.817853045650023e-06.
[I 2025-07-28 19:47:06,633] Trial 18 finished with value: 4.778455498793201e-06 and parameters: {'n_estimators': 276, 'max_depth': 6, 'min_samples_split': 20, 'min_samples_leaf': 9, 'max_features': None}. Best is trial 18 with value: 4.778455498793201e-06.
[I 2025-07-28 19:47:57,289] Trial 19 finished with value: 4.804359316460937e-06 and parameters: {'n_estimators': 246, 'max_depth': 5, 'min_samples_split': 6, 'min_samples_leaf': 7, 'max_features': None}. Best is trial 18 with value: 4.778455498793201e-06.
[I 2025-07-28 19:48:31,632] Trial 20 finished with value: 4.742245860837575e-06 and parameters: {'n_estimators': 261, 'max_depth': 3, 'min_samples_split': 5, 'min_samples_leaf': 7, 'max_features': None}. Best is trial 20 with value: 4.742245860837575e-06.
[I 2025-07-28 19:49:05,692] Trial 21 finished with value: 4.743107970404484e-06 and parameters: {'n_estimators': 259, 'max_depth': 3, 'min_samples_split': 6, 'min_samples_leaf': 7, 'max_features': None}. Best is trial 20 with value: 4.742245860837575e-06.
[I 2025-07-28 19:49:41,926] Trial 22 finished with value: 4.735438459701714e-06 and parameters: {'n_estimators': 276, 'max_depth': 3, 'min_samples_split': 6, 'min_samples_leaf': 7, 'max_features': None}. Best is trial 22 with value: 4.735438459701714e-06.
[I 2025-07-28 19:50:11,335] Trial 23 finished with value: 4.74419961804938e-06 and parameters: {'n_estimators': 224, 'max_depth': 3, 'min_samples_split': 6, 'min_samples_leaf': 7, 'max_features': None}. Best is trial 22 with value: 4.735438459701714e-06.
[I 2025-07-28 19:50:35,379] Trial 24 finished with value: 4.776527764561563e-06 and parameters: {'n_estimators': 182, 'max_depth': 3, 'min_samples_split': 2, 'min_samples_leaf': 5, 'max_features': None}. Best is trial 22 with value: 4.735438459701714e-06.
[I 2025-07-28 19:51:23,237] Trial 25 finished with value: 4.779761503257421e-06 and parameters: {'n_estimators': 280, 'max_depth': 4, 'min_samples_split': 5, 'min_samples_leaf': 6, 'max_features': None}. Best is trial 22 with value: 4.735438459701714e-06.
[I 2025-07-28 19:52:12,171] Trial 26 finished with value: 4.8295257445206215e-06 and parameters: {'n_estimators': 205, 'max_depth': 6, 'min_samples_split': 8, 'min_samples_leaf': 7, 'max_features': None}. Best is trial 22 with value: 4.735438459701714e-06.
[I 2025-07-28 19:52:40,352] Trial 27 finished with value: 4.787401502845152e-06 and parameters: {'n_estimators': 163, 'max_depth': 4, 'min_samples_split': 4, 'min_samples_leaf': 4, 'max_features': None}. Best is trial 22 with value: 4.735438459701714e-06.
[I 2025-07-28 19:53:44,787] Trial 28 finished with value: 4.802673837454082e-06 and parameters: {'n_estimators': 273, 'max_depth': 6, 'min_samples_split': 9, 'min_samples_leaf': 8, 'max_features': None}. Best is trial 22 with value: 4.735438459701714e-06.
[I 2025-07-28 19:53:46,311] Trial 29 finished with value: 5.104099913123704e-06 and parameters: {'n_estimators': 127, 'max_depth': 4, 'min_samples_split': 7, 'min_samples_leaf': 1, 'max_features': 'sqrt'}. Best is trial 22 with value: 4.735438459701714e-06.
[I 2025-07-28 19:54:49,172] Trial 30 finished with value: 4.832568939647479e-06 and parameters: {'n_estimators': 234, 'max_depth': 7, 'min_samples_split': 4, 'min_samples_leaf': 7, 'max_features': None}. Best is trial 22 with value: 4.735438459701714e-06.
[I 2025-07-28 19:55:18,326] Trial 31 finished with value: 4.742682127850373e-06 and parameters: {'n_estimators': 222, 'max_depth': 3, 'min_samples_split': 6, 'min_samples_leaf': 7, 'max_features': None}. Best is trial 22 with value: 4.735438459701714e-06.
[I 2025-07-28 19:55:44,143] Trial 32 finished with value: 4.768330626014775e-06 and parameters: {'n_estimators': 196, 'max_depth': 3, 'min_samples_split': 3, 'min_samples_leaf': 6, 'max_features': None}. Best is trial 22 with value: 4.735438459701714e-06.
[I 2025-07-28 19:56:32,737] Trial 33 finished with value: 4.761411918289937e-06 and parameters: {'n_estimators': 288, 'max_depth': 4, 'min_samples_split': 6, 'min_samples_leaf': 7, 'max_features': None}. Best is trial 22 with value: 4.735438459701714e-06.
[I 2025-07-28 19:56:54,810] Trial 34 finished with value: 4.7653673545556884e-06 and parameters: {'n_estimators': 167, 'max_depth': 3, 'min_samples_split': 10, 'min_samples_leaf': 5, 'max_features': None}. Best is trial 22 with value: 4.735438459701714e-06.
[I 2025-07-28 19:56:56,372] Trial 35 finished with value: 5.02282423808273e-06 and parameters: {'n_estimators': 218, 'max_depth': 5, 'min_samples_split': 5, 'min_samples_leaf': 8, 'max_features': 'log2'}. Best is trial 22 with value: 4.735438459701714e-06.
[I 2025-07-28 19:57:39,434] Trial 36 finished with value: 4.735101186763114e-06 and parameters: {'n_estimators': 256, 'max_depth': 4, 'min_samples_split': 7, 'min_samples_leaf': 9, 'max_features': None}. Best is trial 36 with value: 4.735101186763114e-06.
[I 2025-07-28 19:57:45,124] Trial 37 finished with value: 5.014941027792447e-06 and parameters: {'n_estimators': 353, 'max_depth': 7, 'min_samples_split': 8, 'min_samples_leaf': 9, 'max_features': 'sqrt'}. Best is trial 36 with value: 4.735101186763114e-06.
[I 2025-07-28 19:57:46,171] Trial 38 finished with value: 5.030196974956289e-06 and parameters: {'n_estimators': 144, 'max_depth': 5, 'min_samples_split': 3, 'min_samples_leaf': 9, 'max_features': 'log2'}. Best is trial 36 with value: 4.735101186763114e-06.
[I 2025-07-28 19:58:19,736] Trial 39 finished with value: 4.8306120464420816e-06 and parameters: {'n_estimators': 193, 'max_depth': 4, 'min_samples_split': 7, 'min_samples_leaf': 3, 'max_features': None}. Best is trial 36 with value: 4.735101186763114e-06.
[I 2025-07-28 19:58:25,308] Trial 40 finished with value: 5.066648710385313e-06 and parameters: {'n_estimators': 239, 'max_depth': 14, 'min_samples_split': 10, 'min_samples_leaf': 6, 'max_features': 'sqrt'}. Best is trial 36 with value: 4.735101186763114e-06.
[I 2025-07-28 19:58:59,221] Trial 41 finished with value: 4.741975235790212e-06 and parameters: {'n_estimators': 258, 'max_depth': 3, 'min_samples_split': 5, 'min_samples_leaf': 7, 'max_features': None}. Best is trial 36 with value: 4.735101186763114e-06.
[I 2025-07-28 20:00:55,309] Trial 42 finished with value: 4.891436841648919e-06 and parameters: {'n_estimators': 297, 'max_depth': 20, 'min_samples_split': 5, 'min_samples_leaf': 8, 'max_features': None}. Best is trial 36 with value: 4.735101186763114e-06.
[I 2025-07-28 20:01:31,545] Trial 43 finished with value: 4.760089413675744e-06 and parameters: {'n_estimators': 213, 'max_depth': 4, 'min_samples_split': 3, 'min_samples_leaf': 7, 'max_features': None}. Best is trial 36 with value: 4.735101186763114e-06.
[I 2025-07-28 20:01:33,668] Trial 44 finished with value: 5.057674551846894e-06 and parameters: {'n_estimators': 268, 'max_depth': 6, 'min_samples_split': 7, 'min_samples_leaf': 6, 'max_features': 'log2'}. Best is trial 36 with value: 4.735101186763114e-06.
[I 2025-07-28 20:02:15,491] Trial 45 finished with value: 4.737226630167635e-06 and parameters: {'n_estimators': 320, 'max_depth': 3, 'min_samples_split': 5, 'min_samples_leaf': 8, 'max_features': None}. Best is trial 36 with value: 4.735101186763114e-06.
[I 2025-07-28 20:03:33,537] Trial 46 finished with value: 4.781437518876864e-06 and parameters: {'n_estimators': 386, 'max_depth': 5, 'min_samples_split': 2, 'min_samples_leaf': 9, 'max_features': None}. Best is trial 36 with value: 4.735101186763114e-06.
[I 2025-07-28 20:04:14,245] Trial 47 finished with value: 4.728554847177362e-06 and parameters: {'n_estimators': 311, 'max_depth': 3, 'min_samples_split': 4, 'min_samples_leaf': 8, 'max_features': None}. Best is trial 47 with value: 4.728554847177362e-06.
[I 2025-07-28 20:04:17,880] Trial 48 finished with value: 4.9861471955546505e-06 and parameters: {'n_estimators': 320, 'max_depth': 4, 'min_samples_split': 4, 'min_samples_leaf': 8, 'max_features': 'sqrt'}. Best is trial 47 with value: 4.728554847177362e-06.
[I 2025-07-28 20:05:47,153] Trial 49 finished with value: 4.811420289815306e-06 and parameters: {'n_estimators': 312, 'max_depth': 8, 'min_samples_split': 13, 'min_samples_leaf': 9, 'max_features': None}. Best is trial 47 with value: 4.728554847177362e-06.
[I 2025-07-28 20:05:47,153] A new study created in memory with name: no-name-71a4de54-dc49-45dd-9d26-3ee5dc4c2ad3
[I 2025-07-28 20:06:28,301] Trial 0 finished with value: 4.952422313970437e-06 and parameters: {'n_estimators': 139, 'max_depth': 7}. Best is trial 0 with value: 4.952422313970437e-06.
[I 2025-07-28 20:07:14,474] Trial 1 finished with value: 4.788101719990988e-06 and parameters: {'n_estimators': 345, 'max_depth': 3}. Best is trial 1 with value: 4.788101719990988e-06.
[I 2025-07-28 20:08:31,119] Trial 2 finished with value: 5.026017377437215e-06 and parameters: {'n_estimators': 208, 'max_depth': 9}. Best is trial 1 with value: 4.788101719990988e-06.
[I 2025-07-28 20:09:08,639] Trial 3 finished with value: 4.773465651123224e-06 and parameters: {'n_estimators': 280, 'max_depth': 3}. Best is trial 3 with value: 4.773465651123224e-06.
[I 2025-07-28 20:11:05,338] Trial 4 finished with value: 5.036180442307668e-06 and parameters: {'n_estimators': 291, 'max_depth': 10}. Best is trial 3 with value: 4.773465651123224e-06.
[I 2025-07-28 20:11:51,349] Trial 5 finished with value: 5.017611878326878e-06 and parameters: {'n_estimators': 115, 'max_depth': 10}. Best is trial 3 with value: 4.773465651123224e-06.
[I 2025-07-28 20:12:52,202] Trial 6 finished with value: 4.9783619469121675e-06 and parameters: {'n_estimators': 205, 'max_depth': 7}. Best is trial 3 with value: 4.773465651123224e-06.
