📁 Logging session started: training_month_20250728_192143_89e5ee7d_20250728_192143
📂 Session directory: C:\Users\dyars\Desktop\cursor_ai_test_bot\project_hyperion\logs\training_month_20250728_192143_89e5ee7d_20250728_192143
📝 Terminal output will be saved to: C:\Users\dyars\Desktop\cursor_ai_test_bot\project_hyperion\logs\training_month_20250728_192143_89e5ee7d_20250728_192143\terminal_output.log
INFO - 🚀 TRAINING SESSION STARTED
INFO - Mode: month
INFO - Symbols: 1 pairs
INFO - Symbol list: PEPEFDUSD

================================================================================
🚀 PROJECT HYPERION - MONTH TRAINING
================================================================================
📊 Mode: 30-Day Training (1 month)
⏱️  Duration: 30.0 days (43200 minutes)
⏱️  Estimated time: 30-45 minutes
📊 Weight estimate: Medium
🎯 Recommended for: Monthly model retraining
🔒 Rate limit safe: ✅ YES
❄️  CPU Throttling: ✅ ACTIVE
🛡️  Max symbols per batch: 25
⏳ Batch delay: 90s
🤖 Symbols: PEPEFDUSD
📁 Session ID: 89e5ee7d
================================================================================
📊 Step 1: Collecting data with CPU optimization...
   🚀 Using 6 threads for parallel data collection
   Collecting data for PEPEFDUSD...
   ✅ Collected 44000 data points for PEPEFDUSD
✅ Total data collected: 44000 points

🧠 Step 2: Generating features with CPU throttling...
   🚀 Generating features with intelligent CPU management...
   ✅ Generated 359 basic features
   🧠 Adding intensive features with CPU monitoring...
      📊 Adding advanced technical indicators...
      📈 Adding momentum indicators...
      📊 Adding volatility indicators...
      🔄 Adding oscillators...
      💰 Adding price action features...
      📊 Adding volume analysis...
      📈 Adding statistical features...
      🔗 Adding cross-timeframe features...
   ✅ Added intensive features, total: 526 features
   ✅ Generated 526 features

🤖 Step 3: Training models with intelligent CPU management...
🤖 Using advanced trainer: MonthTrainer
INFO - Advanced Intelligence Engine initialized
INFO - Enhanced Model Trainer initialized with 10X intelligence features
INFO - Ensemble trainer initialized (placeholder)
INFO - Month Trainer initialized with maximum intelligence features
INFO - 🚀 Starting Advanced Month Training with Maximum Intelligence
INFO - ✅ Using pre-collected data: 44000 points
INFO - 🧠 Generating maximum intelligence features...
INFO - ✅ Generated 409 maximum intelligence features
INFO - 🤖 Training advanced models with maximum intelligence...
INFO - Aligning features and data indices
INFO - Removing 1 NaN values from returns target
INFO - Removing 1 NaN values from volatility target
INFO - Truncating features to 1620 samples for alignment
INFO - Final data shapes - Features: (1620, 407)
INFO - Target close: 1620 samples
INFO - Target returns: 1620 samples
INFO - Target volatility: 1620 samples
INFO - Starting enhanced model training with 10X intelligence
INFO - Preparing enhanced data: 1620 samples, 407 features
INFO - Removing 232 rows with NaN features
INFO - Created target 1m_returns: 1388 samples
INFO - Created target 1m_momentum: 1388 samples
INFO - Created target 1m_trend: 1388 samples
INFO - Created target 5m_returns: 1388 samples
INFO - Created target 5m_volatility: 1388 samples
INFO - Created target 5m_momentum: 1388 samples
INFO - Created target 5m_trend: 1388 samples
INFO - Created target 5m_reversal: 1388 samples
INFO - Created target 15m_returns: 1388 samples
INFO - Created target 15m_volatility: 1388 samples
INFO - Created target 15m_momentum: 1388 samples
INFO - Created target 15m_trend: 1388 samples
INFO - Created target 15m_reversal: 1388 samples
INFO - Created target 30m_returns: 1388 samples
INFO - Created target 30m_volatility: 1388 samples
INFO - Created target 30m_momentum: 1388 samples
INFO - Created target 30m_trend: 1388 samples
INFO - Created target 30m_reversal: 1388 samples
INFO - Created target 1h_returns: 1388 samples
INFO - Created target 1h_volatility: 1388 samples
INFO - Created target 1h_momentum: 1388 samples
INFO - Created target 1h_trend: 1388 samples
INFO - Created target 1h_reversal: 1388 samples
INFO - Created target 4h_returns: 1388 samples
INFO - Created target 4h_volatility: 1388 samples
INFO - Created target 4h_momentum: 1388 samples
INFO - Created target 4h_trend: 1388 samples
INFO - Created target 4h_reversal: 1388 samples
INFO - Created target 1d_volatility: 1388 samples
INFO - Created target 1d_trend: 1388 samples
INFO - Created target 1d_reversal: 1388 samples
INFO - Created 34 comprehensive targets
INFO - Final data shape: (1388, 407)
INFO - Target 1m_returns: 1388 samples, 1 NaN
INFO - Target 1m_momentum: 1388 samples, 1 NaN
INFO - Target 1m_trend: 1388 samples, 0 NaN
INFO - Target 5m_returns: 1388 samples, 5 NaN
INFO - Target 5m_volatility: 1388 samples, 1 NaN
INFO - Target 5m_momentum: 1388 samples, 5 NaN
INFO - Target 5m_trend: 1388 samples, 0 NaN
INFO - Target 5m_reversal: 1388 samples, 1 NaN
INFO - Target 15m_returns: 1388 samples, 15 NaN
INFO - Target 15m_volatility: 1388 samples, 1 NaN
INFO - Target 15m_momentum: 1388 samples, 15 NaN
INFO - Target 15m_trend: 1388 samples, 0 NaN
INFO - Target 15m_reversal: 1388 samples, 1 NaN
INFO - Target 30m_returns: 1388 samples, 30 NaN
INFO - Target 30m_volatility: 1388 samples, 1 NaN
INFO - Target 30m_momentum: 1388 samples, 30 NaN
INFO - Target 30m_trend: 1388 samples, 0 NaN
INFO - Target 30m_reversal: 1388 samples, 1 NaN
INFO - Target 1h_returns: 1388 samples, 60 NaN
INFO - Target 1h_volatility: 1388 samples, 1 NaN
INFO - Target 1h_momentum: 1388 samples, 60 NaN
INFO - Target 1h_trend: 1388 samples, 0 NaN
INFO - Target 1h_reversal: 1388 samples, 1 NaN
INFO - Target 4h_returns: 1388 samples, 240 NaN
INFO - Target 4h_volatility: 1388 samples, 1 NaN
INFO - Target 4h_momentum: 1388 samples, 240 NaN
INFO - Target 4h_trend: 1388 samples, 0 NaN
INFO - Target 4h_reversal: 1388 samples, 1 NaN
INFO - Target 1d_volatility: 1388 samples, 1 NaN
INFO - Target 1d_trend: 1388 samples, 0 NaN
INFO - Target 1d_reversal: 1388 samples, 1 NaN
INFO - Target original_close: 1388 samples, 0 NaN
INFO - Target original_returns: 1388 samples, 0 NaN
INFO - Target original_volatility: 1388 samples, 0 NaN
INFO - Training enhanced models for target: 1m_returns
ERROR - NaN values found in target for 1m_returns
INFO - Training enhanced models for target: 1m_momentum
ERROR - NaN values found in target for 1m_momentum
INFO - Training enhanced models for target: 1m_trend
INFO - Training data shapes for 1m_trend: X_train=(1110, 407), y_train=(1110,)
INFO - Training enhanced LightGBM for 1m_trend
Training until validation scores don't improve for 50 rounds
Early stopping, best iteration is:
[1]	valid_0's rmse: 0
INFO - ✅ LightGBM trained successfully for 1m_trend
INFO - Training enhanced XGBoost for 1m_trend
INFO - ✅ XGBoost trained successfully for 1m_trend
INFO - Training enhanced Random Forest for 1m_trend
INFO - ✅ Random Forest trained successfully for 1m_trend
INFO - Training enhanced Neural Network for 1m_trend
INFO - ✅ Neural Network trained successfully for 1m_trend
INFO - Applying walk-forward optimization for 1m_trend
INFO - Skipping walk-forward optimization for neural network (matrix size compatibility)
INFO - Training enhanced models for target: 5m_returns
ERROR - NaN values found in target for 5m_returns
INFO - Training enhanced models for target: 5m_volatility
ERROR - NaN values found in target for 5m_volatility
INFO - Training enhanced models for target: 5m_momentum
ERROR - NaN values found in target for 5m_momentum
INFO - Training enhanced models for target: 5m_trend
INFO - Training data shapes for 5m_trend: X_train=(1110, 407), y_train=(1110,)
INFO - Training enhanced LightGBM for 5m_trend
Training until validation scores don't improve for 50 rounds
INFO - ✅ LightGBM trained successfully for 5m_trend
INFO - Training enhanced XGBoost for 5m_trend
INFO - ✅ XGBoost trained successfully for 5m_trend
INFO - Training enhanced Random Forest for 5m_trend
INFO - ✅ Random Forest trained successfully for 5m_trend
INFO - Training enhanced Neural Network for 5m_trend
INFO - ✅ Neural Network trained successfully for 5m_trend
INFO - Applying walk-forward optimization for 5m_trend
INFO - Skipping walk-forward optimization for neural network (matrix size compatibility)
INFO - Training enhanced models for target: 5m_reversal
ERROR - NaN values found in target for 5m_reversal
INFO - Training enhanced models for target: 15m_returns
ERROR - NaN values found in target for 15m_returns
INFO - Training enhanced models for target: 15m_volatility
ERROR - NaN values found in target for 15m_volatility
INFO - Training enhanced models for target: 15m_momentum
ERROR - NaN values found in target for 15m_momentum
INFO - Training enhanced models for target: 15m_trend
INFO - Training data shapes for 15m_trend: X_train=(1110, 407), y_train=(1110,)
INFO - Training enhanced LightGBM for 15m_trend
Training until validation scores don't improve for 50 rounds
INFO - ✅ LightGBM trained successfully for 15m_trend
INFO - Training enhanced XGBoost for 15m_trend
INFO - ✅ XGBoost trained successfully for 15m_trend
INFO - Training enhanced Random Forest for 15m_trend
INFO - ✅ Random Forest trained successfully for 15m_trend
INFO - Training enhanced Neural Network for 15m_trend
INFO - ✅ Neural Network trained successfully for 15m_trend
INFO - Applying walk-forward optimization for 15m_trend
INFO - Skipping walk-forward optimization for neural network (matrix size compatibility)
INFO - Training enhanced models for target: 15m_reversal
ERROR - NaN values found in target for 15m_reversal
INFO - Training enhanced models for target: 30m_returns
ERROR - NaN values found in target for 30m_returns
INFO - Training enhanced models for target: 30m_volatility
ERROR - NaN values found in target for 30m_volatility
INFO - Training enhanced models for target: 30m_momentum
ERROR - NaN values found in target for 30m_momentum
INFO - Training enhanced models for target: 30m_trend
INFO - Training data shapes for 30m_trend: X_train=(1110, 407), y_train=(1110,)
INFO - Training enhanced LightGBM for 30m_trend
Training until validation scores don't improve for 50 rounds
Early stopping, best iteration is:
[65]	valid_0's rmse: 0.281014
INFO - ✅ LightGBM trained successfully for 30m_trend
INFO - Training enhanced XGBoost for 30m_trend
INFO - ✅ XGBoost trained successfully for 30m_trend
INFO - Training enhanced Random Forest for 30m_trend
INFO - ✅ Random Forest trained successfully for 30m_trend
INFO - Training enhanced Neural Network for 30m_trend
INFO - ✅ Neural Network trained successfully for 30m_trend
INFO - Applying walk-forward optimization for 30m_trend
INFO - Skipping walk-forward optimization for neural network (matrix size compatibility)
INFO - Training enhanced models for target: 30m_reversal
ERROR - NaN values found in target for 30m_reversal
INFO - Training enhanced models for target: 1h_returns
ERROR - NaN values found in target for 1h_returns
INFO - Training enhanced models for target: 1h_volatility
ERROR - NaN values found in target for 1h_volatility
INFO - Training enhanced models for target: 1h_momentum
ERROR - NaN values found in target for 1h_momentum
INFO - Training enhanced models for target: 1h_trend
INFO - Training data shapes for 1h_trend: X_train=(1110, 407), y_train=(1110,)
INFO - Training enhanced LightGBM for 1h_trend
Training until validation scores don't improve for 50 rounds
Early stopping, best iteration is:
[160]	valid_0's rmse: 0.157828
INFO - ✅ LightGBM trained successfully for 1h_trend
INFO - Training enhanced XGBoost for 1h_trend
INFO - ✅ XGBoost trained successfully for 1h_trend
INFO - Training enhanced Random Forest for 1h_trend
INFO - ✅ Random Forest trained successfully for 1h_trend
INFO - Training enhanced Neural Network for 1h_trend
INFO - ✅ Neural Network trained successfully for 1h_trend
INFO - Applying walk-forward optimization for 1h_trend
INFO - Skipping walk-forward optimization for neural network (matrix size compatibility)
INFO - Training enhanced models for target: 1h_reversal
ERROR - NaN values found in target for 1h_reversal
INFO - Training enhanced models for target: 4h_returns
ERROR - NaN values found in target for 4h_returns
INFO - Training enhanced models for target: 4h_volatility
ERROR - NaN values found in target for 4h_volatility
INFO - Training enhanced models for target: 4h_momentum
ERROR - NaN values found in target for 4h_momentum
INFO - Training enhanced models for target: 4h_trend
INFO - Training data shapes for 4h_trend: X_train=(1110, 407), y_train=(1110,)
INFO - Training enhanced LightGBM for 4h_trend
Training until validation scores don't improve for 50 rounds
INFO - ✅ LightGBM trained successfully for 4h_trend
INFO - Training enhanced XGBoost for 4h_trend
INFO - ✅ XGBoost trained successfully for 4h_trend
INFO - Training enhanced Random Forest for 4h_trend
INFO - ✅ Random Forest trained successfully for 4h_trend
INFO - Training enhanced Neural Network for 4h_trend
INFO - ✅ Neural Network trained successfully for 4h_trend
INFO - Applying walk-forward optimization for 4h_trend
INFO - Skipping walk-forward optimization for neural network (matrix size compatibility)
INFO - Training enhanced models for target: 4h_reversal
ERROR - NaN values found in target for 4h_reversal
INFO - Training enhanced models for target: 1d_volatility
ERROR - NaN values found in target for 1d_volatility
INFO - Training enhanced models for target: 1d_trend
INFO - Training data shapes for 1d_trend: X_train=(1110, 407), y_train=(1110,)
INFO - Training enhanced LightGBM for 1d_trend
Training until validation scores don't improve for 50 rounds
INFO - ✅ LightGBM trained successfully for 1d_trend
INFO - Training enhanced XGBoost for 1d_trend
INFO - ✅ XGBoost trained successfully for 1d_trend
INFO - Training enhanced Random Forest for 1d_trend
INFO - ✅ Random Forest trained successfully for 1d_trend
INFO - Training enhanced Neural Network for 1d_trend
INFO - ✅ Neural Network trained successfully for 1d_trend
INFO - Applying walk-forward optimization for 1d_trend
INFO - Skipping walk-forward optimization for neural network (matrix size compatibility)
INFO - Training enhanced models for target: 1d_reversal
ERROR - NaN values found in target for 1d_reversal
INFO - Training enhanced models for target: original_close
INFO - Training data shapes for original_close: X_train=(1110, 407), y_train=(1110,)
INFO - Training enhanced LightGBM for original_close
Training until validation scores don't improve for 50 rounds
Early stopping, best iteration is:
[1]	valid_0's rmse: 1.09835e-06
INFO - ✅ LightGBM trained successfully for original_close
INFO - Training enhanced XGBoost for original_close
INFO - ✅ XGBoost trained successfully for original_close
INFO - Training enhanced Random Forest for original_close
INFO - ✅ Random Forest trained successfully for original_close
INFO - Training enhanced Neural Network for original_close
INFO - ✅ Neural Network trained successfully for original_close
INFO - Applying walk-forward optimization for original_close
WARNING - Walk-forward optimization failed for lightgbm: Input contains NaN.
WARNING - Walk-forward optimization failed for xgboost: Input contains NaN.
WARNING - Walk-forward optimization failed for random_forest: Input contains NaN.
INFO - Skipping walk-forward optimization for neural network (matrix size compatibility)
INFO - Training enhanced models for target: original_returns
INFO - Training data shapes for original_returns: X_train=(1110, 407), y_train=(1110,)
INFO - Training enhanced LightGBM for original_returns
Training until validation scores don't improve for 50 rounds
INFO - ✅ LightGBM trained successfully for original_returns
INFO - Training enhanced XGBoost for original_returns
INFO - ✅ XGBoost trained successfully for original_returns
INFO - Training enhanced Random Forest for original_returns
INFO - ✅ Random Forest trained successfully for original_returns
INFO - Training enhanced Neural Network for original_returns
INFO - ✅ Neural Network trained successfully for original_returns
INFO - Applying walk-forward optimization for original_returns
WARNING - Walk-forward optimization failed for lightgbm: Input contains NaN.
WARNING - Walk-forward optimization failed for xgboost: Input contains NaN.
WARNING - Walk-forward optimization failed for random_forest: Input contains NaN.
INFO - Skipping walk-forward optimization for neural network (matrix size compatibility)
INFO - Training enhanced models for target: original_volatility
INFO - Training data shapes for original_volatility: X_train=(1110, 407), y_train=(1110,)
INFO - Training enhanced LightGBM for original_volatility
Training until validation scores don't improve for 50 rounds
Early stopping, best iteration is:
[1]	valid_0's rmse: 6.78181e-08
INFO - ✅ LightGBM trained successfully for original_volatility
INFO - Training enhanced XGBoost for original_volatility
INFO - ✅ XGBoost trained successfully for original_volatility
INFO - Training enhanced Random Forest for original_volatility
INFO - ✅ Random Forest trained successfully for original_volatility
INFO - Training enhanced Neural Network for original_volatility
INFO - ✅ Neural Network trained successfully for original_volatility
INFO - Applying walk-forward optimization for original_volatility
WARNING - Walk-forward optimization failed for lightgbm: Input contains NaN.
WARNING - Walk-forward optimization failed for xgboost: Input contains NaN.
WARNING - Walk-forward optimization failed for random_forest: Input contains NaN.
INFO - Skipping walk-forward optimization for neural network (matrix size compatibility)
INFO - Optimizing ensemble weights
INFO - Optimizing ensemble weights
INFO - Ensemble weights for 1m_trend: {'lightgbm': 0.5, 'xgboost': 0.5}
INFO - Ensemble weights for forest_1m_trend: {'random': 1.0}
INFO - Ensemble weights for network_1m_trend: {'neural': 1.0}
INFO - Ensemble weights for 5m_trend: {'lightgbm': 0.5240289922573618, 'xgboost': 0.4759710077426383}
INFO - Ensemble weights for forest_5m_trend: {'random': 1.0}
INFO - Ensemble weights for network_5m_trend: {'neural': 1.0}
INFO - Ensemble weights for 15m_trend: {'lightgbm': 0.5056079593512575, 'xgboost': 0.49439204064874254}
INFO - Ensemble weights for forest_15m_trend: {'random': 1.0}
INFO - Ensemble weights for network_15m_trend: {'neural': 1.0}
INFO - Ensemble weights for 30m_trend: {'lightgbm': 0.4953255105295367, 'xgboost': 0.5046744894704632}
INFO - Ensemble weights for forest_30m_trend: {'random': 1.0}
INFO - Ensemble weights for network_30m_trend: {'neural': 1.0}
INFO - Ensemble weights for 1h_trend: {'lightgbm': 0.5349314572697539, 'xgboost': 0.46506854273024617}
INFO - Ensemble weights for forest_1h_trend: {'random': 1.0}
INFO - Ensemble weights for network_1h_trend: {'neural': 1.0}
INFO - Ensemble weights for 4h_trend: {'lightgbm': 0.5, 'xgboost': 0.5}
INFO - Ensemble weights for forest_4h_trend: {'random': 1.0}
INFO - Ensemble weights for network_4h_trend: {'neural': 1.0}
INFO - Ensemble weights for 1d_trend: {'lightgbm': 0.5, 'xgboost': 0.5}
INFO - Ensemble weights for forest_1d_trend: {'random': 1.0}
INFO - Ensemble weights for network_1d_trend: {'neural': 1.0}
INFO - Ensemble weights for original_close: {'lightgbm': 0.5, 'xgboost': 0.5}
INFO - Ensemble weights for forest_original_close: {'random': 1.0}
INFO - Ensemble weights for network_original_close: {'neural': 1.0}
INFO - Ensemble weights for original_returns: {'lightgbm': 0.5, 'xgboost': 0.5}
INFO - Ensemble weights for forest_original_returns: {'random': 1.0}
INFO - Ensemble weights for network_original_returns: {'neural': 1.0}
INFO - Ensemble weights for original_volatility: {'lightgbm': 0.5, 'xgboost': 0.5}
INFO - Ensemble weights for forest_original_volatility: {'random': 1.0}
INFO - Ensemble weights for network_original_volatility: {'neural': 1.0}
INFO - Applying meta-learning
INFO - Applying meta-learning
ERROR - Error applying meta-learning: name 'info' is not defined
INFO - Models versioned and saved with timestamp: 20250728_192801
INFO - Models versioned and saved with timestamp: 20250728_192801
INFO - Enhanced training completed. Trained 40 target models
INFO - ✅ Trained 40 advanced models
INFO - 🧠 Applying reinforcement learning optimization...
INFO - ✅ Reinforcement learning optimization completed
INFO - 🔄 Applying self-improvement systems...
INFO - ✅ Self-improvement systems completed
INFO - 🎯 Creating advanced ensemble with meta-learning...
INFO - Ensemble training requested
INFO - ✅ Advanced ensemble created
INFO - 📊 Validating and optimizing final results...
[I 2025-07-28 19:29:08,175] A new study created in memory with name: no-name-27d55655-062e-4ccc-b144-d6c5e2b274c7
[I 2025-07-28 19:29:09,013] Trial 0 finished with value: 5.019251650211013e-06 and parameters: {'n_estimators': 753, 'learning_rate': 0.07335154263545712, 'max_depth': 6, 'num_leaves': 44, 'reg_alpha': 0.22945242471397986, 'reg_lambda': 0.8840564235251396}. Best is trial 0 with value: 5.019251650211013e-06.
[I 2025-07-28 19:29:09,701] Trial 1 finished with value: 5.019251650211013e-06 and parameters: {'n_estimators': 848, 'learning_rate': 0.23984387256359643, 'max_depth': 10, 'num_leaves': 35, 'reg_alpha': 0.8988730162677918, 'reg_lambda': 0.18338361181963225}. Best is trial 0 with value: 5.019251650211013e-06.
[I 2025-07-28 19:29:10,031] Trial 2 finished with value: 5.019251650211013e-06 and parameters: {'n_estimators': 239, 'learning_rate': 0.1260623767514418, 'max_depth': 9, 'num_leaves': 73, 'reg_alpha': 0.3190865750619337, 'reg_lambda': 0.9804353692910839}. Best is trial 0 with value: 5.019251650211013e-06.
