[I 2025-07-29 09:42:55,075] Trial 36 finished with value: 4.986180271088134e-06 and parameters: {'n_estimators': 140, 'max_depth': 9}. Best is trial 29 with value: 4.736242615887749e-06.
[I 2025-07-29 09:43:19,159] Trial 37 finished with value: 4.781895680002436e-06 and parameters: {'n_estimators': 178, 'max_depth': 3}. Best is trial 29 with value: 4.736242615887749e-06.
[I 2025-07-29 09:43:40,993] Trial 38 finished with value: 4.855552359576783e-06 and parameters: {'n_estimators': 100, 'max_depth': 5}. Best is trial 29 with value: 4.736242615887749e-06.
[I 2025-07-29 09:44:00,695] Trial 39 finished with value: 4.756904136980181e-06 and parameters: {'n_estimators': 146, 'max_depth': 3}. Best is trial 29 with value: 4.736242615887749e-06.
[I 2025-07-29 09:44:57,088] Trial 40 finished with value: 4.900039392057785e-06 and parameters: {'n_estimators': 218, 'max_depth': 6}. Best is trial 29 with value: 4.736242615887749e-06.
[I 2025-07-29 09:45:18,260] Trial 41 finished with value: 4.766818222706394e-06 and parameters: {'n_estimators': 157, 'max_depth': 3}. Best is trial 29 with value: 4.736242615887749e-06.
[I 2025-07-29 09:45:35,114] Trial 42 finished with value: 4.747488410510075e-06 and parameters: {'n_estimators': 125, 'max_depth': 3}. Best is trial 29 with value: 4.736242615887749e-06.
[I 2025-07-29 09:45:57,076] Trial 43 finished with value: 4.791976956714521e-06 and parameters: {'n_estimators': 124, 'max_depth': 4}. Best is trial 29 with value: 4.736242615887749e-06.
[I 2025-07-29 09:46:16,348] Trial 44 finished with value: 4.753472349024407e-06 and parameters: {'n_estimators': 142, 'max_depth': 3}. Best is trial 29 with value: 4.736242615887749e-06.
[I 2025-07-29 09:46:42,821] Trial 45 finished with value: 4.781157967728851e-06 and parameters: {'n_estimators': 196, 'max_depth': 3}. Best is trial 29 with value: 4.736242615887749e-06.
[I 2025-07-29 09:47:04,569] Trial 46 finished with value: 4.796459868236924e-06 and parameters: {'n_estimators': 123, 'max_depth': 4}. Best is trial 29 with value: 4.736242615887749e-06.
[I 2025-07-29 09:47:19,545] Trial 47 finished with value: 4.73600883225598e-06 and parameters: {'n_estimators': 111, 'max_depth': 3}. Best is trial 47 with value: 4.73600883225598e-06.
[I 2025-07-29 09:47:38,684] Trial 48 finished with value: 4.787004796325354e-06 and parameters: {'n_estimators': 108, 'max_depth': 4}. Best is trial 47 with value: 4.73600883225598e-06.
[I 2025-07-29 09:47:54,869] Trial 49 finished with value: 4.750743893030802e-06 and parameters: {'n_estimators': 120, 'max_depth': 3}. Best is trial 47 with value: 4.73600883225598e-06.
INFO - ✅ Validation and optimization completed
INFO - 🎉 Advanced Month Training completed successfully!
   ✅ Models trained successfully

🔄 Step 4: Self-improvement systems...
   ⏭️  Self-improvement systems activated (optimized mode)

📊 Step 5: Performance monitoring...
   ✅ Performance monitoring active (optimized mode)

================================================================================
🎉 MONTH TRAINING COMPLETED SUCCESSFULLY!
📊 Total data points: 44000
🧠 Total features: 526
🤖 Models trained: 40
🛡️  Rate limiting: ✅ SAFE
❄️  CPU Throttling: ✅ ACTIVE
📈 Models: lightgbm_1m_trend, xgboost_1m_trend, random_forest_1m_trend, neural_network_1m_trend, lightgbm_5m_trend, xgboost_5m_trend, random_forest_5m_trend, neural_network_5m_trend, lightgbm_15m_trend, xgboost_15m_trend, random_forest_15m_trend, neural_network_15m_trend, lightgbm_30m_trend, xgboost_30m_trend, random_forest_30m_trend, neural_network_30m_trend, lightgbm_1h_trend, xgboost_1h_trend, random_forest_1h_trend, neural_network_1h_trend, lightgbm_4h_trend, xgboost_4h_trend, random_forest_4h_trend, neural_network_4h_trend, lightgbm_1d_trend, xgboost_1d_trend, random_forest_1d_trend, neural_network_1d_trend, lightgbm_original_close, xgboost_original_close, random_forest_original_close, neural_network_original_close, lightgbm_original_returns, xgboost_original_returns, random_forest_original_returns, neural_network_original_returns, lightgbm_original_volatility, xgboost_original_volatility, random_forest_original_volatility, neural_network_original_volatility
================================================================================
INFO - ================================================================================
INFO - SESSION SUMMARY
INFO - ================================================================================
INFO - Session ID: 89e5ee7d
INFO - Session Name: training_month_20250728_192143
INFO - Start Time: 2025-07-28 19:21:43.562119
INFO - End Time: 2025-07-29 09:47:55.405534
INFO - Duration: 51971.84 seconds
INFO - Total Loggers: 9
INFO - Session Directory: C:\Users\dyars\Desktop\cursor_ai_test_bot\project_hyperion\logs\training_month_20250728_192143_89e5ee7d_20250728_192143
INFO - ================================================================================
