[I 2025-07-28 19:29:10,330] Trial 3 finished with value: 5.019251650211013e-06 and parameters: {'n_estimators': 231, 'learning_rate': 0.06286094991777497, 'max_depth': 8, 'num_leaves': 58, 'reg_alpha': 0.429075022230728, 'reg_lambda': 0.3386419373918521}. Best is trial 0 with value: 5.019251650211013e-06.
[I 2025-07-28 19:29:10,923] Trial 4 finished with value: 4.945674042932826e-06 and parameters: {'n_estimators': 707, 'learning_rate': 0.22479358038339817, 'max_depth': 3, 'num_leaves': 76, 'reg_alpha': 0.11523657276813504, 'reg_lambda': 0.01408602899147593}. Best is trial 4 with value: 4.945674042932826e-06.
[I 2025-07-28 19:29:11,410] Trial 5 finished with value: 5.019251650211013e-06 and parameters: {'n_estimators': 608, 'learning_rate': 0.06465711713931334, 'max_depth': 7, 'num_leaves': 24, 'reg_alpha': 0.4929435653272132, 'reg_lambda': 0.9372216067091972}. Best is trial 4 with value: 4.945674042932826e-06.
[I 2025-07-28 19:29:12,581] Trial 6 finished with value: 5.52458219650576e-06 and parameters: {'n_estimators': 161, 'learning_rate': 0.2128282364162911, 'max_depth': 7, 'num_leaves': 42, 'reg_alpha': 0.002844697701379739, 'reg_lambda': 0.18302946053558722}. Best is trial 4 with value: 4.945674042932826e-06.
[I 2025-07-28 19:29:13,346] Trial 7 finished with value: 5.019251650211013e-06 and parameters: {'n_estimators': 943, 'learning_rate': 0.055273161594271245, 'max_depth': 5, 'num_leaves': 87, 'reg_alpha': 0.26524618205468753, 'reg_lambda': 0.5778955051220205}. Best is trial 4 with value: 4.945674042932826e-06.
[I 2025-07-28 19:29:14,019] Trial 8 finished with value: 5.019251650211013e-06 and parameters: {'n_estimators': 849, 'learning_rate': 0.05401280722434034, 'max_depth': 10, 'num_leaves': 38, 'reg_alpha': 0.840966014539073, 'reg_lambda': 0.682391590468652}. Best is trial 4 with value: 4.945674042932826e-06.
[I 2025-07-28 19:29:14,725] Trial 9 finished with value: 5.019251650211013e-06 and parameters: {'n_estimators': 891, 'learning_rate': 0.13998702207540084, 'max_depth': 10, 'num_leaves': 30, 'reg_alpha': 0.3420073322559738, 'reg_lambda': 0.8261164775333143}. Best is trial 4 with value: 4.945674042932826e-06.
[I 2025-07-28 19:29:15,416] Trial 10 finished with value: 5.526249883154169e-06 and parameters: {'n_estimators': 435, 'learning_rate': 0.2987670810835752, 'max_depth': 3, 'num_leaves': 86, 'reg_alpha': 0.016299073383898216, 'reg_lambda': 0.006838570770512432}. Best is trial 4 with value: 4.945674042932826e-06.
[I 2025-07-28 19:29:16,010] Trial 11 finished with value: 5.003773230195946e-06 and parameters: {'n_estimators': 663, 'learning_rate': 0.19994067350449687, 'max_depth': 3, 'num_leaves': 61, 'reg_alpha': 0.1653686515906761, 'reg_lambda': 0.43935711125728055}. Best is trial 4 with value: 4.945674042932826e-06.
[I 2025-07-28 19:29:16,576] Trial 12 finished with value: 5.019251650211013e-06 and parameters: {'n_estimators': 602, 'learning_rate': 0.19002536941078815, 'max_depth': 3, 'num_leaves': 62, 'reg_alpha': 0.6420950021148193, 'reg_lambda': 0.4169485512298232}. Best is trial 4 with value: 4.945674042932826e-06.
[I 2025-07-28 19:29:17,159] Trial 13 finished with value: 5.0044915267806e-06 and parameters: {'n_estimators': 476, 'learning_rate': 0.2634172003321275, 'max_depth': 4, 'num_leaves': 98, 'reg_alpha': 0.16677418678864697, 'reg_lambda': 0.007211499905553561}. Best is trial 4 with value: 4.945674042932826e-06.
[I 2025-07-28 19:29:17,784] Trial 14 finished with value: 4.962570147069591e-06 and parameters: {'n_estimators': 719, 'learning_rate': 0.1807577661423243, 'max_depth': 4, 'num_leaves': 72, 'reg_alpha': 0.12712609391429136, 'reg_lambda': 0.2541302350030178}. Best is trial 4 with value: 4.945674042932826e-06.
[I 2025-07-28 19:29:18,396] Trial 15 finished with value: 5.019251650211013e-06 and parameters: {'n_estimators': 759, 'learning_rate': 0.15511313188538775, 'max_depth': 5, 'num_leaves': 10, 'reg_alpha': 0.7176477219525844, 'reg_lambda': 0.2025490743901167}. Best is trial 4 with value: 4.945674042932826e-06.
[I 2025-07-28 19:29:18,862] Trial 16 finished with value: 4.818979814309128e-06 and parameters: {'n_estimators': 414, 'learning_rate': 0.10821224128501704, 'max_depth': 4, 'num_leaves': 74, 'reg_alpha': 0.07922264056957212, 'reg_lambda': 0.29596826873547555}. Best is trial 16 with value: 4.818979814309128e-06.
[I 2025-07-28 19:29:19,333] Trial 17 finished with value: 4.828390890433911e-06 and parameters: {'n_estimators': 407, 'learning_rate': 0.1137258655574718, 'max_depth': 5, 'num_leaves': 75, 'reg_alpha': 0.08035019698565499, 'reg_lambda': 0.08958817541177938}. Best is trial 16 with value: 4.818979814309128e-06.
[I 2025-07-28 19:29:19,817] Trial 18 finished with value: 5.019251650211013e-06 and parameters: {'n_estimators': 371, 'learning_rate': 0.10430664996097758, 'max_depth': 5, 'num_leaves': 100, 'reg_alpha': 0.6367493825875388, 'reg_lambda': 0.3111492505173751}. Best is trial 16 with value: 4.818979814309128e-06.
[I 2025-07-28 19:29:20,202] Trial 19 finished with value: 5.019251650211013e-06 and parameters: {'n_estimators': 352, 'learning_rate': 0.10534384638049345, 'max_depth': 6, 'num_leaves': 84, 'reg_alpha': 0.40897428304470124, 'reg_lambda': 0.13414525158114887}. Best is trial 16 with value: 4.818979814309128e-06.
[I 2025-07-28 19:29:20,679] Trial 20 finished with value: 5.019251650211013e-06 and parameters: {'n_estimators': 507, 'learning_rate': 0.018769636276479026, 'max_depth': 4, 'num_leaves': 48, 'reg_alpha': 0.9889158554748838, 'reg_lambda': 0.5686421816231866}. Best is trial 16 with value: 4.818979814309128e-06.
[I 2025-07-28 19:29:21,100] Trial 21 finished with value: 4.844013040110738e-06 and parameters: {'n_estimators': 349, 'learning_rate': 0.16145983720415225, 'max_depth': 4, 'num_leaves': 71, 'reg_alpha': 0.08740030204297933, 'reg_lambda': 0.09401880147987605}. Best is trial 16 with value: 4.818979814309128e-06.
[I 2025-07-28 19:29:21,568] Trial 22 finished with value: 4.819780448433611e-06 and parameters: {'n_estimators': 354, 'learning_rate': 0.16161480428790934, 'max_depth': 5, 'num_leaves': 69, 'reg_alpha': 0.06693985761323303, 'reg_lambda': 0.1061529982647375}. Best is trial 16 with value: 4.818979814309128e-06.
[I 2025-07-28 19:29:21,972] Trial 23 finished with value: 4.817947552798272e-06 and parameters: {'n_estimators': 282, 'learning_rate': 0.09620812419946256, 'max_depth': 5, 'num_leaves': 66, 'reg_alpha': 0.05791499056894041, 'reg_lambda': 0.31584528393635514}. Best is trial 23 with value: 4.817947552798272e-06.
[I 2025-07-28 19:29:22,302] Trial 24 finished with value: 5.019251650211013e-06 and parameters: {'n_estimators': 265, 'learning_rate': 0.09362365756437797, 'max_depth': 6, 'num_leaves': 54, 'reg_alpha': 0.22674633945926492, 'reg_lambda': 0.33063209035345414}. Best is trial 23 with value: 4.817947552798272e-06.
[I 2025-07-28 19:29:23,165] Trial 25 finished with value: 5.560449949786861e-06 and parameters: {'n_estimators': 121, 'learning_rate': 0.1411124182005592, 'max_depth': 5, 'num_leaves': 67, 'reg_alpha': 0.000513661620527156, 'reg_lambda': 0.4292906680681118}. Best is trial 23 with value: 4.817947552798272e-06.
[I 2025-07-28 19:29:23,534] Trial 26 finished with value: 5.019251650211013e-06 and parameters: {'n_estimators': 299, 'learning_rate': 0.021364303024810447, 'max_depth': 4, 'num_leaves': 52, 'reg_alpha': 0.2964421261264745, 'reg_lambda': 0.2828509609977065}. Best is trial 23 with value: 4.817947552798272e-06.
[I 2025-07-28 19:29:24,045] Trial 27 finished with value: 5.019251650211013e-06 and parameters: {'n_estimators': 542, 'learning_rate': 0.08586826712885091, 'max_depth': 6, 'num_leaves': 80, 'reg_alpha': 0.2194994777466468, 'reg_lambda': 0.5197178189635416}. Best is trial 23 with value: 4.817947552798272e-06.
[I 2025-07-28 19:29:24,398] Trial 28 finished with value: 4.835600581213528e-06 and parameters: {'n_estimators': 185, 'learning_rate': 0.12434585551573807, 'max_depth': 7, 'num_leaves': 91, 'reg_alpha': 0.06101425761936658, 'reg_lambda': 0.3946333510908437}. Best is trial 23 with value: 4.817947552798272e-06.
[I 2025-07-28 19:29:24,774] Trial 29 finished with value: 5.012744141369892e-06 and parameters: {'n_estimators': 312, 'learning_rate': 0.17493158928701721, 'max_depth': 5, 'num_leaves': 67, 'reg_alpha': 0.18122383967117173, 'reg_lambda': 0.23695371188258896}. Best is trial 23 with value: 4.817947552798272e-06.
[I 2025-07-28 19:29:25,266] Trial 30 finished with value: 5.019251650211013e-06 and parameters: {'n_estimators': 497, 'learning_rate': 0.041016381667411866, 'max_depth': 6, 'num_leaves': 64, 'reg_alpha': 0.37652774539106354, 'reg_lambda': 0.12333139645894878}. Best is trial 23 with value: 4.817947552798272e-06.
[I 2025-07-28 19:29:25,756] Trial 31 finished with value: 4.830080894001188e-06 and parameters: {'n_estimators': 409, 'learning_rate': 0.1189422472960152, 'max_depth': 5, 'num_leaves': 80, 'reg_alpha': 0.07980416438263063, 'reg_lambda': 0.08004459372277334}. Best is trial 23 with value: 4.817947552798272e-06.
[I 2025-07-28 19:29:26,258] Trial 32 finished with value: 4.8152300699617904e-06 and parameters: {'n_estimators': 420, 'learning_rate': 0.08359777481629223, 'max_depth': 4, 'num_leaves': 78, 'reg_alpha': 0.05815378120371135, 'reg_lambda': 0.124889652753422}. Best is trial 32 with value: 4.8152300699617904e-06.
[I 2025-07-28 19:29:26,767] Trial 33 finished with value: 4.976597290214756e-06 and parameters: {'n_estimators': 449, 'learning_rate': 0.08666922201718791, 'max_depth': 4, 'num_leaves': 92, 'reg_alpha': 0.1382741313116797, 'reg_lambda': 0.19592573895884347}. Best is trial 32 with value: 4.8152300699617904e-06.
[I 2025-07-28 19:29:27,133] Trial 34 finished with value: 5.019251650211013e-06 and parameters: {'n_estimators': 274, 'learning_rate': 0.07698832369406705, 'max_depth': 4, 'num_leaves': 79, 'reg_alpha': 0.2387422487250439, 'reg_lambda': 0.3663207729298199}. Best is trial 32 with value: 4.8152300699617904e-06.
[I 2025-07-28 19:29:27,529] Trial 35 finished with value: 4.812544246341364e-06 and parameters: {'n_estimators': 211, 'learning_rate': 0.14066910752336603, 'max_depth': 3, 'num_leaves': 68, 'reg_alpha': 0.05170719649329811, 'reg_lambda': 0.17283027223059494}. Best is trial 35 with value: 4.812544246341364e-06.
[I 2025-07-28 19:29:27,862] Trial 36 finished with value: 4.83827698124672e-06 and parameters: {'n_estimators': 179, 'learning_rate': 0.13844368984437083, 'max_depth': 3, 'num_leaves': 58, 'reg_alpha': 0.03964952270250003, 'reg_lambda': 0.26139555718278573}. Best is trial 35 with value: 4.812544246341364e-06.
[I 2025-07-28 19:29:28,208] Trial 37 finished with value: 5.019251650211013e-06 and parameters: {'n_estimators': 222, 'learning_rate': 0.039164494330375735, 'max_depth': 3, 'num_leaves': 76, 'reg_alpha': 0.4955037674433206, 'reg_lambda': 0.22080830138938543}. Best is trial 35 with value: 4.812544246341364e-06.
[I 2025-07-28 19:29:28,535] Trial 38 finished with value: 5.019251650211013e-06 and parameters: {'n_estimators': 214, 'learning_rate': 0.07008768721156046, 'max_depth': 3, 'num_leaves': 50, 'reg_alpha': 0.20207373363896866, 'reg_lambda': 0.49027962914099443}. Best is trial 35 with value: 4.812544246341364e-06.
[I 2025-07-28 19:29:28,802] Trial 39 finished with value: 4.957530417090979e-06 and parameters: {'n_estimators': 110, 'learning_rate': 0.13209903036106946, 'max_depth': 8, 'num_leaves': 57, 'reg_alpha': 0.12401778475209899, 'reg_lambda': 0.16486995900073315}. Best is trial 35 with value: 4.812544246341364e-06.
[I 2025-07-28 19:29:29,335] Trial 40 finished with value: 5.019251650211013e-06 and parameters: {'n_estimators': 562, 'learning_rate': 0.1009463194799387, 'max_depth': 4, 'num_leaves': 66, 'reg_alpha': 0.2963074079401483, 'reg_lambda': 0.6552723225367304}. Best is trial 35 with value: 4.812544246341364e-06.
[I 2025-07-28 19:29:29,783] Trial 41 finished with value: 4.815875278838911e-06 and parameters: {'n_estimators': 324, 'learning_rate': 0.15516887288641892, 'max_depth': 4, 'num_leaves': 70, 'reg_alpha': 0.053868227066877404, 'reg_lambda': 0.0642131754144089}. Best is trial 35 with value: 4.812544246341364e-06.
[I 2025-07-28 19:29:30,301] Trial 42 finished with value: 4.918174184263208e-06 and parameters: {'n_estimators': 326, 'learning_rate': 0.14630733495724613, 'max_depth': 4, 'num_leaves': 83, 'reg_alpha': 0.034958942735286366, 'reg_lambda': 0.04239403588709176}. Best is trial 35 with value: 4.812544246341364e-06.
[I 2025-07-28 19:29:30,677] Trial 43 finished with value: 4.948374546368606e-06 and parameters: {'n_estimators': 259, 'learning_rate': 0.11602121615551103, 'max_depth': 3, 'num_leaves': 73, 'reg_alpha': 0.11770450789017908, 'reg_lambda': 0.16176724514825153}. Best is trial 35 with value: 4.812544246341364e-06.
[I 2025-07-28 19:29:32,113] Trial 44 finished with value: 5.479884161339377e-06 and parameters: {'n_estimators': 389, 'learning_rate': 0.07861157556127157, 'max_depth': 3, 'num_leaves': 62, 'reg_alpha': 0.007155468499900522, 'reg_lambda': 0.053746199767016195}. Best is trial 35 with value: 4.812544246341364e-06.
[I 2025-07-28 19:29:32,521] Trial 45 finished with value: 5.002790194819819e-06 and parameters: {'n_estimators': 301, 'learning_rate': 0.17287269046416964, 'max_depth': 4, 'num_leaves': 90, 'reg_alpha': 0.1633956589920103, 'reg_lambda': 0.2809881682416073}. Best is trial 35 with value: 4.812544246341364e-06.
[I 2025-07-28 19:29:33,024] Trial 46 finished with value: 4.910773051733906e-06 and parameters: {'n_estimators': 440, 'learning_rate': 0.21598881283552154, 'max_depth': 3, 'num_leaves': 78, 'reg_alpha': 0.10256720673253748, 'reg_lambda': 0.16467412049506439}. Best is trial 35 with value: 4.812544246341364e-06.
[I 2025-07-28 19:29:33,416] Trial 47 finished with value: 4.820394787166888e-06 and parameters: {'n_estimators': 229, 'learning_rate': 0.09497361745525222, 'max_depth': 4, 'num_leaves': 46, 'reg_alpha': 0.054635031689474686, 'reg_lambda': 0.3472791468997072}. Best is trial 35 with value: 4.812544246341364e-06.
[I 2025-07-28 19:29:33,893] Trial 48 finished with value: 5.0066668430788824e-06 and parameters: {'n_estimators': 407, 'learning_rate': 0.06039876675288408, 'max_depth': 5, 'num_leaves': 71, 'reg_alpha': 0.17086411153763864, 'reg_lambda': 0.05536536497972555}. Best is trial 35 with value: 4.812544246341364e-06.
[I 2025-07-28 19:29:34,207] Trial 49 finished with value: 5.019251650211013e-06 and parameters: {'n_estimators': 177, 'learning_rate': 0.2475801941206539, 'max_depth': 9, 'num_leaves': 59, 'reg_alpha': 0.25759630628386143, 'reg_lambda': 0.14355468658137654}. Best is trial 35 with value: 4.812544246341364e-06.
[I 2025-07-28 19:29:34,207] A new study created in memory with name: no-name-c63c8e58-404f-4cbc-81a3-959e11b70ce6
[I 2025-07-28 19:29:39,411] Trial 0 finished with value: 5.019251649998546e-06 and parameters: {'n_estimators': 667, 'learning_rate': 0.23048214411369985, 'max_depth': 10, 'reg_alpha': 0.25057177532009767, 'reg_lambda': 0.8419219450949335}. Best is trial 0 with value: 5.019251649998546e-06.
[I 2025-07-28 19:29:44,822] Trial 1 finished with value: 5.014157032440764e-06 and parameters: {'n_estimators': 729, 'learning_rate': 0.16287533029199835, 'max_depth': 6, 'reg_alpha': 0.17618503981230127, 'reg_lambda': 0.21853265235573627}. Best is trial 1 with value: 5.014157032440764e-06.
[I 2025-07-28 19:29:48,772] Trial 2 finished with value: 5.012326813902301e-06 and parameters: {'n_estimators': 506, 'learning_rate': 0.2903695426756007, 'max_depth': 9, 'reg_alpha': 0.15220464734767825, 'reg_lambda': 0.2015913449482737}. Best is trial 2 with value: 5.012326813902301e-06.
[I 2025-07-28 19:29:53,604] Trial 3 finished with value: 4.956500453647431e-06 and parameters: {'n_estimators': 637, 'learning_rate': 0.20015304612291113, 'max_depth': 3, 'reg_alpha': 0.11220605398827455, 'reg_lambda': 0.011944792640123714}. Best is trial 3 with value: 4.956500453647431e-06.
[I 2025-07-28 19:29:57,045] Trial 4 finished with value: 5.019251649998546e-06 and parameters: {'n_estimators': 443, 'learning_rate': 0.02402971047482818, 'max_depth': 9, 'reg_alpha': 0.19295358095500204, 'reg_lambda': 0.42201238766695204}. Best is trial 3 with value: 4.956500453647431e-06.
[I 2025-07-28 19:29:58,840] Trial 5 finished with value: 5.013824809355986e-06 and parameters: {'n_estimators': 194, 'learning_rate': 0.2873338916932568, 'max_depth': 10, 'reg_alpha': 0.1529721903005986, 'reg_lambda': 0.37230534111363267}. Best is trial 3 with value: 4.956500453647431e-06.
[I 2025-07-28 19:30:01,462] Trial 6 finished with value: 5.019251649998546e-06 and parameters: {'n_estimators': 325, 'learning_rate': 0.057428101690060324, 'max_depth': 8, 'reg_alpha': 0.8588260683112214, 'reg_lambda': 0.49870196733166294}. Best is trial 3 with value: 4.956500453647431e-06.
[I 2025-07-28 19:30:08,565] Trial 7 finished with value: 5.019251649998546e-06 and parameters: {'n_estimators': 959, 'learning_rate': 0.09016091890258113, 'max_depth': 4, 'reg_alpha': 0.18817884490173586, 'reg_lambda': 0.9170441857458207}. Best is trial 3 with value: 4.956500453647431e-06.
[I 2025-07-28 19:30:13,165] Trial 8 finished with value: 5.019251649998546e-06 and parameters: {'n_estimators': 566, 'learning_rate': 0.25065467133880864, 'max_depth': 8, 'reg_alpha': 0.42395367149023366, 'reg_lambda': 0.38590390758832316}. Best is trial 3 with value: 4.956500453647431e-06.
[I 2025-07-28 19:30:16,391] Trial 9 finished with value: 5.019251649998546e-06 and parameters: {'n_estimators': 421, 'learning_rate': 0.15791448892985907, 'max_depth': 6, 'reg_alpha': 0.43814182442160976, 'reg_lambda': 0.22152442925914573}. Best is trial 3 with value: 4.956500453647431e-06.
[I 2025-07-28 19:30:22,992] Trial 10 finished with value: 5.019251649998546e-06 and parameters: {'n_estimators': 901, 'learning_rate': 0.19965738208336675, 'max_depth': 3, 'reg_alpha': 0.7040536917226377, 'reg_lambda': 0.01824723941763784}. Best is trial 3 with value: 4.956500453647431e-06.
[I 2025-07-28 19:30:28,945] Trial 11 finished with value: 5.089195707425056e-06 and parameters: {'n_estimators': 730, 'learning_rate': 0.29783318661158004, 'max_depth': 5, 'reg_alpha': 0.02620390628384134, 'reg_lambda': 0.009916886456513665}. Best is trial 3 with value: 4.956500453647431e-06.
[I 2025-07-28 19:30:34,458] Trial 12 finished with value: 5.082942844100981e-06 and parameters: {'n_estimators': 574, 'learning_rate': 0.12050104495848399, 'max_depth': 3, 'reg_alpha': 0.011783620883602741, 'reg_lambda': 0.18688966026174256}. Best is trial 3 with value: 4.956500453647431e-06.
[I 2025-07-28 19:30:40,646] Trial 13 finished with value: 5.019251649998546e-06 and parameters: {'n_estimators': 835, 'learning_rate': 0.20385884269681562, 'max_depth': 7, 'reg_alpha': 0.5953614942561533, 'reg_lambda': 0.6793720805712201}. Best is trial 3 with value: 4.956500453647431e-06.
[I 2025-07-28 19:30:44,050] Trial 14 finished with value: 5.019251649998546e-06 and parameters: {'n_estimators': 433, 'learning_rate': 0.252619868192286, 'max_depth': 5, 'reg_alpha': 0.35326729114561983, 'reg_lambda': 0.12804143074226568}. Best is trial 3 with value: 4.956500453647431e-06.
[I 2025-07-28 19:30:45,987] Trial 15 finished with value: 5.019251649998546e-06 and parameters: {'n_estimators': 224, 'learning_rate': 0.19405532047766552, 'max_depth': 8, 'reg_alpha': 0.9734693810763244, 'reg_lambda': 0.6706028797113981}. Best is trial 3 with value: 4.956500453647431e-06.
[I 2025-07-28 19:30:50,961] Trial 16 finished with value: 5.019251649998546e-06 and parameters: {'n_estimators': 655, 'learning_rate': 0.1292692836937841, 'max_depth': 7, 'reg_alpha': 0.330597700429673, 'reg_lambda': 0.1022393188106138}. Best is trial 3 with value: 4.956500453647431e-06.
[I 2025-07-28 19:30:52,505] Trial 17 finished with value: 4.951997631765775e-06 and parameters: {'n_estimators': 104, 'learning_rate': 0.2678771987785098, 'max_depth': 9, 'reg_alpha': 0.07544120902010268, 'reg_lambda': 0.2831696314979535}. Best is trial 17 with value: 4.951997631765775e-06.
[I 2025-07-28 19:30:53,846] Trial 18 finished with value: 5.019251649998546e-06 and parameters: {'n_estimators': 101, 'learning_rate': 0.22775228175959736, 'max_depth': 4, 'reg_alpha': 0.5752424661278581, 'reg_lambda': 0.3160486020106959}. Best is trial 17 with value: 4.951997631765775e-06.
[I 2025-07-28 19:30:57,057] Trial 19 finished with value: 4.954373970822273e-06 and parameters: {'n_estimators': 317, 'learning_rate': 0.2662336296912825, 'max_depth': 9, 'reg_alpha': 0.06144594394180947, 'reg_lambda': 0.5828537175159814}. Best is trial 17 with value: 4.951997631765775e-06.
[I 2025-07-28 19:30:59,478] Trial 20 finished with value: 5.019251649998546e-06 and parameters: {'n_estimators': 292, 'learning_rate': 0.26273552531076566, 'max_depth': 9, 'reg_alpha': 0.2797617170443858, 'reg_lambda': 0.5999456091452807}. Best is trial 17 with value: 4.951997631765775e-06.
[I 2025-07-28 19:31:01,258] Trial 21 finished with value: 4.9469369856653095e-06 and parameters: {'n_estimators': 113, 'learning_rate': 0.22271855637727433, 'max_depth': 10, 'reg_alpha': 0.07141038302240366, 'reg_lambda': 0.5431928113594321}. Best is trial 21 with value: 4.9469369856653095e-06.
[I 2025-07-28 19:31:02,897] Trial 22 finished with value: 4.971355527516757e-06 and parameters: {'n_estimators': 104, 'learning_rate': 0.2666299434950582, 'max_depth': 10, 'reg_alpha': 0.07282406325402892, 'reg_lambda': 0.5469240015522037}. Best is trial 21 with value: 4.9469369856653095e-06.
[I 2025-07-28 19:31:05,450] Trial 23 finished with value: 4.943197417680113e-06 and parameters: {'n_estimators': 190, 'learning_rate': 0.2338677279268475, 'max_depth': 9, 'reg_alpha': 0.04246601227104595, 'reg_lambda': 0.7169517917637198}. Best is trial 23 with value: 4.943197417680113e-06.
