[I 2025-07-29 07:29:03,892] Trial 28 finished with value: 5.00638566542662e-06 and parameters: {'n_estimators': 243, 'max_depth': 7, 'min_samples_split': 16, 'min_samples_leaf': 6, 'max_features': 'sqrt'}. Best is trial 21 with value: 4.6929509371622144e-06.
[I 2025-07-29 07:29:27,877] Trial 29 finished with value: 4.746587394612474e-06 and parameters: {'n_estimators': 140, 'max_depth': 4, 'min_samples_split': 18, 'min_samples_leaf': 5, 'max_features': None}. Best is trial 21 with value: 4.6929509371622144e-06.
[I 2025-07-29 07:29:28,762] Trial 30 finished with value: 5.079750003581218e-06 and parameters: {'n_estimators': 100, 'max_depth': 7, 'min_samples_split': 15, 'min_samples_leaf': 7, 'max_features': 'log2'}. Best is trial 21 with value: 4.6929509371622144e-06.
[I 2025-07-29 07:29:51,358] Trial 31 finished with value: 4.694433417779061e-06 and parameters: {'n_estimators': 134, 'max_depth': 4, 'min_samples_split': 11, 'min_samples_leaf': 9, 'max_features': None}. Best is trial 21 with value: 4.6929509371622144e-06.
[I 2025-07-29 07:30:19,662] Trial 32 finished with value: 4.719303014138858e-06 and parameters: {'n_estimators': 168, 'max_depth': 4, 'min_samples_split': 10, 'min_samples_leaf': 9, 'max_features': None}. Best is trial 21 with value: 4.6929509371622144e-06.
[I 2025-07-29 07:30:41,373] Trial 33 finished with value: 4.696938757797329e-06 and parameters: {'n_estimators': 129, 'max_depth': 4, 'min_samples_split': 12, 'min_samples_leaf': 9, 'max_features': None}. Best is trial 21 with value: 4.6929509371622144e-06.
[I 2025-07-29 07:31:26,776] Trial 34 finished with value: 4.860585434391693e-06 and parameters: {'n_estimators': 188, 'max_depth': 6, 'min_samples_split': 9, 'min_samples_leaf': 6, 'max_features': None}. Best is trial 21 with value: 4.6929509371622144e-06.
[I 2025-07-29 07:31:27,951] Trial 35 finished with value: 5.0601323023660696e-06 and parameters: {'n_estimators': 147, 'max_depth': 6, 'min_samples_split': 13, 'min_samples_leaf': 7, 'max_features': 'log2'}. Best is trial 21 with value: 4.6929509371622144e-06.
[I 2025-07-29 07:32:17,581] Trial 36 finished with value: 4.753331159621693e-06 and parameters: {'n_estimators': 293, 'max_depth': 4, 'min_samples_split': 14, 'min_samples_leaf': 8, 'max_features': None}. Best is trial 21 with value: 4.6929509371622144e-06.
[I 2025-07-29 07:32:18,689] Trial 37 finished with value: 4.97264874862232e-06 and parameters: {'n_estimators': 114, 'max_depth': 3, 'min_samples_split': 9, 'min_samples_leaf': 9, 'max_features': 'sqrt'}. Best is trial 21 with value: 4.6929509371622144e-06.
[I 2025-07-29 07:33:49,297] Trial 38 finished with value: 4.892911625370642e-06 and parameters: {'n_estimators': 237, 'max_depth': 13, 'min_samples_split': 12, 'min_samples_leaf': 7, 'max_features': None}. Best is trial 21 with value: 4.6929509371622144e-06.
[I 2025-07-29 07:33:50,841] Trial 39 finished with value: 5.0340534873468915e-06 and parameters: {'n_estimators': 167, 'max_depth': 9, 'min_samples_split': 17, 'min_samples_leaf': 10, 'max_features': 'log2'}. Best is trial 21 with value: 4.6929509371622144e-06.
[I 2025-07-29 07:34:53,159] Trial 40 finished with value: 4.898252585257806e-06 and parameters: {'n_estimators': 206, 'max_depth': 8, 'min_samples_split': 8, 'min_samples_leaf': 5, 'max_features': None}. Best is trial 21 with value: 4.6929509371622144e-06.
[I 2025-07-29 07:35:14,362] Trial 41 finished with value: 4.6964730606448715e-06 and parameters: {'n_estimators': 127, 'max_depth': 4, 'min_samples_split': 12, 'min_samples_leaf': 9, 'max_features': None}. Best is trial 21 with value: 4.6929509371622144e-06.
[I 2025-07-29 07:35:34,919] Trial 42 finished with value: 4.689262639960444e-06 and parameters: {'n_estimators': 122, 'max_depth': 4, 'min_samples_split': 14, 'min_samples_leaf': 9, 'max_features': None}. Best is trial 42 with value: 4.689262639960444e-06.
[I 2025-07-29 07:36:05,512] Trial 43 finished with value: 4.776704484297937e-06 and parameters: {'n_estimators': 151, 'max_depth': 5, 'min_samples_split': 14, 'min_samples_leaf': 8, 'max_features': None}. Best is trial 42 with value: 4.689262639960444e-06.
[I 2025-07-29 07:36:28,625] Trial 44 finished with value: 4.745188231519977e-06 and parameters: {'n_estimators': 100, 'max_depth': 6, 'min_samples_split': 10, 'min_samples_leaf': 10, 'max_features': None}. Best is trial 42 with value: 4.689262639960444e-06.
[I 2025-07-29 07:36:58,444] Trial 45 finished with value: 4.732026852052629e-06 and parameters: {'n_estimators': 177, 'max_depth': 4, 'min_samples_split': 15, 'min_samples_leaf': 9, 'max_features': None}. Best is trial 42 with value: 4.689262639960444e-06.
[I 2025-07-29 07:36:59,615] Trial 46 finished with value: 5.030769754279594e-06 and parameters: {'n_estimators': 119, 'max_depth': 3, 'min_samples_split': 13, 'min_samples_leaf': 2, 'max_features': 'sqrt'}. Best is trial 42 with value: 4.689262639960444e-06.
[I 2025-07-29 07:37:01,157] Trial 47 finished with value: 5.091745633419014e-06 and parameters: {'n_estimators': 145, 'max_depth': 20, 'min_samples_split': 11, 'min_samples_leaf': 8, 'max_features': 'log2'}. Best is trial 42 with value: 4.689262639960444e-06.
[I 2025-07-29 07:38:06,460] Trial 48 finished with value: 4.7677009537020095e-06 and parameters: {'n_estimators': 325, 'max_depth': 5, 'min_samples_split': 8, 'min_samples_leaf': 10, 'max_features': None}. Best is trial 42 with value: 4.689262639960444e-06.
[I 2025-07-29 07:38:58,725] Trial 49 finished with value: 4.800347353981516e-06 and parameters: {'n_estimators': 221, 'max_depth': 6, 'min_samples_split': 16, 'min_samples_leaf': 8, 'max_features': None}. Best is trial 42 with value: 4.689262639960444e-06.
[I 2025-07-29 07:38:58,726] A new study created in memory with name: no-name-3c19952c-2e26-45c5-87d6-a532b28fb345
[I 2025-07-29 07:39:49,527] Trial 0 finished with value: 4.820572894226062e-06 and parameters: {'n_estimators': 289, 'max_depth': 4}. Best is trial 0 with value: 4.820572894226062e-06.
[I 2025-07-29 07:40:43,453] Trial 1 finished with value: 4.865565437995844e-06 and parameters: {'n_estimators': 248, 'max_depth': 5}. Best is trial 0 with value: 4.820572894226062e-06.
[I 2025-07-29 07:42:53,814] Trial 2 finished with value: 4.988465718541388e-06 and parameters: {'n_estimators': 392, 'max_depth': 8}. Best is trial 0 with value: 4.820572894226062e-06.
[I 2025-07-29 07:45:56,063] Trial 3 finished with value: 5.010495561495493e-06 and parameters: {'n_estimators': 492, 'max_depth': 9}. Best is trial 0 with value: 4.820572894226062e-06.
[I 2025-07-29 07:46:58,449] Trial 4 finished with value: 4.914925038145161e-06 and parameters: {'n_estimators': 241, 'max_depth': 6}. Best is trial 0 with value: 4.820572894226062e-06.
[I 2025-07-29 07:49:54,994] Trial 5 finished with value: 5.009875977590672e-06 and parameters: {'n_estimators': 479, 'max_depth': 9}. Best is trial 0 with value: 4.820572894226062e-06.
[I 2025-07-29 07:52:58,523] Trial 6 finished with value: 5.0315404124287355e-06 and parameters: {'n_estimators': 457, 'max_depth': 10}. Best is trial 0 with value: 4.820572894226062e-06.
[I 2025-07-29 07:54:07,109] Trial 7 finished with value: 4.90212318444761e-06 and parameters: {'n_estimators': 265, 'max_depth': 6}. Best is trial 0 with value: 4.820572894226062e-06.
[I 2025-07-29 07:54:54,452] Trial 8 finished with value: 5.02245646553391e-06 and parameters: {'n_estimators': 118, 'max_depth': 10}. Best is trial 0 with value: 4.820572894226062e-06.
[I 2025-07-29 07:56:05,578] Trial 9 finished with value: 4.9786785248153115e-06 and parameters: {'n_estimators': 239, 'max_depth': 7}. Best is trial 0 with value: 4.820572894226062e-06.
[I 2025-07-29 07:56:52,147] Trial 10 finished with value: 4.787872929103306e-06 and parameters: {'n_estimators': 346, 'max_depth': 3}. Best is trial 10 with value: 4.787872929103306e-06.
[I 2025-07-29 07:57:41,147] Trial 11 finished with value: 4.7897984607327735e-06 and parameters: {'n_estimators': 364, 'max_depth': 3}. Best is trial 10 with value: 4.787872929103306e-06.
[I 2025-07-29 07:58:31,036] Trial 12 finished with value: 4.789783240649252e-06 and parameters: {'n_estimators': 370, 'max_depth': 3}. Best is trial 10 with value: 4.787872929103306e-06.
[I 2025-07-29 07:59:20,423] Trial 13 finished with value: 4.788955162858995e-06 and parameters: {'n_estimators': 366, 'max_depth': 3}. Best is trial 10 with value: 4.787872929103306e-06.
[I 2025-07-29 08:00:20,327] Trial 14 finished with value: 4.840714371508049e-06 and parameters: {'n_estimators': 339, 'max_depth': 4}. Best is trial 10 with value: 4.787872929103306e-06.
[I 2025-07-29 08:01:36,207] Trial 15 finished with value: 4.831718921655168e-06 and parameters: {'n_estimators': 429, 'max_depth': 4}. Best is trial 10 with value: 4.787872929103306e-06.
[I 2025-07-29 08:02:19,000] Trial 16 finished with value: 4.783727204535658e-06 and parameters: {'n_estimators': 318, 'max_depth': 3}. Best is trial 16 with value: 4.783727204535658e-06.
[I 2025-07-29 08:02:55,030] Trial 17 finished with value: 4.853787918829129e-06 and parameters: {'n_estimators': 165, 'max_depth': 5}. Best is trial 16 with value: 4.783727204535658e-06.
[I 2025-07-29 08:04:03,767] Trial 18 finished with value: 4.867125468575954e-06 and parameters: {'n_estimators': 314, 'max_depth': 5}. Best is trial 16 with value: 4.783727204535658e-06.
[I 2025-07-29 08:04:29,947] Trial 19 finished with value: 4.7826207201948535e-06 and parameters: {'n_estimators': 194, 'max_depth': 3}. Best is trial 19 with value: 4.7826207201948535e-06.
[I 2025-07-29 08:05:25,910] Trial 20 finished with value: 4.981532925242443e-06 and parameters: {'n_estimators': 188, 'max_depth': 7}. Best is trial 19 with value: 4.7826207201948535e-06.
[I 2025-07-29 08:05:52,270] Trial 21 finished with value: 4.780877145932583e-06 and parameters: {'n_estimators': 195, 'max_depth': 3}. Best is trial 21 with value: 4.780877145932583e-06.
[I 2025-07-29 08:06:26,788] Trial 22 finished with value: 4.830515010865812e-06 and parameters: {'n_estimators': 195, 'max_depth': 4}. Best is trial 21 with value: 4.780877145932583e-06.
[I 2025-07-29 08:06:40,687] Trial 23 finished with value: 4.749575797444571e-06 and parameters: {'n_estimators': 103, 'max_depth': 3}. Best is trial 23 with value: 4.749575797444571e-06.
[I 2025-07-29 08:06:59,453] Trial 24 finished with value: 4.789644085264129e-06 and parameters: {'n_estimators': 106, 'max_depth': 4}. Best is trial 23 with value: 4.749575797444571e-06.
[I 2025-07-29 08:07:32,208] Trial 25 finished with value: 4.848142058461559e-06 and parameters: {'n_estimators': 150, 'max_depth': 5}. Best is trial 23 with value: 4.749575797444571e-06.
[I 2025-07-29 08:08:00,401] Trial 26 finished with value: 4.781868814930766e-06 and parameters: {'n_estimators': 209, 'max_depth': 3}. Best is trial 23 with value: 4.749575797444571e-06.
[I 2025-07-29 08:08:24,511] Trial 27 finished with value: 4.795173956315841e-06 and parameters: {'n_estimators': 136, 'max_depth': 4}. Best is trial 23 with value: 4.749575797444571e-06.
[I 2025-07-29 08:08:53,370] Trial 28 finished with value: 4.773454949838991e-06 and parameters: {'n_estimators': 214, 'max_depth': 3}. Best is trial 23 with value: 4.749575797444571e-06.
[I 2025-07-29 08:09:55,192] Trial 29 finished with value: 4.8592999576308955e-06 and parameters: {'n_estimators': 283, 'max_depth': 5}. Best is trial 23 with value: 4.749575797444571e-06.
[I 2025-07-29 08:10:24,778] Trial 30 finished with value: 4.812260918660477e-06 and parameters: {'n_estimators': 167, 'max_depth': 4}. Best is trial 23 with value: 4.749575797444571e-06.
[I 2025-07-29 08:10:53,220] Trial 31 finished with value: 4.775948471306555e-06 and parameters: {'n_estimators': 213, 'max_depth': 3}. Best is trial 23 with value: 4.749575797444571e-06.
[I 2025-07-29 08:11:22,344] Trial 32 finished with value: 4.772715893803808e-06 and parameters: {'n_estimators': 216, 'max_depth': 3}. Best is trial 23 with value: 4.749575797444571e-06.
[I 2025-07-29 08:12:01,654] Trial 33 finished with value: 4.818968302911937e-06 and parameters: {'n_estimators': 222, 'max_depth': 4}. Best is trial 23 with value: 4.749575797444571e-06.
[I 2025-07-29 08:12:38,178] Trial 34 finished with value: 4.7744161761257046e-06 and parameters: {'n_estimators': 271, 'max_depth': 3}. Best is trial 23 with value: 4.749575797444571e-06.
[I 2025-07-29 08:13:26,694] Trial 35 finished with value: 4.818478467734881e-06 and parameters: {'n_estimators': 274, 'max_depth': 4}. Best is trial 23 with value: 4.749575797444571e-06.
[I 2025-07-29 08:14:33,223] Trial 36 finished with value: 4.904316990798834e-06 and parameters: {'n_estimators': 257, 'max_depth': 6}. Best is trial 23 with value: 4.749575797444571e-06.
[I 2025-07-29 08:15:13,937] Trial 37 finished with value: 4.782236849225218e-06 and parameters: {'n_estimators': 302, 'max_depth': 3}. Best is trial 23 with value: 4.749575797444571e-06.
[I 2025-07-29 08:16:32,379] Trial 38 finished with value: 5.0015718843540324e-06 and parameters: {'n_estimators': 234, 'max_depth': 8}. Best is trial 23 with value: 4.749575797444571e-06.
[I 2025-07-29 08:16:54,493] Trial 39 finished with value: 4.7907397451729135e-06 and parameters: {'n_estimators': 125, 'max_depth': 4}. Best is trial 23 with value: 4.749575797444571e-06.
[I 2025-07-29 08:17:30,615] Trial 40 finished with value: 4.85524499317153e-06 and parameters: {'n_estimators': 167, 'max_depth': 5}. Best is trial 23 with value: 4.749575797444571e-06.
[I 2025-07-29 08:18:00,856] Trial 41 finished with value: 4.776695756346283e-06 and parameters: {'n_estimators': 224, 'max_depth': 3}. Best is trial 23 with value: 4.749575797444571e-06.
[I 2025-07-29 08:18:34,173] Trial 42 finished with value: 4.780236954763507e-06 and parameters: {'n_estimators': 247, 'max_depth': 3}. Best is trial 23 with value: 4.749575797444571e-06.
[I 2025-07-29 08:19:13,113] Trial 43 finished with value: 4.776301227959901e-06 and parameters: {'n_estimators': 289, 'max_depth': 3}. Best is trial 23 with value: 4.749575797444571e-06.
[I 2025-07-29 08:19:42,220] Trial 44 finished with value: 4.772715893803808e-06 and parameters: {'n_estimators': 216, 'max_depth': 3}. Best is trial 23 with value: 4.749575797444571e-06.
[I 2025-07-29 08:20:28,421] Trial 45 finished with value: 4.823072875974239e-06 and parameters: {'n_estimators': 261, 'max_depth': 4}. Best is trial 23 with value: 4.749575797444571e-06.
[I 2025-07-29 08:20:48,389] Trial 46 finished with value: 4.758300718115015e-06 and parameters: {'n_estimators': 148, 'max_depth': 3}. Best is trial 23 with value: 4.749575797444571e-06.
[I 2025-07-29 08:21:26,766] Trial 47 finished with value: 4.986102299000659e-06 and parameters: {'n_estimators': 104, 'max_depth': 9}. Best is trial 23 with value: 4.749575797444571e-06.
[I 2025-07-29 08:21:50,653] Trial 48 finished with value: 4.790384925337665e-06 and parameters: {'n_estimators': 135, 'max_depth': 4}. Best is trial 23 with value: 4.749575797444571e-06.
[I 2025-07-29 08:22:11,018] Trial 49 finished with value: 4.764798942927081e-06 and parameters: {'n_estimators': 151, 'max_depth': 3}. Best is trial 23 with value: 4.749575797444571e-06.
[I 2025-07-29 08:22:11,020] A new study created in memory with name: no-name-9578ed64-7b8a-4003-b09a-2ff987ad1592
[I 2025-07-29 08:22:11,560] Trial 0 finished with value: 5.019251650211013e-06 and parameters: {'n_estimators': 549, 'learning_rate': 0.268384306457137, 'max_depth': 9, 'num_leaves': 13, 'reg_alpha': 0.19436873069964566, 'reg_lambda': 0.4833514706540487}. Best is trial 0 with value: 5.019251650211013e-06.
[I 2025-07-29 08:22:12,181] Trial 1 finished with value: 5.019251650211013e-06 and parameters: {'n_estimators': 632, 'learning_rate': 0.08959484352528639, 'max_depth': 6, 'num_leaves': 63, 'reg_alpha': 0.9302309833369405, 'reg_lambda': 0.6685737817023009}. Best is trial 0 with value: 5.019251650211013e-06.
[I 2025-07-29 08:22:13,626] Trial 2 finished with value: 5.510674757135578e-06 and parameters: {'n_estimators': 962, 'learning_rate': 0.187449641513586, 'max_depth': 8, 'num_leaves': 35, 'reg_alpha': 0.008653099297954991, 'reg_lambda': 0.9211387124035753}. Best is trial 0 with value: 5.019251650211013e-06.
[I 2025-07-29 08:22:14,034] Trial 3 finished with value: 5.019251650211013e-06 and parameters: {'n_estimators': 311, 'learning_rate': 0.034317777720474306, 'max_depth': 10, 'num_leaves': 84, 'reg_alpha': 0.4607988102343822, 'reg_lambda': 0.8918173730142936}. Best is trial 0 with value: 5.019251650211013e-06.
[I 2025-07-29 08:22:14,810] Trial 4 finished with value: 5.019251650211013e-06 and parameters: {'n_estimators': 910, 'learning_rate': 0.1973840443081844, 'max_depth': 7, 'num_leaves': 41, 'reg_alpha': 0.27961415444768756, 'reg_lambda': 0.8024104728014667}. Best is trial 0 with value: 5.019251650211013e-06.
[I 2025-07-29 08:22:15,077] Trial 5 finished with value: 5.019251650211013e-06 and parameters: {'n_estimators': 143, 'learning_rate': 0.031855804737232776, 'max_depth': 6, 'num_leaves': 85, 'reg_alpha': 0.6046060457792917, 'reg_lambda': 0.42335320336403526}. Best is trial 0 with value: 5.019251650211013e-06.
[I 2025-07-29 08:22:15,845] Trial 6 finished with value: 5.019251650211013e-06 and parameters: {'n_estimators': 899, 'learning_rate': 0.04716381319103427, 'max_depth': 10, 'num_leaves': 44, 'reg_alpha': 0.6804349714014988, 'reg_lambda': 0.7760979428923377}. Best is trial 0 with value: 5.019251650211013e-06.
[I 2025-07-29 08:22:16,170] Trial 7 finished with value: 5.019251650211013e-06 and parameters: {'n_estimators': 247, 'learning_rate': 0.12305279033814154, 'max_depth': 5, 'num_leaves': 15, 'reg_alpha': 0.5693860744778261, 'reg_lambda': 0.664925290609213}. Best is trial 0 with value: 5.019251650211013e-06.
[I 2025-07-29 08:22:16,715] Trial 8 finished with value: 5.019251650211013e-06 and parameters: {'n_estimators': 596, 'learning_rate': 0.13104415165057878, 'max_depth': 5, 'num_leaves': 40, 'reg_alpha': 0.8176433963603111, 'reg_lambda': 0.04815473764263789}. Best is trial 0 with value: 5.019251650211013e-06.
[I 2025-07-29 08:22:17,045] Trial 9 finished with value: 5.019251650211013e-06 and parameters: {'n_estimators': 252, 'learning_rate': 0.27944206224219087, 'max_depth': 4, 'num_leaves': 24, 'reg_alpha': 0.25477650642033944, 'reg_lambda': 0.6758679063718949}. Best is trial 0 with value: 5.019251650211013e-06.
[I 2025-07-29 08:22:17,893] Trial 10 finished with value: 5.693801076890485e-06 and parameters: {'n_estimators': 464, 'learning_rate': 0.2966211658659178, 'max_depth': 8, 'num_leaves': 66, 'reg_alpha': 0.010636395319886471, 'reg_lambda': 0.3215004854927772}. Best is trial 0 with value: 5.019251650211013e-06.
[I 2025-07-29 08:22:18,521] Trial 11 finished with value: 5.019251650211013e-06 and parameters: {'n_estimators': 672, 'learning_rate': 0.0939767727046324, 'max_depth': 3, 'num_leaves': 65, 'reg_alpha': 0.9889612184241959, 'reg_lambda': 0.5319619278570811}. Best is trial 0 with value: 5.019251650211013e-06.
[I 2025-07-29 08:22:19,264] Trial 12 finished with value: 5.019251650211013e-06 and parameters: {'n_estimators': 747, 'learning_rate': 0.22616247051578964, 'max_depth': 8, 'num_leaves': 99, 'reg_alpha': 0.33162761940781305, 'reg_lambda': 0.25338612658883536}. Best is trial 0 with value: 5.019251650211013e-06.
[I 2025-07-29 08:22:19,777] Trial 13 finished with value: 5.019251650211013e-06 and parameters: {'n_estimators': 446, 'learning_rate': 0.08783734566590601, 'max_depth': 9, 'num_leaves': 56, 'reg_alpha': 0.90224477101912, 'reg_lambda': 0.5245629404123437}. Best is trial 0 with value: 5.019251650211013e-06.
[I 2025-07-29 08:22:20,503] Trial 14 finished with value: 5.006888006510155e-06 and parameters: {'n_estimators': 746, 'learning_rate': 0.24440993643587428, 'max_depth': 6, 'num_leaves': 12, 'reg_alpha': 0.1712670325963021, 'reg_lambda': 0.6354853085735688}. Best is trial 14 with value: 5.006888006510155e-06.
[I 2025-07-29 08:22:21,217] Trial 15 finished with value: 4.9829401622659895e-06 and parameters: {'n_estimators': 779, 'learning_rate': 0.2464757260630445, 'max_depth': 7, 'num_leaves': 11, 'reg_alpha': 0.14763802861141428, 'reg_lambda': 0.18751432264090795}. Best is trial 15 with value: 4.9829401622659895e-06.
[I 2025-07-29 08:22:21,991] Trial 16 finished with value: 4.928404022594207e-06 and parameters: {'n_estimators': 797, 'learning_rate': 0.24004308263572255, 'max_depth': 7, 'num_leaves': 26, 'reg_alpha': 0.10501328903684115, 'reg_lambda': 0.0786216575112167}. Best is trial 16 with value: 4.928404022594207e-06.
[I 2025-07-29 08:22:22,716] Trial 17 finished with value: 5.019251650211013e-06 and parameters: {'n_estimators': 786, 'learning_rate': 0.1853293819627507, 'max_depth': 7, 'num_leaves': 23, 'reg_alpha': 0.41571969377222073, 'reg_lambda': 0.00038727847567426865}. Best is trial 16 with value: 4.928404022594207e-06.
[I 2025-07-29 08:22:23,453] Trial 18 finished with value: 4.950600896602213e-06 and parameters: {'n_estimators': 842, 'learning_rate': 0.22437042102042698, 'max_depth': 7, 'num_leaves': 25, 'reg_alpha': 0.11946769612439415, 'reg_lambda': 0.1271995741699748}. Best is trial 16 with value: 4.928404022594207e-06.
[I 2025-07-29 08:22:24,206] Trial 19 finished with value: 4.9319510760934e-06 and parameters: {'n_estimators': 850, 'learning_rate': 0.21778819577597142, 'max_depth': 5, 'num_leaves': 29, 'reg_alpha': 0.10630822344907309, 'reg_lambda': 0.16403283002747338}. Best is trial 16 with value: 4.928404022594207e-06.
[I 2025-07-29 08:22:25,130] Trial 20 finished with value: 4.821523128045701e-06 and parameters: {'n_estimators': 977, 'learning_rate': 0.1599788507409362, 'max_depth': 4, 'num_leaves': 51, 'reg_alpha': 0.08087398428489198, 'reg_lambda': 0.3087800139760994}. Best is trial 20 with value: 4.821523128045701e-06.
